rating_value,rating_title,atuthor_name,rating_time,Value_1,Technology,Interior,Exterior_Design,Build_Quality,Reliability,Safety,Performance,Comfort,Value_2,Fun_To_Drive,reviews,pros,cons
4.75,Best van out there,east ,02/17/2009,,,5,5,5,5,,5,5,3,5,"Really nice van.  When you drive it, you know it is quality.  Gas mileage seems average for a van.  Stereo stinks - replace with better speakers  Can't go wrong with a Honda","Folding and movable seating, shift on the dash, tray in front middle, lots of storage, non-stationary middle seating, lots of leg room - all seats, nice lighting, good looks","Stereo.  Also, some road noise "
5,Satisfied so far,Happy Van Owner ,02/16/2009,,,5,5,5,5,,5,5,5,5,"I admit, no one buys a minivan for driving excitement, but Honda does a good job of making a vehicle whose main purpose is functionality seem fun to drive.  It does everything we ask of it, and actually remains reasonably fun to drive.  Mileage is pretty good, and park assist is a great help.  We're really happy with it after 4 months of driving.","Automatic doors, park assist, entertainment package, cavernous cargo space.","Chrysler has a great idea with those turn around seats.  If their design and build quality was anywhere near Honda's, that might be a deal maker."
5,A Very Nice Minivan,Shawkins22 ,02/15/2009,,,5,5,5,5,,5,5,5,5,"So far, a typical quality vehicle I expect from Honda.  After 20 years of Civics, this is my first Honda Minivan and I love it!  It is replacing a 1998 Sienna.  The Odyssey is feature-rich and has good looks to boot.  The rear entertainment system with headphones is a godsend.  The dash is a bit intimidating at first, but every day we are learning how to use another feature.  I was skeptical of the zone climate controls, but the are effective and work nicely.  ","Zone climate control, rear entertainment system, overall design.",Maybe hide the spare under the van instead of the interior.  
4.875,Love it!,Chad ,02/15/2009,,,5,5,5,5,,5,5,4,5,"We have had our Odyssey for two months and have 0 problems and love it.  We had our second child in January and the Odyssey is wonderful for our boys.  Overall quality has been excellent.  Wouldn't own anything else after driving every mini-van available.  Wish fuel economy would be better, but not a reason, not to drive it.","Power doors, rear-view camera, room, drive.",Gas mileage could be better.
5,Great people/cargo mover,bchris8906 ,02/14/2009,,,5,5,5,5,,5,5,5,5,"Solid, comfortable, smooth, & sporty performance for a minivan. Quality of interior materials & design is top notch. Exterior, I think it is the best looking minivan on the market. If you have young children and you can get over the ""soccer mom"" image you will very satisfied with tis vehicle. It is the ideal people & cargo mover. The 2nd row seats can be removed very easily. The 3rd row fold down easily as well. The interior is roomy, even the third row is comfortable for adults. Not many crossovers can say that. 2nd row magic seat is for children. Gas mileage is impressive for such a large vehicle. It is easy to see why it is rated number one by so many professional reviewers.","Folding 3rd row seats, removable 2nd row, Rear Entertainment system, XM radio, comfortable seats, roomy interior build quality, ride & handling, sliding power doors, power rear hatch, interior quality, exterior styling, numerous safety features. Honda reputation for quality.",User manual could be better. Cabin is a bit noisy. Offer an all wheel drive version? RES wireless headphones are too big for young children's heads. Offer wireless headphones for small heads.
1.5,Unreliable,Rita Brogonsian ,01/30/2009,,,1,2,1,1,,2,3,1,1,I have a stalling problem my Honda dealer (and another) will not fix.  It stalls every time I get hard on the gas pedal.  I have been on the 400 trying to merge and the van just dies.  I have it towed to Honda but they can't find anything wrong.  I don't like this van as much as my old Caravan.  It not very reliable.  I think I made a big mistake.,My kids like the DVD player but the sound is muffled out of the speakers.  Honda replaced the rear speakers but the new ones worked only a couple of days. Kids are starting to complain to the point we don't even use it anymore.  A lot of wasted money on that option.,
4.875,Excellent,happy ,01/30/2009,,,5,5,5,5,,5,5,4,5,"Interior comfort is unrivaled.  This is my second Odyssey.  First was a 2001.  Drove it until wrecked this year on the highway.  Wife stopped in traffic when she was plowed at 55 mph from behind.  Pushed her into a semi.  Car is crushed, she is fine!  The updates like the rearview mirror backup camera are awesome.  Considered a volvo XC90; but it doesn't remotely have the room of the odyssey.  Kids can ride in comfort on long trips.  Car has every airbag in the world.  Auto sliding doors; auto sunroof; sliding door windows now go down!  Now a power lift gate too!  Air/heat controls for all three rows of seats.  Only complaint is cupholders too far away for little ones in the second row to use",6 disk changer/power sliding doors and lift gate/rear view camera in rearview mirror/leather seats/controls for heat and air for all three rows on the front console/push button on remote to open all windows and moonroof to let out heat before entering.,Cupholders my 5 and 4 year old can reach from the car seats in the second row. Perhaps an auto power seat setting linked to the keys for individual drivers so the seat is already set when you press the unlock button on your remote.
5,Improvement from 2005 model,volchic ,01/27/2009,,,5,5,5,5,,5,5,5,5,"We owned a 2005 Odyssey and loved many of its features.   It was fun and easy to drive, although the mileage was a little below advertised.  We were very pleased with the vehicle overall and it met all of family's needs but we started having several of the problems that other owners of the 2005 model reported (rattles, power steering pump, brakes  so we decided to trade in for a 2009 model.  So far we have been delighted with the new vehicle and Honda seems to have upgrades in several of these areas .  We can't wait to see how this Honda holds up.","Rear view camera, power lift gate, telescoping steering wheel","Sun shades for the 3rd row standard, fewer dealer installed options"
4,Is it a Honda or a Land Rover?,Hessam ,12/06/2008,,,5,5,1,1,,5,5,5,5,"With three little boys under the age of 6 I finally decided to get a practical, safe and reliable minivan. I owned an accord in the mid 90s so I knew they were reliable. Well, come to find out things have changed. Since day 2 the check engine engine light has been on and my Honda has seen more of the mechanic in three weeks than my 9 year old Land Rover has in the past year!! It's a shame because the primary reason one purchases a Honda is for its reliability.",The seats are very comfortable and it's amazing how three boys  can remain quiet in a car with the DVD player on!,Put trays for the middle row so they can use it like an airplane's dinner tray. Also the DVD player should automatically pause when the blue tooth activated phone rings.
4.875,Honda Mom 2nd time,Honmom ,11/04/2008,,,5,5,5,5,,5,5,4,5,"I had a Sienna and liked it very much, but bought the Honda based on the safety factor. It rides like a dream, with great pickup. It has lots of room and is very comfortable. I agree about not getting PAX. I have heard it is a complaint by a few. The Toyota is poorly rated for rear crashes with the insurance institute. This was a huge factor for me having three children. I have had no significant issues to speak of. I am sold on Odysseys.  ",Smooth ride and safety.,Colors
4.625,Follow up on my 08 Touring,Hammock1 ,10/18/2008,,,5,5,4,5,,4,5,4,5,"After driving a nice van in most regards except a rattle trap, finally got it to an Illinois dealer who cured the rattle problems by applying a Honda grease (Part# 08798-9013) to all the door gaskets.  Wow, now totally rattle free.  Just over 21,000 and love it more all the time.  In Daytona Beach area where I live, they added ethanol now and gas mileage dropped to 21 around town and 24 on the road but ALL vehicles suffer with Ethanol.","Easy to drive.  Roomy, GPS is great once you figure it out.  Comfortable and drive 1,200 miles non stop at times.  Everything works as advertised.","No complaints now at all.  Follow HONDA service, NOT the dealer as some will try and get into your wallet big time.  Biggest improvement Honda can make is in the sales dept."
5,Best van ever!,podra ,09/19/2008,,,5,5,5,5,,5,5,5,5,"I just bought the 2009 Odyssey it is the best van there is in the market. This Honda is well built, smooth and quiet, very powerful and it has great reliability and great value. Brought it home 2 weeks ago and no problems. Our last car was a sienna and it had transmission problems so i sold it. Always buy a Honda it won't disappoint.","powerful and smooth v6, solid feeling materials, not a Toyota Sienna!",nothing at all!
2,Do NOT buy the PAX,BrokeHondaOwner ,09/18/2008,,,2,2,2,2,,1,3,1,3,"Do not buy the PAX model.  The tires only last 25,000 miles, if that, and they cost $1,500 for a set of four. This means, that by the time you hit 50,000 miles (when  most tires wear out), you will have spent $4,500 on tires.  If you get a flat, Honda recommends you buy 2 new tires because the tires are not repairable.  Nice going Honda...",,Get rid of PAX.  Keep them off the Accord!
2.625,Overrated Odyssey,Mike Jones ,09/11/2008,,,3,4,2,2,,3,3,2,2,"Look the its a good van, but way too much for the price. I should gone with my gut instincts and bought the Toyota Sienna. I listened too much to Model Review experts and not my heart. The Sienna rode like a dream, much better in my opinion than the reviews. The Honda makes a louder noise when accelerating on the highway than the Sienna. Toyota also offered a lot more standard features than Honda did. I listened to my wife and I should have changed her mind. Honda is good, but the Sienna' s Style, performance and overall quiet powerfully safe ""star rating"" is superb. I am probably going to trade in my Honda for the Sienna.",Exterior appearance. cosmetics.,"Follow the Toyota's overall quality. The braking was a little more demanding than when I stopped with the Sienna model. Everyone I can see is buying the Honda for its looks as the final decision. However, check out the Sienna up close and inside. I regret not getting initially."
1.125,Not good,Paul Leiberstien ,09/05/2008,,,2,1,1,1,,1,1,1,1,"I've had mine for about two months and I am very disappointed.  Came out of a Caravan lease that had no issues for the entire time I had it.  The Odyssey has squeaking brakes, doors rattle, and the DVD player skips.  Try telling our 4 year old that the movie has to start all over again all the way to Florida.  Not pretty.  I wouldn't recommend the Honda",I thought that I would have no problems but I have had to have it in for service many times.  So I guess that I have no favorite features,After talking to other owners at the Honda dealership I think Honda are way overrated.  Will not buy another.
