rating_value,rating_title,atuthor_name,rating_time,Value_1,Technology,Interior,Exterior_Design,Build_Quality,Reliability,Safety,Performance,Comfort,Value_2,Fun_To_Drive,reviews,pros,cons
5,Accidentally Got The Best,Happy Hyundai Owner ,12/29/2009,,,5,5,5,5,,5,5,5,5,"I bought the Base 09 Accent Coupe because it was half the cost of my 1st choice, the Honda Fit. However, the longer I drive the Accent, the more I feel it's the best choice I could've made.  I've even come to love the apple green color.  It has an amazing amount of room inside - I went from a GMC Jimmy and have had little trouble adapting, space-wise.  The exterior design is simple, clean and well- proportioned; I think it's one of the best-looking cars on the road.  It handles and drives like a sports car, feels like an extension of my body: I think, it responds.  Very solid, well- made car, reminds me of an MGB-GT I once had (without the constant repairs!).","Extremely roomy - my skis & 1-piece kayak paddle easily fit inside.  With the 5-speed manual tranny, superb handling and responsive steering, it's like driving a sports car.  Zoom zoom, zip zip zip!  Great mileage, a huge plus after my GMC Jimmy.  Handles GREAT in the snow, even w/o snow tires!","Manual tranny s/b geared higher; highway RPMs are 3500-4000, s/b 2000- 2500.  Needs more ground clearance, esp. in front.  Factory roof rack would be a nice option - Thule rack needs short-roof adaptor, reduces highway mileage from 36 to 31. Sun visors are hard to pull out w/gloves on."
4.875,Fun to drive- great mpg!,HollyG ,11/24/2009,,,4,5,5,5,,5,5,5,5,"I purchased my Accent this summer, and am completely thrilled with my purchase!  I changed careers, and now drive quite a bit, thus making the Accent a perfect fit.  It fit my budget, and I ended up paying $11,000 for my little car.  Since I drive into rural areas, I purchased the XM/MP3 package, and I'm pleased with it- I've not lost a signal yet!  One thing that I miss however, is cruise control.  It was not an option with the 5-speeds that were on the lot.  I would imagine that I'd get even better mileage with cruise.  :)",* xm radio * tight turn radius * super easy to park! * love that the rear seat folds down- I've fit LOTS of stuff in this car!,I'd like to see a better quality interior door panel- it scratches very easily.
5,Better than expected,W. Henry ,11/23/2009,,,5,5,5,5,,5,5,5,5,"4 months of usage and the first 4,737 miles used 122.75 gallons of gas for 38.59mpg and I had to round for the JD Powers survey so it rounded to 39mpg. Course, I only use the first quarter inch on the gas pedal and park behind the slow moving trucks on the freeway. I think this is the least expensive car sold in America and to get 39mpg--this car is a steal.  My son thinks that Korea is building the best cars for the price just like the Japanese companies did when they first started.  They are trying harder.  I'm not just comparing it to my last car, a 1981 Rabbit diesel, but also w rental cars such as the sporty Cadillac and a Mercedes that I owned in 1970. I didn't get AC.         ","A very solid car that I feel quite safe in, even tho it is a small car.  I also use it like a small pick-up transporting farm equipment and materiel and I'm sure glad I purchased the Accent instead of a small pick-up since the car holds almost as much and can also be locked.    ",I've only used the brakes hard once and was going about 5 or 10mph and they sounded metallic and the front end really dipped so there is a little worry that the brakes may not be as good as the gas mileage.  Also all 4 tires in 3 months leaked from 32 to 23psi so the tires might be cheap.   
5,Money well spent,Azawon ,11/16/2009,,,5,5,5,5,,5,5,5,5,"I was also looking at other cars when I stumbled on the Accent SE.   I'm so glad I did, because I really couldn't decide between the 10 cars I had on my list. There was always something wrong, or missing.   Either the price was too high, or the warranty too short, or I just couldn't fall in love with the car's styling.    I had never considered a subcompact, but reluctantly started looking at them.   I was intrigued with the Accent SE.   It had a lot of nice features, and was sporty to boot.  It's so much fun to drive, and has been solid and comfortable.   This car gets many looks in traffic, from all angles, by drivers slyly checking it out.  It is very sharp in Ebony black, and stands out.","The styling, the hatch, the automatic light features, alloy rims, satellite radio, and the performance.","Could use a sixth gear, for high-speed freeway driving.   Up to 70 it's fine, but there is a little engine noise as you go faster than that.   I just turn up the satellite radio a little, and it's easily covered up."
4.875,FIRST BRAND NEW CAR,TOM FROM PA ,11/03/2009,,,5,5,5,5,,4,5,5,5,"Just purchased vehicle through a chain of dealerships I work for.  I was looking at the Hyundai accent, the Suzuki sx-4, and the Nissan versa.  I loved the accent's looks and all the features it had for the money.  The versa and sx-4 where way more money for a comparably equipped car.  The only thing they had on the accent was more room (but they are four doors) and the Suzuki has all wheel drive.  The performance in all three cars was almost identical, but in the end the car with the better looks and the better warranty won me over.  I have owned it for less than a week and have put 1000 miles on it.  I can't get over this car.  I smile every time I get in it.  No buyers remorse here!","XM radio, 16"" wheels, 176 Watt sound system, abs, that beautiful charcoal Gray paint, 60/40 seats, massive interior room for a two door hatch back, zippy acceleration","165 turbocharged horsepower, standard Cruise control, more aggressive performance options like lower suspension, bigger brakes, maybe a CVT with paddle shifters but then again thats pushing it."
4.875,New Owner,PDR ,10/21/2009,,,5,5,5,5,,5,4,5,5,My daughter has a 2000 Accent and is wonderful. My wife has driven an Elantra for 5 years and it has been bullet proof. I just purchased an Accent and it drive great.  PDR,"Warranty, reliability, ratings",
4.625,Best Value out there!,Christopher ,10/18/2009,,,4,5,5,5,,4,4,5,5,"I must admit i was a little skeptical about Hyundai at first. However, my dads 2004 elantra has 270,000 miles on it before the oil pump went and blew the engine. That said i decided for my job to get a el cheapo accent base, no ac, no radio (i installed one myself), and a 5 sp manual tranny. I only paid after tax title license $11,325 with a 20 yr powertrain warranty, yes a 20 yr, from Rick Case. I average 33-41 MPG per tank. Clutch is smooth, drivability is fun, and the best part of it is the price. I have 12000 miles on this car with no issues. I cant say enough about this little fun car, except I highly recommend this vehicle!","Fuel Economy,easy to park,easy to maintain. Overall the best bang for the buck.  It is also one less part to break. I use Mobile 1 OW-20 oil, with a Napa Gold filter and I change the oil every 7500 miles.",Produce the exact same vehicle with a diesel engine w\ a 6 sp manual gearbox. Also increase to fuel tank to 14 gallons. Maybe drop a hybrid motor in this model as well.
4.625,"Comfy, efficient, cute, SE is a good buy",thepod ,09/12/2009,,,4,5,5,5,,4,5,5,4,"I bought my Accent SE six weeks ago and have put 1900 miles on it since.  I was looking for efficiency, reliabiltiy, cargo space, and a little bit of cuteness.  I got all of that plus ABS, cruise, a decent stereo system with 3 months of XM included, a sunroof, and reasonably comfy seats.  As to be expectied, it's not monstrously powerful, but I can merge onto the freeway or climb a hill comfortably, albeit a bit noisily.  When not laboring in one of those situations, the engine runs quietly and smoothly.  It corners well, stops well and doesn't feel too mushy.  I would have preferred an MT, but the AT was in stock so I went for it.  Interior is laid out logically. Overall, a good value.","armrest on driver side, lighted vanity mirrors, extra compartments for sunglasses and stuff, low tire sensor, tilt steering, actual spare TIRE, sunroof, foglights, shiny paint. it's a very cute car - the low pro tires and wheels aren't bad.  i really love the apple green color.  i call it 'the pod'.","armrest on passenger side, center console, let rear seatbacks fold flat and flush, doors ding somewhat easily, interior plastics scratch somewhat easily, no height adjustment for seats, cupholders could be more conveniently located, hatch release from inside"
4.75,Good subcompact,JD ,09/09/2009,,,5,5,5,5,,4,5,4,5,Bought under cash for clunkers.  Was looking for inexpensive car with good fuel economy.  Got a surprisingly comfortable little car.  I don't think anyone could beat the bang for the buck.  ,Plenty of interior space,Could use a better armrest maybe a console.
5,Gas milage and pep too,Roger Rabbit ,08/30/2009,,,5,5,5,5,,5,5,5,5,"I can't really believe the gas we're getting! When the wife drives it she's getting 33-35 mpg in town! I get over 30. I was totally surprised when on a trip to Oregon, We averaged 39.8 mpg!! The car has all the warranty and with the factory rebate we only paid 12k. The wife and I couldn't be happier!!!","Gas mileage and fun to drive, oh and turning radius. A real pleasure to park!",I don't really have any.
4.75,Solid built and fun to drive.,mamitchell ,08/25/2009,,,5,5,5,5,,4,4,5,5,"I purchased my Accent primarily for daily commute duties.  I have put about 1000 miles on car so far and it has been a pleasure to drive.  The soft suspension provides a comfortable ride.  Wind, suspension and engine noise are well controlled.  The 1.6L engine and automatic transmission provide adequate power for my needs.  The interior is roomy for the car size and looks nice for an economy car.  Gas mileage is ~26 mpg with only in town driving and 40+ mpg with pure freeway driving.    ",Gas mileage is good.  Interior layout is simple.  Smooth ride and quiet at cruise speeds.  Radio has XM service.  Arm rest.  Additional recline position for rear seat back(s).  After unlocking power door locks with remote the doors will relock after ~1 minute if you do not open a door.,Transmission upshifts for economy only. It would be nice to have an optional shift pattern setting to help acceleration when desired.  Not sure about paint quality?  Seat belts on 3 door hatchback are too far back behind seat to reach without stretching.  A seat belt hold on seat could fix issue.
5,I love my bella,Kayla ,08/25/2009,,,5,5,5,5,,5,5,5,5,I bought this car 4 days ago. I love it it's a perfect car for me. Gas is cheap. I have a daughter and its very easy to get her in and out. 5 speed is deff. Fun and easy to shift. It is all I wanted and more in a car. I was going to get the tc but they didn't have any and I thought lets try here and I'm so happy I did. Also I have the blue tooth and its amazing =]. The warranty is amazing too by the time its over I'll have a new car so its a Peace at mind. I love my car.,"blue tooth, 5 speed, xm =], and comfort.",cruise control. 
4.75,excellent buy...,Vinayak ,08/23/2009,,,4,5,5,5,,5,5,4,5,"Could not be more happier buying this car. Its very sturdy and holds very well on freeway about 70-80mph. Drives very well within city too. get about 28mpg within city and 30-32 mpg on highway (mostly because of no cruise control). Excellent second car to have. Very spacious too, can easily fit 4 people.",xm radio,automatic cruise control
4.75,Lovin' the mpg!,tinybubbles ,08/18/2009,,,4,5,4,5,,5,5,5,5,"got this car with the C4C (cash for clunkers) $4500 that I got for my 1998 Isuzu Rodeo.  What a deal! This car is great for the money spent. LOVE the way it handles and I get 33mpg in mixed city/hwy driving. Can't beat that. Odd mix of features - has power windows, power locks, low tire pressure indicator, six airbags but no cruise control! Overall I can't complain - the warranty is great, too.  Take a serious look at this car especially if you're doing the C4C deal.","nice overall body style, great mpg, quiet ride, nice handling, nice interior layout",a bit anemic when accelerating but for a 4 cylinder you kind of expect that. upgrade the plastic components in the interior
3.875,Traded a Clunker,JAC ,08/17/2009,,,4,4,4,4,,4,4,5,2,"Just got the vehicle yesterday and put almost 200 miles on it the first day. Traded in a piece of trash and got $4500 from Cash for Clunkers and $1500 Factory Incentive.  Sticker price was $16,184 (Dealer added $299 for tint) and I paid $9,060 (plus tax, title & license).   For $9,000 you can't beat it.  It's not fast off the line, but once you get going, it goes great.  It was almost hard to keep it at 75 on the freeway as it drove effortlessly at 80 and 85.  A 6 foot driver and 2 6 foot passengers in the back all had enough room, although the seats are not as soft and comfortable as a more expensive model.  You can't go wrong with this car if you can pick it up cheap.","Price, gas mileage",Cruise control
5,a true suprise,thrilled ,08/09/2009,,,5,5,5,5,,5,5,5,5,"I bought this car for nothing more than fuel economy. I took a real leap of faith in that I only saw a picture because the dealer had none in inventory, also never test drove the car. When I picked it up it was more than I imagined, it had a great look both exterior and the interior was much better than I thought it would be. Seats and int. Color is beautiful stereo is fantastic XM is fantastic (3 months free ) car drives very well handles nicely and all for 8 out the door. Car has a desert pkg and all floor matsonly complaint is dealership refused to   give the $1.49 gas deal. This is a definate surprise never expected this car to be this good. Keep thinking they delivered wrong car","looks,  both inside and out,stereo,cargo room, gas value",
4.625,Thank you CARS,tusker ,08/08/2009,,,4,5,5,5,,4,4,5,5,"I have been looking at small cars for a year and ended up with the accent. I went from a Yukon to this and love it. The front is just as roomy as my Yukon was and it is a lot more fun to drive. The mpg is fantastic and it looks good too. Going up steep hills can take some patients but it is a small 4 banger so what do you expect? for the money, it is a great buy and Hyundai is what Toyota used to be. You cant go wrong. Not a lot of extra features, but I knew that going into it. It is even easy to drive on the interstate with it. I have not owned it that long, but I like it more and more every day.","6 air bags standard, auxiliary jack, mpg, the body lines, interior is comfortable. very clean interior design.","You are buying a economy car, you cant expect a lot. Everything it has is what I need. And that is about it... Which I don't mind at all."
5,"Good expectations, Great results!",Stephen ,08/08/2009,,,5,5,5,5,,5,5,5,5,Love the Hyundai Accent! Needed a new car after wearing out a very good Subaru but did not want to pay the high price for another Subaru. Looked at Hyundai since they are affordable and reliable. Liked the styling of the Accent hatchback and the fact that it did not come with a bunch of gadgets that will eventually break. Test drove and immediately knew this was the car for me. Though not a Ferarri with acceleration it gets to speed well enough. The car is quiet and rides very well. You get a little suspension noise over large bumps but the ride is very stable. Get the A/C - it is nice and cold. Controls are well laid out and easy to reach. Surprisingly very roomy for a small car.,"Roominess, CD player with 3 months free XM (what a deal), ride and comfort. Ease of finding serviceable items under the hood. Overall design of car.",Lumbar support for driver and arm rest for passenger
4.875,"Am a Honda guy, but bought the Hyundai!!",MikeK! ,08/06/2009,,,4,5,5,5,,5,5,5,5,"I didn't even want a new car, but when the government came out with it's new middle-class welfare program (Cash for Clunkers) I said what the heck, I'll go spend some of my own tax dollars. I wanted a cheap, cheap car and thought of the Hyundai's, Kia's, etc. The Honda's and Toyota's were still too pricey for me even after the 4500 cash. Well, I came across the Hyundai Accent GLS and that was it. This car is nice, not cheap. I'm 6'4 and I fit just fine. Get one w/o a radio and install your own, all the wiring/speakers are already installed. Took me 20 minutes to put a great radio in. Keep up w/ the maintenance and the warranty won't let you down. GO BUY ONE, YOU WON'T BE DISAPPOINTED!!!","Peppy engine w/ the 5 speed. Nice ride for an econobox. Firm, solid build",Tilt steering for us tall guys. 
5,What a surprise,GL Brink ,07/31/2009,,,5,5,5,5,,5,5,5,5,"I have been driving large cars all my life but being retired I needed to save on gas.  What a car, this little Accent drives great, has head room for my cowboy hat, accessory holders, great radio/CD player, goes around curves like a BMW, less noise interior than my old caddy, drives by gas stations on trips, we love our light green color, air conditioning cold as ice, leg room for my 6'1"" 250 lbs and comfortable in drivers seat, Took my granddaughter to lunch and she had plenty of room in rear seat next to the groceries and half dropped back seat. What a bargain for the price. As you can see we love it. ",1. Get up a go  2. pleanty of room 3. gas mileage 4. looks  5. Hatch back with split back seat 6. Handles great,Cruise control standard on power package GS and be sure to get tinted windows I did not and have to buy after market because of window area. My mistake.  
4.75,Quality and Value,Jim from Richmond ,07/10/2009,,,5,5,5,5,,4,4,5,5,"What a fun, comfortable, drivable car! Lots of room for the driver and front passenger. The radio (XM) and CD are way beyond anything expected. Handles well, responds surefootedly, and peppy. Used the gov't. ""Cash for Clunkers"" program ($4,500) and a $1,500 dealer rebate, which covered half of the vehicle cost (before state sales tax and transportation). You will love the car even more when gas goes back up to $4.00 or more per gallon. Go get one today.",XM radio and storage area.,Arm rest for front passenger.
4.375,Love This Car,David ,05/22/2009,,,5,5,5,4,,4,5,3,4,"Great car for your dollars!  Not only does it look good but it is fun and easy to drive.  Has most everything you'll need and the automatic transmission is a nice change from having to shift in traffic.  Corners easily, good performance all the way around.  Plenty of room front and back.  Controls easy to reach and operate.  I cannot find anything that I don't like about this vehicle!  I compared two other vehicles in the same class and in the end the Accent won out.  The GS 2 door hatch back with the auto trans/ac package is a great buy.  Compare it and you'll see! Had a very minor issue with a 'rattle', and the dealer took care of it quickly.","Looks, ease of driving, nice stereo, controls easy to operate, plenty of room.","Needs a stronger horn, or perhaps two. Rear speakers with the premium stereo system not terribly wonderful, but do ok for what they are."
5,10,tonda ,05/20/2009,,,5,5,5,5,,5,5,5,5,I was looking for a another good car I had a Hyundai before and I loved it so I went back for another and iam glad I did the hatchback is wonderful and I love the way it drives it handles very good. It has a lot of room the truck space and inside is big. I am very pleased with my car.,lots of room and the sound system is good drives good ,none
3.625,new GLS Accent 2009 manual,kisiel ,05/13/2009,,,3,5,3,4,,3,4,4,3,"I needed second car, so we decided to buy something small and fuel efficient. So the most important for me was fuel economy, I did not care about others ""comforts"". So after two months I have to admit economy is good, when I am not speeding (average 50 mph) accent is doing about 37 mpg!  I read editors review here on Edmunds and I knew that accent does not belong to demons of speed, but I am fine with this.  So car let say is ok, worth money I gave, but I would do more improvements: 1) put smaller engine (1.4l) so they will beat Toyota in fuel efficiency 2) I do not really like in this car gear stick is not smooth and is hard to change gear, Hyundai schould work on this in manuals.",fuel efficiency big trunk speakers system,smaller engine so improving yet fuel efficiency gear stick in manuals should move more smoothier
5,A lot of Value at a Very Reasonable Cost,Edward ,05/08/2009,,,5,5,5,5,,5,5,5,5,"We test drove several other popular cars and didn't expect the Accent to be the one we choose, but one test drive and we were sold. We wanted a fuel efficient car that would last well beyond the payments and this one was certainly a consideration for us. We wanted a car that was quiet and comfortable to drive. With a seat height that is higher than the competition's and very surprisingly fun to drive handling characteristics, this was the one liked the most. ",The audio in this car sounds better than all others in it's class and that's a bonus for me because music is big part of my life style. We also enjoy the popular equipment package it came with.,A sixth gear. The five speed shifts nice and crisp but for highway driving a six speed transmission would be better.
4.75,Great car with Warranty,trevor ,03/21/2009,,,5,5,5,5,,4,4,5,5,great little car for the money.  Great mpg.  Performance isn't the greatest but for a 4 cylinder it does good.  There is tons of room on the inside of the car. One thing that I did was get tinted windows.  car looks alot better.,"16"" alloy wheels and factory stereo. driver side armrest is money.",wish cruise control came standard and wish cup holders were in different spot. Seats could be a little more comfy 
4.625,Good things in small packages,Hako ,03/13/2009,,,5,5,5,5,,4,4,4,5,"I've only had the car for 8 days, but I am totally in love with it.....more so than any car I've owned.    Funny thing was, I didn't expect to be.   I figured it was a nice looking, decent fuel economy and great warranty.  I was stunned when the car arrived at the dealership.  It was way more beautiful than the internet pics, and the interior seemed upscale in rich, textured black.   The car itself is Ebony Black.  I love the 16 inch alloy rims, satellite radio, and the B&m short-shifter.   I assumed this car would be a yawn to drive.   Wrong again.   It has snappy acceleration, and is grippy through the turns.  I am totally happy with my choice, and grin every time I sit in this cute car.","Alloy rims, satellite radio, B&M short-shifter....and the interior fabrics.",Add a USB port.....to go with the aux jack.
5,Happy with purchase,Chris ,12/29/2008,,,5,5,5,5,,5,5,5,5,"I just bought this 2009 accent and I could not be happier. This car is not my primary vehicle, its just a around town vehicle and for my 17yr old son to use to school and work. The outside body design makes it look like a more expensive vehicle. I was also surprised by the get up and go from the 1.6L engine. I'm 6-4 and have plenty of head room. I do have to put the seat all the way back and tilt the back, but over all I feel comfortable.  ",The appearance. ,"For what I paid for this vehicle and what I use it for, there are no improvements needed."
4.875,starting out new,joseph a colombo jr. ,11/29/2008,,,5,5,5,5,,5,4,5,5,"This car is fun to drive you can zip around in parking lots and it fits anywhere. There is lots of room, I am a large guy and I fit in her fine. It rides Nice on the road, very smooth. I think they could of put a little more sound deafening inside the fenders and rear quarters. There is a little road noise. All in all this car is cool. Try it I think you will like it.",I like the body lines and the way it looks parked,think they could of made the seat go back a little father back  (drivers)
