rating_value,rating_title,atuthor_name,rating_time,Value_1,Technology,Interior,Exterior_Design,Build_Quality,Reliability,Safety,Performance,Comfort,Value_2,Fun_To_Drive,reviews,pros,cons
5,And he swore we wouldn't by a minivan...,Luvmydaughter ,07/22/2009,,,5,5,5,5,,5,5,5,5,"This is my second Honda Odyssey. My first was a 2003 Odyssey EX. I have had a history of selling my cars after 2-3 years. My last Odyssey I had over 6.5 years-130,000 miles with nothing wrong with it. Only scheduled service.  My husband also swore HE would never buy a Honda OR a minivan.  When I was pg with my first child he was completely SOLD with the Odyssey- enough to get him to buy a Pilot a year later. SO when we got the new one it was a no brainer. I didn't even have to shop the market. The leather interior is beautiful. The basics are the same as the 2003 but they made it more luxurious and FUN! Wouldn't trade it for the world!","DVD player in dash - AWESOME feature. My last one I added an aftermarket DVD player that worked well, but the factory one is so much better! The leather is so soft. Rear cam is great. Sun shades are handy. Love that the rear windows roll down. All in all fun to drive!",My only complaint is you can only get the DVD system with the EXL or higher - granted I ended up with a higher model than originally expected (that I love). It was disappointing that you couldn't get it with the well equipt EX (as with my 2003). It looks like they have changed this with the 2010. : )
5,Great family car,H  Patel ,07/22/2009,,,5,5,5,5,,5,5,5,5,"Great family car with excellent mileage. Gave about 27 mpg when driven to Niagara from Columbus. Love the leather and interior design. Automatic back door and sliding doors are must have feature for minivans. Paid 28,750 OTD price with 2.9% APR! Can't beat the price with the standard features that comes with this minivan while comparing with other vans...!","Automatic back lift, iPOD connection and high MPG on highway!",MPG in city is about 18! Getting 20 - 22 would be excellent!
3.875,Gas mileage,Allen ,07/19/2009,,,4,4,4,5,,4,5,1,4,"I have 2,300 miles on my Odyssey and I get, in my estimation very poor gas mileage. I told the service adviser when I went there, that I thought that when the motor was idling, it seems kind of high rpm and he had the mechanic check and said it was normal. I am not happy. After several tankfuls I filled the tank again this morning and  am getting 17.42 miles per gallon and I drive mostly highway miles.",His and hers control over the AC.,Better gas mileage.
5,Great Van,Doug ,07/18/2009,,,5,5,5,5,,5,5,5,5,Our family absolutely loves this van. We have a 2009 EXL-RES.  The rear entertainment system (RES) is a pleasure on trips.  It allows the front drivers to listen to music while the kids watch their videos through the wireless headphones.  Driving comfort and space is outstanding.  The van is quiet and has very good road manners. The Odyssey replaced a Toyota Highlander for us. We were seriously considering the Sequoia for this purchase. We just found this to be a better vehicle for the money than the Sequoia. We are now van converts.,"Rear entertainment system, ride, space and fuel economy.",More wireless headphones standard (comes with only 2).
5,No complaints,Danielle ,07/15/2009,,,5,5,5,5,,5,5,5,5,I am currently leasing the 2009 EX-L model with rear entertainment.  I have been very impressed so far.  The comfort is great.  The cargo space is excellent!  I wasn't very excited about crossing over into the minivan world as a former SUV driver but I've actually enjoyed the switch.  ,"A few of my favorite features are the soft leather seats, the wireless headsets for the kids and the split third row that you can fold down flat. I also like that the front console can flip down to provide easy access to the backseat.  The storage, cargo and optional 8th passenger seating is great!",None
4.625,The Best Of The Mini-Vans,cm111 ,07/10/2009,,,4,5,5,5,,5,4,5,4,"The Odyssey is best-of-breed.  Great build-quality and very functional.  Where other brands put money into bells and whistles, Honda focuses instead on a great drive-train, top-notch suspension, steering and supportive seating.  We have had the Towne and Country and Grand Caravan.  The Honda is a more responsive vehicle that leaves the driver feeling in-control.","Variable Cylinder Management, A/V inputs and 110V power supply, fold- down rear seating, solid steering with reasonable road feedback, best-in-class suspension and drive-train.","Computer controls desperately needed on EX models (gas mileage, Distance-To- Empty, compass).  Also, better instrument layout.  Because the Odyssey is positioned as the ""drivers"" mini-van, it should have center controls angled slightly to the driver.  Clock and radio controls should be in driver FOV."
4.875,Excellent Family Van,Jason ,07/01/2009,,,5,5,5,5,,5,5,4,5,First van and feel confident with picking the Honda.  Drives great.  Highway fuel economy higher then expected.  Interior is quite spacious and the leather interior makes it feel more luxurious.  Navi and RES is awesome!  Sound system is ok but then again it is a minivan.  Overall an excellent choice for families who require room.    ,"Navigation System, RES, Auto side doors and tailgate.  ",Road Noise is higher then the Sienna.  Suggest more sound deadening material.  
2,Horror-bolt disintegrated-uppr eng lost ,Pat ,06/30/2009,,,3,3,1,1,,1,3,3,1,"Sold 11 yr running Dodge Caravan, bought 09 Honda Odyssey. Had for about 3 months, took out west. Before return home took drive to Sedona, AZ, lost power on National Forest Road w/few places to pull over - van towed to dealership on Sunday. Monday told the whole upper engine destroyed by disintegrated bolt, needed days to repair. Afraid to drive it home about 1800 miles to Ohio. Informed insurance agent of manufacturer defect - if something else happens to investigate van. Seriously worried we could have been in bad accident. Honda disinterested in our concerns - repaired to their satisfaction not ours.",too disappointed to pick any,A defective bolt? someone should be making sure bolts do not disintegrate that are integral to an engine - unbelievable that such a small part caused so much damage.
4.875,Family Hauler,Firerobin ,06/27/2009,,,5,5,5,5,,5,5,4,5,"We just recently upgraded from a Saturn Vue to the Honda Odyssey.  We couldn't be happier with the upgrade.  At first the wife was worried about her coolness factor and driving a minivan, but after driving it for a few weeks she is in love with the room and convenience.  I like it for the features and handling.  On many occasions now I've been driving at highway speeds when a light turns red and I'm worried about stopping in time an was initially surprised that I stopped with no problem and had room to spare.  In the Vue, I would have had trouble stopping.   The seats are comfortable, everything seems to be of good build quality.",I love the automatic trizone climate control... also like the built in sunscreens on the sliding door for our baby.,Wish they had more color combinations with a darker interior color to make it easier to keep it clean with the kids. The red color we liked outside had the light tan inside which we didn't like.
5,More than happy with my choice!,Jessica S. ,06/25/2009,,,5,5,5,5,,5,5,5,5,"We were in the market for our first minivan, narrowing the search to a Sienna or Odyssey.  Odyssey's ability to load and control the DVD from the front with 2 small kids is a big win.  Ultimately, though, Honda was willing to negotiate more than Toyota, with an offer below the TMV - What Others are Paying quote (below invoice).  Have had the van for almost a month... no issues with noise, great mileage (avg. 21 mpg with a mix of highway/city driving), love the handling.","Front loading DVD, remote control for DVD, automatic liftgate open/close, adjustable armrests.","My husband doesn't like the speedometer since it only shows miles by 20's, with dashes for the 10's.  I wish the parking break was further back so I didn't bump it when trying to find a place to rest my left foot.  These are minor when compared to everything we like about it so far!"
4.625,Great vehicle except gas mileage,Second Odyssey ,06/22/2009,,,5,5,5,5,,5,5,2,5,"I've owned two Honda odysseys. A 2007 Odyssey Touring that met a deer late at night and a 2008 Odyssey EX-L (bought new after the 2007's accident). Both vehicles have been completely reliable, a joy to own and drive and perfect for my family. However, one big surprise. Even with the 3,4 & 6 cylinder switching engine, the fuel economy has been averaging 13- 14 mpg. I'm not an aggressive driver and now that I know I'm getting this mileage, I've been trying to improve it but with not a lot of success. On long trips things certainly improve but around town gas mileage is my biggest disappointment. I expected better, maybe 17-18. ",,
4.5,2009 Honda Odyssey LX,mikecnorthwest ,06/12/2009,,,4,5,5,4,,5,5,4,4,"We replaced our 1999 Plymouth Grand Voyager with this 2009 Honda Odyssey LX.  We like to shop for quality products but our budget is also a limiting factor.  The LX is a great way to get quality without having to break the bank.  We got everything we need in a minivan, including excellent quality, without the added expense of features we don't really need.  If you can live without power seats, power sliding doors, a high end stereo, leather, etc., then the LX is a great choice.  Mechanically its really the same van as the high end model.  You just need to be ready to open your own door and perhaps read a map if you really don't know where you're going.","The seats are extremely comfortable, both front and rear.  Plenty of storage space especially with the fold down rear seats.  We also love the fact that the windows on the sliding doors open and close.  Plenty of power on the engine and it really does drive like a car.",Road noise has been mentioned as being more pronounced in the Odyssey as compared to the Toyota Sienna.  My wife has noticed this but so far I have not.
4.875,"Great Van, but...",First Odyssey ,06/01/2009,,,4,5,5,5,,5,5,5,5,"We love our new Odyssey. We had good luck with our 2000 Grand Caravan but the Honda looked better this time. We have just a few minor issues though, the digital displays are all over the dash and look like they were borrowed from a ten dollar watch. The clock and climate control settings are hard to see when the sun is out, and there's no constant display of the odometer except as one of three or four display options with the trip computer. And, what's with no compass? The daytime running lights/headlights have confused me as I have an automatic headlight switch on my other vehicle.","We love the power doors and lift gate, the back-up camera, and the fold-in-the- floor rear seats. ","Better color choices, compass, better digital displays. How many choices of grey and silver do you need?"
5,2009 Odyssey EXL RN!,Lorraine  ,05/26/2009,,,5,5,5,5,,5,5,5,5,"Very impressed!  I love the minivan just like my 3rd child (I only got 2 children)!  The engine is smooth, quiet, and powerful.  It's the best car we've ever bought!  100% Satisfaction!  No complaint at all! Just bought it ~ 3 weeks ago with 1 mile on it when brand new.  ","Nav with Voice activation and Backup Camera, DVD with 2 wireless headphones, 6 CD changer, 3 zone climate control, moonroof, etc.",It would be nicer if they could throw in the backup sensor and fog lights though!
4.625,Still tough to beat the Odyssey,Tommy B ,05/20/2009,,,5,4,5,5,,5,5,4,4,"This is our 2nd Ody. The first one, an '03 EX-L, was bullet-proof. Got as much as 26 mpg on the highway.  Our new 2009 is even more refined. Much more plush interior, nicer exterior colors and lines. Features like power liftgate and backup camera are super useful.  Some complain that their new Ody rides rough. Actually, it reminds me of the driving feel of my Bimmer. You can definitely ""feel"" the road; but it's a good refined feeling, not a ""rough"" feeling. Interior noise about the same as the old one.  The one complaint I have is with the Plus-One center seat for the 2nd row. I find it nearly unusable. First, you can't stow it. On earlier models you could, but no longer.","Backup camera in mirror, power liftgate, good hiway mileage.",Make the Plus-One seat stowable. Right now it has to be removed and stored in my garage when not in use.
5,Odyssey Excellent!! ,Olavanman ,05/18/2009,,,5,5,5,5,,5,5,5,5,"We just love our 2009 Odyssey EX-L with RES. It feels just like our Accord. Drive: The drive is smooth and comfortable. Accelerates well. Comfort: We just love the leather interior, really comfortable seats. One drawback though is - the Steering Wheel should extend out a little farther for a little more comfort. I am 5'-6"" and sometimes I find it hard to rest my arms on the arm rest and still be able to grip the steering comfortably. Anyone looking at buying the Odyssey should consider this. Interior Design: We just love the design. The fold-away center tray in the first row is a great thing to have. It makes moving from the front to the back so much easier (especially with kids).",In-floor storage. VCM. Power Tail gate. Rear-view camera and mirror display. 1st row center fold-away tray. 2nd row middle seat.  ,Steering should extend out a little farther - maybe another 2 inches would make for a more comfortable seating!
4.875,Love our newly bought Odyssey,Shania ,05/12/2009,,,5,5,5,5,,5,5,4,5,"We got our first minivan a few days ago after doing research between Odyssey and Sienna for several months.  We finally decided to go with Odyssey because of the safety rating, the roomy third row seats and better value for the price.  It is really fun driving this car. Though we never drove a big car before, we find it extremely easy and pleasant to drive this car.  The whole family loves this car.    ","Backup camera, power doors, safety features, three zone climate control.",Nothing for now. 
4.75,First MiniVan....Love It,chris ,05/12/2009,,,5,5,5,5,,5,5,3,5,"I originally did not consider a Honda thinking it was going to be too expensive.  But after comparing costs with other ""less"" expensive options the Honda stood out.  Exterior has great stylings for a minivan and the interior is roomy and luxurious. Drives like a car.  I can hardly wait for my first trip.  Auto doors are a feature I never really thought about, but I love them. What's more the wife and kids love it.   ","Auto doors and tailgate, seating options, plenty of storage compartments. Smooth ride.",More color options.
4.75,An Impressive Vehicle,Chrysler Exile ,05/06/2009,,,5,4,5,5,,5,5,5,4,"This vehicle replaced a 2000 Town & Country Limited that literally fell apart on me.  I liked the ride a little better on that vehicle, but the Odyssey is extremely well-designed in terms of day-to-day practicality.  That even extended to the pre-drilled bolt-holes that allowed me to install a trailer hitch in about a 1/2 hour using only a socket wrench. The Honda's principal drawbacks are that it is noisier than other minivans and the entertainment system is too complicated.  Plus, it's wider than other minivans, which makes garage parking harder.",VCM is invisible in operation and significantly boosts mileage.  Interior storage and cabin organization are superb.  The best cruise control system I've ever used.  The digital media input jack is simple and welcome.,"Seriously, what's up with the no- compass thing?  Automatic headlights and exterior rear view mirrors that actually show what's behind you would be nice, too.  And cross-bars on the roof rack should come standard with the roof rack."
3.125,Hope based on reputation,HHSBS ,05/05/2009,,,3,4,4,4,,3,3,3,1,"Honda is a well reputed co., so we bought the minivan. Having said that, overall I am very happy with the interior room. But it lacks features and the most disturbing thing of all is the road / wind noise. If you plan to go out with family on long trips, this is not a van for you. Noise level is high and makes the journey a bit of a torture. Also lack of power outlet is a big disappointment. Will look elsewhere for my next car / van.",Lots of room.,Fix the road noise and provide a little more comfortable ride.
4.5,Honda is only company making deals,steve ,05/03/2009,,,5,4,5,5,,5,5,3,4,"This is our 2nd Honda Odyssey.  First had 105k miles, 6 years and we paid sticker no discounts.  This time we looked at Toyota, Nissan, and Ford.  Ford, Toyota, and Nissan were basically offering invoice pricing which is what they did last time, not great deals... Honda was 28% off sticker and way below invoice listed on websites.  Way different than last time we bought from Honda. This van was thousands less expensive than what Nissan or Toyota would do.  Ford was not that great either.  Now I know why Honda has the best year over year sales figures.  They know what market they are dealing in...  I have a 2000 Acura RL with 115k, but can't get Acura to do a deal... strange. ",,
4.5,Honda let us down!,Jerry-from Cloquet ,04/28/2009,,,4,5,4,5,,5,5,4,4,"My wife and I considered the Honda Odyssey and the Toyota Sienna, but liked the overall looks and reputation of Honda. The one option we both wanted, living up here in the frozen north, are heated seats. At first we only wanted the EX model, but had to purchase the EX-L to get the heated seat option, along with the other options that came with the EX-L. This cost us over $3000.00 extra, all because we wanted heated seats. After buying the Honda, taking it home and reading into the owners manual, discovered that only the drivers seat was fully heated, not the passenger seat, which is only heated on the seat portion. Honda should have had this information on their brochures.","Good ride, roomy interior and resale value. Spare tire stored inside the car. A solid, good looking vehicle.","A ""compass"". Switches for heated seats should be up higher on the instrument panel. Instrument panel should be better lighted. Did I mention a compass?"
4.875,First Honda Owned,Melissa ,04/22/2009,,,5,5,5,5,,5,5,4,5,"Love it! I have a 2004 Town & County which has been the most unreliable vehicle owned. The T&C does seem to have a more comfortable ride as the Honda has a more ""car feel"" to the drive. However, the safety ratings and extra space - as well as reliability ratings - makes this a much better investment for the money. The drive in comfortable and the kids love the exterior look - a little sportier than the T&C. We cannot wait to move up to the EX-L or Touring in a few years. ","6 CD Disc Changer, rear power windows, power sliding doors are very quiet, temperature and zone control, 2nd row jump seat or tray, extra floor storage","automatic headlights, power passenger seat on the EX model, more padding in seats"
4.375,One week and so far so good,EC from Canada ,04/05/2009,,,4,5,4,4,,5,5,3,5,"Picked up my first Honda and first mini van a week ago and so far it's been very good experience.  I haven't driven it lots yet, but so far I really like how it drives.  Love the backup cam and power sliding door and tailgate. I do find the VCM is more obvious than it felt on the van I test drove.  I also felt it more when the gear downshift as I am gliding along with the foot off the gas pedal and running with the ECO light on. Mileage so far hasn't been as good as I expected, but we are just about 500km into the break-in phase of the vehicle, so hope it gets better. Will write another review in a few months after the break-in period is over. Considered Sienna, but like styling of Honda",Power doors and tailgate. Sunroof (my first) Backup camera The fun one can have with VCM - trying to keep the ECO light on Power seat Spacious interior Stylish exterior Heated seats    ,"Better mileage - I hope this will improve after the break-in period. Could use more than one power outlet in front I thought the front door is not as solid as it should be.  When closing the door, it sounds solid from inside, but sounds kind of hollow from outside. More storage spaces in front."
4.375,2009 LX - Not bad,ale ,03/28/2009,,,4,5,5,5,,4,4,4,4,"We just bought the LX and have been driving it for a few days.  The car is easy to handle and the ride is pretty smooth.  I know it is an base model but for safety reasons, with children in mind, I wish Honda would just make all their models with electronic doors.  I would have loved to purchase the EX but could not afford the price.  Also would prefer the review mirrors to be a bit larger as their is a blind spot area that is hard to catch.  Second, design the radio closer to the driver so you're not having to reach so far over to work the radio - some people are short.  Finally, I think a tray, similar to the one in the front should also be placed between the second row seats.","Easy handling, very roomy, comfortable.","Electronic doors on all models for child safety.  I'm scared that my younger children will get smashed fingers or hands.  The doors are heavy!!  It's just not safe.  A second row flip tray, like in the front, would be helpful for kids (drinks, food)."
3.625,Where is the reliability?,Low Budget Dave ,03/28/2009,,,4,4,3,2,,5,3,4,4,"I spent the extra money on a Honda because my friends told me the Chrysler was unreliable.   But the Honda's check engine light came on after 20 miles, and is still on.  The dealer can turn it off for me, if I drive the 20 miles back to the dealer.  The road noise is worse than my 4Runner, the seats are less comfortable, there are fewer features, and the VCM feature stopped working when the engine light came on.  I want my 4Runner back.","It drives like a car.  No sway, and a good feel for the road.",1. The stereo controls are unreachable.  The controls on the steering wheel only change between pre-sets.   2. Check the engine before it leaves the factory.  3. There should be an average gas mileage computer.  4. The dealer's first offer was higher than the sticker.  How about some sanity?
5,Long time Honda fan,AEdwards ,03/26/2009,,,5,5,5,5,,5,5,5,5,"This is our sixth Honda product, first van.  Love the way Honda packages models so you don't have to buy an option you don't want just to get something you do want.  Great quality that we expect from Honda. Odyssey has definitely lived up to it's reputation.  Lot's of fun features to keep kids and dads happy.",Power doors/tailgate.  Hands free link.  backup camera,Would like to see more color combinations.
5,So far so good....,sid ,03/02/2009,,,5,5,5,5,,5,5,5,5,"After months of flipping between Odyssey and Sienna, I am a very happy owner of a Honda. Its fun to drive and turns like a normal car. Doesn't feel when you are driving a van, only when you see the space, it feels like a spaceship.",- Backup Camera - MP3 Compatible 6 CD Changer - Power liftgate - Lots of Space - 8th Seat - Sliding 2nd Row Seat,Nothing right now...
5,09 EX-L w/RES Just off Assembly Line,raechris ,03/02/2009,,,5,5,5,5,,5,5,5,5,"Just purchased my first Honda and first minivan. It just came off the assembly line two weeks ago and the family could not be more excited.  Having driven sports cars, sedans and wagons up until this point, I can honestly say after a short adjustment to the driving dynamic of a van, it is just wonderful. Having the unusual ability to detect even the smallest fault, there is a slight rattle/buzz above driver's head area, but the radio easily compensates. It is a living room on wheels, the kids have plenty of room and love all the options/variations, space. Insanely comfortable, amazing visibility, plenty of power and a VCM system that is nearly imperceptible. On the first half tank 19 mpg city.","VCM, headlight illumination, power doors, heated seats great warmth (some others barely noticeable), seat comfort, visibility, versatility, everything works so far without exception.","All color leathers pick up dirt and discolor easily. I have had VW and Infiniti leather that never did (esp. VW) over life of vehicle.  Interior very nice, but spoiled from VW interiors."
4.625,Practical and Utilitarian,DR. KARL ,02/20/2009,,,5,5,5,5,,4,5,4,4,"Just traded in a 2007 MB CLS550 for a more practical vehicle... no regrets! This minivan is more useful and spacious than our MB GL450. Touring model wonderful in that no options apply (comes fully loaded); avoid the PAX system however - expensive to replace the tires. Sound system/DVD player/navigation system are user friendly. Cylinder deactivation of 3.5L V6 is great, enabling 26 mpg on highway. Amount of storage space (without folding 3rd row seats flat) is astonishing. I highly recommend this vehicle to anyone with kids and dogs (we have one child and 2 dogs). ",Sound system/navigation/DVD player; cylinder deactivation system; storage space -- EVERYTHING!,Power folding 3rd row seats (although very easy to manually adjust).
4.5,Best One Yet,itsjustme ,02/19/2009,,,5,4,4,5,,5,5,4,4,"Our van is used for both in town grocery getting, and long road trips.  We typically get 18 mpg in suburban driving and 25+ mpg on the interstate.  Once you get over the ""I'm driving a mini van"" syndrome, it is highly functional and drives like a car.  We just went to the Chicago Auto Show to look for alternatives.  Many smaller vehicles get less mileage, have greater depreciation, and cannot do all of the things a minivan can.  Can't wait to take our tandem bike to Florida and escape from the Chicago winter.","Power hatch, power passenger seat, MP3 input, backup camera. New VCM (3-4-6) is smoother.",Why in the world doesn't a vehicle at this price point have a compass?  Also need more than one power socket in front. 
