4.875,Made me a VW Fan!,Mariya ,05/21/2009,,,5,5,5,5,,5,5,4,5,"I searched for a convertible for 6 months, researched endlessly an honestly barely considered the VW-then I drove it and fell in love!  My husband had owned a Corrado & Jetta Wolfsburg yet I never thought much of them.  I am now a VW convert.  The hardtop is significantly quieter than every other convertible I drove. The turbo has amazing pick up and makes it incredible fun to drive (I have never thought any car was fun)  Nice sound system and great interior. ",The hardtop drops opens and closes quickly and conveniently.  ,
4.875,Enjoying the Eos,loudounman ,03/29/2009,,,5,5,5,5,,5,5,4,5,Purchased base model w/ 17 inch wheels. Great fun to drive. Plenty of pick-up with turbo. Slight hesitation but then it really moves. Compared with BMW 328 but glad I went with Eos. Saved alot of money and enjoying the car. Give this car a try and dealers are willing to deal right now.,No doubt it is the hard top convertible with the sunroof. Great to use either way. Smooth ride.,Improve the base radio and keyless entry should be standard. Better headlamps.
4.875,Just perfect,rulerofthemoon ,03/21/2009,,,5,5,5,5,,5,4,5,5,"Had the car for about 3 weeks and could not be happier.  It's the perfect combination of sporty fun and practical comfort.  The convertible hardtop is stunning to watch and will sell you on the car.  Interior noise is what you'd expect for this car ... unlike the soft-tops I drove that just were too loud with the roof up.  Get the upgraded floor mats ... adds a nice touch.  The Komfort trim is VERY well equipped.  The Lux version is a considerable premium but some items, like steering wheel controls, are useful.  ","Excellent performance, transmission and gas mileage.  Big sunroof provides great light and view when the roof is up.  Nice sounding radio and outfitted very nicely.  Heated seats, auto-climate control and ipod dock are excellent.  Get the 17inch tires if buying the Komfort trim.","Big, large sunroof is very noisy when open. Might as well go all the way and put the roof down!  I prefer a true tilt steering wheel.  "
4.75,Great car for the value,NYattorney ,03/19/2009,,,5,5,5,5,,5,5,3,5,"I really wanted to reward myself with a hardtop convertible- just wasn't entirely sure which.  Once I saw and test drove the Eos, I immediately fell in love.  It's the perfect size, picks up fast (thanks to the turbo engine), is the only hardtop with a sunroof, and the style is sleek. The only complaint I've had so far is since I bought it towards the end of winter, I've noticed that when it drops below freezing, condensation builds up inside the car and freezes on the windows.  The gas mileage is not GREAT, but i guess we should expect that from a turbo engine! ",Everything! from the sunroof to the turbo engine. ,"I would suggest VW come out with a model that has the radio controls standard on the steering wheel, instead of having to upgrade to the Lux just for something simple like that.  Also it'd be nice if they could correct the windows going down everytime the doors are unlocked/opened. "
5,Lovin this little car,neweosfan ,02/12/2009,,,5,5,5,5,,5,5,5,5,"I've had my Eos 3 mos and really enjoy this car.  Comments: the top is amazing - attention getter - same as on much pricier models - mine works great & used a lot.  Moon roof great & huge for the car, handles on mountain roads well. Light car, acceleration to spare, good brakes, fun! Quiet ride (top up), sound system good for the price. Lots of people stop me to compliment/ask about this car - really.  And I live in a car lovin town.  That was a surprise.  Glad I saved that BMW money and got this sweet little ride.  Love it - recommend it highly.  Fun, good-looking, great convertible top. One thing, got hit in driver's door.  No repair parts are avail., so slow to get Euro parts at plant.","Great car for the money. Convertible Top is a blast & works great. Just plain fun to drive - I find myself smiling a lot, my not-leather seats are just as nice as the real deal & no one knows.  Handles very well, good looking, low read noise, seamless shifting (auto), gas mileage!","Note... I got the base model to save $ - Why not automatic headlights in 2009? Rreally. I miss my keyless entry - hard to go back,  no steering wheel controls but I must say controls are very easy to reach so have not missed it as bad as I thought.  Nothing major."
5,It's worth it! ,EOSEJIL ,01/17/2009,,,5,5,5,5,,5,5,5,5,"I purchased my Black on Black fully loaded EOS in October and gave it much thought, it was totally the right choice.  I have read a TON of reviews on the '07-'09 and here are tips for those who have had issues.  You need an excellent dealer with VW fans in service, the prep work needed on this car is extensive.  I test drove several and only two dealers seemed to have it prepped right.  My car has no issues at all.  Also you cannot wash this car under 40 degrees or you will mess up the seals, plain and simple.  If you do not have a garage I would not buy an EOS.  You have to be patient with the car, the window move to get in and out be gentle.  '09 DVD Nav is worth it too if you drive a","Trunk is really great, I have fit so much into it.  The top of course. The sound system is really good. My EOS has very little road noise at all, with the top up of course. Great on snow and ice. In good weather (over 40) 31 MPG city/hwy heavy traffic, now 25. All the bells and whistles!",It drives very well except for the initial acceleration could be smoother. But once you get used to it you can get it going super fast.  Turbo is amazing on expressways.  One more storage compartment would be groovy but it keeps me from using my car as storage. LOL 
4.5,"Great functionality, poor driving",swissre ,11/05/2008,,,4,5,5,5,,3,5,5,4,"After almost 3 months of owning a new EOS I am still happy with the functionality of the sunroof, it has good torque throughout the RPM range even compared with other turbo engines, it has very good speakers but lousy sound unit (premium) but the worst for me is how it drives. You have to be really delicate to avoid the car spinning like crazy when you start. I have the upgraded 17'' wheels with Continental tires and that has helped little. So at the end it dissapoints because the engine is great and the DSG gearbox is amazingly smooth but the car is not sitting on the road as it should and can become dangerous because of the big torque it has for its size.","DSG, torque throughout engine's range, sunroof, speakers quality",Poor driving characteristics 
4.875,I love this car,Cindy ,10/16/2008,,,5,5,5,5,,5,4,5,5,"I love this car.  I have a new 2009 color-gold/silver, not the official name, it is beautiful.  Everything works well, very quiet and I get lots of looks.  I love having the moon roof so I have a great sun-overs car all year.  The only thing I don't like, is the movement of the windows after you turn the car off- they go down a little before rolling all the way back up.  This is bad in a rain storm.  I would recommend this car to anyone who had considered buying a convertible.  It is better than a convertible with the sun roof!  It gets great gas mileage so I don't mind the premium gas.",convertible top with the sun/moon roof,correct the window issue
5,Very pleased,CCP ,10/12/2008,,,5,5,5,5,,5,5,5,5,"Sorry there are ""lemons"" . Fortunately, I am one of the lucky ones. I have been in search of a convertible for close to a year.  I knew I wanted German technology, retractable hard top, front wheel drive if not all wheel,and some updated technology like a navigation system and ipod adapter. What you can get loaded in this car is a just a starter price in BMW or Audi.  Audi does not yet make a hard top and BMW does not have front wheel drive in the class. The retractable hardtop has a panoramic sunroof that opens..the only convertible with this feature.  They have corrected the ""whirring""with small windscreen above he windshield. Technology of top closure:priceless. Gas OK.",Retractable hard top with panoramic sun roof that opens.  Windscreen above windshield detracts noise. Navigation system has full media capabilities.,"Built in bluetooth, now a purchased accessory."
5,You get what you want,Jeff ,10/10/2008,,,5,5,5,5,,5,5,5,5,The car is very fun to drive.  I have never had a convertible in my life so I was not to happy when she brought it home.  I figured it is her car and she will be the one driving it so get what you want.  She loves it.  The handling is good and speed is fine.  Does it have wind noise.  What can you expect when the top comes off.  Great car overall,The top,Steering wheel controls would be great but I can easily reach the controls
2.5,Do not buy this car! ,JLM  ,10/02/2008,,,3,4,1,1,,1,4,3,3,"I purchased a 2009 VW EOS 8/30/08. On 9/29/2008 a valve that measures the clutch temperature malfunctioned. If the clutch is too hot ""safety measure"" the car cant change gears. This malfunction occurred while I was on the freeway; I was almost hit by a semi trying to pull to the side of the road. It was like I put it in neutral and revved the engine, every light in the car flashed indicating a problem. I was initially told that my problem was a faulty engine switch. This diagnosis didnt make sense. I had to demand to speak with the head mechanic for my concerns to be taken seriously. This value malfunction also causes a pressure problem in the transmission. I have contacted a lawyer.","Affordable hard top convertible, but it would be much nicer if the car ran properly.",Make sure that these cars are safe for people to drive. I was nearly killed due to my situation and then the dealership treated me poorly until fully diagnosing the problem. I have only had my car for 4 weeks and the dealership will most likely have it for 2 weeks. Do not buy this car!
4.25,Total Fun Car!,Steve ,06/12/2008,,,4,5,4,4,,4,4,4,5,"I've always wanted a hard-top convertible ever since I saw one two months ago.  I generally assumed that it would be way out of my price range, but when I found out that Volkswagen made a hard-top convertible, I was totally 'hoodlumed'.  It turned out to be not only very reasonably priced but it drives and handles really well.  People will also be very surprised by the roominess of the rear seats.  The back is definitely big enough to hold two average sized dwarfs or a couple of medium sized farm animals.  My automatic transmission shifts very smoothly and the engine definitely holds its own on the highway.  Overall, this car is a pleasure to drive.    ",This drives like your typical volkswagen - with nimbleness and class.  Mileage is pretty decent for a fun car.,"I wish it had a small cooler that you see on some minivans.  It would be nice to put my cold drink and chocolate somewhere.  Otherwise, I wish the Volkswagen engineers found a way to put a moonroof when the top is down.  "
