4,Great Little car,K F ,07/07/2016,4,2,3,,,3,4,5,4,,,This car is fun and great on gas.  It has a zippy S-transmission that gives you the feel of a manual with the ease of an Automatic.  It didn't come with an owner's manual so I am not sure how to use many of the entertainment functions which is frustrating.  The interior is leather which gets VERY hot in the summer.  The interior was used well and I am adjusting to the missing pieces.  I love how this car drives and love the convertible/sunroof option.  The dealership I purchased from gave me a good deal and I would buy from them again!,,
5,Problem free for 50K miles!,rcboater ,03/25/2014,4,3,5,,,5,4,4,5,,,"Bought my car new in May 2009.Car is now five years old, and we've put 50,000 fun-filled miles on it.MPG is pretty good, too. On the highway, I get 32 MPG.In my mixed suburban driving,I will get about 28 if I drive normally,but have gotten as high as 35 on the same route by driving conservatively.My car has never leaked- but I paid heed to the advice on the owner forums to lubricate the roof seals annually, to keep them soft and pliable. (That's a 20 minute job.)  I've had NO issues with the mechanical aspects of the car-- to date, the only thing outside of regular scheduled fluid changes was new rear brake pads at 31K miles.UPDATE:  Now up to 68K miles, all still good.   Rear brake pads again at 60K. My only real complaint with the car goes back to how VW packaged the options in 2009.   Back then,  to get the leather seats and steering wheel audio controls, you had to buy the Lux, which meant you got an automatic.   I wanted the manual, which meant I had to have the Komfort, which couldn't have those other options.     I do love my manual Tx-  so it was the right choice, but I wish VW had been more flexible in the optioning.UPDATE:  Now up to 72K miles. all good.",,
5,this is the one!,atlanticdave ,10/12/2012,,,5,5,5,5,,5,5,5,5,"unlike so many other folks who seem to have owned nothing but foreign cars, i have only ever driving u.s.-made cars...and, although i know that american cars are essentially now the best they've ever been the quality they've ever been, i have to say i have never owned or driven anything as nice as this car...i am saddened that not all of us have had positive experiences...i purchased it three years old, with 14,000 miles on it...and i just want to say, so far,so GREAT! nice ride, nice interior comfort, great sound system, very head-turning and eye-catching, plenty of acceleration, i recommend this car without hesitation! i have driven it 6,000 miles, and have nothing but positive things ","to say about it...love the mp 3 player, love the satellite radio, love the inlet for my ipod, the moonroof along with the hard-top convertible is a unique and amazing combination! it is exceptionally quiet-it is the fourth convertible i've owned, and it is just so much better than anything i have owned before! the heated front seats are fantastic, especially for a new england winter, and it truly makes driving fun!","i would like if it had cruise and volume controls in the steering wheels...those are nice touches in nicer cars, of which this is one"
2.25,Worst Car Ever ,jlmurray81 ,07/21/2011,,,3,3,1,1,,3,3,1,3,"I leased this car back in August on 2008 and have had nothing but problems with it and the dealership ever since. Four weeks after I leased the car, a transmission valve had to be replaced. I learned about his problem only after nearly being killed on the freeway because my car lost all forward momentum. To add insult to injury the dealership insisted it was my starter that caused this issue. Only after speaking to a mechanic was this issue actually addressed. The dealership had my car for over three weeks and tried to charge me for the rental car. Approximately a year later the manufacture issued a recall for this transmission value issue. ",,"On extremely hot days the navigation/radio will randomly turn off and not come back on, this issue has happened three times which requires a trip to the dealer to be rebooted each time. I rarely take this car on any trip over 100 miles as I am concerned with the reliability. Most recently I took the car on a 250 mile trip and sure enough the Malfunction Indicator light illuminated on our way home. We did everything the manual suggests to address the MIL. Upon our return the car started to idle very rough and the transmission would kick when slowly climbing up hills. We dropped the car off at the dealership at the night drop. Only after calling four times through out the next day did I find out that the exhaust manifold flaps had to be replaced? The dealership had the car for two days and didnt offer me a rental car. All of these issues were covered by the warranty; however, I have left my car with the dealership for over a month during my 36 month lease. I only have 27k miles on my car and I dont even trust it to get me to and from work, which is 7 miles from my home. "
3,DEFECTIVE TRANSMISSION,BOCA LEN ,11/13/2010,,,3,3,3,1,,4,4,2,4,"Overall my EOS is a reasonably priced convertible with generally good quality.  I bought the car new. I drive to work and never abuse the car - just basic transportation  However, at 1400 miles the transmission blew and had to be replaced with what I now know is a refurbished unit.  Last week at 10,000 miles the refurbished transmission blew again.  The dealer wants to replace with a refurbished unit again.  VW extended the warranty, the dealer has been pleasant to work with and provides a loaner car. The point is, this transmission is too complex. I thing that anyone considering buying a VW with this transmission needs to be aware of the problems that are inherent with this unit. Beware!",drop top,"VW needs to find a decent transmission to put into these cars.  Simply covering them under warranty does not ameliorate the hassle and inconvenience of continually replacing the transmissions which self-destruct every 10,000 miles.  (at least for me)"
5,FUN2BEHAD,FunFunFun ,11/06/2010,,,5,5,5,5,,5,5,5,5,"I had a 2006 Passat on lease.  I had been looking for 6 months for a convertible.  VW let me out of my lease for a ridiculous amount and I got a EOS.  I had tried the Toyota, Sebring and a few others but loved the handling of the EOS.  It's fun, no problems, lots of compliments.  Most fun driving ever. The back seat is small, but deep and bigger then the Volvo, Lexus etc..  I always get compliments on the car.  It's been so much fun. Great for road trips to the beach.    ","Hardtop Convertible/Sunroof, heated seats","lock for trunk when valet parking...available in Passat, but not EOS"
4.875,It's the greatest Car I owned,mac ,06/15/2010,,,4,5,5,5,,5,5,5,5,I have owned Fords and Honda's all of my 50 plus years. Last year I went to look at a VW Passat and left with a fully equiped EOS. I and my kids are thrilled. I have a hard time keeping my car keys in my hand my four boys take it every chance they get. It by far is the best car I ever had not a lot of back seat leg room nor storage but runs great with nice get up. Would recommend this car to anyone who doesn't have to load their family in their car anymore.,hard top and ease of converting it. Radio sound is tremendous and has good speed and steering. Great safety rating. ,Could be a little bit bigger. But I really am not complaining. Great
3.875,My 1st VW and my LAST,louloulane ,05/12/2010,,,4,5,3,1,,3,5,5,5,"Beautiful eye catching car. Too bad it's not reliable. I have had to have it towed 3 times in 3 months back to the dealership. We bought 2 VW's on the same day, an Eos & a CC. The Eos has been such an unpleasant experience it will be the last time a VW is owned in our family. 1st time and last time for a VW for us. Ignition, electrical,turbo problems.",The sunroof/convertible is an awesome feature. The front seats are very comfortable. The backseats are a different story (see below). Love the nav system too.,Quick release to access the backseats would be nice. The slow moving electric seats is annoying & then difficult to get in the back. The back seats are pretty much non-functioning. The Navigation system needs to be recessed so you can see the screen when you have the top down. 
4.75,New leftover 2009 EOS,Jeff ,03/26/2010,,,4,5,5,5,,5,5,5,4,"We bought this along with a new 2010 Golf tdi. So far we have about 3000 miles on it, and it has preformed well. Most surprising is the relatively good fuel economy. Overall we have posted 29.8mpg with a high of 36mpg, and this is winter and the car has a ways to go before fully broken- in. We picked up the car for $26,600 or $5700 off MSRP. It's still too early to tell how this car will turn out but so far it is good. The only drawback is the weight of 3500 lbs, but all convertibles are heavy, and this is one of the lighter ones. Cornering although acceptable is not as crisp as lighter German cars. This is our first convertible, so we'll have a better idea after our Wisconsin summer.","The CSC, coupe/sunroof/convertible is really nice. The car is remarkably quiet, very comfortable seating and reasonable rear seating. In addition, it's a nice looking car. The motor and manual transmission excel, love the power and fuel economy. Economy so far is much better than the posted EPA.","A stiffer suspension would be nice, but the weight of 3500 lbs on a front wheel drive car has handling limitations. Would be better if it was a rear wheel drive car."
4.625,Nice car with a few hiccups,drspoon ,03/25/2010,,,5,4,4,5,,5,4,5,5,"This fun car is a dream to drive.    The turbo engine really gets up and goes.  We have taken the car on long trips and it is really very comfortable.  Now after having it for a year we find out the hard way that the engine is an oil burner after total 20k mileage.  Just got it back from the dealer where the oil consumption is one half quart per 1000 miles-- an amount that Volks says is acceptable.  I asked how I can make the 10,000 mile factory suggested oil change interval and the dealership simply says I cannot.  For the price of this car and the supposed quality of Volks engineering this is simply unacceptable.   No more Volkswagens for me!!!!!!!",Great acceleration and maneuverability.  We get up to 30 mpg on long trips so with today's gas prices this car will not break the bank.  The audio system and navigational systems are top notch.  The trunk is still large enough with the top down to carry most of the things we want on a long trip.,With no guard the sides are prone to dings from other cars.  And finally we just do not like the fact that we must carry oil with us to constantly top off the oil every other gas tank fill-up.  Oil consumption for this car is unacceptable.  Keep that in mind before purchasing  one!!
4.875,Baby Boomer Bust!,Stephen Harris ,02/18/2010,,,5,5,5,5,,4,5,5,5,"I believe this car is for the baby boomer that has finally reached a time in life when they feel they deserve a fun car. They have lived with the practical long enough and want something that makes no obvious sense. I think it is the most fun car I have ever owned and has the VW stamp of quality. No problems after 4000 miles of ownership and a trip of 2500 miles to Florida and back was super. No problem with trunk space, two bags consisting of one duffle and one regular was plenty for wife and I for one week. VERY comfortable and had no problems with power for passing or keeping up with traffic. Grandkids love the ""transformer"" and it gets lots of attention. Most people can't believe it's VW","Fun to drive, very classy and attention getting. Most people don't even know what it is until they see the VW on the trunk. Comfortable for long trips and fun to drop the top when the temp. is right. Hard top for winter. Feel very protected with top up, not like a cloth top vehicle. Very good MPG.","If it was bigger in back it would be nice, but it was purchased with the thought that it is a TWO person vehicle so why whine because because you can't haul your friends around. If it is too crowded, let them drive!"
4.875,So Glad I went with it. ,mac ,01/06/2010,,,5,5,5,5,,5,5,4,5,My wife and sons take my car every chance the get. I have trouble sometimes getting it to drive. It is smooth and reliable. I really was going back and forth on which car i wanted and test drove many and settled on the EOS and glad I did.  The interior is excellent I do wish the back seat had a little more leg room but I don;t plan to sit in the back. the Stereo system is tops and the control of the car is tops. i am surprised on how quiet it is when the hard top is on.....Great Car,Hard top and sun roof.....is out standing....and the wind screen really does work.. I have own this car for 6- 7 months and thinks its great...,leg room in the back and wished passanger seat was adjustable. 
4.75,Love the Goddess,BW in Wash DC ,12/21/2009,,,5,5,5,5,,5,5,3,5,"Bought myself a b-day gift w/a Komfort 6M. Brings a smile every time I have the top down. It is the perfect combination in size, handling, and fun. Not a speedy coupe but come on, it is a convertible, relax, ease back, and feel the sun on your back. No problem yet w/seal leak as some others reported in earlier models.",CSC Hardtop (Coupe-Sunroof-Convertible),Side mirrors don't provide as much view coverage
5,Very safe hardtop,Tristan ,12/06/2009,,,5,5,5,5,,5,5,5,5,"I have had this car for 4 months, nothing has gone wrong the build quality is amazing.  I recently flipped the car on Thanksgiving day, and the hardtop is very safe, only caved by about an inch to maybe 1 1/2 inches. The anti-rollbars popped up and if I hadn't had the top up I believe I would be just as fine.  Only got a couple cuts on my hands when getting out.  I highly recommend it just for the safety features even though the interior is amazing along with the engine.  I was hitting 36 mpg with premium on the freeway at an average of going 75 mph.  ","My favorite features was the convertible top, along with the panoramic sunroof.  I really appreciate having no buttons on my steering wheel.  Much better seats than the Jetta.","No suggested improvements, except that the HID lights I had were so great I would expect them to make them standard on every car.  Best lights I have ever had on a car.  Stereo was pretty good, but not as fulfilling as the Monsoon stereo on my old '02 z28 Camaro."
3.625,Avoid It - Traded Mine In,LR ,11/24/2009,,,3,5,2,1,,5,4,4,5,"53 days in the shop in the first year, finally had enough and traded it in for another brand.  Every imaginable problem with the electrical system, sensors, gas cap, abs, braking, fuel pump, air bag, among other problems.  Every little repair required shipping in parts so repairs took forever, and nothing fixed right the first time by dealer.  I owned the car for a little over a year and just took a huge loss on the trade, but it had to go.  Had trouble even getting near blue book on trade due to the car's reputation.  Did lots of research prior to buying and 07/08 models were well reviewed.  09 seems to be a disaster.  After 15 years driving VWs, this will be my last.  Very disappointing.","The 4 cylinder engine is powerful, acceleration is great, handling is very precise.  Top is extremely cool when it works.  The ipod adapter was ok.  Solid ride on the highway and around town.","At this price point, the car should have some basic things like audio controls on the steering wheel and bluetooth capability for phone.  I looked past these items when I bought it, but should not have.  Very annoying not having those basic features that I had even on Jettas I owned prior."
4.125,FUN LITTLE CONVERTIBLE,FLORIDA LEN ,10/20/2009,,,4,4,5,5,,4,4,3,4,"I was concerned about buying a hardtop convertible, but I bought the EOS knowing how well VW builds cars.  So far, early on in ownership, the car is solid and exhibiting no leaks.  The car is a good value for the money.  It is not a styling standout, but the design is nice looking.  The interior is typically German, all business.  What is great about the car is that is overall very solid, handles well and has decent mileage from a very peppy engine.  Although, a small car, it feels very safe and secure and I am glad I bought it.",I do love the whole top system with the sunroof.  I also like the fact that the engine is pretty quick even though it is a 4 cylinder.  Best feature is the radio - no funny buttons or things to pull or push just very straight forward radio controls.,"They need to improve on the window system in that it drops a little when you shut off the engine and if it is raining, it makes the interior wet.  I also think they could have put the audio controls on the steering wheel."
5,Best Car Ever!,My favorite! ,09/28/2009,,,5,5,5,5,,5,5,5,5,"I was a little worried getting into this car because of the reviews about the not so sporty steering, I disagree a whole lot! Its so much more fun then then the chrysler sebring hardtop or Pontiac G6 hartop! My favorite features are the great sound system and the HUGE sunroof with pop up wind blocker. For the money its worth it! I live in Michigan and i must say it turns heads, i love seeing the people in awe when i bold off the line! Also i get 25 mpg in mixed driving! The other day i had the sunroof open and i was doing 100 on the highway and it felt and sounded like 65! If you can live without 5 seats and a smaller trunk this car is perfect for You.","-The sunroof with pop up wind blocker, its not black, ugly, or takes up half of the sunroof! -Backseat is good for anyone under 5'10 when the top is up. -Sound system is great! (8 speakers) - quick yet efficient! - DSG Twin Clutch is best of both worlds!",-Trunk is only about 10 cubic feet with top up and like 3.5 cubic feet with it down. -The VW symbol is also the trunk opener it took me 2 weeks to figure it out! -Its has nice styling but its a lot more sporty then the styling suggests!
5,Great Car!,DTR ,08/22/2009,,,5,5,5,5,,5,5,5,5,"This is my first convertible, and I was a little concerned about the problems that are typical of the breed- -wind noise, cowl shake, etc.  I have been very pleasantly surprised by how this vehicle performs.  Yes, there is some wind noise, and it's not quite as ""solid"" as a sedan, but I'd definitely purchase this car again.  It's so much fun to drive, and gets great gas mileage.  ","Great gas mileage, hard-top convertible, nav system, xenon lights and backup sensors, DSG, turbo engine",Bluetooth & HomeLink should be included for this price
3,Run..... from EOS,nstallent ,08/17/2009,,,4,4,1,1,,1,4,4,5,"My Eos, that I loved, is sitting in Al Johnson Volkswagen repair shop and is going to stay there. I have 12 sheets of repairs. Volkswagen has tried to be very accommodating, but now lets see when I get to settle. I traded my 2000 Camaro Convertible with 22,000 miles, I am really upset that I traded my car for that piece of junk!!!! Nancy",,Make them better!!!!!
1.875,This car is awful!  Beware!,amyinbuffalo ,08/03/2009,,,3,3,1,1,,1,3,2,1,"Long story short:  I leased my Volkswagen EOS April1, 2009.  Today is August 3, 2009 and it's been in the shop 3 times (STILL THERE mind you) for the convertable top malfunctioning OVER AND OVER AND OVER again. It stopped mid-air in a parking lot and wouldn't open all the way OR close all the way! I had to get a Flat Bed to take it to the dealership! Now VW wants to replace the ENTIRE roof!  It's 3 MONTHS OLD! And, this is the best part, they are telling me that I MAY HAVE TO PAY FOR THIS. It's $8,000 alone just for the top! I am PETRIFIED to drive this car anymore and I don't want it anymore. The aggravation I have been through is appalling. It's STILL in the shop for the rest of summer!!!",Absolutely none.,"Yeah, try making the top ACTUALLY WORK right!"
4.75,3 months and 3000 miles,zrickety ,08/02/2009,,,5,5,5,5,,4,5,4,5,"We bought this car a few months ago after looking at many cars.  The EOS rocks!!  She said, 'I never loved a car, but I love this one.'  High praise, believe me.  It's a blast to drive.  Dr Jekyl when you need to be conservative, Mr Hyde when you want to cut loose. It's early on, but the car has been consistently quick and solid.  Future collectible here, would definitely buy again!    ","Build quality, transformer-top, turbo, 6-speed DSG automatic, heated seats, sound system",Wish I could hear the turbo a little more.  Car is too quiet!  2 minor issues fixed under warranty.
4.875,1 year so far no issues,Paul ,07/31/2009,,,5,5,5,5,,5,4,5,5,"I put 13k on it so far so good. Absolutely no-issues. I was driving a VW passat earlier and wanted to get a convertible, SAAB, VOLVO and EOS was in my list. With the price , quality , handling and look we decided to go with EOS. Excellent gas mileage Highway I even got 35MPG. ",hard top,rear seat space
4,EOS Headaches,Sasha ,07/27/2009,,,4,4,2,2,,5,5,5,5,"Loved vehicle, but came from factory with air conditioner condensation draining into cabin causing inches of water, mold, and stench. If you are considering buying this car, make sure the dealer checks this in their final inspection/prep. Transmission also needed work ~ 4,000 miles. Great car and gas mileage (avg 33.3 mpg highway) besides these problems. Comfortable for long distances... ","Hardtop, comfortable seats, fun to drive, gas mileage ","quality control, bluetooth link for phone"
5,Classy Ride,HTEXBB ,07/20/2009,,,5,5,5,5,,5,5,5,5,"I was going to reward my self with a new car and thought I would go with the Sky but after driving decided too small.  Happened upon the VW EOS by accident and so happy I did.  I even thought about going Certified Pre- Owned Mercedes but kept going back to the EOS.  After I test drove the car, I was hooked.  Its such a beautiful car and it is fun to drive.  I'm not use to not having more storage but I'm sure I will get use to it.  The car is amazing!",The top!  Its like something out of the future.,Moving the seats - getting the seat up and down is a little hard.  I've only had the car 2 days maybe with practice.
5,Dream Car,Joe ,07/18/2009,,,5,5,5,5,,5,5,5,5,"I had no idea how fun a car could be, until I bought the Volkswagen Eos.  I can't stop driving this thing...  It makes driving fun again. I should have purchased this years ago.   The Eos has the same solid feel of your typical Volkswagon with the added luxury of being able to put the top down.   The car is peppy, gets very good gas mileage and feels good to drive.  Excellent sound system.  My kids and their friends all beg for rides in the car. It has been a great experience!!!",European styling and the convertible top make this car worth buying...  ,
4.75,Great Value - Fun to Drive,Jay ,07/13/2009,,,4,5,5,5,,5,4,5,5,"Traded in my 2004 Saab Aero convertible on the EOS. This car has the best turbocharger I have ever experienced. I always have proper power and torque. In fact if you stomp the accelerator from a standstill, the car will hop as a result of excess torque. With Nav, I paid $33K for this car - thousands less than any other quality convertible and I am averaging 29 mpg in the first 2,000 miles of mixed driving. The seat are exceptionally good (I have a very bad back and can tell!). The only criticism I have is that a power passenger seat is not standard although it is not that big a deal. VW has the best priced lineup of any car manufacturer.",Turbo - Hard Top - Seat Comfort - Leg Room - Superb Nav System.,More standard features at various trim levels.
5,This is a keeper,VWFANS ,06/12/2009,,,5,5,5,5,,5,5,5,5,"Very cool car.  No other has a hard top, a drop top, and a sunroof.  It is fun to drive, pretty comfy,everything is layed nicely and to be able to go through the car wash is an added plus. VW builds quality! Gas miles ....WOW like 30 in the city! Buy one you will be so happy you did. ","Top,  DSG Trans, gas miles, sunroof, Everything",Offer it in a 4 motion and there would be no other car for us!
5,Compare to WHAT??,50something ,06/10/2009,,,5,5,5,5,,5,5,5,5,"We wanted a convertible for years.  We considered and drove the BMW 128i, Porsche Boxster, and Mercedes 350 CLK.  On vacations we rented Sebring and Mustang Shelby convertibles.  When we discovered the EOS on a trip to Arkansas, we bought it on the spot and left our Acura RDX at the dealer.  We continued our vacation in our brand new EOS and had a blast.  Consider it a 1200 mile test drive!  The person who wrote Edmunds review saying the car could not handle the twisties must be faking his reviews in my opinion.  I also own a 1985 Porsche 911; the new EOS driven in Sport mode with the DSG handled every bit as well as my Porsche.  The car definitely has German DNA and was FUN, FUN, FUN!!","We got 31 MPG Hwy.  The EOS Lux has features that would add $10k to the BMW 328i.  I can't tell you all that we love in 250 characters.  The car has high-class luxury features for a middle- class price.  The value compared to Saab, Volvo, BMW or Mercedes is outstanding.  Sebring?  Forget about it.",We skipped the $2000 navigation system and spent $200 at Best Buy for a portable TomTom system.  It is ridiculous that Volkswagen cannot make nav standard for a LUX model.  How much would it really cost?  The Porsche Boxster Nav is $3400 so I imagine it is a profit center to get your last dollar. 
3,Agree with poster JLM from 10/01/2008,MG ,06/04/2009,,,4,4,4,1,,1,4,5,1,Same problem as poster JLM.Totally dissatisfied and would not buy it again. Car in dealer for at least 10 biz days for a problem that I believe VW know about all along. The DSG transmission is the culprit and appears in all VWs-not onlyt he EOS. Check the VWVortex website for similar stories. I wish that I had before I bought this mistake.,Hardtop convertible with sunroof that I'm not able to use while car is in service,Don't sell cars with dangerous transmissions
