1,Pass Lock Engages,Chevy H8r ,05/30/2016,1,1,2,,,1,3,1,2,,,"The First time this happened My key Broke in the ignition. after a week the PassLock system engaged. I towed my car to Huntington Chevrolet because I was Only allowed 25 miles or so. They Charged me $750 to replace the Lock Cylinder and my remote start didn't work anymore. they said they didn't cover the remote start and Robert Chevrolet was responsible for that only if they put it in. in which they did. yet they still weren't responsible that Huntington was because they played with the ignition. that was last year. now my car is Locked Out and I can't start it once again. have no Idea how to start it. i'm probably going to have to tow it to a dealer so they can reset it. and figure out how to by pass the pass lock wich voids warrantee but I won't have to pay the dealer a couple hundred every year to reset the lock system. I get 14mpg. constantly carrying tools so its sluggish going up hill. electric mirrors, blue tooth and all my electronics either don't work or don't function properly all the time. and the AC only takes in outside air. so if I'm behind a school bus in the rain. and need the defroster on my car smells like diesel exhaust and I have a baby in the car and I have to go through a dirty wheel well to change the blinker from under the car. it because of this car that I HATE CHEVY.",,
1,STEER CLEAR OF THIS VEHICLE!,Chevy Junk! ,05/12/2016,1,1,2,,,1,2,2,1,,,"At first, I LOVED this car. Smooth ride, lots of room, pretty decent gas mileage. Four years later, all radio speakers, except the small one in the dash, stopped working, unless the outside temperature was at least 85 degrees. After calling Heritage Chevrolet in Chester, Va 3 times to get an appointment, I was told there was a short in the speakers. This affected the On-Star, back up alarm, and turn signal volumes. Heritage said to replace the radio, it would cost $750!!!! No radio is worth all that.  Maybe when the radio catches fire, Chevy will do something about it!  So I lived with no radio 9 months out of the year. Now, after the warranty expires by 8 months, but much less than 100,000 miles, a plate in the transmission breaks causing the car not to change gears. Repair costs....$4500!!!!! Again, Chevrolet will not help with the repair costs. Never again will I buy a Chevrolet product. Poorly made parts only last a few years. I have bought 2 cars from Heritage, one of which we paid cash for, but never again. They do not stand behind their product because they know it is JUNK! And adding insult to injury, my independent mechanic tells me that the power steering will need to be replaced very soon. JUNK, JUNK, JUNK!!!!!!!",,
2,2009 chevy traverse,mimi29 ,03/25/2016,,,,,,,,,,,,"had the car for 2 yrs at first i loved it ran great until i reached 57,000 miles and now i need a new engine. i went to chevy to have them fix it and they wouldn't because my warranty ran out 3 days before it happened. i was in the drive thru buying food and it kept smoking and wouldnt drive. i tried to break and nothing worked including steering with kids in the car its going to cost $5,000 to fix. im highly upset about this vehicle had a jeep Cherokee before this and it lasted 9 yrs never had a big problem.",,
1,POS,Ruby Break ,03/09/2016,1,1,2,,,1,1,1,2,,,"Absolute worst car ever.  Ever.  Replaced transmission at 90,000 miles.  Now at 110,000 it needs new belts for $2500.  They need to take the engine out.  Valves shot.  GM should never be allowed to sell another vehicle again.  DO NOT EVER BUY ANOTHER GM UNTIL THEY FIGURE OUT HOW TO MAKE A CAR.  Worst value ever.  Horrible company; horrible car.",,
3,check engine light,john ,03/02/2016,2,1,3,,,1,3,1,4,,,"purchased  the 2009 traverse two weeks ago second day the check engine light came on , the code reads pt 301 #1 cylinder miss fire . so now its at the dealers and after two days they still can't find the problem, we are sick because now we have no car",,
5,Driving Machine.,Susan Grace Rice. ,01/21/2016,5,5,5,,,5,5,5,5,,,"its a great vehicle, runs very good, rides smooth, and an all around great vehicle to have. with dogs, kids and just all around family its a great car to travel and go places and it holds a good amount of people, if i had to get a new one i would get another traverse,lt1. with leather this time for inside seats, and heated ones, would like to have a navigation in it, and side view mirrors with navigation on the mirrors for helping you stay in the lanes,[non-permissible content removed] .",,
2,Transmission Failed!,Amin Khan ,09/18/2015,1,2,3,,,2,3,1,3,,,"Be aware and stay away. A quick internet search will tell the whole story. My transmission is shot, broken,kaput!Constant water leaks, Squeky steeringDead battery, no explanationpassenger seat belt light comes on without warningDrinks gas",,
3,SO DISAPPOINTED,Denean ,09/16/2015,2,3,3,,,1,3,2,3,,,Got my 2009 Chevy Traverse from Rick Hendricks in January 2015 Transmission wasn't working properly so I went to Rick Hendricks mechanic shop in Feb. They said there was nothing wrong with the transmission. Months later in May they had to fix it because the transmission went out. Now a month later the transmission is slipping again. I have powertrain warranty that will cost me $150 but I shouldn't have to pay anything.,,
3.25,"Serves our purpose well, but... transmission repair at 117k miles... really?",asianteacher ,12/28/2014,,,3,5,2,1,,5,3,3,4,"I am displeased.  Our Traverse has been a vehicle that we brought to the dealership most because of recalls, back jobs, and now a shot transmission at just 117k (min $1,500, max 3k+ repair cost)?  Our other cars certainly did better!  I usually don't complain but we are not happy. I found out that this transmission problem is a common issue, I don't understand why it isn't a recall!

We bought this because Americans help Americans especially in GM's dark times.  But now we realized, who's going to help us now?  We don't have the budget for this now, so our Traverse is sitting in the garage.

If you insist in getting this, get an extended warranty.","It is huge.  Fits everything that a family of four + some more needs on outings and lots more for shopping.

Fuel economy.","Since middle seating spaces in 2nd row is narrow, the middle buckle is in the way of your bottom when you sit.  It will definitely hurt your bottom.

Needs improvement on reliability.  I brought this car to the dealership for different reasons such as interiors (carpet clips always breaking off), interior controls (drivers side window control stopped working but fixed and now the passenger side stopped working).  The steering squeaks, Chevy dealership never found the problem and now I am out of warranty, I am sure they wouldn't care.  Now, my transmission broke down at only 117k and we do not have the money for the repairs."
2.5,Ridiculous piece of trash,sherrypisces ,10/23/2014,,,5,5,1,1,,1,5,1,1,"I purchased my 2009 Traverse used last year and it was exactly what I wanted and needed for my family. Well, from the beginning I had problems with the car. I was experiencing a stalling type of drive. I would be driving along and all of a sudden the car would jerk and go extremely slow almost killing myself and my family. At times the vehicle would jerk and lose all power and shut off in the middle of the highway, street, anywhere! I have put so much money into this vehicle that I am embarrassed to say. I don't know what to do or who to contact because this is not a safe vehicle. Do Not, I repeat, Do Not purchase the 2009 Chevy Traverse EVER!",The inside of the vehicle is all that and more! I love the leather seats and the radio and the space is ridiculously perfect!,I suggest Chevy buy back each and every 2009 Chevy Traverse because there is something wrong with this particular vehicle.
3.375,Horrible 2009 Traverse,aburgener ,10/06/2014,,,5,5,2,1,,2,3,4,5,"We have had the Traverse for about 2 years and just on Friday I was driving down a 4 lane highway and it didn't want to shift.  Barely, made it home alive and took it to the auto center.  They informed me they would not work on it because it would happen again and so when I tried to move it, it would not go in reverse.  
We have had problems with the power steering and 3 recalls on it.  Something is wrong with the 2009 version of this car.  My brother had the same problem and when we were at the repair shop the owner said his sister had the same problem.  We are getting another estimate because the first one said it was the transmission... if you have money for lots of repair go for it.",,
4.875,Reliable. Period ,loveblues234 ,09/08/2014,,,5,5,5,5,,5,5,5,4,"I bought this car in 2011 as a 2009 model.  Had higher miles in it for the year but that seldomly bothers me considering my driving needs.  Terrific car!  Have had to fix one thing since 2011 and that was a minor repair.  (Actuator ... Controls hot and cold air)  Haven't had to jump it, tow it, fix it, absolutely nothing!  No joke either!  Ridiculously happy with this car!  When I need my next, I'll buy another one, wouldn't think twice about it.  ","The drive is nice, no it's not a performance vehicle.   But if your buying a Traverse you're not using it as a high end performance vehicle either.  Dual temperature controls makes it comfortable for everyone in any seat.  Lots of room for people and things! Middle seats also move forward and back, so you can make adjustments if the very back seat is filled with people as well.  Had the car full of softball players to grown adults and it went great for all!  I coach ball during the summer so equipment and players are in and out all.the.time.  Buy all weather mats, much easier to clean with all those cleats. 
","Of course like any SUV mpg's are always the complaint.  Fuel economy.gov is right what I get.  I drive both highway and in town miles.  Combined I'm at that 17 mpg mark.  As usual, that's my only complaint.  I don't baby my cars, i drive them.  Just a very nice all around car, low maintenance, typical oil changes, cheap gas (doesn't need the pricey stuff), reliable.   Will defiantly buy another; when I finally need one.  Only 85k, so I don't see that in my near future.  "
2.125,many many issues,nomoregm4me3 ,05/02/2014,,,3,3,1,1,,3,2,1,3,"we have own the traverse since its release. we have had timing chain issues, transmission issues, A/C issues, and power steering issues. keep an extended warranty or get ready to fork over some cash for poor design, and poor workmanship.","size/seating capability. but now that the AC doesnt work, taking the family anywhere is mute.","keep the body style, scrap everything else"
3.375,Steering Shaft defect,mngirl ,03/28/2013,,,4,4,1,3,,3,4,4,4,"Currently there is 51K on my Traverse.I do like it, it fits our family of five perfectly with room to spare.I didn't give the review 5 stars simply because there is always room for improvement.That said, I had a major problem with my steering column recently.While driving the vehicle, I suddenly and with no warning had no control of my tires - zero steering!When the vehicle was hauled to the shop, I was told that the steering shaft was completely dismemberedand fell ""out of place"".Hmm....has this happened to anyone before? ",,
2,Wish I would have waited for reviews,teyjay ,09/30/2012,,,3,3,3,2,,1,2,1,1,"I bought my car new off the lot in 2009. I have had numerous problems with this car since i bought it. Starting with the air conditioning knob which until this day has not been fixed because they can not duplicate the problem. The next would be the trip i took right after we got the car and the water pump blew which left my family of six sitting in the middle of no where with no cell phone access in 90+ degree weather. The car can not stop on a small hill without rolling back.But the one that i am dealing with now is the transmission. The car will not shift into gear, it shuts down on the freeway. It's going back in the shop yet again. Do not waste your hard earned money on this car! ","Spacious, looks good from the outside. ","Transmission, uncomfortable seating, tires, power steering, air conditioning unit, and many, many more.."
2.75,Minivan in disguise,tvaleri ,09/16/2012,,,3,3,2,3,,3,3,2,3,"I owned a 2009 for two years. Just sold last week. Hallelujah!Nonetheless, the Traverse drives and handles like a minivan. The plastic around and on the doorsinterior was already beginning to wear. Wires to a box located under driver's seat were loose and caused the ""service airbag"" light to display.Worst of all, there is no spare on the LS model. Instead, Chevy equips this vehicle with a mini air pump and some flat tire fixer. Not cool if the tire has a hole in it. The middle row of seats vibrated horribly. The 3rd row wasn't an issue. Glad to be rid of it. No more American made cars for me.",Hidden compartment in back; console in dash; sliding second row; privacy glass; lots of air vents.,Address shaking of second row. Spare tire on all models. 
3,2009 Traverse,tigger68 ,01/09/2012,,,4,4,3,1,,1,5,2,4,We bought our traverse in June 2009 and I had one problem with a computer about a year ago.Then October 2011 came around and our check engine light came on.It was something I don't remember.We took it to the dealer and it was the timing chain and it had been recalled.They had the car for 10 days. Then we had the car back one day and I was driving home from work and it started smoking.We attempted to drive to dealer and did not make it.A transmission clamp broke.they fixed it and then we got it back.We had it back in 4 days.The fixed and have had some hesitation and now transmission module is out?Now back we go again!Dealer has been working with us at least!,Radio--- seating---- lift gate,"WARRANTY---- make it 100,000 bumber to bumper because I am out of warranty and am not happy with the fact that I will be making serious repairs when the powertrain is out.

I have 47,000 miles on it now and am waiting for them to say it is not covered! I will fight tooth and nail since they had to pull my engine for a timing belt!"
1.875,Wish I hit reverse before buying Traverse,mom2x2 ,11/29/2011,,,3,3,1,1,,1,4,1,1,I have been into the dealership 13 times in the past 2 months...nothing but issues with engine and powersteering.Was happy with car but this has thrown me over the edge.Do not feel comfortable driving my family of six in this vehicle.I would not recommend this vehicle to anyone.BEWARE,,"Engine that works, better quality, more reliable car- otherwise I would like car."
4.375,satisfied,larry ,12/02/2010,,,4,5,4,5,,4,5,4,4,I have owned this car for 1 year. No problems except standard maintenance.,Comfort and ride. great on trips with 7 people in vehcle. Double moon roofs are nice. Acceleration is decent for this size vehicle.,Mileage could be better but it is a big vehicle so it is good for the size. I get 18mpg around town and 22mpg to 23mpg on the road. I do not like the location of the battery which under floorboard behind the passenger seat. Interior could be of a better quality.
2,the car that makes me nuts,zectbu1 ,11/25/2010,,,1,1,5,1,,1,1,3,3,"Okay, lets see where to start. I thought this car was going to be amazing and fun to have. Well it turns out it is the complete opposite. I have been to the dealership 6 times! And now let's talk about the customer service, it is unprofessional and rude. I have had so many problems with this car it is incredible. It even has warranty so it shouldn't be a problem but no, they don't want to change my tires they didn't even want to give me a rental car. I have a weird rattling noise coming from them and they won't change them. I am incredibly disappointed with this car and I do not advice this car to anyone on this planet. Here is a list of all the things I have done to this car, steering etc.",the outside looks nice that absolutely it. ,"The entire car needs improvements, there is so much noise when you drive the car, the customer service needs improvement. The entire chevorlet company needs major improvement."
4,Eats coil packs like a fatty eats donuts,Allan Elder ,10/26/2010,,,5,5,4,1,,4,5,4,4,"I loved this car initially; the best interior layout in its class bar none. Captain's chairs in the back, leather, DVD with Bose 5.1 surround. After 9000 miles we took it back to the dealer for a hesitation issue; they investigated and found nothing up. The Hesitation issue became worse and worse; on the third visit @ 18K miles they replaced the coil pack on cylinder #1. At 32K miles, they just replaced it again for the same issue.",Interior layout gives functional amounts of space when the back seat is up; cavernous when it is down.,"An engine that doesn't eat coil packs would be too much to ask, I guess."
3.375,Love/Hate relationship,mdr ,10/12/2010,,,4,5,2,2,,4,4,2,4,"Love my Traverse! Except the fact that it has been in the shop over 4 weeks this year. Timing chains(stretched) replaced twice, timing chain tensioners (weak) replaced, emission problem fixed, fuel injector fixed, shrill high pitched noise when radio/cd/dvd is on that tech can't seem to duplicate. Feel I have a lemon but really love my Traverse when it is running decently! Just do not feel I can rely on it. :~( ","sporty, not your mother's mini-van","center console takes us too much space, could have much more storage instead. Needs to be more reliable!"
1.75,Traverse is junk !,Chris Robinson ,10/11/2010,,,3,3,1,1,,1,3,1,1,"For the past 6 mos, have had nothing but trouble. First the dealer said nothing was wrong. When check engine light came on, they had my car for 3 weeks straight. Then timing chain problem turned into transmission problems. Now, you cant accelerate quickly because the tires spin. So much for traction control. the dealer has replaced the software in my transmission 3-4 times now. i would NOT recommend this garbage of a vehicle to anyone. It's no wonder GM went bankrupt, because their customer service really blows. I have spoken to GM numerous times about these issues, but they don't seem to care. Looks like my GM buying days are over.",Nothing. Entire vehicle is junk.,Everything
3,Problems,chase ,10/01/2010,,,4,4,2,1,,4,4,2,3,We looked at all crossovers before buying the vehicle and decided we liked it best. Then the problems came. We have had it in the shop 4 times now. First one of the rear seatbelt latches was broke.  Then on a trip to the beach the driver lumbar went out with it inflated all the way. That was comfortable! A couple of months later check engine light came on took it to the shop and after everyone in the world looked at it they determined the timing chains had been stretched. Don't really know if thats possible. Currently its in the shop for the engine skipping while driving of coarse it never does it when they drive it. Wish I could trade it. Who knows what will be next. ,I like the drive and ride and room if I didn't have the problems,Put a Honda or Toyota symbol on the front. Thought I would give Chevy a chance but don't know if they'll get another one.
3.125,Same Old GM- Junk,Dave ,09/04/2010,,,4,3,2,2,,3,5,3,3,"We bought this vehicle and all I can say is I am officially done with American cars, especially GM. This vehicle has been a problem since the day we bought it. The salesman demoed the fold down seat and it split. They tried to restitch it rather than replace it because GM would not replace it. Window motor problems, trans problems, electrical problems and all we get is grief from the crappy service department and GM. We bought the stain protection for the interior and we are now arguing because they have tried to get two stains out that wont come out but nobody (GM or the chemical supplier) wants to eat the price off all new seat covers. Never again, stay away from GM",The day I trade it in,Too many to list
4.625,Does Not Disappoint!,ilovemytruck ,09/01/2010,,,5,5,5,5,,5,5,2,5,"Bought my SUV ""used"" in June 2010. It only had 9k miles at the time. I've had to bring the truck in twice to have the chrome stripping on driver & passenger sides replaced due to peeling. Other than that, the vehicle drives perfect! Nothing wrong mechanically and the interior/exterior of the vehicle is absolutely wonderful. I can fit 7 people comfortably, including my parents (who are in their 70's) plus, trunk space is still sufficient. It's like a mini- van without the ""mini-van"" cliche. For those worried about the gas mileage, it's a gas guzzler. But, what else would you expect? It's an oversize SUV ; -)",Everything from nav to the dvd & bose system.  Don't forget the leather ;-),The *screen* used for the sunroof.  I live in the south and it can get terrible hot!
4.25,It's good but not great.,john ,09/01/2010,,,5,5,4,4,,4,4,3,5,"Bought this vehicle because I previously had a suburban that averaged 14 mpg. The Awd version which I have is supposed to average 23 mpg. Most of the time I am in the 17,18,19. It is a far cry from the 23 they advertise.      I believe the vehicle lacks power and the v 6 in this vehicle needs an upgrade.    

Last the engine light kept coming on and now the dealer has told me that the vehicle with 32,000 miles on it needs a new belt( timing I believe). He said its a common problem in the Traverse. Besides that I think its a decent vehicle for your money. Gm has come a long way but they need too realize that they are not there yet. Its a good vehicle but not great.",The styling of the vehicle is very nice. The  front grill adds a distinct look for the vehicle. Rear sunroof was a very nice feature. Driving and handling are actually pretty good. Rear bucket seats are nice but don't move back far enough. DVD and Navigation are enjoyable also.,More power in the acceleration of the vehicle. Better gas mileage or at least something close to what was promised. Better Navigation system as far a being more user friendly. Rear bucket seats that can actually recline more would definitely be an easy fix I would think.
4.75,Not Disappointed,ilovemytruck ,08/31/2010,,,5,5,5,5,,5,5,3,5,"I looked and test drove all types of cars, trucks and suvs before finally purchasing the 2009 Traverse LTZ.  Yes, I bought it used (9k miles at the time of purchase).  The vehicle drives like champ and I've had no problems mechanically.  I've had to bring it into the dealership to replace to chrome trim on both drive/passenger sides because it was peeling off, but all is fixed.  The cargo room for back seat passengers is enough that even my parents were comfortable (and they're 70).  In regards to gas mileage, IT'S AN SUV a big one at that, so it's to be expected that it isn't going to get great gas mileage.  I don't speed, maybe 73 in a 70 zone, and average 22 mpg.","onstar, xm radio, navigation, seats 7, dual sunroof and leather... (the leather keeps tight).",Not a big fan of the **screen** for the sunroof.  i live in the south and it gets too hot.
2.375,"Terrible vehicle, poor dealer",hangman ,08/28/2010,,,2,3,2,1,,4,3,2,2,"Purchased 1-8-09, fully loaded $45K.  From day one problems every few months. Four serious problems.  On 2 long trips this vehicle almost left us stranded on the road.  Once, it almost caught fire(bad cable connection under hood), rear lift gate left strut went bad and lift gate fell right on my head.  GM & Chevy say:  Well, it is fixed now and that then end of what we will do.",None,"Inspect the lift gate struts and see if they can be replaced with a strong strut assembly.  But, GM does not care."
4.5,Timing Chain,Timing Chain ,08/25/2010,,,5,5,5,3,,4,5,4,5,"I fell in love with this vehicle from the first time I seen it. We didn't even test drive it because it was in the show room and bought it off the show room floor. The vehicle has less then 30,000 miles and I knew something was wrong with it. I've had it to the service department 4 times since the end of June and finally they told me it was the timing chain. After 8 days at the service department they called me today and told me the timing chain was on back-order and it could be up to 6 months before they could get one in. They told me that GM said I could drive it and if the engine blows up they will just replace the engine. How's that for customer service?? Very disappointed with GM!",,Need to fix whatever is going on with the timing chain issues!! I've read a lot of reviews that people have wrote and they too have had timing chain issues! Maybe that's why they are on back-order and the dealership can't seem to get one in. 
3.375,2010 Traverse LT ,Mike ,08/11/2010,,,2,3,4,5,,4,4,2,3,"Overall I like the vehicle however, Chev lies about MPG. I have the AWD and although I realize it won't be as good as the FWD it isn't anywhere near what it's supposed to be. Took it on a trip to NC mostly HGWY driving MPG is a paltry 17.5 a gallon - personally I think that's poor. I will be trading ASAP when financially feasible. Now I know why they are offering 0% financing for so long on this vehicle. If gas mileage is important run from this vehicle.",NONE,"Gas mileage, rear visibility, the camera is awful, it's not true view so it's useless, it's like looking in a rounded mirror. There are better choices available, make one."
5,Great vehicle,hawkeye ,07/30/2010,,,5,5,5,5,,5,5,5,5,"I have over 21,000 miles and love the vehicle. It has great power.  I've had a transmission flash which improved what I considered good shifting, already.(people complaining of ""slipping or harsh shifts"" should get it)  The interstate mpg is 22 at a steady 76 mph-back highways at 60mph is up to 24 mpg-around town is in the 14 mpg range.",The back up camera is great,The leather seats in the LT2 are a little hard.
