5,"Good, good, good.",Donte Wilson ,10/06/2015,4,5,5,,,5,5,5,5,,,"I purchased this car in October of 2013. I'm a younger guy, so personally I would want something faster, but when I was car shopping, I was in a hurry, I wanted a Mazda, and this popped up infront of me.I've had no problems at all with this car. Over 97,000 miles on it. Engine is fine. Tranny is fine (it's an auto, I wish it were a standard). Everything is fine. I do have a few minor mods to it, and I've had them on for most of the time I've had the car, exhaust, intake, upgraded springs, and it holds them up fine. I do take care of it. I only use top grade maintenance stuff. Full synthetic oil and lube and all that stuff.The only thing I dislike about this car is the weight. I am a person that likes a bigger, heavier sedan, but 170hp and 160trq in a 3,300+lb car is not very appealing at all. Its weight is also the reason why it gets poor fuel economy. I have about a 50/50 mixture of highway and city, and I get 20mpg on the dot. About 360miles per tank. Which, I don't have much of a problem with. My problem is the power. 170hp is fine. Especially for a family sized sedan, but 170hp in a 3,300lb is just stupid and unethical. It is rather quick in the 4cly family sedan category, but in an upper category, its falls very short. However, the handling is amazing.If you want something quick, I wouldn't completely reccomend this car, unless you're gonna shave some weight some how and/or forced induction. However, if you want everything a car can offer, this is the car.It's also great in the snow.I also over paid for my car, so don't let that price fool you. Be sure to check KBB and other consumers for a good price.",,
,,,,,,,,,,,,,,,,,
4,You need deep pockets if driven on salted roads!,Headed for Bankruptcy ,07/29/2015,2,4,4,,,2,4,4,3,,,"I completely agree with the other reviewer about how unsupportive the clamshell-shaped front seats are, with no lumbar support whatsoever -ouch! As well as the easily scratched plastic panel under the gearshift, and how the steering wheel blocks the speedo when properly adjusted. I bought it in Aug. 2012 with 47K miles. It now (July '15) has 102K+ miles due to long work commutes (on salted roads during rough Cleveland Winters). Which 2 brake repair shops tell me is the reason why I've had to replace the rear brake rotors/pads no less than 4 times, and the rear calipers no less than 3 times!! Add to this- $885 in 3 separate transmission service/repairs by the Mazda stealership over the past 5 months alone! Same reason given- corrosion from road salt. Combined with the fact that this car is downright scary/dangerous to drive on snow/ice covered roads- even with 4 new Kuhmo KH16 (pure crap) tires. (And I've been driving here since 1982) Other than that, I like it better (and is only slightly less scary driving in Winter than my '07 6i Touring Hatchback with the low profile tires was), but only after replacing the garbage factory door speakers w/ Alpine SPS-517 ones.",,
,,,,,,,,,,,,,,,,,
4.625,Bought the car new.,09mazda6gts ,07/04/2014,,,4,4,5,5,,5,4,5,5,"I love the car and have no regrets buying it. There have been a few issues with the car. The battery went bad at two years. The rain sensing wipers are irritating. They will go into high speed in light rain. I bought nav but never use it, (I have Google Maps on my smart phone, much easier to use). I got locked in the car when my wife got out with the key and the doors locked when she walked away. I had to lay on the horn to get her to come back and let me out. The dealer had never heard of that. This wasn't a one time deal, it happens every time in the same situation. 63K on it now, replaced the tires and brakes. The power is great and the tranny is super smooth. Would buy again.","The car came loaded. Love the sunroof, traction control, stability control, BSM, seat memory, heated seats, XM radio, etc. Traction control has to be turned off when punching it from a dead stop. The wheels spin plenty, especially on half worn tires. This car is fast! I was going to try it at the strip. The transmission is so smooth, up shifting and down shifting that I didn't want to take a chance wrecking something just to see how fast it is. I never back down from a red light challenge though.","The wide wheels have no protection when touching the curb. If you touch the curb, it's the wheels that make first contact, not the tires.

It would be nice to have a way to disable the rain sensing wipers. It has to be auto sensing, on, or off. There is no intermittent setting.

Redesign the door lock system so the doors can be opened from the inside once they're locked. Can't believe there isn't a recall on this. There is a recall for the door hinge bolts falling out, haven't had that problem yet.

This is a great car and I intend to keep it for many more years. The reliability has been excellent."
,,,,,,,,,,,,,,,,,
3.875,Good performer but has some terrible usability features,kmukhopa ,05/24/2014,,,4,4,3,4,,4,4,4,4,"I have a 2009 Mazda 6 sport and have owned it since 2010. The car has good performance and is comfortable. Overall I have not had major quality issues, but I do have some complaints centering around customer usability ease. First of all, the Key FOB is terribly difficult to open when you need to replace the battery, both to open and to replace the battery are quite hard to do. I have had problems with it not working at all lately, even when I replace the battery, and I will have to take it in. Second, the headlamps are almost impossible to get to so you can replace the bulbs. You have to go underneath the wheels, take out grommets, etc. Mazda needs to work on that.","Styling, performance","Improve Key FOB ease of use

Improve ease of access to headlight bulb change access

Steering wheel sometimes has play in it

"
,,,,,,,,,,,,,,,,,
3.875,Built really well....,realitycheck1 ,01/29/2014,,,4,4,4,5,,3,4,4,3,"Interior quality of this car is a step above the competition. Smooth engine, decent acceleration and decent fuel economy. I average 28MPG between highway and city usage. Very reliable. Very roomy and above average handling. Very safe. I was broadsided in it and it held up very well. I find Mazda's in general are certainly a cut or two above its competition. The stock speakers were a little weak, and I find the stock Xenon headlamps are not as powerful as they should be and are very expensive to replace. But this is a very satisfying car.","Good fuel economy, great build quality both mechanical and cosmetically inside and out. Comfortable and sporty...ish. Very safe and solidly built.",Spending as little as 300 dollars to replace the stock speakers did wonders for the sound system. Im investigating what brand of Xenon bulb to buy to make those Xenon headlamps as bright as they should be. 
,,,,,,,,,,,,,,,,,
5,Fun sporty Mazda with lots of features,rporterincincy ,08/27/2013,,,4,,,5,,4,5,,,"My wife bought the 2009 Mazda 6i loaded with leather, sunroof, Bose stereo, everything but Navigation. She loves the car and finally understands why some people are ""car people"". Lot's of interesting features (a switch to adjust the headlight aim, auto wipers, ac, lights, and locks. The car now has 43k miles and has only needed tires and brakes. It has never broken down, the interior and exterior are perfect. I would like the speedo to be larger with easier to see numbering (hard to tell if you are going 75, 72, etc.), and would like the gas mileage to be just a bit better. At 75 mph, the tach is showing about 2,500 rpm.This all said, the ride is comfortable and firm, seats are good.Update: The car now has 58k miles. I forgot to add that the red lighting for the buttons is hard to see at night. I wish they were white like other cars. Still very dependable. I just did rear brakes recently and it was very easy. The car is holding up very nicely and has yet to have any repairs (besides a battery, tires, brakes and normal oil changes).",,
,,,,,,,,,,,,,,,,,
4.75,Zoom Zoom is everywhere,adick75 ,08/12/2013,,,5,5,4,4,,5,5,5,5,Great car for value on the market. Good millage as a cars with over 270 PS under hoodaverage 21 miles per gallon. Bed side is only limited speed to 132 mph. In Germany hgwy no doubt. You can get easy over 155 mph and the worst is that this car can do it more than that. Nice acceleration 0-60 under 6.5 s. Beast!!! Only speed limit and breaks poor quality (pads changed after 14K miles and rotors after 22K) are under average. Also hand set free system is screwed only for US and Canada with dailling European nr you can do it on phone book.,Iluminate dash controls (blue and orange clocks) Awsome. Bose system and traction. Zoom Zoom ZOOOOOOOM. I deffenetly love it.,Breaks (poor quality need to be much better for that kind of power) and no offer 4x4. Shame
,,,,,,,,,,,,,,,,,
4.375,Really decent vehicle,realitycheck1 ,01/07/2013,,,4,5,4,5,,4,4,4,5,"Exterior design is very attractive. Excellent handling, good pickup from the 4cyl engine. Could be better on the fuel economy but not too bad. Ride is well controlled but it can be a bit busy. Decent room inside, good design to the dash board. Interior quality is a mixed bag. Some parts of the dash and doors are very high endbut other parts are cheap feeling. Leather quality is decent, if a little stiff feeling, but it smells good though. Xenon lighting is excellent. I would suggest this car for those who like spirited driving, if you drive it softly it may leave you a bit cold.","Handling is best in class. Great in the snow. Decently Comfortable, the fit and finish overall is good. Good safety features and excellent reliability potential. Looks expensive in the upper trim models. Decently quiet on the highway. Decent power.","Competitors get better fuel economy. The cheap parts of the interior really take away from the overall ambiance, Mazda usually does better."
,,,,,,,,,,,,,,,,,
3,"Eye catching, Wallet snatching!!",cc45 ,05/19/2012,,,5,3,2,3,,2,5,1,3,"I bought this car still under warranty with roughly 35000 Miles on it in 2011, Car was great drove amazing handled great, I am used to SUVs So it was an adjustment with the wanky 4Cyl init, And very light weight which not a fan of, After having it and discovering the cons there are alot of them, With the HID headlights i had one go out. I thought the bulb was dead took it to mazda and well it needs all new wiring 1000 to fix and then the AC tube leaked. Alot of inside noise when driving at high speeds. Brakes suck, picking up speed and down shifting sucks, The radio is worthless!! the frames in the back the plastic around rear windshield is falling off will not stay attached. JUNK!!","The interior is very cool i have black dash with carbon trim and tan seat with zebra looking print on inner part of seat. With black carpet. Very nice, Guages are very bright, push to start and the fact you can walk up and just grab the handle with key in pocket is very cool as well. ","Headlights, Extend warranty, Better AC, Push start button by steering wheel not by gear shift, Use metal on or behind bumpers, make the car not so weak feeling. Over all by a charger they are amazing!!! But then again you get what you pay for! spend a few thous more and get an a ride of your life best decision i made!! "
,,,,,,,,,,,,,,,,,
4.875,wifeys 2nd mazda 6,dailydrivernc ,12/24/2011,,,5,5,4,5,,5,5,5,5,"ive been reading reviews of suvs on here thinking of trading our 6. after reading about the issues with the arcadia i thought id check out reviews for the car i already own. these 6's rank high and i thought id put in my 2cents.our 6 has push button start, roof, all options but nav and leather. telescopic steering is nice. fastest 4cyl ive ever drove. 34mpg @65mph, city mid 20s. back seat room is largestand most leg room ive seen. fit and finish is nicebut plastic on windsheild pillars starting to warp at just 36k miles, and we park in a garage. guess in the sun at work during the day is taking its toll.traded a hybrid civic on this, 6 has +pwr,+room, and almost same mpg","4cyl power 170hp, same as some v6 cars

roomyness rivals big cars, back legroom is an engineering marvel.

observed 25 mpg city, 34 hwy, why even get a hybrid or a compact car?

styling, looks like a lexus

cost, buy a loaded 6 for several $k under a camry or accord.

reliable, our 2006 mazda 6 never had any problems. powertrain reviews look good too. just change oil and drive for 200k.","i wouldnt suggest any improvements but mazda needs to step up their marketing. theres a ford fusion commercial on every 5 mins but mazda consistantly gets the highest reviews for all their models sectors except the rx8. the mazda speed3 beats the caliber srt and hhr ss. the mazda cx9 beats out the acadia, flex, acura. 

i will never buy a car without reading edmunds customer reviews. a coworker got a used outlook that was in the shop constantly-u read the reviews one these and u see why."
,,,,,,,,,,,,,,,,,
4,This car saved my life,chahn89 ,12/14/2011,,,4,4,4,4,,4,4,4,4,"I bought this car used, 2009 mazda 6, i bought it 2010 with 38,000 miles, throughout the time it needed simple changtes like breaks n tires n oil but nothin g to big, in 2011 i was hit from the front and both sides and iw as able to walk away from it alive, when everyone including police and paramedics said they had no idea how that happened. GREAT CAR! go mazdaaaaaa :)",,
,,,,,,,,,,,,,,,,,
4.625,Still Perfect ,danalube ,11/15/2011,,,5,5,5,5,,4,5,5,3,"I bought this car new and have racked up about 60,000 miles.Most of those miles were in Florida.The A/C kept my dark car and dark interior very cool.I do have window tint, which helps.In Summer 2011, I drove it from Tampa to Seattle.The cross country drive was very comfortable and problem free.The stereo with Sirius/XM has decent sound and the nav system got me to my new home with no problems either.All I've done to it so far is oil changes and tire rotations.New tires are going on this year.The only thing that I would improve on this car is the handling and better brakes. Previous car was an RX-8. I got spoiled with the brakes and handling on it.","Interior comfort/convenience.
Looks like RX-8 in front.
Great pickup for a sedan.","Handling
Brakes that will handle the power in this car"
,,,,,,,,,,,,,,,,,
4,Great choice,montrealer2095 ,05/28/2011,,,3,4,3,4,,4,4,5,5,"This is my second Mazda 6 and have been very happy with both. The 4 cyl engine is a bit wheezy, but I commute a long way each day and was a worthwhile tradeoff vs. the V6 to get the extra mileage, which is good but not great.My quibbles are a phantom squeak and the a/c isn't strong enough for those of us who live in the South.I was rear ended by a Camry a few weeks ago and the 6 lived up to its excellent crash ratings. Car was in decent shape and the Camry was a writeoff.No doubt this is the best value in its class.","Steering is crisp, no major dead spots. Braking and handling are both outstanding",gas mileage mediocre and a/c a bit lifeless.
,,,,,,,,,,,,,,,,,
4.125,Love fades,mazda convert ,11/01/2010,,,4,5,3,4,,5,4,3,5,"Bought it new but seem to be owning it used. Rattles and squeaks abound. Does drive and handle well. Great pickup great brakes. Transmission down shift feels odd at lower speeds, almost like it stuck in neutral. Wind noise in cabin too loud at freeway speeds. Sound system is average or below par. I find the driving position/seat comfortable. Enjoy spirited driving.  the interior and reliability does not live up to the exterior and performance.","exterior styling, driving fun, blind spot monitoring, seats.",more attention to quality. better mpg
,,,,,,,,,,,,,,,,,
4.875,Tons better than my 2008 Honda Accord,MNA2002 ,10/27/2010,,,5,5,5,5,,5,5,4,5,"I bought an '08 Accord in March 2008. It was plagued with fault brakes and other electrical problems. So, buh-bye Accord. I know Mazda owners and test drove the '09 6. I had parked by Accord next to a 6 at the dealer's. The 6 made the Accord look like a dowdy Buick. The 6 has had zero problems. The interior is 10 times better than the Accord. The power seat is fantastic for my long legs. On the highway I get 30 mpg -- the Accord got 33, so it's a little less. I like a reliable car, and I do believe that I have found it. I've read some unfortunate things about the current Accords. The 6 might not hold its resale value as much as the Accord, but I won't have the car repairs that Accord needs.","The sporty sexy styling, the interior, the fit and finish, the ease of using the features such as the clock. The clock has 2 buttons 1 for hour 1 for minutes. Changing the clock is so easy to do without having to be a programmer and to execute some convoluted 12 step process",There is no warning from the car if I have turned it off and am getting out of it. I had not realized that I had grown so dependent on hearing a reminder bell.
,,,,,,,,,,,,,,,,,
4.75,2009S Grand Touring,Shadetree ,10/05/2010,,,5,5,5,5,,5,4,4,5,"Test drove a four cylinder with four adults on board. Went straight to the V6. Love the power and this car has power. Took a trip with four adults and luggage, drove generally 10 over the speed limit. Was surprised to get 27.7 mpg. Another trip with just myself and setting the cruise on the speed limit, I got just over 30 mpg. Mileage is not as bad as advertised. Have 21000 on the car now and have had zero problems, same as the 04 Mazda 6 we had. Love driving this car when I can get it away from my wife. Powerful, smooth running and shifting, handles, and 100% reliable, the ride is a bit firm along with the leather seats, can be taxing on a long trip. Couldn't be happier that I own this car.","Blind spot monitoring, heated seats, climate control, rain sensing wipers, keyless entry and ignition, seat memory, navigation system, Bose stereo, sun roof, handles great, excellent acceleration, and a smooth as glass automatic transmission. Did I mention a hoot to drive.",Build a little more comfort into the seats. This isn't an issue for average commutes. You feel it on a 300 to 400 mile trip though.
,,,,,,,,,,,,,,,,,
4.5,So Far So Good,zoomtex ,09/10/2010,,,5,5,5,5,,4,4,4,4,"Bought used with 8K miles. 6sp Manual fun to drive but could be geared taller. Very close ratios, do not use all 6 in normal driving. But if you want to thrash it, it's fun.  Impressed with trunk. Headed on trip in old minivan with 5 people, but it broke down. Switched all people and gear to Mazda and went on 3Kmi road trip. Immense trunk swallowed luggage with ease. Got up to 33 mpg @75 mph. Enough room in back to prevent fratricide. Came back from that trip very happy with vehicle.","Stereo with aux input, and multiple DC outlets. Large trunk with non- intruding hinges. Remote fob opens front windows (great in TX summer). Symetric styling of gauges and and switches is much improved over previous Mazda 6. Gas Mileage.",Lower gearing for 6 speed. Tachs at 3K @ 70 mph. Folding side view mirrors. AC vents for back seat.
,,,,,,,,,,,,,,,,,
4.375,2009 mazda6 - 1 year later,tamoshanter ,09/07/2010,,,4,5,5,5,,4,4,4,4,"bought this 2009 mazda6 for my wife last year after she put 235k on her 2000 626.  she loves it - base model, sound system very good, very good pickup for a 4 cyl w/ 6 spd manual.  black interior shows dust and dirt more quickly.  you can bury several bodies in the trunk without blinking, and sleep in the back seat with two others.  ride is smooth, handling excellent (for its size) and A/C will freeze you in seconds.  we had a 1990 protege with 250k, and i got the hand- me-down 2000 6 (averaging 150 miles/daily) and still running like a watch.","6 speed manual, basic sound system is very good, handling/pickup for 4 cyl excellent. styling wonderful","more optional interior colors for the  sangria red, hand brake moved to other side of shifter"
,,,,,,,,,,,,,,,,,
5,Zoom Zoom Mazda 6,jb26wcu ,08/25/2010,,,5,5,5,5,,5,5,5,5,"I got a Black Mazda 6 3.7l V6 Gran Touring with Black Leather.  I really believe the car is the best in its class.  It has more styling than the accord, camry, malibu or altima.  It is the fastest in its class too.  If everyone in the market for an altima or accord test drove the mazda I believe it would out sell both.  My sister has the v4 altima and the only thing that is better about her car then mine is I think the leather is of better quality in the altima.  Other than that Mazda wins on every level!","The Smart Key system, Blind Sport Monitoring is very helpful/useful and the rain sensing windshield wipers are also cool.","I wish they made the v6 in manual, used a better quality of leather on the seats.  Make the Display on the radio larger and make the car faster.  A 0-60 time under 6.0 would be great!"
,,,,,,,,,,,,,,,,,
4.75,"Looks Hot, Runs Hot",Tonebone1 ,07/27/2010,,,4,5,5,5,,5,5,4,5,"This is my second Mazda6.  My first was was a 2006. I love to drive my Madza6, especially with the V6 it has.  However, recently it has been running hot.  I had to get it towed once because of this issue, and had to return it to the shop for the same thing a few days later.  The service person advised me that it was a manufacturer defect.  Needless to say, the car is still in the shop.  Other than that, the car with its unique look, is fun to drive.  Interior features can be improved like the Aux plug that is located in the armrest isn't convenient (why not put one on the radio).  Folding mirrors with turn signal would be nice. ","V6, Auto/Manuel Shifter, sleek body design","Folding mirrors with turn signal, Chrome Door pillars, more interior/exterior colors. "
,,,,,,,,,,,,,,,,,
4.25,Good but not great!,txmazda ,07/14/2010,,,4,4,4,4,,5,4,4,5,"We waited till we had some miles on our new car in order to give a more accurate review as almost every car seems great when brand new and no miles. After 11,500 miles we still enjoy the car but have had 3 issues with the A/C. I'm a bit concerned because each time the dealer has stated the issue has been fixed but then it breaks again. The service at the dealer (Roger Beasley Mazda) has been exceptional and if not for the A/C issues, we would be ecstatic with the car. I'm a Honda/Toyota guy historically (owned 6 hondas, 3 toyotas) but decided to venture out after reading all the quality issues with the new Hondas/Toyotas. The interior quality isn't as high as Hondas/Toyotas but is decent.","Never having to take the key out of my pocket! Keyless unlock/lock/start/stop/trunk on a car at this price is awesome. We got the V6 and it has plenty of ""zoom-zoom""! Decent gas mileage (23 MPG combined city/hwy) for all the zoom-zoom in my opinion (I'm not light on the accelerator either).",Higher quality interior components/plastics and more comfortable seats (we solved the seat issue by buying a $20 seat pad). Upgrade A/C system as A/C still doesn't cool like other cars in this price range or even some much less expensive. 
,,,,,,,,,,,,,,,,,
2.875,Think twice before buying,RAG723 ,07/14/2010,,,4,4,2,2,,3,2,3,3,This is my 2nd review. This car continues to give me issues. It took the dealership 5 tries to fix a alignment problem. All four window motors were replaced. I hear a metal clanking noise coming out from under the hood and Mazda says it normal.How can a clanking noise at low speeds me normal. Bluetooth module was replaced. Clicking noise from steering wheel was fixed. Dealer replaced water pump because it making a loud noise when driving. And the list goes on and on. I make it a point to tell everyone that rides the car with me not to buy Mazda. I sure will never buy one again. ,at this point nothing.,improve quality. figure out the problems and fix them. 
,,,,,,,,,,,,,,,,,
5,Awsome Mazda6,Matt ,06/25/2010,,,5,5,5,5,,5,5,5,5,"I have now owned the Mazda6 for almost a year now and I have 11,200 miles on it.  I still love to drive the Mazda6 to work every day.  My Mazda6 is averaging 22 city/29 highway in gas mileage.  I am very pleased with the gas mileage for all the power.  I have not had any problems with the car.  It has performed very well.  The Mazda has a lot of quality that I enjoy.  The 5 star crash test rating gives me a peace of mind.  The blind spot monitor system is awesome.  Love the rain sensing windshield wipers.  What can I say; I love everything the Mazda6 offers. ",Headlights shine very far down the road which gives me better visibility at night. Leather seats with Bose system that sounds great. The power of the engine. The gas mileage. I love the steering wheel controls. The illuminating gauge is sweet with the red and blue lights. Blind spot system.,I would suggest that the Mazda6 get turn signals on the mirrors.  I would also like the car to lock automatically when the car is in motion.  
,,,,,,,,,,,,,,,,,
