4.375,I love the Traverse ,Mrs. Smitty  ,07/18/2010,,,5,4,4,5,,4,4,4,5,"I had to chime in and defend my Traverse.  We have had the car for one year now and we love it. It's a very comfortable and quiet ride. We have not experienced any of the rear end noises others seems to be having. We have two kids and a dog and love the flexibility of the seating - we can haul 5 kids and a dog, or a bunch of lumber.  The sun roof is a nice feature although we don't use as much as I thought we would because of the noise and wind (we do a lot of highway driving). My husband and to talk me into an SUV - but I'm glad that he did.  We test drove the Flex and some other vehicles similar to the Traverse and found the Traverse to offer to most style and value for our money. ","Deep console storage, able to flip down some of all of seats, back hatch opens and closes with touch of button on key fab or on hatch. ",The rear bucket seats could be more comfortable - they should be able to recline a little.  Makes it hard to snooze on long trips.  
1.625,2ndRowMidSeatUnusable,mcspat ,07/11/2010,,,1,2,2,2,,2,1,1,2,Purchased this car in order to carry a crowd.  The middle seat of the second row is unusable for more than a few blocks unless a small child is using it.  Even a thin person will have the seat belt boring into their hip very uncomfortably.  I have had it in to the dealer and they said that it was a design flaw and nothing could be done-- their words exactly. I just went and sat in the 2010 and it is the same way.  ,,
5,1 year and quite happy,Gfi ,07/08/2010,,,5,5,5,5,,5,5,5,5,"With about 13,000 miles, have not been back to dealer except for oil changes. Still very tight with no rattles. The car is very comfortable around town and on the highway. I get 24.7 on road at 72 mph. Around town, I get 20-21. Not bad for a comfortable, roomy, safe vehicle. I remain happy with this domestic car after more than 20 years of Hondas and Toyotas.",Back up camera. Dual sunroofs. ,"Like in my first review, a more seamless iPod connection would be a nice touch."
3.375,Like it but I dont love it,Daphne ,07/07/2010,,,3,4,2,3,,4,4,3,4,"I recently purchased my certified 2009 Traverse. I am already thinking it's time to unload the truck. I think I need to purchase a 2010. The truck is making a whining noise that sounds like the power steering. I also noticed that the brakes tried to lock up this weekend. Last but not least, the dealership has inspected my car 2xs already. Today, will be the third time. This is costing me time and money. I haven't received my tags yet and the 30 day tags they issued expire tomorrow. I think its time to stop being nice. I do like the ride, the room and I'm proud to drive and American made vehicle.  ","Drive, cargo space and the room. ",improve quality
3.125,Give me better gas mileage and quality,Brian ,06/19/2010,,,4,4,2,2,,4,4,1,4,"I love the vehicle, however it has not been without problems.  One of the A/C ducts were inoperable and needed to be replaced.  Next, the engine light kept coming on, ended up having to have the timing chains replaced.  Gas mileage is not what was advertised.  Struggle to average 17 MPG.  Driving is pretty much a mix of hwy/city with slightly more city.  Aside from those problems I do enjoy the drive, handling, interior design, storage space.  It just stinks that I've had to deal with these problems, now my concern is longevity, will the vehicle hold of for years to come w/o additional problems.","Roominess, dual sunroofs, interior layout, handling.",GAS mileage and better build quality.  Hate spending 36K for a vehicle and taking having toi take it to dealer for other than routine maintenance.
4,Noise in rear?,MARIAH ,06/15/2010,,,5,4,4,4,,4,4,3,4,"I like my 09 traverse, but am confounded by a noise in the left rear.  I have had it back to the dealer 3 times and they claim it is a suspension noise and not a problem.  I'm not convinced.  Has anyone else experienced this noise?  It is a Rather loud thump.  Also the driver's seat lumbar control is no longer working.  Taking it in for that and the washer heater recall.","Love, love the backup camera, ease of the seat arrangement, and onstar",Back window is hard to see out of.  The headroom is not adequate for anyone over 6'.  
3,Back pain from seats,Frank  ,06/06/2010,,,2,4,4,4,,4,1,2,3,"I drove this traverse for the first time  from NY. To Florida taking the family to Disney and was very uncomfortable because the head rest is bent forward and the only way to get the head rest to align at proper angle is by reclining the back of the seat to an over relaxed recline. Anyway the day after arriving my back went out and I couldn't even stand up. Vac ruined. Just drove the car yesterday for 20 minutes and my back hurts today as I write. Also dealer sticker says 17 -24 mpg we avg 12.5 mpg city- on Disney trip 2400 miles round trip  we avg 16.7 all highway. GM is deceitful, buy Ford.",back up camera screen is the rear view mirror. nice steering radius and acceleration. standard third row seat with very convenient fold up process from rear bumper.,Recall front seats they are a lawsuit in the making as I currently seek legal advice. Give people back money for false gas mileage advertising or the option to return the vehicle for a full refund. Oh yeah stop lying on your commercials that you paid back your bail out. 5 years ahead of schedule
2.125,"I hate my Traverse, never buy gm again",I HATE MY TRAVERSE!! ,05/10/2010,,,3,4,1,1,,1,3,1,3,"Very disgraceful gm, Chevrolet and dealership customer service, servicing, corporate office, deceptive dealer, 4019 miles dead no start, very poor 12.5 mpg, transmission issues, engine noises whistle knocking, brake squeals, poor visibility front bumper and backing, interior light stayed on 2 hours battery save feature malfunctioned, XM annoying calls, gm owner for 25 yrs and I'm done, will never buy gm again. Should of bought Honda/Hyundai. Stay away. Driver side under doors a small bar to protect plastic gas tanks on impact, hope it works? Driver window shimmy off track, dealer did not do detailing ripped me off $398. Gm/Chevy customer service no support claim dealers independently owned and can't help me.",Wish I could get my money back. GM will lose this 25 yr customer who's owned 2 gm's at most times. I will never buy gm again! Don't ever make a turn in front of someone very hesitant acceleration and stumbles. Blind spots. Need better cup holders and cabin filter for allergies pollen etc.,"See above and:oil filter bad design, interior gets dirty easy, I have a larger truck and get better mpg (very deceptive) service claims mpg nothing can be done for me to see dealer bought at. Paid for rewards program and never received. Salesperson decptively charged extra for White. GMAC disgraceful too."
2.25,Unreliable,rod howard ,05/05/2010,,,2,4,1,1,,4,3,1,2,"Ran great for 1500 miles and then the check engine light came on, 2 days in the shop for repairs. A month later the Traverse starts to jerk when accelerating causing transmission to fail, 4 days in the shop. Got it back and it ran great for 6 month it starts again. Trade for Lexus RX450h ",Warranty it paid for all repairs and I got the Aveo to drive at no cost.,Engine and transmission lack Quality 
5,Yes GM can build a great vehicle,Rob ,04/22/2010,,,5,5,5,5,,5,5,5,5,"Car has plenty of interior room, looks great, excellent quality.  Drives tight, stops quickly.  I would recommend this to anyone wanting seating for 5 plus and wanting a good driving, cool looking and great on gas mileage this is the car for you.  ","Handling, gas mileage, fit and finish, braking.  ",
3.125,Passenger side Power window,Wykke ,03/06/2010,,,4,4,2,4,,3,3,2,3,"After purchasing my 2009 traverse, I noticed the passenger side Power window going up slower than the other windows, also making a groaning sound as if it might not make it all the way closed.  I took it to dealer and they said it was the power regulator and that they would order one.  When it came in, I had the regulator rplaced.  This did not help the problem.  I went back and this time they said that the window was out of alignment and they aligned and lubed it.  This still did not help they problem so I took it back again.  this time, they said that it was normal for the window to operate slower and make a moaning noise.  I still have the problem and will let my lawyer solve the problem.","I do like the dash, the size the radio and other features.  this will be the first vehicle that I will not work on (can't find the engine) Mileage before oil changes",Gas Mileage and customer satisfaction
4.875,Whinning noise,mmrando8 ,02/26/2010,,,5,5,5,5,,5,5,4,5,"2nd trip back to dealer for whining noise under the hood.  Purged the power steering lines the first time; didn't work.  Took it back today and they have now replaced the steering rack.  Seems there are some problems.  Also had whining noise coming from steering column but after reading another blog, I'm guessing that noise will be gone as well.  Going to get it now.  Will let you know more tomorrow.  Absolutely love this car though. Super fun to drive, roomy on the inside.",Pick-up; rear camera; 7 passenger seating; power lift gate;,Better second row seat handles to move them with; make the second row seats removable. This feature is great on long trips with long-legged teens. More power outlets. Black metallic paint is very susceptible to chips.  Need more durable clearcoat.
4.5,I Love My Car,Farm Girl ,02/17/2010,,,5,3,5,5,,5,4,4,5,"I've had my 2LT Traverse for over a year now and am still LOVING it!!  It's way fun to drive and plenty roomy inside.  No complaints about quality or reliability at all.  My mpg is averaging 18-19 even though I drive like a hellion on twisty-turny country roads.  If my hubby drives on longer trips, he'll get 22-23 mpg.  I had a Ford Edge before this and its EPA estimates were the same, but it got better mileage in real life.  I had the jerky tranny problem too for a long time, but at 20,000 miles it seems to have smoothed out nicely. I had trouble with the headrests also, but fixed it by raising them as high as they'll go.  Oh, and the storage on the dash is perfect for sunglasses!","bluetooth, automatic tailgate, heated seats, rearview camera, the way the 3rd row folds down, storage, fun to drive","Rear visibility needs improvement-- that rear window is tiny and not only looks ugly, you can't see out of it.  Needs controls for rear heat/air in the front--I have small kids and they can't reach the controls but they get bumped sometimes and I don't know it because I can't see from the front"
4.25,Best suv weve ever had,pands from mo. ,02/12/2010,,,4,5,4,5,,4,5,3,4,"We love the interior, everything is Handy. The awd has gotten us through several bad snow storms. The leather heated seats are very comfortable and plenty of room for trips. Couldn't be ant happier.","mileage,seats bose speakers",can't think of any
3.75,Chevy Traverse,2009 Chevy Traverse ,02/01/2010,,,2,5,4,4,,3,4,3,5,"My 2009 traverse is a year old and I'm not impressed with the gas mileage. About 16 mpg is the best that I have got.  Also, I have tan leather seats and the drivers and passengers seat have black on them, they have been replaced once and now they are doing it again. It's like the leather is not real leather.  Even the dealership could not get the black off the leather. Very disappointing.",,
5,A great comeback.....,Chevy Lover ,01/31/2010,,,5,5,5,5,,5,5,5,5," Well I was raised on Chevy's and for many reasons, fell away from them in the late Seventies. GM finally saw the light and has produced some fine vehicles that compare and surpass in ways the Japanese vehicles. The Traverse is one such vehicle. The smooth quiet ride, the agile handling, the options to please. It may not have an over 30 mpg, but it's a welcome gift for large guys like Myself. It surpasses the Honda Pilot and anyone looking for a roomy SUV/CUV should definitely test drive this vehicle! It also heralds some great safety ratings as well...and the AWD is great in winter conditions. Try it you'll love it! ","The Bose stereo is second to none. It was a requirement I had due to my experiences with it on My previous vehicle, which was an Acura, yes that's right.....so be prepared to be pleasantly surprised with this Chevy.",Not sure the sunroof screen is as good as a solid one....but so far no real issues. I'll keep you informed however.
4.625,Love this SUV!,Jen ,01/19/2010,,,5,5,5,5,,5,5,2,5,"I have enjoyed this care VERY much! It drives like a dream and is cozy and quiet inside and out. It is wonderful in the snow too, though I haven't driven it in VERY deep snow yet. It sticks to the road and I have yet to slide in bad weather. I feel very safe driving it. My kids love the DVD and XM radio. Gas mileage blows. I think GM needs to be honest in that department. I've had this car for a month now and I can't seem to break 16 mpg no matter what I do. Good thing the car is WONDERFUL in many other aspects...I can overlook the mpg, I guess.","Body style, cargo, camera, DVD shows up on NAV screen while in park, auto lift gate, interior storage, captain's chairs on second row. Radio/Bluetooth controls on steering wheel, leather is gorgeous!  etc, etc, etc...","A real, automatic sunroof cover, not just a weird, awkward fabric thing. Bigger buttons for heat/AC and car info. Too much plastic inside. Second row seat has a flimsy plastic latch to move seat forward. NAV is complicated. Probably my fault;-). Maybe a (big) button to lower DVD player."
4.875,Great Car!,DOzmore ,01/07/2010,,,5,5,5,5,,5,5,4,5,"I love my Traverse. The 7 seats are so versatile and I use them all. The leather interior is easy to clean and keep clean. I really love to drive it, very comfortable - especially on road trips. There's so much room in the back! I really love this car.","The three rows of seats with captains chairs in the second row. The fact that the seats fold flat. The auto start button. The dual sunroofs. The buttons on the dash that tell me the air in my tires and gas mileage, etc.",Perhaps work on the gas mileage a little. I get 20.5 mpg and that's fabulous for this car but a few more mpg wouldn't hurt.
4.375,Tire Chains Not Allowed,BRYCE W KOPPER ,12/22/2009,,,5,3,5,5,,4,5,4,4,We love our 2009 Traverse but if you don't live in the mountains where chains are sometimes required you don't realize the problem you will encounter.  Tire chains will not work on the Traverse which could pose quite a problem if you want to go skiing and you're not allowed to go up the mountain because the stupid vehicle was built so you can't use chains. What does GM expect? To be pulled up the mountain by a team of donkeys?  I'm sorely disappointed with this flaw.,,"Use 16"" tires instead of 18"" or build the underside differently to allow tire chains."
1.75,Broke down with less than 4K miles!,recker ,12/17/2009,,,1,4,1,1,,1,2,2,2,"You would think that after making a 30K purchase, it would be reliable.  GM dropped the ball.  After owning for 4-5 months and less than 4000 miles our traverse has an ""intermittent electrical issue"", and will not start.  The service department had to call GM's engineer dept to find out how to fix the issue.  The fact that the service dept had to call GM on how to fix the problem is a scary thought.  Never again!!",Looks,Work out any bugs before you introduce it to the public
4.75,What about deep snow?,Rondog ,12/11/2009,,,5,5,5,5,,4,5,4,5,"I bought a 2009 Traverse AWD LTZ in July. I have been loving this new vehicle until yesterday. We had 14"" of snow fall overnight. I cleared my driveway and backed into the street. A couple of 4 wheel drive vehicles had gone through but the plows had not. I was stuck immediately. I turned off the traction control and could not move the vehicle. My neighbors had to push me back into my driveway. I had a 4WD S-10 Blazer and was never stuck once in 10 years! I am so frustrated with this vehicle. I live in WI and we have some winters with numerous heavy snow falls. I think it is ground clearance and tire design. My other vehicles were dedicated 4WD and not AWD.","Back-up camera, XM, heated/cooled seats, remote start",More ground clearance.
4.875,Great!,dexterm ,12/07/2009,,,5,5,5,5,,5,5,4,5,"We purchased this SUV about 2 months ago and love it so far. We have been on a couple of road trips and it fits our family of 4 perfectly. It is roomy, drives nicely and the kids love the DVD player.","Power Lift Gate, NAV system, and Black carpet! Cars built for families should never have light gray carpet.",Nothing so far.
4.5,Really like it!,The Dan ,12/05/2009,,,5,5,4,5,,5,5,3,4,"The Traverse rides great. It is quiet, sure footed, accelerates acceptably, and has very good fit and finish. I would highly recommend the Traverse to anyone.  I have two complaints. It doesn't always know what gear it wants to be in and will sometimes have a bit of an acceleration lag when you have slowed down but then press the gas (like when the light changes from red to green). I will press the gas, then press the gas some more until it figures out what gear needs to be in and will then accelerate excessively. The other complaint is that it is surprisingly large and takes some getting use to.",The ride an build quality. The Traverse feels very solid. It creates confidence when driving around town and is smooth and quiet on the open road. It also has plenty of space for people and cargo...more space than a Tahoe and the third row is more comfortable.,"Six gears sounds good on paper and does make the ride smooth for everyday riding but it gets in the way when a little ""performance"" driving is needed."
4.875,Great car,Frank ,11/13/2009,,,5,5,5,5,,5,5,4,5,"We bought this car to replace my wife's car, Honda Odyssey. After having this car for about 3 months we are really impressed. This is a well designed, comfortable car that we both enjoy driving very much. My wife likes it so much that she doesn't want to use it as our primary kid hauler, but as her car.  Now we'll have to buy another car for the kids. Chevy did a nice job on this car.","Interior comfort, features and ride, AWD, Safety features, 3 row seating, vehicle size, back-up camera and sensors, fuel economy, etc",none so far
5,Impressed former import owner,GFI ,11/12/2009,,,5,5,5,5,,5,5,5,5,"I purchased vehicle after more than 20 years of Toyotas and Hondas. I am well pleased with quality of design and with build quality. I have had four months of trouble free ownership and continue to be impressed by roominess, comfort, performance, and ride of vehicle. I was somewhat skeptical of domestic products, but am totally won over.","Back-up camera, dual sunroofs, well- designed folding seats, comfort, room, driving position, On Star","A cleaner, more direct Ipod hookup would be nice."
3.625,Same Old GM----Different Wrapper,uptown48009 ,11/05/2009,,,3,4,2,2,,5,5,4,4,"We bought this vehicle new. While demoing the middle captains chairs, the seat cover ripped. Took vehicle back for service and GM required them to restitch the seat....look like h... Called the dealer and they had to fight to get us a new seat cover..waited 3 weeks for callback only to find out the cover is on back order...tells you how many are ripping (poor design and build quality)...middle row flip seats are not as user friendly as depicted...had stain protection applied to fabric...got stains on seat...dealer could not get stain out...supposed to receive new seat cover....still fighting on that yet it is a selling point to the protection....SAME OLD GM>>>STAY AWAY",interior size,
4,LOVE MY TRAVERSE,christine ,11/01/2009,,,4,5,4,4,,4,4,2,5,"We bought our LT1 Traverse in June and we love it !! I like the way it handles and it looks great.We have a sun and moon roof I have never had one before and I am enjoying them (so are my teenaged boys )I agree with one of the other reviews about when turning right it is very hard to see if anything is coming ,and the head rests are awkward .I am hoping it handles good in the snow as we get alot of it .There is so much room in them ,we packed all my son's stuff for college in it with putting down one of the 2nd row seats.There is enough room for my 5'10 and 6'1 tall boys in the back seat.I would recommend this car . I think next time we would like to upgrade to the LTZ with more features","I like all the room ,how the car looks ","I would like the vision improved  when turning right,the stereo could be alot better and the headrests could be softer and positioned differently."
4,Like my LTZ So Far,andylibby ,10/29/2009,,,3,4,4,5,,5,4,3,4,"I came close to buying the Buick Enclave but got the Traverse for three reasons: (1) Price, the Buick would have cost $3 to $4m more similarly equipped, (2) I got a huge rebate for buying the 09, and (3) I don't like fake wood trim and the Buick is full of it.  I liked everything about the Buick better except for the fake wood and the extra $$$, but the Traverse LTZ is an awesome car with all the goodies and I'm enjoying it a great deal.","Bluetooth, power liftgate, remote start, heated/cooled seats, nav, XM, OnStar, and 288 horses. I also think it's a very smart looking car in the black granite mettalic.","The Sunroof and moonroof need real covers over them, not just mesh screens.  Too much sunlight comes thru. The 20"" wheels diminish the ride and comfort. 19's look good enough and are much smoother."
5,Love my car,traverseowner ,10/29/2009,,,5,5,5,5,,5,5,5,5,We purchased our Traverse to replace a 4-Runner.  We love this car.  The ride is very smooth. On two different road trips we have averaged 22 mpg.  There is plenty of space for everything and everyone. ,"GPS System, DVD system, Bluetooth",Can't think of anything
4.75,5000 mile review,Upstate NY ,10/15/2009,,,4,5,5,5,,5,5,5,4,"We've had the Traverse about 5 months now and 5000 miles. No problems to date (hasn't been back to the dealer) and both my wife and I really like the car. I see a lot of posts about poor mileage but we have consistently got 20 to 22 mpg in mixed suburban driving which in my estimation is great for such a large car. My only regret is that I did not buy an LT2 or LTZ package to get some of he features like backup camera, power folding mirrors, temperature controlled climate controls, and upgraded radio. People who ride in the car are surprized how quiet it is especially the engine (hard to tell it's running).  I don't think Chevy has gotten the credit it deserves for this engine.","I guess it's not a feature but I like the drivetrain, quiet, powerful, economical and so far extremely reliable. ","I wish I had the rear camera, rear visibility could be improved.  "
4.75,Not too bad,Yosef Spinoza ,10/15/2009,,,5,5,5,5,,5,5,3,5,"When driving my Traverse LTZ from home to the baseball field, low milage, slow acceleration, slow downshift, poor rear window visibility are very disappointing BUT when the 6 passenger seats are full with my kids, their friends and their sport gadgets, the cargo area is loaded with their NY Yankees jackets, coolers, one bike, bats, gloves and balls and cup holders are all booked then I realize that I did not make a mistake. Driving back home turns into a joyful experience. I appreciate the stability, smooth and comfortable ride, nice interior design, amenities the vehicle has to offer, room and the feeling of driving a safe vehicle for my family (and their friends). ","Roomy vehicle, handsfree calls, XM radio and navtraffic, nav system, memory seats, folding mirrors, blind spot mirrors, rearview camera, remote starter, power remote liftgate, sunroof, controls position and comfortable seat for seven. ","After driving a rented Traverse LS for 1,500 miles, I believe that smaller tires fit better on Traverse LTZ.  "
5,Great SUV!,M. Cleveland ,10/03/2009,,,5,5,5,5,,5,5,5,5,"We traded in an '06 Cadillac DTS; this rides every bit as smooth.  Retired, but wanted the room to haul things - it's sort of our ""car/truck"".  Lots of cargo space.  Love the Bose sound system, great bass!  Remote rear hatch is convenient & the fact we can change it to manual which allows us to open in the garage.  The head rests were uncomfortable but just turned them around and they're fine.   Cup holders are nice size; storage areas are adequate.  Fuel economy is good considering my DH doesn't do gradual stops and tends to lead foot on take off; even then we're getting avg. 20 mpg city/hwy.  A 75 mi. trip of 60 & 75 mph combined, averaged 26mpg. and a 158 mi hilly day trip-avg'd 22 mpg.",Cargo space; Quiet and excellent handling; smooth ride.  Back-up sensors & camera.  Bose sound system; Blind spot mirrors; Appealing design.,"Given the price paid, LT2 should have driver memory seat and 8-way power seat for passenger.  Improved mileage would always be welcome but given size/weight of vehicle, not bad."
4.375,Traverse LTZ!,Bigboy ,09/25/2009,,,5,4,5,5,,5,5,2,4,Bought the Traverse after a lot of research considering primarily import SUV's. Poor experience with Nissan Pathfinder and support lead me back to a NA product. Dealer was very attentive and worked with me to get the right vehicle at the right price.,"Room, ride and driveability. Towing capacity is a plus as well as interior design. Finish is very good","Better quality sound system Don't buy expecting great fuel economy, I average 16.9 mpg half highway half city and drive easy"
