4,"Almost no problems; 2008 Silverado Reg cab, LB 4wd",C. Henry ,11/28/2015,,,4,,,,,4,,,,"Had to list this as a LT regular cab long bed, 4 wd. Actually is an LS, which in 2008, was just a Work Truck with a chromed front bumper and chromed steel wheels. Mine also has ""Trailering equipment package"", which is the same as ""Towing package"" without the locking G80 rear differential. It has the 4.8 with 4 speed auto. No power windows, no power locks, no cruise control, no power mirrors. Has A/C. The 4.8, thankfully, did not have the variable cylinder engine until a few years later. Then the 4.8 was dropped entirely.I purchased it new in Sept., 2008 at the old GM's fire sales. Truck was made the last week of 2008 production in June 2008. At their best plant at the time, Ft. Wayne. It has very dependable with almost no problems I do all maintenance on it. No rattles or squeaks at 65k.Currently at 65k miles. It has seen all sort of use from heavy urban gridlock to local country roads to Freeway use. I changed out all fluids between 50k and 60k miles. Brake, coolant, transmission, front differential, rear differential, and transfer case fluids. This year, at 62k miles, I replaced the front and rear brake rotors , drums, pads and shoes. The rear drum shoes were almost done, but the front pads could have gone another 10k. Engine consumes almost no oil between 4k to 5k oil changes.Non wear items replaced since new:--Rear shocks were shot at about 40k. Replaced with KYB gas-adjust mono tubes which are great and match the front strut valving well.--Turn signal clicker not audible at 50k. Sound for TS comes from left speaker. Unbelievably cheap paper door speakers replaced with cheap Pioneer speakers. --All good. ( common problem).That's it!I attribute the good reliability my Silverado has had to the fact it doesn't have the things that frequently cause trouble on the GMT's.--No cylinder deactivation on the 4.8 in that era. No piston ring/oil consumption or camshaft problems because of that.--No power locks or power windows which cause many problems.--No Eaton G80 locker rear differential which some people have experienced failure with. With manual shifted 4wd and an open rear axle I have had no trouble --making it through even heavy snow.Due to the lack of any power accessories and being a regular cab, the truck is fairly light. I believe this 4.8 can easily match or beat the ubiquitous 5.3 with extended or crew cab 1500 in acceleration.It has a very wide turning circle, but the use of rack and pinion steering starting in 2007.5 makes it pleasurable truck to drive. Gas mileage is not so good. When I commuted to work, with a total mix of driving, I averaged about 15.5 mpg. Mostly local roads  and shorter trips now. I seldom see more than 14 mpg. It will still do 17 to 18 mpg on infrequent Interstate highway runs. No mileage bonus with the 4.8 over the 5.3.Used buyers may like to know that GM in 2008 and post bankruptcy, 2009 made up different equipment packages that did not exist in catalogs. You may get something that shouldn't have been on your truck ( sometimes heated power mirrors on an LS trim) or not get something that should have been included.",,
4,"Purchased new; 7 years and 90,000 miles later",Rob ,08/23/2015,4,3,4,,,4,,4,5,,,"In my experience this is a good, but maybe not great truck.  Kind of a hybrid between a station wagon and a truck, lots of room and comfort in the cabin, not a lot of bed space.  I've had a few irritating problems, like having to replace one of the seat belt latches and tire pressure warning lights that don't work, but nothing major.  I'm looking for a new truck to replace it and will end up choosing either a Ford F-150 or another Silverado, probably the extended cab though rather than the crew cab model.  I'll just go with the best deal I can find.",,
5,Chevy rocks!,Lee Fowler ,08/02/2015,5,5,3,,,5,5,5,5,,,"I have a friend whom had a older Silverado and put over 500,000 miles, his current is 07 Silverado ands has over 300,000 miles.  @325,000 the transmission was replaced. . He has some oil issue's.  I personally have 08 Silverado with 81,000, only issue. . Actuator driver door.. keep it up Chevy !",,
4.75,2008 Chevrolet Silverado Reg Cab Work Truck 4.8L,11johnathan11 ,05/31/2014,,,4,5,5,5,,5,5,5,4,I have over 5 years and have 45000 miles on it. It has had excellent reliability. I'm still on the original tires. I will replace them around 50000 as they will need it. The only thing I have needed to do was change the front brakes on the truck around 18000 miles and I had to take the truck to the dealer around the 2.8 year mark when the pass door lock stopped working. Apparently this is common because there was another (2007-2012 Chevy Silverado 1500) owner in front of me getting the same pass door lock replaced. Also I had to add some coolant around the 1.5 year mark because in traffic it would start getting warmer as in not in the middle of the gauge where the temp is supposed to be.,Drives great and has been reliable so far.,"Make the door locks stronger. Occasionally it idles rough, starting around 800 miles, so far no issues but its made me wonder. I got a notice letter from Chevy but the dealer (Hudiberg, OKC)told me if they inspect it and find nothing wrong I would owe them the hourly maintenance fee. "
2.375,Trans,squekie ,04/01/2014,,,2,4,1,1,,4,3,2,2,"Have a 2008 Trans went out after 125,000 whats up with that GM ?",,
2.75,Issue after issue,waschevguy ,02/04/2014,,,4,4,2,1,,2,4,2,3,"I have to many issues.@ 40,000 miles went through a set of lower ball joints, 45,000 ran out of oil, 55,000 lost a bearing in the font end. GM made me pay $100 for the ball joints.GM replaced deflector plate to prevent from running oil, GM replaced the bearing.I have stock wheel and tires nothing special.Now have 80'000 and going through oil again, the passenger window does not go down.The dealer put on a oil consumption plan and last time over 900 miles it went through 2 quarts.I'm thinking about calling GM, does any one have any suggestions or ideas.My truck is almost paid off and I don't really want to start over.","I really think the truck is very comfortable and enjoy driving it.
But with the issues I'm not happy.
I have owned several GM's in my life and always been a Chevy guy, but that has changed.
Maybe need to look @ forgein truck or maybe a dodge.
My wife had a arcadia and it was the same year as my truck and had tons of issues with that also.
I hope GM can make this right, hope I can get some feedback on what to do.",
4.25,Somewhat disappointed!,str8dwn ,05/04/2013,,,3,5,4,4,,4,4,5,5,"Just want to say that this vehicle has been a good ride so far. Have a 2008, 97000 miles and BAM!!! get this flashing signal that say's service stabil-track control and traction control, and my engine light flashes....Well, take it to the dealer, they call back saying it is a broken valve spring #3...if that doesn't resolve the engine light they say they'll have to change the manifold....Im sorta lost....can anyone help out????",,
3.25,Quality Issues,08ltxafret ,01/20/2013,,,2,4,2,4,,4,4,2,4,"08 LTZ, 48K miles dash is cracked, door lock actuators working intermitently, interior chrome handles chipping, exterior door handle paint pealing off, interior paint chipping from steering wheel and a/c instrument panel. Under warrenty both d/p window channels replaced due to window squeaking (4 trips to dealer), rear tail light assembly replaced due to moisture (2 trips), carpet under brake/gas pedal comming loose (5 trips), p door lock actuator bad (2 trips). Exterior paint is scracthed with the most minor rub.",,"Improve overall quality of ineterior/exterior parts
Improve exterior paint - needs to be more resiliant to minor scratches
"
2.75,Devastatingly Disappointed,mmc601 ,11/30/2012,,,3,5,1,4,,3,3,1,2,"Decided on my first Chevy after my dad's '93 has over 470,000 miles.Even the original door lock activators still work.I bought my '08 Chevy with 37,000 miles in 2010.Now, dashboard is cracked, vent selenoid went bad, and driver side door lock actuators front and back are bad.Further research has revealed that these problems are COMMONPLACE for this model.Seems that the '08 model is a huge debacle.After learning this, I will try to dump it.What a huge disappointment!!!",,
3,Stay away from 5.3L AFM engines!,GM_Blaine ,06/08/2012,,,4,5,3,1,,1,5,1,4,"I've always purchases only GM vehicles.The latest purchase turned out to be my worst car-ownership experience.The subject truck has an apparent defect that caused carbeurization in cyclinders, sticking rings and incredible oil consumption.The vehicle was back and forth to the dealer for 12 months before I threatened legal action and finally got a warranty piston and ring replacement. The engine had just 60,000 miles at the time of the repair.I have not been able to use this vehicle as i had hoped and I have to look now to trade it in before the rings gum up again in 40,000 miles.GM refused to acknowledge any kind of problem for 12 months!","The body style and interior are great.
It rides well.
I love the design.
","Replace the 5.3l AFM engine before you chase off any more loyal customers.
Don't lie to your customers about known problems. If GM had been honest up front, I would be looking to replace this vehicle with another GM, instead of a Toyota.
What's worse is I have also told all those in my extended family to stay away from GM products. I am an engineer who started out in the automotive sector and the patronizing by GM customer Care has tunred me against GM for the forseeable future.

I suspect there are others out there that have had a similar experience."
3.25,Silverado full of promblems......,2008xgmman ,06/06/2012,,,5,5,1,1,,3,4,3,4,"bought new gm truck cause, thought they were the best... was i wrong..i will try to list the many defects. and there is many i will probably forget on or two..first the day i bought new and drove home the hub caps feel off.. nice right.... one month and less than 8000 miles had to have trans work. and after that the seat recliner lever broke and was fixed and it broke again..junk right..dont ever buy on with on board tire pressure monitor. when that goes out the sensors are over $100.00 and you have to have the tire taking off the rim. more cost...and i still goes off evertime you start the vehicle.worst off the bolts fell out of the exshaust manifold and damaged the heads, ","wont buy gm again and would not reccomend very unsatisfied
 ",
4.75,A REAL review of the Chevy Silverado,afmatt212 ,04/02/2012,,,4,5,5,5,,5,4,5,5,"First off i have to address some of the reviews on the silverado. I keep reading reviews that say things like "" transmission sucks"" and ""truck wont last over 60k!!"" really people!?! I am a aircraft mechanic and have a long understanding of how engines and machines run. I own a 2008 chevy 1500 Z71 and have had ZERO issues with the vehicle, and you know why? Its simple.. buy a service manual and follow the maintance schedule!!! Change fluids and insert some grease here and there and i can almost promise you will have zero maintance failures! I love how people think you can just drive a truck into the ground and it will last. Now on to the details about my chevy!","HUGE cabin space.. you feel like your in the cockpit of the space shuttle. SAFETY.. SAFETY.. with the size of the pickup and amount good quality american steel wrapped around my family i feel like a tank on the highway. QUALITY AND VALUE!! the truck has 60k on it and i still have people ask me how many months have i owned it. paint, engine, interior has all passed my expectations.","All though i give my chevy a 4.8 out of 5 stars it still has a few issues. It turns like a 18 wheeler, you have to swing real wide to get her fat ass in a parking spot. Plastic that hides the mounting brakets to the seat break off. CITY gas miliage is horrible.. but its a huge truck and it is what it is people! My biggest issue is the ride quality. I know it has the Z71 stiff suspension, but DAMN it fill shake the fillings out your teeth some times. I am going to upgrade the suspension soon because i cant take it anymore. But overall a wonderful truck. "
3.125,Problems...,d04 ,03/28/2012,,,4,4,2,2,,3,3,3,4,"We have had numerous problems with our 2008 Chevy Silverado that we purchased new and has low miles.One of the problems is power lock failure.Recently the passenger side quit working, but since we are out of our warranty, GM would not cover the cost.However, after speaking with several people from GM I found that they will do a voluntary recall if they get enough complaints from the consumer about this issue.Even if you have already paid to have this problem fixed in the past, please call 866-790-5600 [non-permissible content removed] to let them know of the problem and maybe we can get them to do the voluntary recall so consumers can get reimbursed for the repair costs.",,
3.625,Not exactly what I expected it to be.,onesix ,02/07/2012,,,4,4,3,3,,3,5,3,4,"I bought my truck slightly used in the summer of '09 with 22K on the dash.I have 86K now.Last summer at 65K my transmission went out on me.And my only indicator was that at highway speeds the RPM's would jump up about 1500 and back down speratically for about a week before it locked up on me on the service road of a busy freeway.Had to drive it in reverse half a mile to a gas station to park it.Also, there have been electrical issues with the drivers side lock not locking when I press the remote and window switches not working.Oh, and I'm on my 2nd battery already.Can't figure that one out.Stabilitrak disengages at times.Looking to get out of it already.","Ride comfort is tremendous...maybe the smoothest riding truck on the road.
Electrical issues in the first 2 years of driving the vehicle.","Better equipment, and better gas mileage.
Yes, I know it's a truck, but I still expect more.
I'm filing up the tank about once every 2-3 days it seems."
3.5,RPM Change while driving/Idle Change...?,jaxarmyguy59 ,10/04/2011,,,5,5,2,3,,2,5,3,3,"The Chevy dealer said that this was ""Normal an that it was the alternator"" kicking in.The truck while driving at any/every speed will idle up an then back down about 100 RPM's.I have put duel flowmaster exaust on it and now this is undeniable.You can also feel it in the truck itself when it kicks in almost every 30 seconds or so.Im pissed!I payed alot for this truck, and work hard for my money.I hate beign lied to an I feel like that is just what Chevy did!Do any of you guys know what this might be, or what it sounds like?Thanks for the help, -Jon",,
3.125,Chevy runs deep in repairs,dlra ,09/08/2011,,,4,3,1,3,,3,4,3,4,"Hello all! First off this truck is not what the dealer told us it was. We purschased it new. Run good when we first got it. Truck has been in the shop for more then 3 repairs. Chattering in the front dashboard, door locks have been not locking, the drivers door cable broken in side of it in order to open it. The check engine light has just came on as my dad left work today. The truck is about 100 miles overdue for a oil change but that shouldnt be the problem considering it has 79% oil life left. We have the 4 door version which is very nice for trips and fits us well. My dad has had enough of this truck. and will never buy chevy again. GM has lost alot of customers on this truck!!!",,"Simple as this, use bolts and not plastic clips. Bulid the truck better. You lost alot of customers due to this truck. better make a better one on 2013"
3,Nice but awefull interior,tjdayney ,08/21/2011,,,1,2,3,4,,3,4,3,4,I bought this truck because I got a great deal with 0% apr.The thing I did not notice when new was how bad the interior seat fabric and dash material is.everything sticks to the fabric like velcro.it so almost impossible to get hair off and any dust just stick like crazy to the dash.it looks nice when it is clean but as soon as you sit in it it gets dirty.Drive train and mechanical functions are all good so far.the only problem I am having is the door handle is loose and the dealer could not fix it.,The exterior style.,"New material for the seats and dash.
the stuff the chose is absolutely awful.
It has almost made me want to sell it it is so bad."
3.25,Last in a long line of Chevys,arrjr ,08/05/2011,,,3,5,2,3,,3,4,3,3,"After owning five previous Silverado models and getting over 200,000 miles on each without problems, I am disappointed in the 2008. At about 50K miles, the door locks began to work intermittantly. Now three of them do not work at all. The passenger side mirror has been fixed under warranty when it stopped adjusting, now it is not working again. The transmission has always clunked into first when stopping or lags to downshift until you take off. Dealer said this was normal but it acts just like a sticking torque converter. Painted surfaces on interior is sub-standard and flaking off. Latest problem is the vent selenoid on the fuel system...only $160.00. This may be my last Chevy!",The ride is better than previous models. The fuel efficiency is better by 20%. It is a nice looking truck.,"Transmission, power locks and mirrors, painted interior, "
4.875,Great after 3 years,anderson427 ,01/04/2011,,,5,5,5,5,,5,5,4,5,I have had my Silverado for 3 years now.I bought it brand new.So far I have had NO problems with this truck.I absolutely love it.,"Remote Start, Ipod Jack, 170 degree rear doors, dual climate, steering wheel controls for the radio, shuts down 4 cylinders when cruising.","Better seat fabric.
These seats hold every bit of lint they come in contact with."
4.375,2 years and running!,TH ,11/29/2010,,,5,5,5,5,,4,5,2,4,"I've had this truck for 2 years now and overall, I'm satisfied. Never really been a Chevy guy, I've always bought imports. My truck before this one was a '06 Titan Crew 4x4. I love the rear doors opening to 170 degrees and the electric side windows. The ride comfort is the best I've experienced in a 4x4 truck. The exterior styling is great. I was expecting better fuel mileage from this truck. The best I've got is 17 MPG. I heard that some people are getting well over 20 MPG. Mines is equipped with the 20"" wheel package which may or may not be contributing to my poor fuel mileage. The 4 speed transmission took some getting used to coming from the 5 speed tranny in the Titan. ","170 degree rear door opening, remote start, XM radio, 20"" wheels. This is a great looking truck and it has a great ride. ",Better quality parts - the door lock actuator quit working on the drivers door. Dealer replaced both door lock actuators under warranty. Could use a 5 speed trans.
4.875,Great Truck,rnd ,11/28/2010,,,5,4,5,5,,5,5,5,5,"First off I will say I only buy GM vehicles. I bought this off lease loaded with every single option in good as new condition for just under $25k with 29k miles on it.  I traded in my 2003 silverado for this one. This is hands down the nicest vehicle I have ever owned. Very comfortable and quiet ride , beautiful interior , pretty good gas mileage and tons of power from the 5.3 v8. The only problem I have is with the exterior design. While the truck looks great it is a little lower in the front which makes going through those snow banks a little difficult. I dont want to crack the plastic in the front. My 2003 had better ground clearance. Great truck for the money..","Power, Gas Mileage , Interior",Delete the plastic ground effects in the front for more clearance.
3.625,Won't stay running!,richr ,08/16/2010,,,4,4,2,1,,5,4,5,4,"Since my last review on 7/8/10, the truck has been in the shop twice. Now Roadside assistance says the dealer is out of the 20 mile range and I had to pay the tow company for the extra mileage, was towed from this address before with no issues. The reduced engine power code came back twice and the truck wouldn't stay running. The dealer is once again claiming they can not find a problem, but they would sell me a new truck. They want to give me 14K as a trade?!?! Paid 32K two years ago, so much for holding any value. Going to contact GM Corp. Mon to see if they are willing to offer any assistance. Probably not, next stop will be the lawyers office. Don't Buy this vehicle!","power, fuel economy","Stand behind your product, now more than ever GM needs buyers! Reliability needs some drastic improvement. I don't need a new vehicle, just need the one I currently own repaired properly."
4,Great Truck!,MikeCmfrt ,08/14/2010,,,4,5,5,5,,4,3,2,4,"I love my Chevy truck! I grew up on a farm where a truck was a piece of equipment, not a fancy car. I don't want heated leather seats or anything else that screams luxury! I bought a regular cab work truck, installed some nice 20 inch wheels and tires, tinted the windows and then I did nothing except drive it, haul stuff, tow trailers and use it for its intended purpose. This is a truck and it does its job well. I haven't done any maintenance except change the oil and rotate the tires. The 4.8 V8 has plenty of power for normal towing and driving. It's just personal preference, but I like the look of the Chevy better than the alternatives.     ","Even though my truck is classified as a Work Truck, it is equipped with AM/FM/CD, air conditioning, power windows & door looks. It's as nice as I want it to be and has always been completely dependable. It's a solid truck with a long history of serving America's workforce. I'll buy another one!    ","Ford's regular cab has a small space for storage behind the seat. Chevy does not. I don't expect a regular cab truck to have a lot of storage room in the cab, but there is NONE in mine. I have to choose between a gym bag and a passenger.  "
3,Very Disappointed,GP ,07/31/2010,,,3,3,1,1,,4,4,4,4,"As much as I like the ride, comfort, power and gas mileage of this vehicle, its extremely unreliable.  In the past 6 weeks, I've had the vehicle in the shop 4 times (14 days total) for various problems that have required major work on the transmission and engine.  I have had various other problems with the transmission and drivetrain in the past that the dealership has not been able to fix, or refused to fix under warranty.  Am done buying GM products!  ","Ride, power, fuel economy for a big vehicle, comfort.",Improve reliability!
3.125,Extremely Disappointed,GP ,07/30/2010,,,4,3,1,1,,4,4,4,4,"Unfortunately, for all the good attributes this truck has, power, performance, comfort, gas mileage for a big car, it's an extremely unreliable vehicle.  I've had it at the dealership 4 times in the last 6 weeks for various issues that have required major repair.  Fortunately, I found a good dealership that has made the repairs under warranty.  The selling dealership was horrible.  Along with all the other problems I've had in the past, I could never recommend this vehicle.  The other funny thing is that some things that one dealerships says is covered under warranty is not at another dealership. ","Power, comfort",Improve reliability!
3.375,Pile of Garbage!,hacks ,07/27/2010,,,4,4,1,1,,5,4,4,4,"As much as I like this vehicle for its performance, styling, and comfort, the reliability is absolutely horrible.  In a recent 5 week span, I've had it in the shop 4 times, once to have a valve replaced, twice for major transmission work that involved its removal, and twice for fuel injection problems.  This does not include the cracked transmission cooler, Belt Tensioner, body molding, and numerous Slip Yoke problems I have had with it.  And the service at the selling dealership has been equally as horrible, and I caught them billing GM for work they did not perform.  Needless to say, I filed a Lemon Law Claim last February on the vehicle. Absolutely would not recommend this vehicle.",,
4.25,2008 silverado 1500,richr ,07/09/2010,,,5,4,4,3,,4,4,5,5,"Overall a great truck, there are a few problems though. Glad I got the extended warranty. Just under 60k and it stopped running with reduced engine power code. Five months later just over 60k stopped running again same code. Both times dealer could not find a problem, reset computer and gave it back. Have a thumping in trans or rear end, cant find that either. The passengers side door lock no longer works by the power switch. Great gas mileage, 22 mpg hwy. Great power when running.",Power and fuel economy. ,Bring control back to USA for parts so quality can be controlled better. 
4.125,Great Garage Queen,prsncat ,04/30/2010,,,4,4,4,5,,4,5,3,4,Parked it when gas reached $4/gal. due to poor gas mileage. Love the way it drives now that it has an ARE shell (weight on the tail helps). Great for towing. Always reliable - no problems whatsoever. Cloth seat material is a PITA -- I put Wet Okole seat covers in the first month. It didn't hold its value -- I tried selling for $12.5K and didn't get a single call. I will resume driving it daily when the Honda Civic lease ends.,Comfortable seats and great ergonomics; smooth ride; long bed is worth the expense.,None. I have owned a lot of trucks and my only regret was not getting the crew cab. I love being able to buy a basic truck with no bells and whistles! How about offering the I-6 rather than V6?
