5,"129,000 miles and I enjoyed every one.",Ron ,12/27/2015,3,3,3,,,5,4,5,3,,,,,
4.625,LOVE my WRX,lilhoot ,10/05/2012,,,4,5,5,5,,5,4,4,5,"I bought my 2008 brand new when I graduated college.I'd been in a few older ones and knew how fun they were, but the 2008+ model years really add a touch of comfort and practicality whereas the previous models just felt slightly cheap.It is a blast to drive and anyone who I've let behind the wheel has fallen in love with it.The AWD has exceeded my expectations in the our tough Utah winters.My only complaints are the interior could be a bit more exciting (esp dash), but I think they did address that in later models.Stock wheels are a joke (mine BENT the first year on small potholes) but just replaced them w/better looking one.Overall, a great car with far more pep than you'd think","Smooth shifting, fun to drive, comfortable seats.","Wish it had a moonroof option(should've waited another model year), better wheels."
3.625,My second Sti- destruction of a fine car,subdriver3 ,09/30/2011,,,3,3,4,4,,4,4,3,4,"I am dissapointed in my 2008 Sti. It drives like a stretched limo compared to my former STI Sedan. Frankly, I am sorry I bought it. My previous Sedan STi was undoubtely the most fun, sensitive, firey driving experience I ever had.I looked forward to driving it every day and it was a magical experience. It was like a wild horse at my finger tips.This 2008 limo has been destroyed by Subaru in my opinion. Its acceleration, handling, ride almost feel like an ordinary car. It is boring. I wish I had spent less money and bought the WRX from what I hear.On the other hand, it is, for me,a reliable, stable luxury car of a draft horse that can handle the altitude of Colorado.","Nice , slow, stable feel. You know it won't let you down.",Bring back the 2006 characteristics of the firey Sedan as much as possible. Add an option to stop fishtailing on sharp acceleration and turning as an option.
4.375,Surprisingly fun,bloovis ,06/14/2011,,,4,4,4,5,,4,4,5,5,"This car replaced a beloved 2001 VW Golf GLS 1.8t. I was hoping to find something as fun and comfortable as the VW, but with AWD to get me up our steep Vermont hills in winter in the places where the VW failed to make progress.The Outback Sport has turned out to be much more entertaining than I expected.It doesn't have quite the zip of the VW turbo, but it's plenty fast.The biggest surprise was the excellent steering and handling: quite an improvement over the somewhat squishy VW.The next biggest surprise was the fuel economy; I'm getting 28 on average, and as high as 32 on some off-freeway road trips.","Excellent handling, fairly responsive engine, AWD, decent fuel economy, heated seats, good legroom for tall driver.","As others have noted, the passenger seat is a bit low.
I also miss the telescoping steering wheel and sunroof of my old VW.
The VW also had galvanized steel body panels, so I'm sure the Subaru will rust out sooner.
The external styling isn't quite as clean as the VW, but it's an improvement over the previous generation of Impreza.
However, all of this is nitpicking since this generation is due to be replaced in a few months."
3.75,Nice car but...,oak6 ,06/12/2011,,,4,3,5,5,,3,3,5,2,"Just returned this car off lease at 30k.The deal was too good to pass up: $199/mo.Reliability was excellent: no issues.I went through 3 Syracuse winters on M+S tires with no driving problems.That said, I was happy to be rid of the car.Engine noise is excessive and there is annoying vibration at over 2500rpm.Highway speed in 5th gear is about 2700rpm; get the picture?I test drove other Subes and all had the same issue.The boxers in the engine really go at it at high rpm.This car will accelerate briskly but that means high rpm. Who needs the beating.Great car at 200rpm which means 45mph.Homely.27-30mpg (70% highway) duration of my ownership","Ran 30k with only routine maintenance.
Smooth transmission.
Comfortable front seating.
Satisfactory A to B car in a snowy climate.
(Probably the important factors for the Sube love crowd.)

","Needs much better engine vibration control over 2500rpm.
Noisy at highway speeds.
Limited fun to drive factor.
Trunk lid closing arms intrude into the trunk: great for crushing items.

I have always heard that people either love or hate Subarus.
You may put two check marks in the ""Hate"" column."
2.75,Do not purchase this car!,webbie304 ,01/17/2011,,,3,4,1,1,,4,4,1,4,"I bought this car for my wife new in 2008. We test drove the car and liked it. It is a good driving car, and thats all. We have had back to the dealer several times. Everything from the struts, sway bar bushings. Had to replace the brakes a little over a year of driving it. We live in an area with alot of snow, and the AWD is not very good. Only two wheels will spin at a time, one front and one opposite rear. There is no traction control what so ever. Save your money!",,
3.25,"A great car, ruined by Subaru ",bensti ,12/18/2010,,,4,4,3,1,,4,3,2,5,"This was my first Subaru. I bought it as a CPO with 19k miles on it. About 1300mi after buying it, the MAF sensor failed, then at 3k miles, the engine spun a rod bearing and failed, got a new engine which was broken in properly and then failed from another cracked piston 5kmi later. Oh, and did I mention that it sat in the shop waiting for Subaru to get off their asses and fix it for over a month each time. On top of that, the transmission has begun to have issues, like it won't go into 1st gear without a horrible grind, the dealer says it is ""Not a major problem""!Headlights failed, rear diff failed, clutch failed due to bad work from the dealer, and the car is still brokenBuy an Evo","The car is fast from the factory, it is quite a blast on the highway! When you get into corners, it is good until you start pushing it, then you run into the understeer. 

The front seats are great, the cluster looks awesome, and the overall feel of the interior is high quality. 

","Fix the issues with the engine Subaru! It is stupid to have to keep putting in entire new engines to fix issues that you could have prevented at the factory! 

Slightly stiffer bushings would help a lot. Steering is fairly sloppy but could be corrected with better bushings in the control arm. There are plenty of small mods that can be done to greatly improve the car's handling and feel from the factory with little or no extra cost. "
2.875,The ugliest of the ugly duckling,Anonymous ,12/06/2010,,,3,1,2,4,,3,3,3,4,"For a WRX fan, the 08 is the one to stay away from. I am now at 41k miles and cannot hand this lease back in fast enough. The suspension is too soft with an intense amount of body roll, though the ride comfort is much improved (IMO leave that for the Impreza owners, not the WRX). The interior is clean but uninspiring with hard plastic everywhere. Throttle response is slow and the traction/abs systems are intrusive. Exterior styling speaks for itself. The sound system is close to the quality of a cell phone speaker in a tin can. Hatch boom is very prevalent. The AWD system in the snow is the only reason I gave FtD category an 8 but the OE RE050's leave a lot to be desired in all conditions.",Interior space is phenomenal! Subaru AWD is one of the best (with TCS off). Head room is surprising. Steering feedback is just right. 2.5L HO motors sound remarkable.,Sound quality. Ipod controls on stereo are clumsy. seat bolsters are a joke and provide no support. lots of hatch boom. suspension is too soft. Subaru paint at its finest and anti-corrosion warranty wont fix it (calls it surface rust). Typical notchy subaru gearbox. Ext. styling and int. materials.
4.125,3rd Subie,nsky ,11/29/2010,,,4,4,4,4,,5,3,4,5,"Bought a used 2008 with high miles to replace an aging Mazda B truck. I also compared a few 2006-2007 models, but no WRX's  in the same price range. The 06-07's were much more fun to drive-  more connected to the road.  The 08 is much quieter and smoother like a ""grown-up"" car as my wife put it ( she drives an Outback, which we LOVE)   I'm a sporty driver with a heavy foot, and the gas mileage is OK- about 23 for urban- suburban commuting, quite often in bumper to bumper. If you want a gas sipper, look elsewhere. If you want AWD security, your're in the right place. 35 MPG is useless if you can't get out of the driveway.  ","AWD is great- this is our 3rd Subaru. The standard features are fine for an inexpensive car. In regular drive mode, it just putters along. BUT, when you want to play, the Sport mode unleashes the Subie beast. This car runs great! ",It needs another gear in the automatic. RPM are a little high at 60-65 mph.. Better yet it needs a completely redesigned auto tranny that can decide what gear it wants to be in.
3.75,Pleasant car to drive,Tom ,11/04/2010,,,4,4,4,4,,3,3,4,4,"This car is very quiet, nothing like the rattle box my wife's Focus is. Engine is very quiet, that my wife can't hear it well, and try to restart it twice. I don't like the abs at times as it kick in prematurely, but most time it is quiet. The interesting ""safety"" feature about the car is that if you forget to tighten your gas cap well, or if any glitches occur in the engine or drive train - the Cruise control light flashes, check engine light goes on, and the traction control light goes on. This scared the jeepers out of me at first - but it is an important safety feature to protect the engine. You can buy a code reader for $20 or take to action auto for the code to be read. ","Quiet car, handles corner's well.  VERY decent mileage if you consider it is an all time AWD and not driving the WRC or STI model.  I get 35 mpg going 60 mph, and about 24 in my neighborhood driving.  But I am a non-aggressive driver.",Have a built in code reader - Don't WE ALL WISH.  Make passenger seat higher so that short people can see over the dash board.  
4.375,Perfect pass ,SpeedyPetey14 ,11/03/2010,,,4,5,4,4,,5,4,4,5,"Driving the STI is an unmatched experience, especially. l compared to the Impreza w/o turbo.  I previously owned an Impreza Outback Sport and always craved something more, the STI gave me that and then some.  The SI drive and center differential settings are a great way to ""customize""  your driving experience every time you jump in.  It's truly a Rocky Mountain toy.","Turbo, 6 speed, exterior design, wide stance, performance, cornering ability, snow car.",Sticker price
3.625,A pretty gas guzzler!,SK4417 ,10/13/2010,,,5,5,4,4,,3,4,1,3,"I got this vehicle based on the Subaru reputation for safety and reliability. It's safe, alright, but it has been a money pit for me maintenance and fuel- wise. I commute 90 miles a day, and I average 23-25 MPH on the highway. And, hope you never have to replace a tire-- due to the AWD you'll need to replace all four. It looks pretty standing, but is a gas guzzler! I won't buy another one or recommend it.","Appearance, Handling",Fuel Economy!
3,A car thats Bought with Good Intentions,Trutsayer ,08/09/2010,,,2,4,3,5,,3,3,2,2,"I had a 2004 and had to replace it after I was hit and just not thinking got another hoping it was better as it changed---it didn't, it was NOT better. It gets just pathetic gas mileage to the point where I chatted with other owners that were sure that something was wrong as the mileage was so bad! Then the fantasy.ITs a car that you buy based on the fantasy that you will be 4 wheeling all over the place and plowing through 4 ft snow drifts and lake sized puddles. Reality= trip to grocery / gas station . Not much ""fun' to drive . Its not quick and peppy as the 4wd has its drawbacks . Then at high speeds when passing it would lunge in 3rd to 4th and make aloud CLUCK* sound both years. let-down",Looks Good standing still. Handsome rims and restyle. easy to sell to another pigeon ,"Better Gas mileage, Needs more power - Subaru so embarrassed by 0-60 time its listed NOWHERE! Flat handling feedback and the 4wd doesn't seem to add to the ability to go thru the slalom , the 18 Mazda 3 smokes it in every category? Why it's only 2wd  isn't 4wd better --well that's what they sell you!"
3.75,Poor mileage,Barbara Rueckert ,07/25/2010,,,4,4,4,4,,4,4,2,4,"In stop and start driving I get 15.8 to 16.2 mileage. Received message that my tires were low, they were not. Message went off when I hit cruise control. Computer problem?",,better mileage
4.875,Best car i've ever owned,luckyzsquirrel ,06/12/2010,,,5,4,5,5,,5,5,5,5,"I've had this car a couple years and plan to keep it for a long time. Handles great, comfortable, lots of features, solid, great visibility and performs!  It may have ""only"" 170 Hp, but a very broad power band.  This car flies up the Colorado mountain passes.  I could easily do 20 over even the steepest grades here, while many cars struggle to hold the speed limit.  AWD is extraordinary in the winter, in all but true off road and deep snow(say over a foot) this car does better than my truck.  Its economy is rated at 19-22, but I've NEVER been close to that low. I consistently get just under 30 mpg combined driving.  I've had it in the mid 30's on the highway.  ","Performance. Handling. Extremely roomy.  Comfortable.  Reliable.  Well built. Does great in adverse conditions. Great MPG for AWD (I get close to 30mpg consistently, and as high as 37 on the highway).","Styling takes some getting used to. Road noise a little high.  Front passenger sits really low, something short people might not like (the driver seat can be raised however)."
3.375,Not quite there,Mide ,05/11/2010,,,5,4,3,4,,2,4,3,2,"On paper the car has everything a person needs, but in reality it is lacking at a few areas. First off the 4-speed auto is bad. It is in dire need of 1 more gear. You have to put it into 2nd in order to have any sort of acceleration. Next is the paint quality. It really sucks. There are chips everywhere. Lastly is build quality. The steering-wheel control of the audio system barely works and I have to press very hard to get it to function. Because it still ""works"" the dealership won't fix the problem. Because of this, it will be the last Subaru I ever purchase. If I could do it again I would not purchase this car.",Everything you need on paper,"Fix the horrible 4-speed and the fact that there is a 2 second delay if you floor the gas pedal for a quick acceleration. Get a better paint job service to do the work. MPG is still hovering around 24-26 mixed driving, a little better would not hurt."
4.25,Great overall car for the money.,ahowell ,04/07/2010,,,4,3,4,5,,4,5,4,5,"I've driven a lot of cars, this particular one has me hooked on Subarus. In general it has a lot of torque and it puts you in your seat very well. The overall build and design is not bad, other than no forethought on where to put aftermarket gauges (boost, wide band,..) The paint takes a lot of TLC to keep it looking new, not too much but more than most. The suspension is wonderful for normal day to day driving but taking a turn it could be a little better. ","Turbo, Seats, Hood Design","Stiffer suspension, more finished paint job, a place to either put aftermarket gauges or include oil pressure boost and wide band considering they will help keep the turbo in check. A little bit more aggressive style wouldn't hurt."
4.875,Great Little Car,NigelPV2 ,03/22/2010,,,5,5,5,5,,5,5,4,5,"This is truly a great car. It is versatile, safe, reliable, and fun to drive. With 44.4 cu/ft of cargo space, 60/40 fold-flat seats, the car can handle anything I throw at it. With the car's AWD system and 6 standard air bags it offer's a level of confidence on the road unlike any of the other cars I test drove. Lastly, Subaru has found a great balance between ride and handling. The car rides completely different then it's predecessor with a subtle ride, yet still contains the prowess to be tossed into a turn. The car is not without it's faults, though, as the hard plastic that completely covers the interior and tires seem to amplify the little road noise that find their way into the cabin.","AWD, Comfortable Seats, Usability, Balance Between Handling Capabilities and Comfortable Ride, Reliability, Subtle Styling, Standard Safety Features, Quite Interior (Especially When Compared To Previous Models), Roomy Interior, and L.E.D Tail Lights","Hard Plastic Interior, Sound System (It's ok but could be better), Rear Drum Brakes (There strong but I would have preferred rear disc), Black Door Handles and Side Mirrors, and Noisy Tires Over Rough Surfaces Disturb An Otherwise Peaceful and Quiet Ride."
4.5,'08 WRX SEDAN,dScof ,01/07/2010,,,4,5,4,5,,5,4,4,5,"This is my second Subaru. I owned a 2005 WRX sedan before, which was a terrific little car. As for the '08, I initially didn't think that an extra half liter in engine size would make much difference, but I was wrong. This car revs so smooth and effortless, if you're not careful you can touch 100mph on the freeway without even realizing it. The handling in this car is superb, with some minor body roll, but it's not noticeable in everyday driving. Fuel economy could probably be better, I used to average 20mpg on the stock tires (tires = awful), switched to lighter, performance tires and am getting 22-23mpg in mixed driving, up to 30mpg at non-freeway speeds if I set cruise and stay off turbo.","Turbo, AWD, VDC (and the option to turn VDC OFF), less of a cop-magnet, lots of add-on options from SPT and STi, no paint problems so far after 25k miles (I have World Rally Blue Pearl), ergonomic climate controls (can reach while my hand is on the shifter merely by extending a finger)","Suffers from brake fade, I've never been impressed with Subaru's idea of a stereo, BETTER STOCK TIRES, better windscreen seals (suffers intermittent 'creaks' and 'pops'), include stock body molding or mud flaps (kicks up lots of grime), MAKE AN STI SEDAN, add a stock boost controller"
3.875,First year with first Subaru,MNJ ,01/05/2010,,,3,4,4,4,,4,3,4,5,"I've had my Impreza for a year.  Its been through rural blizzard-prone Minnesota winter and has performed well.  Very fun to drive in snow and has good grip on snow and ice.  Seems to be able to go through deeper snow as well, but clutch starts to smell hot.  I get about 31-33 MPG in the summer on the highway (haven't driven much in metro traffic.) Winter MPG drops off sharply to 17 in town/short trips and 25 on the highway. Only problems are a faulty tire pressure sensor (covered by warranty) and about 1 out of every 3 times when anti-lock brakes kick in on ice in below 0 temps, vehicle dynamics control and ABS goes out and won't work.  Shutting car off and re-starting seems to fix it.",All wheel drive and MP3 jack.,"Softer seats with more lumbar support, a bit more ground clearance, and a louder maximum volume on the radio."
4.875,Great car for the money,Mich Dave ,12/29/2009,,,5,5,5,5,,5,4,5,5,"I've had my Outback for 34000 miles and I'm very, very happy with the purchase.  Better than expected mpg's-- 25/30 and better performance than I thought I'd get from the 170 hp.  This is my first Subaru, but certainly not my last.  If at all possible go with the 5 speed--better performance and much better mpg's than the 4 speed auto.  All I've done so far is change the oil.  The only downside would be the paint and the radio.  They should be able to do much better in the radio despite the low price of the car.  I'm glad I went Subi instead of the Mazda 3--especially when there is snow on the ground.",I really like the mpg's for an AWD car.  The handling isn't bad for a raised chassis and the 170 hp isn't as sluggish as anticipated.  Exterior styling is much better than the competition out there.  I like the heated windshield and heated seats-- nice touch for an entry level car.,Need to improve paint quality--chips easily. The stereo is very poor.
4.5,Didn't look twice @ Subaru until now,Subie 4 Life ,12/29/2009,,,5,4,5,5,,4,4,4,5,"This is a 2nd review nearly 1.5 years after initial. I changed the performance rating to an 8, prev. was 10. The ECU Map seemed a bit hiccupy. Peaks and valleys thr/out the power band. Subaru recalled for ECU issues. Reflashed the ECU and it helped, however not as it should. I have since ""tuned"" the car w/ aftermarket mapping and parts. Power output is about 350 hp and 380 tq. Very smooth and usable power now. I lowered the exterior rating because of the tail lights. They really bother me! The front grille is out of place too. Nav system is still clumsy to operate and not very accurate. I have gotten used to the lack of amenities. Still smitten by a true 4 season perf. car.",Performance whether factory or tuned. Power potential. Tons of aftermarket parts/support. AWD is absolutely amazing in the snow/ice. Handling. Usable interior space. Simple dummy proof controls (Exc. Nav). Very robust car that eats bad roads like candy. True 4 season performance daily driver.,"Fine tune the ECU. Subaru, dump the NAV! It stinks! Improve the sound system. Improve the HID projection, they don't illuminate far/high enough. Has been dangerous on dark roads. Heated mirrors standard. PERIOD! Most have been cosmetic but the headlights, I think, are the only big issue. "
4.75,It's a great car.,RAS3 ,12/01/2009,,,5,5,5,5,,5,4,4,5,"I've had my WRX 5 dr for 2 years now; 22k miles @ 24.5 avg mileage. I wrote a review on 11/23/07 and what I wrote then still holds. On top of that, I believe that the Subaru AWD system is superior to my Audi's, even w the performance tires on it. I've been the only one to make it up our hill several times over the past two winters (on ice), passing sport utes of all types splayed across lawns and shoulders. I've also had no problem following large Mercs at high speed on interstates - slowing only when my senses returned and the realization that a large fine would be very painful to me. It's a great car.","AWD, interior space, and... the motor.","lag between accelerator and clutch, and a bit more sound dampening (but, hey, I'm an old guy...)"
4.125,2008 STI with NAV,cdv478 ,11/27/2009,,,4,5,4,3,,5,4,3,5,"This car has been decent overall. It is a lot of fun to drive and is useful for hauling smaller items. It has been very reliable with the exception of the NAV system. SOA has replaced it 4 times, and the 4th unit is defective, and has been since Feb 2009. The reason it hasn't been fixed properly is that Subaru will only install used ""remanufactured"" nav units, not new ones, even though I am the original owner and had nav problems less than a week after taking delivery. The car is fun to drive and I am happy with it. Subaru of America service is terrible. As of 11/26/09, my car has 9800 miles and STILL has a defective nav unit.  ","Engine, transmission, brakes, styling, interior.","Improve customer service, provide more durable interior/exterior finishes, provide more content with the NAV system or lower its price considerably."
4.625,One of many VeeDubbers to Subaru,DW ,11/09/2009,,,5,5,5,5,,3,5,5,4,"I recently traded in my '07 VW GTI on a used (17,000 miles)-'08 Impreza 2.5i.  So I lose 30 hp, gain awd, lose handling, but gain a more grown up, and comfortable car.  I wanted something I would be somewhat happy with along with reliability.  With the reliability of Subaru, I had my choice.  If you want something that will be a 6-7 on the fun scale, that looks good, will drive through anything, and that will be as reliable as a rock... buy one of these.","AWD, boxer sound, highway MPGs, interior design, dials, stereo, dual exhaust, heats up very quickly in cold weather, 5 speed manual, steering wheel controls on premium, leather steering wheel/shifter/parking brake, and it's a SUBARU, it will be as reliable as the sun.","Stronger anti-roll bars, stock exhaust tips (although the bare 2"" pipes allow you to put on any tips you like), little nicer cloth interior, otherwise if you keep in mind what car you're buying, there is not much to complain about."
3.875,The Good and The Bad,John ,11/08/2009,,,4,5,5,4,,4,3,3,3,"Being that it has turbo, the WRX is a blast to drive in a straight line. Add corners to the equation and you'd better hang on to the handles if you have the 08. Don't worry, they added sway bars to the 09 WRX because of the problem. They also added significantly more horsepower to the 09 WRX. I feel ripped off that these fixes didn't come with the original 08 WRX model.","Heated seats, hatchback trunk makes it easy to see out of and to load big items with the seats folded down. AWD makes being in the snow fun. Safety ratings are great! Better go with the better speakers from what others have said about the base speakers. My upgraded dealership speakers sound great!","Sunroof, improved gas mileage, interior noise dampening, fix the shifter, passenger side airbag has a difficult time picking up people around 107 pounds which makes the girlfriend a little nervous it won't go off in an accident. Maybe a button to keep it on if you want?"
