4,Good family starter,Chad Price ,10/25/2016,3,4,4,,,3,4,4,4,,,"A good vehicle for it's value. Nothing in it is really going to blow you away with class or ""piz-az"", but it performs as advertised. The 3.5L V6 has enough guts to help you get around slow moving vehicles quickly, but again, won't amaze with speed. It averaged about 21 mpg for us, a little under what we thought it would, but not bad at all. The leg room is good up front in my opinion (but I like to sit up close for a 6'2"" male), however the rear is a little cramped for bigger adults, but fine for averaged sized people and kids. I always felt cargo space was a little small but we always had to fit a big dog into the vehicle plus our cargo. (But that's our problem and has nothing against the vehicle.) We had a few electrical issues with the BCM (Body Control Module) that was about $600 fix, at about 75,000 miles, but other than that everything worked great. If your just starting off and have a growing family, this is a great car for you!",,
3,"Loved the car for 8 years, but then....",marmot ,04/22/2016,1,2,3,,,3,4,5,5,,,"Beware of the the water pump on the 3.5L engine.  Search the internet lots of water pump failures resulting in severe engine damage.  I loved this car.  I purchased it new, no problems until 92K when the water pump failed with no warning.  No warning lights, no fluid leaks.  If you're thinking of buying one used with a 3.5L, be sure to have the water pump checked out first.",,
3,Great Car with Recent and Alarming Issues,JJ ,02/14/2016,4,3,2,,,2,3,4,4,,,"I have a 2008 Ford Edge with 55k miles - 3 Times in the Last year when I have been attempting to accelerate- All of my warning lights turn on - My spedometer gets stuck at zero, and I am unable to accelerate above 5 miles per hour for a significant, and dangerous amount of time. Took car into shop and they were unable to find any issues. Looking online it seems many other people have had the same problem and ford is unable, or unwilling to address the issue. Very Dangerous.",,
5,Love my 2008 Ford Edge AWD,D Baker ,01/04/2016,5,4,4,,,5,5,5,4,,,"First owner of this vehicle.  Absolutely love it.  Buying a new one this year just like it.  Great ride, fast acceleration, great radio.  Could do better on gas mileage, Sync system for cell phones and more backward mobility on driver's seat.  Overall a wonderful SUV.  Have never had any problems with it.  At 62,000 miles right now.",,
5,Great Vehicle,Bill ,08/07/2015,5,4,4,,,5,5,4,5,,,"Vehicle currently has 180,000 miles on it and has been an amazing car. Mechanically, no major problems have ever arose. I did have to do the rear wheel bearings at 150k. Besides that and your typical brakes, tires, and tune ups car has been flawless. It does have good power and excellent AWD system. Does great in northern Wisconsin winters. I drive about 60% hwy and average just over 21 mpg with aggressive driving, so gas mileage isn't great but worth it with the quality of the vehicle. Highly recommend if you're looking for an AWD crossover that's well built.",,
5,I usually dont give 5 star reviews,djscotec ,05/13/2015,,,5,,,5,,5,5,,,"Bought my Edge at the beginning of 2009, was a demo with 9000 miles, to this date i just went over 61000 miles. Knock on wood i've had very little problems with the vehicle, mechanically or electronically. the rear tail lights burn out unusually fast, should have a recall on this. the sockets appear scorched. other than that its been basic maintenance on the vehicle. i changed the transmission oil at 50000 miles just to be safe. I also change the oil every 6000 miles with full synthetic mobil 1. the oil still looks good after 6000 miles! the front end seems to be riding hard as of late but it may need some gas struts replaced, most of my miles are city driving and joy riding UPDATE -  had to replace both tie links in the front as they were worn and thats where the clanking was coming from. Had to replace the gas tank on recall and the now the airbag was recalled as part of Takata.  The right rear wheel bearings went on me over the summer but that was fixed also. Still love the vehicle, rides like new with the repairs of the tie end links . still use Mobil 1 and oil looks great.",,
3.125,2008 Edge SEL ,hmayan ,08/30/2012,,,2,2,2,3,,4,4,4,4,"Good car over all. Bought it new and owned it now for 4 years. Pleasant to drive. Interior design is a bit poor. I saw a 2012 model and they made a lot of improvements. Gas millage is worse than advertised which is the biggest drawback for me. I get 16-17 mixed according to computer, from day 1.","I like the SYNC, large cargo space and the large vista sunroof.","Tail lights (brake) failed multiple times. They actually burned the sockets as well. At 63k miles brakes started making gurgling/bubbling noise when pressed. So, had to spent $400 to change the booster for brakes which is unusual. I keep seeing the same complaints in other forums, so I know I am not the only one who had these problems. They should have had factory recalls for these."
1.75,Not so good...,nivek3 ,04/10/2012,,,1,3,1,2,,2,1,2,2,"After never owning a Ford, I decided to give them a try. Initially I thought it was a good car, but little by little I began to hate it. The Build quality is crap. The interior is made of very cheap plastic and fit is poor. Even worse is the air conditioning. I unfortunately bought the Edge during the winter, so the AC was not a priority at that point. Then came the Texas heat. The Air conditioner makes lots of noise but never puts out air. The dealership said there was nothing they could do since it was due to the design. So I now own a VW and love it.",Exterior design.,"Air conditioner, seat comfort, and interior build quality."
3.875,Good Crossover,sea1967 ,10/15/2011,,,3,3,4,5,,4,4,5,3,Now have over 100K on my Edge.Very happy with it overall.Getting 26.6mpg according to computer in mixed driving.,"Heated seats, compass, strereo","Cancel button for cruise control, heated mirrors"
5,A Very Luxurious Vehicle ,robey_1 ,08/31/2011,,,5,5,5,5,,5,5,5,5,"I purchased my 2008 Ford Edge in October 2010; about 10 months ago. So far, I am very happy. There was only one issue that I had which was covered under my auto Tran.This vehicle drives very smooth, like a car, and is very comfortable. The leather interior and the beautiful exterior (powder blue) gives this vehicle a very luxurious look. People cannot believe when I tell them that the vehicle was just under $20,000. Overall, I would highly recommend the Edge as it is like a luxury vehicle without the price tag!","I really like the Sync capabilities; however, I have yet to use the phone setting. I really love the leather seats and the automatc driver side seats. The heated seats are great for winter too. The rear seat fold forward to make tons of room for anything you may need to load. I have moved a few times and the load capacity has really helped keep the trips to a minimum. ",Air conditioned seats would be really great!
5,Great Car - Fun to Drive,illini025 ,07/31/2011,,,5,5,5,5,,5,5,5,5,"We love this car.Fun to drive, and the AWD handles great in the snow and ice.We bought it new and now have 40K miles on it.We can fit a ton in this car too.We have two kids in car seats, and make frequent overnight trips with strollers, luggage, etc.Our only problem so far has been the power lift gate would not stay up at times (around 30K miles).Dealer fixed it (under warranty) with a computer reset and its worked perfectly ever since.We would definitely recommend the Edge!",Panoramic moonroof; AWD; power lift gate; fun car to drive!,We really have no complaints so far.
4.75,Transmission,Maverick ,09/02/2010,,,5,5,4,5,,4,5,5,5,"We have 46,000 km and have had problems since picking it up with transmission and we find out today a sensor is being replaced already good that it is under warranty.",,
5,Poor AC Flow,AD ,08/14/2010,,,5,5,5,5,,5,5,5,5,"I am very much in love with my Edge, except for the poor AC flow. It worked great for a year and now I can't get it above 80 degrees. We all sweat in my car and bought a fan to put in the back seat.  Hopefully Ford can fix this problem and not let a good car go to waste!  ",,poor air conditioning flow
4.5,Love My Edge,Joy Churchwell ,08/04/2010,,,5,5,5,5,,4,4,3,5,"Very smooth ride -  great handling - lots of compliments on car looks and color, Creme Brulee is very posh!",Color ,Speedometer is horrible and the fact that the 2 large ac vents won't close is a problem
4.125,Corroded rims,caroline ,07/25/2010,,,5,4,5,4,,4,5,2,4,"My chrome rims started peeling in 2009. My dealer stated that the rims were dirty. I did not want any lengthy discussion with the dealers resistance so I thought I would bring it to another dealer - knowing that others have had their rims replaced for the same problem I did not think this would work out to be an ordeal. After dealing with job change, divorce and cancer within my immediate family the vehicle was not the most pressing concern. Bringing my car back to the dealer at 38,000 miles - out of warranty- the corroded rims are undeniable but the dealer will not change the rims since it is out of warranty. Ford co's response is that this issue is between me and the dealer. ",comfort all the way around - even for a 6 foot boy sitting in the back seat.,chrome rims - why on earth are they corroding?
4.625,Awesome Ride,Coach ,07/19/2010,,,5,5,4,5,,4,5,4,5,Had my Edge for 2 yrs.  No issues what so ever.  SYNC is the best invention EVER!  Have no issues mating any phones with the sync system.  Nav system is easy to use.  The seats are more comfortable than my wife's new Cadillac SRX .  One and only one issue that keeps raising its head is the trim on the roof (panoramic roof) rattles.  ,SYNC,"I guess they already added weather and traffic to SYNC, only suggestion"
4.875,Thank You Ford!,Happy Edge Owner ,07/13/2010,,,5,5,5,5,,5,5,4,5,"After test driving many different cross overs, I decided on the Edge. It was the most comfortable to drive, had more to offer than the others and for a good price too. I custom built my SEL in White Sands, Tan w/black stitching interior, Sync that works better than my husbands Acura TL, Rear Lift gate, Towing package that gave me a bigger radiator, Roof Rack, and more. Back seats offer flexibility by lowering one or both. Plenty of room for hauling stuff. I've had it for two years now, taken it on long trips with no problems. I like to ask my husband ""have I told you how much I love my Edge lately? It's by far the best vehicle I've ever had. ","Sync, Auto Rear Hatch, Comfort, sporty good looks, good acceleration, lights that turn on inside & out when I unlock it, not too big, just the right size.",The air conditioning output could be better on the drivers side. 
4.75,Like it a lot!,tt ,06/16/2010,,,5,5,5,5,,5,5,4,4,"After driving & owning 3 New Explorers (which I really like) I traded my last Explorer in on a new Escape. BIG mistake, did not like the Escape as it was too small and had cheaply made interior, traded it in after owning it 2 years onto an EDGE SEL AWD, am very happy with it. Gets about the same gas mileage as the Escape but rides SO much nicer. ","Vista sun roof, roomy and the seats are very comfortable!",
4.5,Best used car every bought,great gas mileage ,04/13/2010,,,5,4,4,4,,5,5,5,4,I just got my Ford Edge and purchased from a Chevy Dealer who took it in trade.   I recently went on a road trip and got 25 mpg on the trip. I use bp gas as recommended in the manual and find performance gas mileage was improved over the two tanks I got at the local convenient store.  Lots of power and handles great in any situation. ,bluetooth feature and hands free phone use.,"none at this time, very satisfied. "
4.5,Awesome Vehicle,Antony ,02/07/2010,,,5,5,4,4,,5,5,3,5,I purchased this vehicle after having a Jeep Grand cherokee for years. But after test driving the Ford Edge it was like driving a car in an suv body and was surprisingly even larger inside than it looked form the outside. It recently snowed and the AWD feature had be handling the roads like a glove,,
4.75,would buy again ,nice ride ,02/01/2010,,,5,5,5,5,,5,5,3,5,i think one best suv on the market .smooth ride and lots room ,i was surprised at all the room in the back lots of leg room. ,big blind spot 
4,"Fun to drive, not perfect",jerbo ,01/27/2010,,,4,5,4,3,,4,4,3,5,"I am trying to buy American so this was an experiment for me that I don't regret. Everyone loves the exterior look, I get compliments all the time. The interior feel very roomy. It drives like a car for the most part. SYNC is fun once you figure it out. Plenty of get up and go for my taste. Unfortunetly the AC is not powerful enough, the plastic interior is not my favorite, and we got a smoking transmition problem that others have reported that has disappointed me. However, it is fun to drive and looks great.","The spunky engine, SYNC audio, and general good looks.",Smoky transmition!? AC and front vents specifically. Cheap feel to interior.
4.375,LOVE my new Edge ! =],abercrombie_girl4158 ,01/23/2010,,,4,5,5,5,,5,5,1,5,"I traded in my 2009 Chevrolet Malibu LT for my new Edge. When I test drove this SUV, I was HOOKED! Awesome performance and very fun to drive. Sporty look inside and out! I feel safe in this vehicle and I LOVE the room!","Six CD changer, Bluetooth compatible, awesome color exterior (Pearl Metallic White), bright headlights!",Gas mileage! I have gotten no more than 20 on the highway with cruise set at 65.
5,I'm suprised how much I love my Edge!,Brent ,12/20/2009,,,5,5,5,5,,5,5,5,5,"I'm a faithful Ford buyer.  I feel they're safer & better built than any other American made car.  I needed to trade my Taurus. I started transporting my grandfather, and he had a hard time getting down and into my Taurus.  (He's 93 and 6 foot tall)  I looked at the Edge because of ease of entry for him, not because I saw myself driving it.  It was OK, but just OK.  After driving it for 2-3 days, I LOVED THIS CAR!  It's fun to drive, looks good on the road - I get compliments, and is comfortable for distance traveling.  Would I trade?  Only for the Lincoln version.  I could see myself buying Edge again.",,
4.875,Ford sold us,Jeff and Mary ,12/10/2009,,,5,5,5,5,,5,5,4,5,"This is the first American car I have ever owned.  We traded a 2007 Altima for the Edge (needed more space).  Got a great deal, loaded with all but nav and awd.  This CUV is so comfortable and just does almost everything excellent, we looked at alot of vehicles too.  Some reviews I read say the interior plastics are cheap.  Now they aren't soft to the touch, but they are put together very well.  No creaks or squeaks at all unlike our Altima which had leather all over and soft touch plastics but had creaks.  I'll take a well put together interior over soft touch plastics anyday.  This vehicle is so comfortable, great for highway trips.  Got 24 MPG on our 2.5 hr trip home from the dealer.","20"" wheels are beautiful, vista roof is awesome, paint quality, build quality, comfort, stereo is the best I have ever heard, heated seats, power liftgate, memory seat/mirrors, styling, ice blue color, fog lights that come on with parking lights","power seat back angle and lumbar support, better dead pedal, more leather on doors/armrest, better brake pedal feel (too much dead travel), larger floor mats, better tires (not the best in snow), and of course, better gas mileage (especially city)"
4.75,Like the Edge,pbear9 ,11/12/2009,,,5,5,5,5,,5,5,3,5,Really like this Edge. Had a Mazda CX- 7 that was repurchased by Mazda. Looked hard for the replacement vehicle and have been pleased with the Ford. Had Fords years ago and they have definitely improved.,Sync! In console IPod hook up - Sat Radio - Love the Moonroof,Grab bars for the passenger side front. Better gas mileage.
5,Amazing Crossover,Gina ,10/04/2009,,,5,5,5,5,,5,5,5,5,I Love my Edge! This is a wonderful winter vehicle for Montana. Heated leather is the best. I love the fact that it rides so smoothly and quietly even on some pretty bad roads. I haven't had any problems with it. This is a very great SUV. I looked at a lot of others but I felt the safest in this puppy. Great room for my sons car seat and stroller. Love you people from Ford. ,"Leather seats, Smooth riding, Quiet, Pretty car, roomy!",Nothing   !
5,Awesome SUV--- I want another one!!!!!,Leotus ,08/30/2009,,,5,5,5,5,,5,5,5,5,Plenty of power and does well in the N.E. winters.  Vista roof is awesome along with the power rear gate.  Not too many flaws in this puppy.,Too many to list.,The Edge needs a grab handle above the front passenger window to assist entry.
4.125,Ford Edge Limited,Mike ,08/26/2009,,,5,5,4,5,,4,4,2,4,"Very practical. Lots of compliments on looks in and out. Ride is a bit stiff with the 20"" whl option. Could handle a bit better if your giving up a plush ride. Plenty of go but TERRIBLE mileage for a V6. How others on here get 23+mpg is beyond me when mine doesn't even get 22mpg with cruise on at 60mph on the highway. I get 15city/20highway regularly. Car is too heavy at 4300lbs but strangely the doors are too light and slam shut too easily. Had a problem known to ford with drivers side heat not getting as hot as the passengers. heater core replaced. fixed. Others on here complain about warm A/C but strangely mine is mind numbing COLD! I have to turn it down in 95 degree weather often.",Audi-like interior in Limited with leather. AWD great in Massachusetts winter. Plenty of pickup. SYNC works well with bluetooth features.,Gas mileage stinks. Either give me 265hp with better mileage or give me a full 300hp for the mileage im getting now like the new camaro V6 is getting. No 1234 gear selection or paddle shifting like the fusion? Gear selection is nice for hills in winter or when towing. Only D for drive or L for 1st.
4.625,08 Ford Edge SEL,Amanda ,08/15/2009,,,5,5,5,5,,4,5,3,5,I've only owned my edge for a couple months. I had a Hyundai elantra and wanted a bigger vehicle since I just had a little girl. I love the room in the edge. I was looking at a few suvs  and most of them still looked just as crammed as my car did once I put the car seat in. This crossover has plenty of room for the car seat and plenty of cargo space for my stroller and anything else I might need to take along with me. Also love that it has ac vents in the back so I don't have to worry about my little girl burning up. It's very comfortable even in the back seats. Gas mileage could use some improvement though. I usually get about 22-24 on the highway and about 16-18 in the city. ,"6 disc in dash cd, ac in the back, comfortable, roomy, fun to drive",ac vents for driver could use some improvement. They don't hit you. gas mileage
4.5,I love my Edge!!,Teenda ,08/11/2009,,,4,5,4,5,,4,5,4,5,I love driving my edge.  I traded in a Jetta for it to deal with the winters and I was tired of a manual transmission.  I have now found out I am an SUV woman and will probably always be one.  My edge was broken into once so the pass window was smashed in but that isn't a manufacturers defect.  My cruise control did stop functioning but it was replaced under warranty.  As for fuel mileage - I drive to quick to give an accurate answer.  I love the stability and comfort I feel while driving my Edge vs. driving a Jetta which was low to the ground and a rough ride.  LOVE LOVE LOVE MY EDGE!,"Cabin room, Exterior visual appeal, Comfort of the seats, Reclining rear seat, We can fit 5 mtn bikes in the back (we love biking)",Vents by stereo can't be turned off.  I feel like this car also has a huge blind spot (but that could be because I was used to a Jetta before this vehicle)
4.5,HOT in Texas,Anthony ,08/06/2009,,,5,5,5,4,,5,5,2,5,"We had our 2008 Edge limited just 11 months before it was totaled in a very bad car wreck.  My wife got T- Boned at 65 mph, and walked away from the car with no broken bones.  If you saw the accident scene, you would be surprised that anyone lived.  I am 100% sold on the safety of this vehicle!  It had a very comfortable ride and was fun to drive.  There are 2 significant problems:  A/C is VERY weak (especially in TX), and we have never gotten better than 16-17 mpg (even highway trips).  The window sticker said 16-24 avg mpg.  What a joke that is...  With that being said, we are looking at buying another one!","SAFETY, fun to drive, comfortable ride, great styling, American made!!",A/C is the worst I have ever seen.  The mpg needs significant improvement.
3,2007 Edge ,Edge owner ,07/25/2009,,,5,5,1,1,,1,5,3,3,"I hit 50,000 and it seems like things are really deterioating with the Edge. I have had squeaky windows that have been repaired ($200) and now the accelerator wiring has to be replaced ($325). None of which is on warranty. I will not buy another Edge as a result and the rapirs make me wonder about Ford in general.",The roominess of the interior.,
4.75,I LOVE MY 2008 FORD EDGE!!,Annette ,07/24/2009,,,4,5,5,5,,5,5,4,5,"We purchased our Ford Edge in March 2008 after selling my car. We live in Wyoming where the winter weather can be a challange at times and we wanted something that had higher ground clearance and was AWD or 4WD. We took 2 weekends test driving every crossover vehicle on the market. We kept coming back to the Ford Edge. It is roomy, classy looking, AWD, we have 32,000 miles on it and are getting 23 MPG. I miss my little car's 30 MPG but Im not totally disappointed in my Edge's MPG wish it was getting 26-28 but 23 isn't real bad. ","Comfortable ride, roomy, good sound system really enjoy the Sirius radio. Extra car charger plugs a plus. ","Not happy with the vents near the radio, they dont turn and cant be turned off. Rear tail lights not real bright. Luggage rack came off when using a car carrier in New Mexico in high winds on the interstate. "
5,Great Car for the Midwest,Eric ,07/19/2009,,,5,5,5,5,,5,5,5,5,"We traded from a 2004 Ford Freestar Limited to this, WOW! We get 24-26 MPG mostly freeway miles, which is a huge improvement. We love the fact the kids can watch the DVD with headphones while we listen to tunes. SYNC is great with the hands free it just freaks you out the first time you get a call. Living in Wisconsin this drives great in the winter weather, snow, and ice storms. The memory seat set is great. It is a spendy car but you get a ton of options. 17K miles and no problems!","Sirus radio, DVD, the overall look inside & out. Very Flashy!","I'm not thrilled with the A/c vents for the driver. If you want them to blow towards you they hit the steering wheel or your hands, not my face or body. But I can live with that."
4.875,Fun to Drive,Pammy ,07/08/2009,,,5,5,5,5,,5,5,4,5,Driving has been a wonderful surprise. I had driven vans for 12 years and didn't feel like I traded away anything. It handles well and maneuvers like a champ around town and cruises the interstate highways.,"Acceleration is fantastic, no lag time.",
4.375,mixed,fordowner ,06/25/2009,,,5,5,3,5,,5,4,3,5,"I bought this car because it was cute and i wanted a small suv so i dodnt have to cram my stroller into a trunk anymore.  Overall, I am pretty happy with it.  I am a little disappointed because the carpet under the driver side has already pulled back and wire are showing, as well as the drivers seat underneath (my car only has 7k on it).  The door rattles a little.  There is no passenger handle to grab for assistance while getting in or for comfort while driving. There seems to be several blind spots.  My biggest complaint is the ac.  The vents only move down and you cant close them so you always have the air on you! my husband likes it cold so I am always uncomfortable when he drives",its fun to drive and its flashy,"a/c vents, passenger ceiling handle, better job putting it together..."
4.625,Expected Less - Got Much More,Rick ,06/25/2009,,,4,5,5,5,,5,4,4,5,"Purchased this car because they were offering buyers incentives. I got much much more then I expected. Great pickup and handling; smooth ride and safe secure feeling when riding in the vehicle. Although the brakes could feel better, in two separate emergency situations they stopped me very quickly and I averted a collision. ","Exterior styling, ride and handling.",Better feel on the brake pedal.
4.375,Great Vehicle/Bad Mileage,edge driver ,06/11/2009,,,4,5,5,5,,5,5,2,4,"Great Vehicle.  Looks Great, Drives Great.  No problems so far.  Gas Mileage Stinks!",Styling,Gas Mileage
4.625,Prove me wrong Ford,Back to a Ford ,06/11/2009,,,5,5,5,5,,4,4,4,5,"I said I would never buy a Ford again after many years ago having a bad experience with a Ford Dealer. After two Toyota Camrys(great car) I purchased a Ford Edge 2008 new. It has been a short time only 3 months and I am loving it. I test drove the Lexus Rx350, Nissan Murano and a few others. I agree with many others Ford has a winner. No car is perfect but if it lasts me for serveral years and runs great I will buy another one. Time will tell! I am keeping my fingers crossed!    ",Love the vista roof and I think the inside gets a bad rap. I like it and think it looks sleek.  My interior is the stone leather and light grey. I got in a Honda CRV but I did not want test drive it because the inside looked so cheesy even though it is a good car. I love the 22inch wheels very showy,Gas mileage can be better but I am glad it does take regular. Some of the colors look  aliitle cheap. Ford-- stay with classic colors that look stunning. Trendy colors can make a car look cheap and the car will look dated fast. 
