2.5,What do you want for the price,Joe ,02/16/2009,,,2,3,1,3,,3,3,1,4,"This car is ok if you just want a puddle jumper to get back and forth. I bought this car as a left over 2008 b/c the price was right, but I should have spent more for a better car. The sheet metal body panels ding very easy. This car rattles with every bump, maybe due to the sport suspension. The interior plastic scratches easy, very easy. Plus I am only getting around 20-21 mpg in the city. 25-27 mpg on the highway. I do better with my old awd Subaru. The car is good for parking around town in tight spaces and can hold a large amount of groceries with the rear seats folded down. ","Standard XM (cant find that standard on a $24,000 car), Nice 16in. Alloy wheels, Does not feel small inside.",Standard Cruise control please. How about some material on the door panels. Better fuel mileage. Seat belt holders on the front seats. Body side molding.
4.25,Love this car!,Meghan ,02/10/2009,,,4,5,4,4,,4,4,5,4,"I bought this car in September '08 as a replacement for my previous car, a '96 Saturn SL2.  I test drove this car and the Yaris before ultimately purchasing the Accent.  The Yaris felt narrow while the Accent felt much wider, and has a warranty that can't be beat, for a couple thousand dollars less.  There have been mixed reviews about gas mileage but I am averaging 30mpg with the manual.  This car turns on a dime, and I have gotten TONS of compliments about how cute the car is. (Tango Red - looks much better in real life than on the website).  The shifter isn't as smooth as the Yaris, but all in all I am very satisfied with my purchase.  ","Turning radius, gas mileage, interior is roomy despite small size.  Fun to drive.","Cruise control, engine revs a bit high at 65 - I can only imagine what the gas mileage would be if this thing revved lower!  Also better visibility out of the rear.  It isn't perfect, but it's probably the best bang for your buck in the compact, super cheap category."
4.375,Practical yet Charming,thesouthernaccent ,02/04/2009,,,5,5,5,5,,3,5,4,3,"The Accent drives quite smoothly and in that way, it fits my driving style quite well.  The most pressing complaint I have is its long shift time, which makes the GLS 4-speed automatic feel kind of like a manual.  The suspension is loose too, which makes curves a little wobbly.  However, it returns good real world MPG figures, and is very economical in other categories.  Accent offers plenty of trunk room, passenger area and leg room, rear head rests, height adjustable seat belts, and many other features I probably still haven't discovered.  For what it is, Accent is an excellent car.","The exterior design is cute. It sort of looks like a ""goomba"" from Super Mario Brothers when viewed from the front.  I also like the design of the passenger compartment (the radio is tilted to the driver's point of view) and the smooth ride.","I suggest making the steering wheel a little stiffer, as well as the suspension.  Make the shift timing much quicker, also.  That might compromise the ride quality, but I like a car to be nimble."
4.625,Excellent for the price,dcmisa ,12/12/2008,,,5,5,4,5,,4,4,5,5,"A lot of car for what you pay. The gas mileage is fantastic, I get about 32 to 34 mpg. The interior is great but you can tell that the plastic on the inside doors would scratch easily your not careful. I have the SE model and it comes with the stiffer suspension which really improves handling. Acceleration is very decent too because I have a manual. Don't get an automatic, the manual is cheaper, lighter and a lot more fun to drive. (Beware the trunk is tiny) Also buy the SE coupe as its the only Accent model with ABS which has already helped me out this winter. IMO ABS is pretty important. XM radio is great, even has a input jack for an MP3 player. CD player is also MP3 enabled.","XM Radio, ABS, Gas mileage, Handling, Peppy acceleration.","Cover more of the inside of the doors with cloth material or use a different plastic. Add a ""miles to empty"" feature to trip computer."
4.875,my first new car.....for a long time!!,Beth Ann ,12/04/2008,,,5,5,4,5,,5,5,5,5,"I looked around for a car for almost 6months then I found my Accent! The price the payments and the insurance all fit perfect! I'm 20, live on my own and work full time and go to school! So money is tight but I never stop moving. I needed something cheaper, dependable, and good on gas. My little car is perfect! I can park anywhere and I love my XM. Oh and I had it out in the country for the first time the other day and it handle the gravel roads and bumps great.","My radio and the trunk, it has a enter handle so when your hands are full its still simple to get it shut. also i like the seats, they feel secure but they keep you comfortable. ",I wish they had Cruise control and a back windshield wiper. Other than that its great.
2.25,Not what I expected,mechanic ,11/26/2008,,,4,5,1,1,,1,3,1,2,"The overall configuration of the two door hatchback is nice because it gives you large doors to get in and out of and large items can go in the back without the limitation of a small trunk opening.  My Hyundai only got 21 mpg to start and that declined to 15 mpg!!! For a 1.6 liter engine that is unreal.  The wipers did not work from day one and the dealer took over a month to get the part.  It ran cold always, the transmission way slow to react  and locked up at times.  The engine would tach over 4000 on the interstate in any kind of a grade and gave the feeling of going backwards.  The service department was impossible to deal with at my dealer making the warranty useless. ",The two door hatchback allows for large item to be put in the back the visibility is good too. The car handled very well but hit bumps hard. The standard features on my SE were a good value. (if the car was worth having) the lighted vanity mirrors are well thought out in how they operate.,Gas mileage is poor if you are in a state where you must buy a 10% ethanol blend.  The car is underpowered and the automatic transmission is not responsive with a tendency to lock up when downshifting.  Hyundai could make sure their dealer's service departments are competent and have parts needed
4.875,My 2nd new Accent,ANNIEMONTE ,11/24/2008,,,4,5,5,5,,5,5,5,5,"I am on my 2nd Accent and the first was a 2005 Accent. I have driven this new car over 2 weeks now and I love it.  Compared to my other car, it rides better, drives better and there is less road noise.  I have 6 ft plus sons who has head room to spare.  The color is perfect and with the spoiler in the back quite cute.",The way it handles it is a pleasure to drive.  I will not mind doing some long distance driving in it.,I would like to see a hybrid in this model.
4.125,2008 Hyundai Accent,Dewayne ,11/24/2008,,,4,4,4,5,,4,4,4,4,"Bought my 2008 Accent new.  It now has almost 5000 miles on it, and 90% are high speed highway miles.  I have had no problems with the little car at all. At 75 mph it gets 31 mpg. At 60 mph it gets 41 mpg. At 80 mph its turning 4,000 RPM. It's a 5 speed manual, and I had a cruise control added. Service these guys correctly, and they should run several hundred thousand miles.","Fun to drive, fuel mileage.","In the 5-speed manual transmission, perhaps a 6th gear would be great."
4.75,Very Impressive!,Grumpy ,11/20/2008,,,4,5,5,5,,5,4,5,5,"City driving has been between 26-29 mpg consistently with an automatic. Highway comes in at 33. Visibility, handling and power are excellent for a car of this class. The a/c and heat provides a very comfortable cabin. ",I would say the locking fuel tank lid is my favorite feature. I was drained more than once with my old car. So far no problems.,"Cruise Control! Cruise control! Cruise Control! It's a much needed improvement. I could drive all day if I had one. Next time I'm ready to buy a new car I'll look at the Accent again. If there is no cruise, it's NO SALE! A rear hatch release is much better than using the keys all the time. "
4.75,Best car for the money,Mark S ,11/10/2008,,,5,5,5,5,,4,5,4,5,"I bought this car as a long distance commuter car. It's a GS model with the bottom options package so I could A/C. 5 speed manual. I work a week on and a week off so I drive once a week 135 miles there, and a 135 miles back. I have also driven this car all over Southern Louisiana and Eastern Texas for work as well, and once to Chicago. The comfort level of this car for long trips is good. The seats do hold on to you well in tight turns. The shifter, steering wheel, and pedals are all positioned well. I have gotten as low as 27.5 mpg and as high as 35.5 mpg. My average 31.5 mpg. I researched the Yaris and Aveo as well and this is hands down the best deal.","It is fun to drive. It's not the fastest but you make it happen with the manual. The passenger seat moves far enough forward so I can get my son in his car seat in the back while standing hunched over in the car! I'm 6'1"". 6 airbags and the leg room. Easy oil changes, I've done one of them.",Cruise control. I had to put in my own unit for $140.00 but I didn't mind so much. The inside panels do scratch easily. Pushing down the rear seats cushion after folding the back up is a little tricky until you find the in spot. I wish the fuel mileage was better.
4.625,Good Car,PAULO ,10/24/2008,,,4,5,4,5,,5,4,5,5,After a lot of research I found that the Accent was by far the best vehicle for the money.  I got the SE with all the options including sunroof/body kit/Auto for $14700 including tax and fees.  Just like the one you see in the marketing posters.  If it wasn't for my wife I would have preferred a 5M and saved some more. I wanted a economy car with great looks and some options and the accent covered it. I avg 30mpg with DC traffic. Low 27 high 35.  ,"Looks, Airbags, Warranty, handles the road well, affordable options","Road noise could be better at higher speeds..  include cruise control in the future.  And that's it, otherwise the cost will go through the roof.."
4.875,Thank you Hyundai,Aaron E. ,10/14/2008,,,5,5,5,5,,4,5,5,5,"After 3000 miles I'm still thrilled with this car. I've averaged 34 mpg so far with about 70% of my driving highway miles. I test drove the Yaris, Corolla, and Mazda 3 first, but found this a far better value. I also considered the Fit and Versa. I was most interested in a quiet ride, mpgs, price, and warranty. The Accent hatchback is great for these reasons. I was surprised the others had so much road noise at a higher price. That said, over about 60mph the Accent engine gets more noticeable.  The only things I miss from my old Rav4 are cruise control and a rear windshield wiper in snowy conditions. Traction with snow tires has been great.","Looks, fuel efficiency, road noise (when under 60 mpg), 100K mile warranty, interior appearance.","Rear windshield wiper, flatter folding rear seat to more directly compete with the Honda Fit, a 6th gear, less dated looking clock/air bag status part of the dash console (it's reminiscent  of a Stanley Kubrick film set in the ""future"")."
4.75,Cool Ride,Michael Dellapenta ,09/30/2008,,,5,5,5,5,,4,4,5,5,"The automatic is sluggish, but have all the options. I put in a  stereo with a sub, new front speakers, with a Rockford amp.  ",,
4.875,Best Bang for the Buck,greginrichmond ,09/30/2008,,,5,5,5,5,,5,4,5,5,I was looking at similar cars in the 16-17k range and just happened upon the Accent 2D SE.  Handles like a sports car and sips gas like everyone else wishes their car would.  The 5 speed is a must and the fit and finish of the SE is fantastic.  I'm very happy.,"Handling, gas mileage, build quality, long warranty, sound system...","Cruise control, 6th gear (or a higher 5th) and an audio port.  Maybe a factory turbo?  ;)"
5,Super Little Car at a low price,Glenn ,09/27/2008,,,5,5,5,5,,5,5,5,5,"I have had my new Accent for a few months now.  This is the 4th Hyundai I have owned and Hyundai never lets me down.  The best warranty out there.  The best price for a small car out there.  The 2-door Accent is sporty, peppy, has style and class you cannot find in anything in this price range.  I bought the vehicle with automatic and AC with XM satellite radio and CD for only $11,200 including TT&L.  No one could come close to that price.  Not Aveo, Fit, Yaris, or anything else.  ",The sporty feel and of course the gas economy.,Hyundai has got to do something about the front seat belts.  You have to reach way back to get the belt.  A real pain.
4.75,Great Car,kevperro2 ,09/15/2008,,,5,4,5,5,,4,5,5,5,"I've had it for a month and no regrets.  It is what it is.   A small efficient car that is inexpensive to buy, own and operate.   In addition to that the car is well put together.   It feels tight with everything working the way it should.   Hyundai has really closed the gap with the Japanese.   I am VERY happy with this purchase.","Economy, price and build quality.   I'm a pragmatic person and this is a very functional car with lots of space.  My favorite feature is the build quality. Nothing feels cheap.  Nice car for a very nice price and I'm averaging 36 MPG in mixed city/hwy driving.","Anti-lock brakes should be standard.  A 6-spd transmission with a nice tight shift linkage would be VERY nice.   The door scratches easily.  If Hyundai could deliver those upgrades and keep price <$12,000 it would be the car to beat in this class."
4.625,Great Value,kevperro ,09/11/2008,,,5,5,5,5,,4,4,5,4,"I've only 1000 miles on her but I'm extremely happy with the car.   It isn't a fast car but feels very well built, is fun to drive and is extremely high-value.   I drove all the competition and liked the Accent for both the interior layout, quality feel, conservative design and price.   It was a good $4500 cheaper than the Honda Fit.   Gas mileage was 36 MPG on first tank with mostly highway driving.   In town driving on 2nd tank was down around 31 MPG.   That could improve with break-in, airing up the tires and synthetic oil.   Overall I'm pleased with the purchase.   Hyundai has made incredible strides in quality.   Fit/finish is as good or better than the Japanese cars.    ","Fuel Economy, Price, Warranty, functionality and interior volume for class of car.   I like the way it is built.   Hyundai has made enormous strides in Q/C.   It is solidly built and feels like a much more expensive car.  ",Anti-lock brakes should be standard on all vehicles.  Wish it didn't have the TPS monitoring (required by the govt.) I wish it had a 6th gear in the manual gearbox and shorter throw.   I wish it had better visibility out the rear hatch.  There is no perfect car.
5,  2008 accent big gas saver,iner9 ,09/07/2008,,,5,5,5,5,,5,5,5,5,"I bought this car for commuting in the NYC area I own a 07 silverado its a Nice truck but too much fuel this 08 accent took care of that its a pleasure to drive love the radio XM the air its always ice cold 6 airbags love the warranty had to pay extra for my gm one its a Nice car for the price got mine for 13,500 had pinstripe on it front rear mats cargo net and rear  cargo mat thanks Hyundai keep up the good work got 600 miles on it no problems. ",love the xm radio 6 air bags the am fm mp3 xm radio a gas saver ,I should have bought the one with power Windows that the only thing I have a prob with not a lot too choose from. 
4.875,Kurt 2008 accent GS ,khardiman77 ,09/04/2008,,,5,5,5,5,,4,5,5,5,Have to get use to the small engine but it runs great on the highway it will run with some of the best out there on the highway with know problems at all.,I like the XM radio the sporty look i get alot of looks like wow that car has came along way ,slow acceleration when taking off could improve that other than that i love the car 
4.375,First tank of Gas,Eugene ,08/18/2008,,,5,4,4,4,,4,5,5,4,"Good first impression, 1st fill up was pleasant surprise, 33.6MPG. How above 400 miles logged, Tried a 100 mile trip to see how it rides. All seems good, but the radio has a shorter range than my other vehicles. Have to try all the seat adjustments to see which like better. Good all around vision. Vehicle is hard to seen by others. ","2 tone interior. Adjustable seat, power windows and lock well worth the price. Remote lock is good. ",Add cruise control. Add truck release to remote. Add softer material to driver's arm rest. Position driver's seatbelt latch so you don't have to move the arm rest to latch the seat belt. Bigger mirrors. More chrome. Better radio antenna.
4,Lug at low speed,Joe ,08/15/2008,,,4,4,4,4,,3,4,5,4,"While I do enjoy the fuel efficiency and it is comfortable for 6 ft tall man to drive for extended periods, I found that right after you have to decelerate for traffic and then try to pick up the pace, the transfer lugs sometimes. Go with a manual for stop and go traffic.",,
3.125,what do you expect?,boofus ,08/10/2008,,,3,3,4,5,,2,3,3,2,"Don't misunderstand my title, I love this car.  But it does what it is supposed to well.  If I expected heated mirrors, seats, navigation, chrome wheels, etc. I would have purchased a Cadillac.  I wanted an inexpensive, comfortable commuter that gets good gas mileage.  I love XM radio so that was a surprise and the fact it has curtain airbags is a surprising benefit.  That's extra with the other mfgs.  I must admit you have to be very deliberate when driving it, 0-60 in 13sec. Does not a dragster make!  But once up to speed it does fine.  ",XM radio.  30mpg on average (I drive it kinda hard).,A little more  low end torque would help.
4.625,Fuel Economy  is important,E. Stanfill ,08/09/2008,,,5,5,5,5,,5,4,4,4,"Great Commuter Car. I travel approx 70 miles per day and had been driving a Diesel Pickup that was costing me over $140 per week in fuel, this little car has enough room for a driver 6'3"" tall and I'm only spending around $40 per week I'm saving $400 per month and the car payment w/ insurance are much less than that. It's money in the bank to buy this car and keep the diesel parked.","I like the XM radio feature, but not sure if i will keep it active after the 3 month free trial period, also the Air conditioning will freeze you out of the car",Lumbar seat adjustment would be nice
4.75,Loving It!!!,Coro ,08/08/2008,,,5,5,5,5,,4,5,4,5,"I just bought my new Hyundai Accent last weekend. I replaced a 1999 Accent and this one is light years over the old one! As soon as I sat on the driver's seat, I fell in love with the car. It's my first new car and I couldn't be any happier. My dad owns a Nissan Versa and the Accent has a much more comfortable driver seat, and have to admit the Versa it better in the back seat. Overall, I find the Accent to be a great value and an excellent car for a college student like me. I already took it to a 250 mile trip and was awesome!","Love the stereo with XM, automatic, TPMS and the large screen on the stereo, and of course all the AIRBAGS!!! LOVE THE ARMREST!!! My dad's Versa is a little more expensive and does not have one. The warranty is great!","Would like to have power windows and keyless access, but it's ok, I can live without them..."
4.875,HYUNDAI ACCENT 2-DOOR,Glenn ,07/31/2008,,,5,5,5,5,,5,5,4,5,"I did a ton of searching for the best but cheapest gas saver on the market today.  I considered the fit, matrix, aveo, rio, and serveral others.  By far Hyundai makes the best little gas saver out there.  The warranty cannot be beat.  This is my 4th Hyundai!  I have never been disappointed yet by a Hyundai product or service.  The only thing I can say is that if you buy a Hyundai in the Houston area do not go to best Hyundai as they are total crooks.  I dealt with hub Hyundai in two different areas in the Houston area and they have both been great.  I got this little baby for $11,250 with automatic and air and I just love it.","Sporty appearance of the 2-door, all the added features that are standard, WARRANTY, just the feel of the car.",In order to get the seat belt you must reach way behind the seat.  A simple seat belt retainer on the front seat would eliminate this problem.
4.875,Efficient and FUN!,Beterraba ,07/31/2008,,,5,5,4,5,,5,5,5,5,"We bought our Accent a couple months back, it has been averaging 34mpg with some highway, some city driving.  Radio is great.  My husband is the main driver, and is 6'4"" and fits just fine.  A/C is working great, plenty of space in the car.  We already fit a 40"" tv in the back, and some other furniture (not all together).  We love this car, and are so happy with the purchase!","MPG!!!  easy to use features, fits anywhere, nice radio, 6 standard air bags.",The interior plastic seems to scratch easily.  
4.75,MPG? Big MPG!,litesong ,07/28/2008,,,5,5,5,5,,4,4,5,5,"My wife drove Accent thru a tough commute & winter, getting 33MPG. She let me drive over 1400, 3000, 4000 & 5500 ft. mtn. passes, getting exceptional 41.5, 42.6, & 45.2MPG, 13 MPG over the EPA highway! Think Honda Fit would have a tough time getting such mountain MPG. At 10,000 miles, Accent is 100% w/no squeaks, creaks or rattles.   Although Accent, Yaris & Honda Fit have the same exterior width, Accent has 1 to 3 more inches of shoulder room than Yaris, & a bit more shoulder room than the space efficient Fit.   The rpms at 60MPH are too high at 2900rpms. Needs a 6th gear. Engine & ride are smooth. Short shifter coupled to the clutch is the 2nd smoothest combo I've ever tried.","I love the clutch-shifter combo, recommending this dealer installed option to all manual drivers. Feather foot Accent for excellent MPG. Wherever you can get it, install a High Definition radio, if you have such stations in your area. ","Accent needs to eliminate large blind spots to the rear. The manual tranny needs a 6th gear desperately. Hyundai is coming out with a small, higher MPG turbo engine. Use it in Accent.  "
5,Great little car,NBB CHALESTON WV ,07/24/2008,,,5,5,5,5,,5,5,5,5,"I love this little car. The short shifter and sunroof are great. The car rides really well and is very spirited for a small car. The back seat folds down and  creates a large cargo area. I took my sister and niece on a 150 mile journey. The back seat had plenty of room behind the passenger side seat. The back seat armrest and cup holder was Nice. There was no difference with one or three riders. The car rides smooth and very quite. The seats are comfortable and supportive. The rear window wiper and defroster works, the air conditioner is ice cold. Never had to change the radio station. Nice quite car and fun to drive. Get the manual. Filled up before we went needle hardly moved. Tire pressure system.",Sunroof/stereo. Simple controls and shifter. Quietness and engine note sweet. Antilock brakes/warranty and design are pluses. The look of the exterior and side blinkers and keyless entry/alarm system. Everything power. The light over each visor is Nice. Price. 8 way driver's positions and quality through out.,Not much. I armoral my doors once a month to keep the scratches down. Lots of safety features but would of paid more for stabilty and traction control system.
4.625,I love my SE,Nancy ,07/24/2008,,,4,5,5,5,,5,4,4,5,"I was only window shopping, but fell in love with this car. I never thought I would own a small car again. It's silver with a sunroof, and as everyone says....it's fun to drive. It has every feature I was looking for. I did not shop around for other small cars. This was the one I HAD to have.","The shape of the car is unique. 16"" wheels.","I hate the radio. The replaced the original with a crummy XM that does not have a equilizer. I can't stand the sound and am replacing it myself. I do like the AUX port. I would have liked spped control, running day lights, and the doors  to auto lock after starting the car or putting in gear."
4.375,I love it!,TerraAccent ,07/23/2008,,,4,3,5,5,,4,4,5,5,"I have only had my Accent (Named Terra) for less than a month and I have to say it's doing me well. The acceleration and power isn't as good as my Ford Ranger but the handling is pretty decent and it has great gas mileage. I get about 27mpg, however, I haven't been able to use it for a long drive or that much highway driving yet. The comfort is pretty good and I really don't care about cruise control. My Ranger has it, and I hardly ever use it. Trunk space is decent as I have been able to fit in groceries for 7 people. Fairly sporty look even with the GS version. Breaks well even without slamming it or ABS. As long as you don't abuse it, then it will love you back!","I love how the back seat back rest folds down, while the back seats lift up. It's the best design so far I've seen (Yaris/Fit). Great Warranty! Aux in is sweet! All in all, a really good car for the buck. Best deal for a car out there.",Plastic needs to be better as it scratches easily. No pockets behind the front seats.  Front seatbelts are a bit harder to reach than regular cars. 
4.875,blind spot fix,Big Mike ,07/22/2008,,,5,5,5,5,,5,4,5,5,"I'm 6ft 5in tall and have more room in this car than all others in it's class. The car was purchased for my wife and she loves it. The fix for the blind spot is a small round mirror called a spot mirror which can be picked up at most auto parts stores. The mirror is appox. 2"" in dia. it has an adhesive so you can stick to the corner of your factory mirror. I wouldn't drive a car with out one. ",All around great car. You can't beat the warranty.,Move shift lever (auto.) forward or backward. Factory installed spot mirror.
