2.875,"Front face got ugly, mis-located control",drtrismo ,07/09/2008,,,1,1,4,4,,4,4,2,3,"1. Additional KARR security system (cost $599, it raise your month payment $10 more) was a big/unwanted surprise on financial sign time. I almost walked out.  2.Front face got ugly. 2007s were much prettier. That ugly look made me hesitate till last moment. Accord is accord, Odyssey is odyssey. Real reason accord sell less than Camry is the look. Honda messed up with CR-V and accord, then odyssey. This is not a family look, it is a group-dummy look.  Please leave civic and fit as are.",,"1. Let driver see what is status of dvd display through NAV screen. To control it, I need to stop or tilt down seat. 2 Locate CD/DVD/XM controls where climate's are. Drivers use those controls more often. Specially DVD door is too low to reach and dark. 3. Unlimit this blanks for suggestion     "
5,Great Van,dovinb ,07/05/2008,,,5,5,5,5,,5,5,5,5,"This is my third Honda vehicle and all of them have been exceptional products. I have just 4,000 miles on the van so far and I'm very impressed. It rides and handles very well! I just came back from a 3,200 cross-country trip and I was impressed with the gas mileage. Droving 78-82 MPH for most of the trip, loaded to the gills with luggage, my wife and 2 kids, running the A/C the entire time, I got a consistent solid 23 MPG.  While driving on country back roads around 65-70 MPH, I achieved 27 MPG.  In city driving I get 17-18 MPG.  Everything is functional and well designed. No problems with anything so far. ",Seats are very comfortable in all positions. Drives well and turning radius is like my Accord.  I test drove everything else out there and for me and my family this clearly won everyone's vote.,Back-up sensors should be standard!  You simply can't judge the distance or clearly see what's behind you. I had the local Honda dealer install a 2 sensor aftermarket kit for just under $300 and it works great. No more guessing how close you are or hitting something you never saw in the first place.
5,Excellent minivan!,banana face ,07/04/2008,,,5,5,5,5,,5,5,5,5,"I purchased this 2008 Honda Odyssey Touring in February and it's the best van I ever bought.  It has a really powerful engine which provides a forceful and strong pull. I have have a little over 20,000 miles and there is no problems. It feels rock solid and expensive when compared to the cheap Toyota Sienna. I averaged 30.6 mpg on a 2000 mile highway road trip. Much better then competition like Toyota or Nissan. Go Honda Products! ","Wonderful engine (which is really  smooth, quiet, fuel efficient),roomy, navigation, handling, and a really quiet ride ",Make a hybrid option!
4.375,Finally got it,SPDFan ,07/03/2008,,,5,4,5,4,,4,5,4,4,Just picked up the van Touring W/O PAX today after months of research. Odyssey was the top choice hands down. We also got a great deal ($6000 off MSRP plus 2.9% APR special). Very pleased with the van. It drives smooth like a car and it drives much smaller than it is. The power and agility are remarkable for a vehicle this size (I owned an Infiniti G35 coupe and M35 the Odyssey drives like a nice sedan). The interior is so comfortable. The build quality and material are top notch. The flexibility of the seats is fantastic. It has tons of cargo room or it can seat 8 people in style and comfort. There are so many features on the touring model. Almost too many to learn. ,Touch screen Navi. Blue tooth. voice command. DVD player. Tri zone climate control. Power doors and hatch. Smooth engine. XM radio. Trip commuter. Tire pressure monitor. Parking sensors,The back up camera is not as good as Infinite. The blue tooth is not as user friendly as Infinite. NEED HID head lights like Toyota. Wood trim. Almost too many gadgets to learn. The second row center seat can not be stored into the car. Better surround sound system.
2.5,Disappointing can find better,mickey ,06/25/2008,,,4,1,2,3,,4,3,2,1,"This is truly the most disappointing car that I have ever owned. First we got the sage green and the bumpers do not match the rest of the car, they are a totally different shade and color. Honda states that this is normal due to the type of material. I have never seen this before. Called several times on this matter with the same explanation. No other cars in my area seem to have this problem. Several makes and colors. The bumpers also keep falling off been to dealer 4 times. This car is very noisy inside while driving, cannot hold a conversation at normal voice. This is also the same for my friends 05 Ody with different tires. The car also is getting lots of rattles. MPG poor 15/1 6city 24 hwy",Safety is good in this car and an enjoy to drive on road trips but the noise level is bad,"Better sound insulation, better mpg, lighting is going out, both headlights and interior lights are going. Better quality control. Honda has also lost its customer service. "
4.5,First impressions,Off A Cough ,06/22/2008,,,4,5,5,5,,5,5,3,4,"We lost our 2007 Caravan Special Edition to another driver who didn't understand the word ""stop"".  While I've always felt Chrysler wins hands-down in the innovation department, I was leery of purchasing a 2008 model due to this being the first year of a major overhaul. The 2008 also lost some aesthetic points that it once had over the Ody (IMHO).  The Ody wins hands-down in interior quality. The leather is nicer, the seats are more comfortable, and the fit and finish is better (but still not perfect).  The Ody is still breaking in, so too early to tell on mileage. Acceleration is smooth.  The vehicle is larger inside and out compared to Chrysler, so watch your parking/garage issues.","NAV is a nice toy. The screen's tie-in to the radio and DVD player is very nice. Handling is much nicer than Caravan, although ride suffers a bit. ",USB or even 802.11 connectivity for NAV to sync with Outlook. Add diagnostics and other info to NAV screen. Fog lights and power tailgate should be standard with this trim - an extra $8k for the Touring model is asinine. Needs more 12v power outlets. A hybrid version would be the winner.
4.875,From Accord to Odyssey,Andrew.M.Tillcock ,06/22/2008,,,5,5,5,5,,5,5,4,5,"Just traded in my 2008 Honda Accord EXl 4cyl . Needed more room and wanted dvd and nav so i went for the big enchilada. Boy am i happy with this van,It's everything i had heard and read and more. The leather is of high grade and the seats are so comfortable.Having DVD made our trip to Asheville NC quiet with two teenagers and a 6 year old in the back. And without nav i would not have attempted as much of the exploring i did in Asheville.I read some of the complaints on here about being given strange routes but it does give options to route by easiest,direct,hwy . I found the nav very user friendly and powerful. The new Odyssey is a   technological wonder and why Honda rules minivan market!!","Comfortable leather seats,Great and easy to use nav with voice function. Rear DVD (A life saver on trips) Handles like a much smaller vehicle. Versatility. Great looks and Great gas mileage, I average in mix of hwy/cty/25 mpg  ","More powerful stereo for EX-l ,standard fog lights for EX-l"
5,The Best Minivan for its Class,yodpad ,06/19/2008,,,5,5,5,5,,5,5,5,5,So far since I purchased this car has been terrific. Drive very smooth.  I have put 3000 miles on the already. Has a great acceleration.  and Good on gas mileage compare to other van.,,I would like to see Honda be a little more generous like Toyota.  At least make the side mirror and the stripe the same color as the body not black.  I will make it much much more pleasing to the eyes.
3.75,Anyone else with transmission issues?,stressedoutdad ,06/18/2008,,,4,5,4,3,,4,5,4,1,"After several years of owning Toyotas, )'95 Camry, '01 4Runner, '04 Matrix), we traded in the Matrix after we realized we couldn't get three car seats in the Matrix.  We found a certified '02 Odyssey w/ very low miles. (my wife cried, knowing that she was driving a damned van).  Other than being drab gray, it's been a good vehicle.  Having a bunch of work to do on my 4runner, I traded it in, and we leased a new '08 Odyssey EX.  We've had it for 4 months, and have had it in the shop three times for a transmission issue: it CLUNKS, then the ""D"" light starts blinking, and the van continues to shift rough.  To be fair, the dealership has given a rental (this one a Sienna! I might trade)","powerful motor, smooth ride, stain resistant cloth, split rear seat","Attn Honda dealership: have a service guy on call.  Yes, ""it is a Honda"", and Honda's reputation for reliability is the reason I bought your van instead of a Caravan.  But for some reason, this one likes to act up on Saturday and Sunday, when I'm out driving with my family.  Back up your car!!!"
4.375,Respect the van,oddity ,06/18/2008,,,4,5,4,4,,4,5,4,5,"This van is light years ahead of my 2005 Dodge GC in terms of styling, refinement, driving experience, safety, and comfort. It is also light years ahead in terms of monthly payment, but you get what you pay for. My family of six loves it.  This vehicle drives wonderfully. Steering is precise and overall handling and maneuverability is fantastic. Backup rear view camera is great once you learn to trust it - much easier to parallel park.  I bought this van for many reasons, but Honda's reputation for build quality sealed the deal. I hope it holds up to its reputation. ","Handling, Safety, DVD, Stereo with XM sounds great, Moonroof, sliding door windows that roll down, integrated sunshades. Keyless remote feature that allows you to roll all the windows down - Great for ventilating the car in summer before everyone climbs in.","17"" wheels, automatic headlights on EX models"
4.75,"Great van, Chrysler gas mileage",Redlinez ,06/11/2008,,,5,5,5,5,,5,5,3,5,"We've had the van a few months now, love driving it and the kids love it.  Great seats, stereo, handling, and power.  The interior plastic scratches easily, the gas mileage with stop and go has stayed at 17.5-18.5 period.  My Town and Country's averaged 19.  That is about the only gripe I have.  Love the ipod plug in.","Seats, room, ride quality much better than our 04 Odyssey","Figure out how to get it to not spark knock on 87 octane, better mpg.  "
3.125,Ody Paint Job,jlsxpressllc ,06/08/2008,,,4,4,2,3,,3,3,3,3,Vehicle seems to drive well except for a slight pull to the right. Transmission seems to 'hunt' when driving slowly around town. Does much better when given a little gas and highway speeds.,Interior design,"PAINT JOB. We noticed a 'cloud' in the paint when the sun is out and looking at a specific angel. Called Honda, they basically said they would possibly repaint if it's determined it's a defect. After reading the forum on here about paint issues, it's come to our attention there's a problem with paint!"
3.75,Me and my wife's ody 08,me and my wife's ody ,06/06/2008,,,4,4,3,4,,4,4,3,4,The transmissions seems to 'seek' when driving around town. It seems to like quicker takes offs rather than driving like granny would. The steering wheel shakes when turning around in parking lot speeds. Say turning a corner and the wheel begins to unravel.  Like the 4wheel independent suspension. AC is not up to par when in slow traffic. Much better when going down the road. ,"My wife and I really like the center tray and layout of the dash. Dis-like the lighter portion of the tachometer area. Have to turn it up during the day and at night it's too bright, so we have to turn it down.",Better AC in traffic. Better paint job (we found a 'white cloud' in the right front pillar area. Found dirt under the paint in the tail gate area.
4.625,First Mini Van,DP ,05/16/2008,,,5,5,4,5,,4,5,4,5,"I think this van is great.  I always told myself that I would never get a minivan, but with kids it's a must.  I think its the best looking minivan on the market, both inside and out.  So far I haven't had any of the problems that some have complained about like excessive road noise or squeaking.  This van has tons of room and the backup camera is awesome.  It drives just like my accord which makes driving it much easier for my wife. Out of all the vans I researched, this had the highest rating and now I see why.",All the storage. All the seat configurations. Smooth ride & easy to drive. Back-up camera. The style. ,Homelink is a bit difficult to get working. 
4.5,Not what I hoped for UPDATE,Hammock246 ,05/15/2008,,,5,5,1,5,,5,5,5,5,"One more trip Illinois to FL and back on business and have to say I don't think this van will be with me for a year.  Passenger side door sounds like it's falling off on bumpy roads.  Creaks & groans from front end all the time.  Rear hatch does not always respond to keyless input to open.  Now 6400 miles and will need 1st service soon.  Brought in to dealer at 3500 miles but they said not to service until 15% on meter.  Told them about the rattles and the guy said ""well, it's a van.""  Yeah, but at $40,450 I hoped for better.","Decent gas mileage.  Good GPS.  Comfortable to drive and ride in.  Roomy.  Good layout on instruments, etc.","Much better build quality on body.  If you like rattles, this is the van for you.  Too bad too because it's a nice vehicle other then that."
4.625,Engine or Transmission,Thai Vuong ,05/13/2008,,,4,5,5,5,,5,5,4,4,"I had this vehicle for two weeks, the bargain price $7,000 below MSRP. I agree with other's reviews on the features. However, Up-shift and down-shift in the city (30-40 mph) is rough, test drive your vehicle on rush hour you can feel car slows down quickly without step on the brake, or slowly accelerate on gas pedal.","3-Zone temperature control,Automatic sliding doors, and slide over second row seat. ","AWD option would have been nice, The passenger seat should be electronic sliding seat."
4.875,"3rd Honda, 1st minivan",chars79 ,05/13/2008,,,5,5,5,5,,5,5,4,5,"We had debated a mini van for a long time.  We purchased a 2006 Civic Hybrid prior to starting foster care...that didn't last long.  Shopped around and looked at mini vans from Honda, Toyota, and Kia as well as numerous SUVs and crossovers.  Decided on a Used Honda Pilot that was a great vehicle but had some odd problems leading up to a bad climate control system that would have been a pain to fix so the dealership returned our money and we were on the verge of just going up to an 2008 Pilot when we stumbled back into the Odyssey on the showroom.  Needless to say, we took it out again and were sold.  Not sure why I waited so long!  Great ride, lots of room, and great style...","Auto doors, large cargo area in the back, comfortable leather seats, and back up camera",Not sure why the stereo doesn't have speed adjusting volume...the civic did.  
4.875,Best Van Available,ROB136451 ,05/08/2008,,,5,5,5,5,,5,5,4,5,"I love the Odyssey, it's by far the best van currently available on the market. The RES is great, the gas mileage is good. Odyssey has roomy interior of high quality and excellent laid out. The standard safety features including the rear camera are the best available. A great ride, over all. ","RES, rear camera, interior room and good value. ",slight road noise and a noticeable squeak in the front suspension when going over a speed bump. 
4.875,Our First Van,joesp8 ,05/03/2008,,,5,5,5,5,,5,5,4,5,"We love our first new van EXL with DVD. The interior was very well designed, very spacious, and very comfortable and room. Not so crazy about the gas mileage but still better than our old SUV. ","Favorite features: power doors, entertainment and sound system, DRL, storage seat, headlights, and moonroof.",I had some difficulty programming the universal garage door opener.
5,Odyssey #3,Tags ,04/29/2008,,,5,5,5,5,,5,5,5,5,"We just took delivery of our 3rd Odyssey and couldn't be happier. The ride is carlike, the power wonderful. We had gotten 27 mpg highway is our last Odyssey and so far this one looks to be no different. Was looking at the Pilot and as nice as it was the Odyssey was just a better value. ","It now comes with XM radio installed, our last one was XM ready but needed a costly option to connect, a rear camera that projects in the mirror and the passenger seat is now also power. ",Wish the hatch window opened and a power hatch was offered.
4.625,Not what I hoped for,Hammock246 ,04/28/2008,,,5,5,2,5,,5,5,5,5,"Bought in FL and a trip to Illinois has this thing squeaking in the front end like it's falling apart on semi rough roads (most of Illinois).  Very hard ride on economy minded tires.  Handles very good and comfortable to drive on our 1,200 mile jaunt here.  Gas mileage OK at first but now very good at 26.2 mpg for the trip average.  A bit noisier then Toyota or Nissan vans I've had but acceptable.  Everything works as advertised if one can read the manual.  Lots of toys on this thing.  Lots of room and main thing is wife likes it.  Easy to get in and out of.",Room is great.  Great navigation system.  Very easy to drive.  Rides and handles OK except on rough roads and then it's rather poor.  Looks good for a van.,"Build quality suspect.  Had 04 Nissan Quest that was rattle free for 70 thousand miles.  Groan in steering early mornings and just 3,100 miles on this thing.  Could be a lot quieter on the road with better engineering, more insulation and better tires which are very hard. MICHELIN, BUT NOT PAX.  "
5,2008 EX-L w. DVD,Johnohio ,04/25/2008,,,5,5,5,5,,5,5,5,5,"Purchased it at a reasonable price ($2400 below invoice found in Yahoo and Edmunds, primarily because of the $2300 incentive Honda provided to dealers). Traded in my 2001 Civic. I have no doubt that this is a fabulous vehicle. Drives like Camry, even my wife who scared of driving any vehicle bigger than her Camry can handle it easily. Most amazing is the gas mileage. Before 1000 miles, it is 19.75 miles/gallon (50% highway + 50% local); After 1000 miles, it is improved to 21.75 and then 22.3.  ","Handling, smooth driving, gas mileage, plenty of room",Road noise slightly bigger; DVD is a cheap piece with low resolution. But no major compliant.
4.875,Great minivan for a family,Shero ,04/24/2008,,,5,5,5,5,,5,5,4,5,"This is our first minivan, and we absolutely love it!!  We looked at every Crossover on the market, Sienna and Quest, and this was by far the best value for the money.  Seats 8 comfortably (3 kids in the back, 1 in a car seat) and 3 adults in the 2nd row.  It was a little tight for the adults, but not uncomfortable.  Mileage isn't bad for the category & better than SUVs.  The rear seats easily fold flat, although removing the 2nd row seats takes a little getting used to.  We love the built in window shades for the kids!!","Seats 8, Wireless headsets for DVD player, lots of storage, separate A/C temps for passenger, driver & rear.  ","All wheel drive as an option, making 2nd row seats a little easier to remove."
4.75,Best Minivan in its Class,KIDDADA ,04/22/2008,,,5,5,5,5,,5,5,3,5,"I test drove all the minivans and Honda Odyssey was the best in its class.  It drives like an Accord and handles pretty good.  My wife loves this car and she cant wait to go out of town.  The dealer gave me $7000 off the MSRP which was a bargain.  Theyre giving out good deals and its affordable than a big SUV.  You want a reliable car for a big family, Honda Odyssey is the van to buy,",Automatic sliding doors,The passenger seat should be electronic sliding seat.  
4.75,2007 EX-L,Airbum ,04/15/2008,,,5,5,4,5,,5,5,4,5,Great space and good highway fuel mileage.    Handles well for a large van/car.  Don't really like the 6 disc cd changer and would like a factory ipod adapter.  Overall this van won my spouse over from the Pilot with flying colors,"Handling, power sliding doors","Reduce the road noise,  add a power tail gate as a option on the EX-L,"
3.875,Nice Vehicle,Nice Vehicle ,04/15/2008,,,4,4,4,4,,4,4,3,4,"Test drove Acadia/Enclave/Outlook, Toyota Sienna, Chrysler Aspen and Chevy Tahoe. All were very nice and gas mileage better on Sienna. Deciding factor was better rebate. Family loves it and that was bottom line.","Handling, roominess, bluetooth, power rear door.","Power adjustable pedals, pop out rear windows (don't know why they got rid of them), roll down rear window on hatch (great for dog lovers on hot days), 6 or 7 speed automatic to improve gas mileage (getting 13.7 around town), better tires (quieter Michelines), LAMINATE WINDOWS like Enclave and Aspen."
5,Best van ever!,Tiffany ,04/11/2008,,,5,5,5,5,,5,5,5,5,"I love the Odyssey, it's by far the best van in the market which it's proven. I love the DVD system, and I get great gas mileage. I had a great experience, I drove both Odyssey and Sienna before making my decision and I am glad I went with the Odyssey, it's interior is higher quality and better laid out. I like the standard safety and luxury features.  A great ride, over all I am very very happy!","DVD, Gas mileage, and comfort.",None
4.75,"""08 Honda Odyssey",atkins92 ,04/04/2008,,,5,5,5,5,,5,5,3,5,Very pleased with this vehicle. It performs excellent on the highway and in the city with nimble handling for a large van and excellent acceleration when needed. The seats in every row are very comfortable and the front heated ones are nice for the cold Canadian days in the winter/spring/fall.,"Where to start! Navigation is a ""don't know how we lived without it"" feature and the bluetooth and voice activated controls are very cool. Power everything from the dual sliding doors to the rear tailgate are great features when you have a handful and 3 kids to get in and out of the vehicle. ",The only thing I can think of is better fuel mileage but I guess you can't have everything!!
4.875,Great Minivan,shoop05 ,04/03/2008,,,5,5,5,5,,5,5,4,5,"Honda makes a great minivan that is powerful, comfortable, stylish and reliable.  This vehicle has a very tight fit and finish, very low road noise and great creature comforts.  The interior of the van has all the features that make it feel like a luxury car and the exterior is sharp looking.  Overall the van outperforms it competition.","Rear view camera, moon roof, XM radio, 6 disc CD player, heated leather seats, 8 passenger seating.",Fuel efficiency could be better.
3.75,Where is the Honda Quality?,fiend_bear ,03/31/2008,,,4,4,3,3,,5,3,4,4,"We thought the car was great when test driving, but after putting 1,500 miles on it, we are already looking to replace this Odyssey.  Too many problems have surfaced and leave us wondering where is the Honda quality?  Already serviced for steering spline noise issue and wheel alignment (neither issue corrected completely).  Engine knock/ping at low rpms (premium gas does not help), front window rattle, mysterious transmission noise when shifting into drive, and one of the most uncomfortable driver's seats for long trips.  This replaced a 2000 Dodge Caravan with perfect initial build quality, but unfortunately recently totaled by another car.  ","Drives like a sedan with solid road feel, very little body roll, and great acceleration.  Very roomy.  Fold down rear seats are easy to operate.  Top ranked safety features.  Good stereo system.  Excellent interior fit and finish.",Initial build quality!  More comfortable driver's seat.  AWD option would have been nice.  Sienna here we come.  Just glad that this was a cash purchase and we can sell or trade-in anytime.
5,'08 better than '05 with some exceptions,briann ,03/31/2008,,,5,5,5,5,,5,5,5,5,"Just turned my '05 ody in for the '08 EX-L RES.  Overall, some nice improvements (back up monitor, tighter fit/finish on dash, minor exterior tweaks).  The big let-down is that the 2nd row jump seat no longer stows in the floor compartment.  BAD BAD move Honda:   that was incredibly useful;  now, you have to either leave it in (hard to access the third row), or leave it at home or in the back compartment.  Whose bright idea was that at Honda??    Still a great van.",,
4.5,Sweet Ride,Walpole ,03/29/2008,,,5,5,5,5,,5,5,1,5,"I picked up this bad boy for $22,595 after holding them to their teaser ad.  I simply would not let them bait and switch me.  The deal got done, and I am very happy.  I have only had the van for two weeks but the gas mileage seems rough. 13 miles/gallon. Just like a recent review, the van does not seem to want to coast.  It seems like it wants to brake.  It may be part of the VSA system...  Anyway the rest of the car is the best car ever!!!!",Everything.  The WOW factor. Being cool dropping the kids off at school.,Fuel economy. Ability to coast.
4.5,Happy but mpg terrible,Wisconsin Owner ,03/19/2008,,,5,5,5,5,,5,5,1,5,"So far we've put 2K miles on the van and are very happy with our purchase.  The van interior is fantastic with very nice leather and dvd system.  It drives more like a sports car/van rather than a floaty minivan.  Overall we are very happy except for the fact that it has been getting between 12 and 14 mpg in the city and 17 on the highway.  Both my wife and I drive very conservatively and even more so with the gas mileage.  Mpg has improved some but we're no way close to the 25 hwy.  If it does not improve we will be taking it in for service.  Also, transmission does not allow van to coast and slows speed at 40 mph and under.  ","DVD system fun, comfortable seats, ride is very nice.","Gas mileage is horrible, transmission seams to be slowing vehicle from coasting, floor mats are cheap."
