4.375,Fun Yet Functional,Lang ,06/06/2008,,,4,5,4,4,,5,4,4,5,"I've had this car for about 18 months. I purchased it as a bit of a compromise. It has many nice features, had some zip, yet also had front wheel drive for northern winters. Turns out, not much of a compromise. Driving this car never fails to put a smile on my face. When you step on the gas, you're gone! It is by no means a high performance sports car. You can quibble about numb steering and other pretentious car guy stuff, but it has great muscle and a fun factor. The average guy, of which I am one, will have a great time with this car. A real plus, especially given $4+ gas, has been the mileage. I get 22 around town and more than 26 on a recent 1200 road trip.","5.3L V8 has great punch, the ability to shut down 4 cylinders when cruising for improved mpg, the rumble!, red jewel coat paint, Bose system, never be without OnStar!","Seats could provide more support, onboard navigation system, express up and down windows, memory seat settings"
4.625,Great for the money ,bob ,06/04/2008,,,5,5,5,5,,4,5,4,4,Impala ls under $20k. You can't beat this car import or domestic 4dr sedan this is it. The interior is basic and that is what I wanted. Trunk is huge good gas mileage ,Seating ,More holders for stuff inside 
4.5,Can't beat it for the money,Miss_X2b ,06/03/2008,,,5,4,5,4,,5,5,4,4,"You can't beat this car for the money. Roomy, comfortable with a rather nice interior.  The ride is smooth, car handles potholes very well.  The car does tend to roll a bit in turns but I found that simply lowering my seat down reduces the effect.",Very comfortable interior. Plenty of leg room for a tall person.,ABS should be standard equipment. Transmission shift intervals can be a bit too long.  
4.875,Great cart so far,Bret ,05/30/2008,,,5,5,5,5,,5,5,4,5,"So far no problems, car runs great. Getting about 25 MPG average which is a lot better than the truck I traded in. ","Fuel mileage, ride, XM radio",Place to put my garage door opener.
4.625,Better than stated mpg,noyego ,05/21/2008,,,5,4,4,5,,5,4,5,5,"Like many of us, wanted a car with better gas mileage, but didn't want a subcompact. Bought car as a program car, saved a ton of money. Good interior. Ride a little bumpy, but might be because was used to driving a towncar. Excellent gas mileage for the size of the car.. I am getting 25 city and a little over 34 mpg on the highway. Good leg room. Has an excellent information center, tells you when to change oil, tire pressures, instant miles per gallon, avg mpg, outside temp, compass, and a lot more usefull info. All controls on steering wheel, radio, air, cruise, etc. ","MPG, smooth ride on freeway, good leg room, information center, interior look, dual temp control. Center gear shift. Power of engine. Most of all, good size car with good gas mileage. Pretty good trunk space.","Outside, looks too plain. Needs body moulding on all Impalas. Better suspension. Better warranty, some car companies have 100k, one has lifetime on the power train. Radio knob in wrong place. Center console in back seat.  "
5,"Impressed with ""The General""",Jeff49783 ,05/19/2008,,,5,5,5,5,,5,5,5,5,"I am pleasantly surprised with this fleet vehicle. The efficiency, space, practicality, and good features really work well. An all-day interstate blitz immediately after delivery was a real pleasure. The visibility to the front is great and satisfactory elsewhere. I enjoyed operating the speed control from the steering wheel, and the speedometer is dead accurate according to my GPS. At great velocity, engine and wind noise are nearly non- existent and mileage is respectable. There are door pockets in each door, a glove box, console storage, a map pocket in the passenger seat, and a cargo net in the trunk.  This vehicle is a great value.","Base stereo - I'm hearing things in the same old songs that I have not heard in years. Driver  information display - mileage, tire pressure monitor, etc.  Large trunk - swallows my gear out of sight from crooks. Appearance - so plain it is almost stealth.  Good warranty.","Seats could use more lateral support, even though this is no sports sedan. A power outlet in the trunk would be useful. A keyed trunk access and switch to secure the dash trunk release would also be appreciated."
4.125,"Hey, y'all wanted to see a review right?",sandrock ,05/18/2008,,,4,4,4,4,,5,4,4,4,"Picked up the '08 SS a few days ago, and I have to say it's pretty good. Everyone mentions the torque steer, and everyone that has mentioned it is right. This car will surprise you if you are not careful. The seats are firm, but do not ""hug"" you like a sport seat should, but then again, this car is meant to cruise, not for SCCA solo-D. Highway ride is excellent. AFM system turns on and off real stealth-like...and the fuel economy numbers for highway are stellar for this type of engine.","XM, OnStar, steering wheel controls, highway ride and power to spare.","When you rotate the tires, the air pressure sensors have to be recalibrated, and it isn't very user friendly to do that. That is really the only issue I have with the car."
3.75,SS Impala 2008,Doug ,05/17/2008,,,4,5,4,4,,4,4,2,3,"The SS is a good overall car. I traded in an Audi A4 3.2. There is no comparison the Audi wins hands down. The SS is a big roomy car and fun to drive, it has power and looks great but the handling + torque steer makes it an effort to drive other then in a straight line. The car is a gas guzzler unless you drive it slow.When you drive it aggressivly be prepared to get 12 mpg. If you set the cruise control at 62 mph on the highway you will get 19mpg. Driving easy around town your best gas mileage wil be 15 mpg. I do like the car for the money. People stop to look at this car and they really like the sound, most can't beleive it's a Chevy. If the new model is RWD I will buy another one.","XM radio, OnStar, V8 motor and overall looks",Lower the suspension and improve the gas mileage. 
4.375,Great car...few minor issues,Daddy to my kids ,05/17/2008,,,5,5,4,4,,4,5,4,4,"Love the car.  Had it for 800 miles now.  Avg.  mileage (65% city 35% highway) has been 28.7 mpg, better than advertised. The car is quiet and comfortable, although some wind noise around front doors is present on highway. I wanted seating for 6, although the front middle seat is not usable for much more than short hops. Trunk is huge, easily swallowing our stroller, other bags, groceries and more. I have a ""knocking"" noise when going over certain bumps similar to a loose tie rod.  Will have dealer look at it.  Brakes pulsed when new, dealer turned the rotors stating  rust needed to be removed as the car had been on their lot a while. Still, I'm glad I got the car.","Comfortable seats, large rear headrests, flip-n-fold rear seats, XM radio, flex fuel capability.",Don't like the way the doors slam easily. They lack the feel of many other vehicles when closing.  Need more cupholders front and rear.
2.125,should have bought a hyundai......,bob ,05/13/2008,,,2,2,1,3,,3,2,3,1,"Bought this car hoping that it would be enjoyable to drive, however front end vibration, limited cupholders, wind noise around windows, can't put a map in drivers side door pocket, no glove box light, no vanity mirror lights, lousy radio. no locking gas door. "," XM radio is the best part about the car, gas mileage is decent, side air bags.feel safe driving car.", All of the above.
4.625,50th Anniversary,Sandman ,05/06/2008,,,5,5,5,5,,4,5,4,4,"I got rid of my expensive to repair VW GTI and bought the 50th anniversary model for 08. I love this car as it is a real hwy crusier unlike the GTI. I realy like the idea of OnStar for emergencies and road service. XM radio I don't think I will continue at the price they want. I thought there were not going to be any commericals, but there are many. Mileage so far has been only 23 mpg, but it still needs to be broken in more. I would really like a conv. Impala or at least a red interior like I had in my first 1959 Impala hardtop.","Two tone seats, 3 DC outlets, OnStar, Xm radio, huge trunk and flip & fold rear seats, 18"" wheels. Mileage is still on the low side where the GTI got 24 with a lead foot.","Parking brake pedal gets in the way getting out of the car.  Could use a handle inside the trunk for holding on to when closing the trunk lid. Would difinitely like a 110 volt power outlet, the HHR has three. I need to use an inverter that cost $30.  Have sunroof glass retract inside the roof."
5,Mothers Red Jewel,jsifferman ,05/05/2008,,,5,5,5,5,,5,5,5,5,"Smooth and quiet. City 19 mpg, Suburban 23 mpg, Cruise 65 on the interstate 30.5 mpg. All the goodies except the skylight.  18 inch wheels. No wind noises, smooth shifts, Wanted to buy an American made Malibu, but couldn't get under the steering wheel. Canadian Impala was next best offer. Lots of room inside. Power and heated driver and passenger seats.  Remote start, OnStar and XM.  2 tone leather seats. For a 50th anniversity car, the trim could have been upgraded, but for a Chevrolet it rocks. ",Smooth. Let's hope it stays that way,No coin holder. No place for cell phone. No place of garage door opener. Would like a mud flap option. The back of the trunk picks up excessive dirt and dust on dirt roads.
4.875,Very solid!,rock ,04/22/2008,,,4,5,5,5,,5,5,5,5,Let me tell you this is a great car. Love the looks of it and rides excellent. The 3.9 v6 is very powerful and has no problem going fast but very long spaced gears. The seats are very comfortable and nice looking. The inside is a little plain but I like it like that. I have the front bench seat with the column shifter and I love the bench seat because you can fit more people. Column shifter is easier to use because it sits next to my hand. Averaging 25 mpg excellent.,"Nice imperial blue, masculine looking, powerful engine, bench seat with column shifter, great gas mileage","Long spaced gears, the inside could be more interesting"
5,Big Car on a Mid-Size Budget,Michael & Kathy ,04/22/2008,,,5,5,5,5,,5,5,5,5,"We commute short distances but like to take multi-state road trips. The Impala fits in the garage and budget but flies down the highway without any strain. XM radio and OnStar's navigation are great over the road tools. Finding an E-85 station is particularly cool using OnStar. The hidden storage under the back seat is nice for the lap top rather than in the trunk.  All the trip computer readouts are nice when the scenery gets boring.  We also considered the new Malibu but tiny things like the 2-zone A/C and power passenger seat ruled the day. A couple of small items would have been nice, memory settings for the seat/mirrors and a wider choice of wheels. Thank goodness for TireRack!","Remote start, heated seats, XM, flip and fold rear seat, tire pressure monitors. E-mailed by OnStar! Great mpg  great ride, quiet. Huge trunk","Memory setting for seats/mirrors, choice of the LTZ style wheels without buying the 3.9L motor (or nicer Accessory wheels that are not chromed)"
2.25,This Is A Real Bow-Wow,Fed Up ,04/18/2008,,,3,3,2,2,,2,3,2,1,"For the upper end of Impalas, this has been a real joke.  The rattles and windshield leaks make you feel like you're watching an outdoor concert of bad music.  Hit a pothole and OnStar wants to know if everyone in the car is OK--even though they think I'm about 80 miles from where I actually was . . . and they called back three times to verify that nothing was wrong.  I listened to them more than the radio.  Where do I find the fuse to kill that beast?",Not much,"I'd rather have it without leaks, rattles, and most importantly, OnStar!!!"
4.625,It's fun!,lambinator ,04/17/2008,,,4,4,5,5,,5,5,4,5,"I have had my SS for about a month now. I traded in my 04 Subaru WRX with many mods. It was tough to get use to at first but the power that the SS has along with the comfort of the ride is taking care of all that. I plan on doing some things to make my family sedan a real speedster. Overall, it's comfortable to drive, it's got lots of power and speed when you need it. The torque steer is something to get used to. You can also gain a little speed by taking the traction control off. I am happy with it and growing happier. I almost bought the G8 but I like the build of the Impalas. Go get it, you won't be disappointed.","XM radio, sunroof and torque/power, ride/comfort. Feels well built, runs strong.","Need to make these vehicles rear wheel drive. Also, as everyone says, it does have a huge blind spot when looking out left or right."
4.375,Pretty good car,Lon ,04/17/2008,,,5,4,5,5,,5,5,1,5,This is the sixth Impala we've purchased in six years. Everything works great except that we seem to be able only get around 23.5 mpg on the highway with the 3.9 engine. Past Impala's had the 3.8 engine and were much more fuel efficent. ,"The car has great seats and the ride and handling are great, the stereo is the best I've heard from the factory in any car. It has a large trunk that fits are needs for all the traveling we do",Better rearview vision and larger side mirrors
4.5,"It's not a Corvette, but",Jim ,04/16/2008,,,4,4,5,5,,5,5,4,4,"I've driven the SS for 4 months now and I'm actually impressed. Being a Corvette owner as well, not many cars excite me. The Impala is actually not a total bore to drive. The shifts are crisp and at the right rpm. Actually encourages you to show some muscle to 80%+ cars on the road that this vehicle will blow away. When it comes to hauling children or family this is the car.  Something you cannot do in a Corvette. The only thing that worries me a little bit is the active fuel management which shuts down to a 4cyl when all 8 aren't needed. Can't get Cadillacs 8-6-4 out of my head","Turn by turn navigation, power","No power adjustable pedals or memory seats available.  Torque steer still not quite up to par, but getting better."
5,Chevrolet Luxury in Sport Clothing,R W Moore ,04/10/2008,,,5,5,5,5,,5,5,5,5,"Having traded in my 2003 Monte Carlo SS for this Impala SS was a stretch. 2 doors for 4 doors?! Well, am ever pleased! This car moves, and be ready for the torque steer! Wish it was RWD though. Hate the FWD. But luxury in sport clothing! Looks cool, turns heads, and moves! Not as fast as my 2005 SSR, but carries 5 people! ",V8 power and good gas mileage,Rear wheel drive!
4.375,A good choice!,Shree K ,04/09/2008,,,4,4,4,5,,4,5,5,4,"I decided to opt for the Impala over the Ford Fusion and the Nissan Altima. The car has close to 10,000 miles on it and the experience thus far has been pleasant. The biggest surprise to me was the fuel economy numbers. I was averaging around 25mpg with my 2006 Nissan Altima 2.5S. The Impala averages that at similar driving speeds. However, recently, I decided to slow down to 65mph and my fuel economy jumped up to 28mpg!  The interior is very comfortable and the seats are supportive. The CD player hiccuped and had to be replaced - now it works great! The ride is smooth and quiet. The engine can be a bit buzzy when the RPM crosses 2500. Overall, good choice!","Great CD player, smooth ride, fuel economy, trip computers and included features","More storage compartments, a 5 or 6 speed auto transmission, more legroom in rear seat, improve exterior looks and give us 2 sticks for wipers and indicators!"
4.625,Whata rush!,Boz ,04/07/2008,,,4,5,4,5,,5,5,4,5,"This car is a blast to drive, gas mileage is acceptable, and if you don't have Flowmasters on it, you're missing out. Great rumble, great performance, great looks. I love this car!","Styling, V-8, comfort","Wheels are a little funky, how about rear drive."
5,Skeptical Chevy buyer,Dano ,04/04/2008,,,5,5,5,5,,5,5,5,5,"1st new Chevy I have owned. Didn't rated it a 10 yet, very close. Car handles nice, ride is nice and I don't have the problems that I have seen on this forum, which I looked at before I purchased my Impala. This car is a very good improvement (I test drove Impala 3 years ago and wasn't impressed). I hope to have this vehicle a few years.","XM radio, side curtain airbags. Four wheel disc brakes. Civilized driving will fuel economy and car component wear ","More safety stuff, anti-lock brakes , traction control "
4.625,So far so good,mark ,03/30/2008,,,4,5,5,5,,5,4,4,5,"Traded our 05 Equinox early as we were very disappointed with quality, problems considerng it was a forty thousad dollar vehicle. Tried the Impala. So far we're happy. Nine thousand kilometers and no problems yet. Had lot's of snow in Canada this winter, was worried about not having all wheel dive, but the car was great with traction control. Handles great,and smooth on the highway. More than enough power with 3.9 v6. Mileage a little embelished on sticker but so are all the other car makers. ","Smooth handling on highway. Adequate power, trunk is huge, love it!","Better contoured front seats, like the 08 Malibu. Little nicer carpet in rear window,and who designed the coffee cup holders? And slightly larger mirrors "
5,Driving Make Fun Again,GPA ,03/26/2008,,,5,5,5,5,,5,5,5,5,"In 2006 I sold my restored 1963 split window Vette. I thought that I would never again get the fun rides I used to get from the 63, wrong. I bought a nSS in January and I am thrilled with the ride. It sure stops better than the 63, the handling is not quite as good. Just this morning OnStar unlocked it for me. I recommend this car to any one who remembers the great cars of the sixties. I am getting between 23 and 25 mpg. I am happy with my 25th new Chevy. This is the same engine that I have gotten over 300000 miles out of in my pickup trucks.","Remote starting on cold days, XM radio,OnStar, six way heated seats. Power to pass. The looks I get from other old guys like me who see the SS on the side.",Better garment hangers in the back. Some kind of stop bar in the trunk to hold my stuff in place.
4.25,No Complaints here!,Maloderous ,03/25/2008,,,4,5,4,5,,4,4,4,4,"Traded in a base-model Grand Prix for the LT and haven't looked back. Sure the Grand Prix had a bigger V6, but she turned like a cow, fat too. Havent had the chance to use E85, not that it really matters to me, although great mileage for the size and driving conditions ~27 MPG avg would definitely recommend, especially with the great leasing options.","Lumbar support. No, seriously.",Plastic steering wheel has some uncomfortable seams. 
4.875,Good value,miker ,03/24/2008,,,4,5,5,5,,5,5,5,5,"The 08 impala lt drives great. I stepped down owning a Mercedes-Benz C-class for 8 years. The Impala is very quiet, smooth shifting and I like the styling and space. Mileage is excellent and it uses regular gas. I am used to that other motorists look at you  while driving a Mercedes-Benz, same thing happens with the new Impala. Love that car.","Large trunk, quiet engine, smooth shifting transmission, good instrument cluster, very easy to operate",Should come with an ash tray
5,Love This Car!,xt109 ,03/16/2008,,,5,5,5,5,,5,5,5,5,"I am so glad we to Chevy to try out an Impala. We'd been test-driving Toyota Camrys and Nissan Altimas. But we finally went to Chevy, and we really liked the Impala. So we bought the Chevy Impala, and for less than a base Camry! Now I realize how flimsy the Camry and Altima were. The quality of the Chevy Impala is far superior. And with the 3.5L V6 we've attained 26 MPG in the city and 33 on the highway, far better than the window sticker said. I'm glad I didn't fall for the Japanese foriegn car hype. If you don't believe it, go test drive an Impala and compare. There are plenty of old Chevy's and Fords driving around, and they are easier and cheaper to fix.  Most cars last with care.","Quiet smooth solid ride, the on-board programable computer with tire pressure and fuel statistics, OnStar, 3.5 V6, the roomy interior, split bench front seat that allows 6 person seating capacity, suprisingly good fuel mileage for a large car.",ABS should be standard.
4.75,Dream Car,KR ,03/15/2008,,,4,5,5,5,,5,5,4,5,"I can't say enough about this car. I factory ordered the LTZ model black on black with cloth seating (as I don't like leather) and the metallic trim on the inside instead of the base woodgrain trim. This car is my dream! 18"" Wheels that stand out and look like I went out and custom bought them. Two large exhaust tubes sporting stainless steel tips. I tried to create a great sports car with this vehicle and I succeded by putting two thick stripes running from to back as well as chroming out the front and rear chevrolet logo (over the default gold. A sound system is my only future plan for this vehicle as it turns heads no matter where it goes. I just want to drive it!","Exterior looks very eyecatching especially with custom modifications, Chevrolet history, engine power, ride comfort, ease of use for all interior controls, very simple interior layout",Only 2 gripes on this vehicle: I hate that rear center headrest. It is unable to be removed and ends up blocking part of your rear view which is already compromised by the spoiler and high rear end of the vehicle.  Cupholders...god why didn't they make these decent years ago?
5,"Believe or not, the best",GM Lover ,02/13/2008,,,5,5,5,5,,5,5,5,5,"I've heard from so many people that American made automobile is not good as Japaness made. That might be true. It may sound strange. My teenage daughter wanted to buy this Impala SS, not Japaness or other imports. She said ""I love Chevy"". Driven about 7000 miles so far, and there was no problem at all. Excellent performance(like my Trailblazer SS). Great gas mileage for V8 engine(over 21 mpg with mixed driving). Very comfy and smooth ride. This Impala's interior may lack  refinement than some foreign car's. But can they bring a car with roaring V8 under $30,000?  ",303 hp engine. cylinder deactivation.,"6 speed shiftable automatic transmission, seat memory, height adjustable pedal."
4.625,2008 IMPALA SS,ROGER ,02/02/2008,,,4,5,4,5,,5,4,5,5,"This is my 4th Impala. This car is the best so far. It has less road noise, and better exterior looks. You get a lot of bang for the bucks. I just wish they would hold a little more resale value.","XM, 303hp, old style ss emblems (not like 04) dual exhaust","My 08 has only one hood shock (kind of flimsy), ss emblems only in white (doesn't stand out on white car), cowl induction hood?"
4.875,Very nice,Scortch ,01/28/2008,,,5,5,5,5,,5,5,4,5,"After the HHR, this thing is like 100 times better. It rides smooth as silk. The shifting is really smooth. It has a really nice pickup and just plain comfortable to drive around in. One of the best cars I have had.","Comfort, OnStar, heated leather seats, smooth ride, hip room, huge trunk. 22 city. Center backseat headrest.",Need a hybrid option. E85 is a joke. Back seat leg room. Add pedal adjustments
3.125,Uncomfortable ride,jim ,01/26/2008,,,3,4,3,4,,4,1,5,1,I have been driving GM cars for 50 years and they have been good except for this model. Very uncomfortable bumpy riding auto. I have rode in a 2008 Buick which looks about the same on the out side but rides good...I travel for a living and not looking forward to driving this year. Hoping I can pay to upgrade the quality of the vehicle to make it comfortable. ,Nothing yet. Paint looks good.,Move back seat 2 inches so people can get in the back seat.. Driver door entrance to small and hard to get into auto. Cloth seats hard as a rock.
5,Pleasantly Surprised,GK ,01/23/2008,,,5,5,5,5,,5,5,5,5,"Having recently leased a Cadillac CTS, I expected a Chevy to be far inferior. I have driven the Impala only about 500 miles, but the verdict so far is quite positive.  This is a very comfortable ride, with most of the same upgrades I enjoyed on the CTS (dual climate control, heated seats, OnStar, XM radio, traction control, Stabilitrak, ABS, etc. etc.) for less money.  As to reliability, I hope that is the case (three separate warranty repairs for the CTS) and have my fingers crossed. So far, so good.","Dual climate control, hands-free calling, heated seats, sunroof, audio controls on steering wheel","Side mirrors should be larger, legroom is just adequate"
3.75,Good Car Made by Cheap Manufacturer,thom ,01/15/2008,,,4,4,4,4,,3,4,4,3,"This is a good, basic car that I now regret purchasing.  Be aware that even the upgraded ""LT"" does not include ABS brakes.  I didn't even think about this until I got it home.  It simply did not occur to me that in 2008 a large family sedan would ship without basic safety features.  GM should be ashamed of themselves for this kind of reckless penny pinching.  Additional penny- pinching becomes more evident as you drive the car more.  Features that most people consider standard in every car, such as a folding back seat, are optional in the Impala.  If purchasing, make sure you verify what is included, down to the most basic safety and convenience features that you probably take for granted.",XM radio,It's 2008. Antilock Brakes should be standard.  Lives are being risked to save a few hundred dollars.
