5,2008 toyota sequoia,jose chavez ,04/26/2016,4,4,4,,,4,4,4,4,,,,,
5,This vehicle saved my family's life!,Lowe ,01/15/2016,5,,,,,5,5,5,5,,,"We were driving home from a ski vacation in Whistler, BC when a group of young snowboarders going too fast, lost control of their truck and crossed the center line, hitting us head on at over 50 miles per hour. We rolled and all 6 airbags deployed. It was a 2008 Sequoia... And it saved our lives! Yes, we already thought it was the best vehicle we had ever owned because it was comfortable, powerful, looked great and we could even fit a twin matters in the back for road trips. It wasn't a until I pulled my precious children from this crushed vehicle that I thanked God that I made the choice to buy it. I've since been told there are no know fatalities in the Sequoia.. I don't know if that's a fact or not... But I know for sure that we are not fatalities because of our Sequoia. Honestly, I didn't know it had a built-in roll bar or 6 airbags or such a good safety rating before this crash. I just knew it was comfortable, could tow the boat and fit the kids and all their friends. Now I know... And want everyone else to know too. Just thought I would share this if your are considering buying a Sequoia.",,
5,Second Sequoia,Steve ,01/06/2016,4,5,5,,,5,5,5,5,,,"Great vehicle. This is second one for us. We buy them with 60-70k miles. As long as they are local trade ins with clean car fax and documented service history I have no qualms about driving them to 200k miles and expect few repairs.  Fuel economy is only downside,",,
4.75,"Loving the Sequoia's power, comfort and reliability",sjhanks ,12/05/2014,,,5,5,5,5,,5,5,4,4,"Need a big SUV to haul people, gear or tow.  It's the best.

Had a Yukon XL and it was plagued with problems.  Didn't tow really well either.

So we purchased the Toyota and spent a little more on it than other similar SUV's, it's my third Toyota and I think a few extra bucks is worth it.  I do miss the Yukon XL's rear storage.  But we just fold one side of the third row down and we have lots of storage.  I also have 3 kids almost 6 foot or over 6 foot and they can fit really comfortably in the 3rd row because it is so roomy.

Love all the power too, it tows so much better than the 2003 GMC.  Pulls right up the hills with no problems","Comfort for adults in all 3 rows.

Power to tow or cruse.

19 MPG on a 12 hour road trip doing 80-85 MPH is not bad either

Towing is great, no hunting for a gear while climbing grades.

Sound system rocks

Very good turning radius for it's size

Hope it lasts for ever!!!","Wish the rear storage had just about 8 more inches, but don't take it from and of the other seat's leg room."
3.875,Engine failure at 138k miles,tmaracle ,09/18/2014,,,5,5,2,1,,5,5,3,5,"I bought brand new. Always kept up with oil changes.  Mostly highway miles.  A valve spring broke, hit the cylinder head which broke and destroyed the engine block and everything.  For the dealership to build me a new engine is $15k in parts, not including labor. You can't buy new engines like ford and GM.  I bought a used engine for $6k and the labor cost ended up in a bill for $9850.  The new engine is not working properly but the dealership is working with me.  I am disappointed.  I wanted to keep this truck forever.  Now I'm faced with a tough decision.  I also lost 3mpg's.  Now around 13.4 mpg's when I used to average 16.4.  ","Size, comfort and drivability","Sell assembled engines, improved strength of valve springs.  Seal electronics on running boards to prevent corrosion."
4.75,Great & powerful SUV ,fortyniner66 ,02/23/2014,,,4,5,5,5,,5,5,4,5,"I love this SUV .Have had 3 4runners, Acura mdx among many other vehicles. Last year We sold our dodge mega cab 2500 diesel and bought a crv.Last year we bought a boat and with several vehicles in our family already with kids driving we decided a used Tahoe or Yukon might be a option. We checked out the older sequoias however the power & towing stats on the 08 sequoia were impressive. We found a used sr5 with nearly all the options we wanted and fell in love with the car. Dream to drive..be realistic about the mileage ..it is what you would expect with the size and power..if mileage is your hang up you will want to pass. If you want power,space reliability and pure fun then give it a shot!",,
4.125,Great but a couple problems,tmaracle ,05/16/2011,,,4,5,3,3,,5,5,4,4,"We like this truck. I am encountering some issues.I added the running boards with LED's underneath that light up when the door is opened.The dealership is fixing them for the third time because the wires got corroded at the connection. It is not a water proof connector, bad design. I now also have a leaking oil pan. It appears to be the valve seal that is faulty because the hose and pan are oily.Hopefully the dealership will fix both issues under the extended warranty. So far they told me the light bulbs are not covered. LED's are not light bulbs, they are diodes that rarely fail. This is an electrical issue. Is anyone else having problems. Albeit, these seem to be minor.","This is a great overall vehicle. I like the hands free, the sound quality of the stereo.
It drives great, handles great and is relatively good on gas for its size.
",Better connectors and wiring for LED's on running boards. Better valve seals in the oil pan. Bluetooth needs noise reduction features and maybe a better location of the microphone.
4.25,Good Family Vehicle,mwaltjr17 ,03/01/2011,,,4,4,5,5,,4,5,4,3,"Bought this to replace a Buick Enclave.There is a ton of room in second row, and third row (with second row seats moved forward).I love being able to independently move each seat in the second row.It handles much better than other vehicles its size.We are very happy with this purchase.","Interior is terrific.
Lots of storage options and cargo space.
Very capable in bad weather.
Power third row is very nice.","I'd like the ability to add more than one phone to the bluetooth.
Nav maps need an update.
Quick release on the middle seat (2nd row).
"
4.875,Love our Sequoia! ,Sequoia Rocks ,09/03/2010,,,5,5,5,5,,5,5,4,5,"So, let me start by saying we have a 2004 Toyota 4Runner, with 130,000 miles.  We have NEVER had any issues with it and it drives like the day we drove it off the new car lot.  Since then, we've had 3 girls and grown to a family of 5 and needed something new.  So, we made a mistake.  We bought a Acura MDX.  Sold it.  Bought a Cadillac Escalade.  Sold it.  Finally came back to our first love Toyota and found the Sequoia used with 44k.  In short, this thing is now a member of the family.   Yes, Toyota hit a rough spot, but they are still Toyota.  They will recover and the 2008 Toyota Sequoia has exceeded ALL expectations.  Not enough time to list all the things we love.  Find one used, buy it.","So quiet, so tight, so big, so perfect, love the Sequoia!","Seats could be more comfortable, that is truly my only suggestion.  Get a freakin' pad, this thing is OUTSTANDING! "
4.625,Love our Sequoia,B&C ,08/27/2010,,,5,5,5,5,,5,5,2,5,"We debated on a mini-van, but wanted a larger 4wd. We looked at all the full size SUV's and chose the Sequoia that we purchased through a broker with 15,000 mi. It's an SR5, but loaded with almost every option available. Of course the mileage is horrible, but if you can get past that fact, you will love this SUV. It accelerates as good or better than my Mercedes E320. I have had 5 full size guys with 5 bikes and even my 6'3"" buddy was comfortable in the 3rd row. We are very happy. On road trips we average around 18 mph. We put in an aftermarket DVD - if this is a requirement, get one with the factory DVD, aftermarket will not work with factory BT, poor steering wheel connections, etc. ","Power, large, very comfortable seats, comfortable on the road and very fun to drive.",Nothing that I can think of.
4.5,Good all around value,tommyk ,08/26/2010,,,5,4,5,5,,5,4,4,4,"I forget I am in a large vehicle most of the time.  It has a silky smooth drive train with an amazing amount of power should you need it.  I wish the ride was a bit smoother, but what can one expect from a vehicle with a tow rating of 10,000 lbs?  I get good mileage on the highway, I get about 20 mpg if I keep it at or below 65 mph and around town about 15. I have only had one little problem with it and that was a bad O-ring on the dipstick tube that needed to be replaced.  Other than that it has been a star.",traction and stability control.  I love the sonar system for heads-up control for tight maneuvering.,I wish it had a AWD setting.  
2.375,WORST Toyota,masterdoc ,07/04/2010,,,4,4,1,1,,2,4,1,2,"Now with 34,000 miles, plastic trim falling inside and outside, rubber insulation on tailgate peeled off, engine with wheezing noise in the dash that 3 dealers can't find a solution for it, awful! Dealer interaction - bad - my other cars are 2008 Mercedes CLS, 2010 Audi S5 and 2005 Hummer H2 - by far this is the worst automotive I have owned! Planning to trade it in for either MB GL320TDI or Audi Q7 this fall! Even the recall repair required 2 visits! I guess the golden era for Toyota is over!",DESIGN - best SUV design inside and out!,"BUILD QUALITY, reliability and dealer respect for problems"
3.75,A beast,kbert ,06/10/2010,,,4,4,4,4,,4,4,3,3,"I traded in a station wagon to get the Sequoia.  With 3 kids, a spouse, a nanny, and a dog, I figured we really needed something bigger than mid- size/large SUVs like the M-B GL, Toyota Land Cruiser, or Land Rover LR- 3.  After owning it for over a year, I was sort of right-- the Sequoia is a dream for family trips with lots of luggage.  But, we only do those a 2-3 times a year!  The Sequoia is nice for carting kids and sports equipment around, but a smaller SUV could do that too (though with the Seqouia, large/long items like skis and bikes can just be put inside without concern).  In sum, it's just a bit too big for my taste and 99%-of-the-time needs. Family loves it though.",Space for long family trips; rear DVD; adjustable and wide second row; comfortable on highway,"I have almost given up using the nav system -- it's so cumbersome compared to the one in my Audi A6; the dashboard plastic is thin and cheap (glove box is shockingly bad); Toyota should try to make the next one less long and not as tall (reduce size/width of hood, e.g.); engine is too rough/course."
4.875,Interstate Cruiser,navintel ,04/20/2010,,,5,5,5,5,,5,5,4,5,"The Sequoia is a great interstate cruiser, comfortable,easy to drive and plenty of power when you need it. Plenty of room for people and cargo and got 21.1 mpg going from Delaware to AZ. I have taken it off-road several times with no problems.",Great engine and the 6-speed trans is excellent for long distance driving.The engine loafs at 75 mph...,"For a vehicle that listed at $39,000,it should have lights on the vanity mirrors."
4.75,Best Large SUV out there.,mg ,04/17/2010,,,4,5,5,5,,5,5,4,5,"If you have a chance to drive this, please do. I found it much more enjoyable and responsive than any of the large SUVs out there. I know Toyota has been hit with reliability issues, but it is Toyota...they will resolve it. I hope to drive this thing to the ground...and should be able too, but right now I only put about 4000 miles a year on this beast.",The bluetooth handsfree phone. The streering wheel also just feels right.,Better visibility for the side view mirrors. I wish they just put the larger Tundra mirrors on it or the Ford crew cab like mirrors. I added 2 small blind sport mirrors to improve the visibility 
4.625,Great for travel and always reliable,AJC ,02/08/2010,,,4,5,5,5,,5,5,3,5,This is a nice ride even on rough roads.  The 4WD allows  me to get in and out of just about anywhere.  Great for travel and always reliable.  I owned a land rover before this and I only miss the heated front windshield.  This has more plastic than  my 06 which makes the interior look cheep for a SUV of this price.  The seats in my 06 are more comfortable for a small person...especially on the passengers side.,Driving Experience.,Heated front windshield-standard.  Get rid of all the plastic.  The seats are terrible for small people.
4.75,Towed 9000lb boat 4000 miles,culross ,01/28/2010,,,5,5,5,5,,5,5,3,5,"Purchased my Sequoia used w/ 7K miles.  Now, at 20K miles, the car still functions like new.  Towed 9000 lb boat/trailer from south California to Alaska without any problems whatsoever.  This SUV was able to accelerate up even the steepest mountain passes with the boat in tow.  Very impressive. Now it allows me to take 6 other people along for fishing trips.  ","Good power, great breaks.  Solid build quality.","Fuel consumption could be a little better, but then we didn't buy it for fuel economy."
5,Big Beast,LGreen ,11/30/2009,,,5,5,5,5,,5,5,5,5,"First the bad news - -I can't say I ""love"" the Sequoia.  I'd rather be driving a Cayenne or a Land Rover Sport, or a BMW M5.  But, with a big family, pets, nanny, and loads of sporting events and gear, the Sequoia does what it's asked to do, with ease.  The Sequoia really proved itself, in my mind, just a few weeks after we bought it (used, with 20K miles) -- we drove it over 500 miles with kids to South Carolina.  The kids didn't peep or complain once -- not a single time!  They were comfortable, enjoyed the view out, with their own climate control and multiple cup holders, not to mention the excellent rear DVD system.  I've also taken it offroad a few times and it's been fine.",Long distance comfort; rear DVD; fantastic seating flexibility in 2nd and 3rd rows; reliability/confidence in driving a Toyota.,Make the next one a bit smaller -- bigger than the Mercedes GL but smaller than the current Sequoia. Get rid of the chrome grill - -I was able to swap mine for a color-keyed one at the dealer (much better and less intimidating).
4,2008 Sequoia,SRJ ,11/21/2009,,,4,4,4,4,,5,4,3,4,"Lots of power and much more room than the Tahoe. Ride is very good for a ""truck"".  A little too much plastic for a $50K car.","Plenty of power, sliding middle seats and great.  Rear window that goes down.","Tires are shot at 20,000 miles, ""something"" is wrong with the VSC it keeps going off every time I back out of the driveway.  Radio needed to be replaced, 4 wheel drive engagement takes too long."
4.625,Follow up review,Bob ,10/07/2009,,,5,5,5,5,,5,5,3,4,"After putting on over 20000 miles since purchase, I wanted to state that this vehicle is still enjoyable to operate. The vehicle still ""feels"" new and has not given us any problems. We use it to travel extensively around the country attending basketball tournaments that my granddaughter plays in. Always comfortable for the occupants and plenty of room for the gear.","Comfort, performance, rear seating leg room and storage.","Nav system is difficult and out of date, transmission is a bit ""jerky"", front distance sensors are useless, especially directly in front not at an angle. Heated and cooled cupholders for front seat and rear buckets."
4.625,Awesome SUV,Tommy2tone ,09/23/2009,,,5,4,5,5,,5,5,4,4,"Have had my 2008 Platinum 2 years now and I'm truly as happy with it as the day I bought it. Sure, it's pricey (I still can't get over my $850 mo. payment) but there is nothing on the road that even compares with it. If it had a Lexus badge (which it should) no one would even question it. It has plenty of power, an awesome transmission that never misses and is extremely comfortable.I love when my friends who have Lexus, Mercedes and one last week who has a Land Rover, get in and look around then say ""This is nice- what car is this""? The Platinum series is that nice! It's the best overall car I've owned. Oh yeah the Navigation- IT STINKS! drives me crazy! Get a TOMTOM for the dash. ","Powerful motor, Smooth transmission, Platinum series has everything, very comfortable, I'm proud of it.",Navigation- So bad it could cause road rage. Just know it going in and get an after-market or a map. Put a Lexus badge on it.
5,Love My Sequoia,Serious Consumer ,09/11/2009,,,5,5,5,5,,5,5,5,5,"I have had this SUV for over a year now and am just as pleased with it now as when I first bought it. The best vehicle purchase I have ever made. I love everything about this vehicle! I love the design, performance, comfort, everything.",,
4.875,A Vast Improvement Over Previous Model,rmgator90 ,09/06/2009,,,5,5,5,5,,5,5,4,5,"I have had for a couple of months now and it has operated flawlessly. I had an 06 and liked it, but felt it was not as safe as I would like it to be.  This has all the safety whistles that I need, plus it is a MUCH smoother, quiet, and comfortable drive. I would recommend this to anyone who is looking to buy a large SUV.  I have a friend who has an Escalade, and he prefers my Toyota.  Averaging about 18 MPG on mostly highway driving.  ","Smooth drive, second row captains chairs. Power folding third row and power reclining (my daughter loves this and insists on riding in the third row), power rear door.",Standard power outlet in front or second row to plug in laptop or DVD player for daughter. Leather wrapped steering wheel. 
4.625,Nice Ride,Charlie ,08/01/2009,,,4,5,4,5,,5,5,4,5,"I just purchased this vehicle a couple months ago and I'm very happy with it, especially on long trips. I was lucky enough to add leather interior and 20 inch wheels from a Tundra Pickup,  complements of Power Toyota & Arizona Sun tops.  It is very powerful and handles very well for its size, it is very quiet on the highway and the JBL system sounds quite well for a factory system. There is plenty of space for my music equipment and is also relatively easy to park due to its short turning ratio.",Comfortable seats and plenty of leg room. Excellent drive train design with a quality feel.,"Toyota may want to try and position front speakers away from the windshield since this does effect overall sound ability due to sound reflection from the glass.  Better softer materials for the steering wheel could be used other that that hard cheap molded plastic, even my old 2000 Acura has that."
4.75,Love my 2nd Sequoia,MR VAT51 ,07/22/2009,,,5,5,5,5,,5,5,3,5,"We bought our second Sequoia six months ago and already put in 10,000 miles. We drove it twice to California coming from Texas and once to Illinois. I love driving it and family loves the long drive because of the comfort of the ride.  ",everything,Radio control on steering wheel should be standard.
4.875,Great SUV,Oh8Limited ,07/20/2009,,,5,5,5,5,,5,5,4,5,"Our family bought this truck this month. We took a 4 hour trip to another city, very comfortable ride, responsive steering, also a quiet ride for the size. For as big as is it, it drives like a smaller SUV.","5.7 Liter engine, JBL stereo, responsive steering.",The Navigation could be more user friendly.
4.875,Love my Sequoia,Warrant_ero ,06/12/2009,,,5,5,5,5,,5,5,4,5,"Just bought our Limited 4x4 Sequoia on 1 Jun. Love driving the big beast. For a big rig it drives like a small car. MPG been around 17 city/highway combined. The interior is nice although I would think there would be less plastic. Very quiet when on the road, love all the power. Looking forward to many great years of service.","Engine, front and rear Sonar, stereo. Folding third row seat.",Less plastic on interior.
4.75,Nicer than the 1st,9 year owner ,06/09/2009,,,5,4,5,5,,5,5,4,5,"I bought my 2001 Sequoia SR5 when they first came out, put 210,000 miles on it and was sad to trade it in on my new 2008 Limited in May of 2009. With gas prices going up we were actually looking for a smaller SUV but kept saying ""we could get another Sequoia for that price"". We bought our 2008 off the lot for the same price we paid for our 2001 SR5. We have already traveled 600 miles to 2 Lacrosse  tournaments with 3 young men, gear and everyone loves it. We didn't like the new design at first but with the optional 20"" wheels it is really starting to grow on us. The ride quality and the quiet interior are in a category of a much more expensive vehicle.","Power liftgate, folding mirrors, powerful 5.7 v8, power folding seats, JBL sound system, storage.",None right now
4.875,Room for Improvement,Guffey Time ,05/21/2009,,,5,5,4,5,,5,5,5,5,"We live in a very rural area on dirt roads. We were amazed at how this vehicle allows the dust to come in. The rattles in the car are very irritating. The bluetooth does NOT work. The person on the other end says that it sounds like you are in a tunnel and cannot hear. Toyota cannot fix the problems! The towing is amazing which is the only reason I am keeping the car. You pay 52000 for a car, you expect a little more - not dust and rattles.",The towing is awesome! I pull a 2 horse trailer with 2 horses in a mountainous area with no problem.,Fix the rattles. The back seats make so much noise that I put the seats down. Fix the dust problem. The amount of dirt that flows into the vehicle is ridiculous.
4.75,I love it,Jim ,05/12/2009,,,5,4,5,5,,5,5,4,5,"This is my second Sequoia, the first is now in my daughter's hands and she loves it, I got the '08 when she got my old one and although it took a little getting used to, it's a superior vehicle to any other SUV I've owned, Ford and GM.  The features of the Platinum trim line include the backup camera, reverse tilt mirrors and more.  We tow an 8500 LB travel trailer with ease, great vehicle!","Reverse tilt mirrors, towing ability, backup camera, heated and cooled seats, folding 3rd row seat, towing capacity.",Allow the backup camera to be used at other times by allowing a selector switch. GPS is not very user friendly and cannot be used while moving; allow an over ride so the passenger can use the system when the passenger seat is occupied.
4.5,Great Family Vehicle,Jonathan ,04/20/2009,,,5,5,5,5,,5,5,2,4,"I was interested in the Sequoia before the redesign, and after seeing the new 2008's it moved to top of my list.  We got the Limited edition and added the dual headrest DVDs with 2nd Row bucket seats.  I could not be more happy with this car. It is primarily my wife's and she goes on and on about how much she loves driving this car.  It has an incredible turning radius for a car of its size and drives very quiet and smooth.  For long trips, the ride, the navigation, and the rear DVDs make traveling with our 3 year old and 3 month old a breeze. ","Push button fold down 3rd row seats, automatic rear door, rear window that can go down, 2nd row bucket seats, headrest DVD system, navigation system, smooth and powerful ride and wonderful turning radius.","The voice command is not as responsive as I'd like, the mic for the bluetooth is useless, I'd like to control navigation while driving, I would say gas mileage - but I didn't buy this car for the gas mileage."
4,Pros/Cons,Paul Dobrovolskis ,04/11/2009,,,4,4,4,5,,4,5,2,4,"I needed a full size SUV that had trailer towing capacity that gave me room to play when towing a boat. I have had Toyotas in the past and though always scant on creature comforts have been extremely well made and reliable. My last clocked in at 450,000 km and only died due to an accident. Issues IPOD connectivity useless to non existent. Don't bother with the Toyota cable. Navigation package useless. Very error laden, extremely user unfriendly, better to buy an aftermarket system. A 150$ garmin will outperform the Toyota navigation. Gas cap has no lock. Oil changes, uses a cartridge filter that few aftermarket dealers have. Dealers even hate doing changes.","Engine power- power to spare hauling 6000 lbs. Comfort; great seats, views good comfortable ride, plenty of adjustability for trailer towing. Turning radius - beats any other vehicle in its size class. Quiet ride, low noise at highway speed.",By far the worst problem is the navigation/bluetooth system. The maps are years out of date. 2008 DVD with maps from NAVTEQ dated 2003!. Navigation lock out while in motion. You must stop to use it as the voice commands often won't read properly. Can't even find a gas station while in motion.
4.75,2008 Toy,A Real SUV!!! ,04/10/2009,,,5,5,4,5,,5,5,4,5,"Love this truck, bought it 500 miles ago. I had a Ford expedition that I got rid of when gas hit almost $5.00 a gallon. I went to a Cherokee sport which was just as bad, then I went to 2009 Toyota matrix, which was beautiful on gas, but I was very unhappy with the limited space. 10 months later I traded in the matrix for the sequoia (best investment I made!). I don't care if gas hits $10.00 a gallon - it's worth it & if you put super you can get about 14 miles a gallon in the city.","JBL speakers, DVD, back up camera","Dashboard, but what can you expect - it's a full size truck. If you want easy to reach, then go with a BMW x3 or x5 or a crossover!"
4.75,2008 Sequoia Limited with all Options,Luv2Dive ,04/10/2009,,,5,5,5,5,,5,5,3,5,"Traded in my wife's Ford Explorer Sport for the Sequoia Limited 4wd, and it was the best thing we ever did. Before purchasing the 2008 Sequoia, we test drove the Escalade, Tahoe, 2006 Sequoia and Expedition XL for a weekend each, and the 2008 Sequoia was the clear winner.  The Sequoia ride quality and handling ability is excellent... even in 4 wheel drive. Our regular ski trips to Lake Tahoe have been a lot more comfortable and fun, since we got the Sequoia. ","The power from the 5.7L engine. The tight turning ability of the Sequoia. The third row seats is very comfortable for tall guys. Also, if you get the DVD player option, it's installed with a 115V AC outlet with video ports, so you can hookup a game station for the kids to use with the DVD screen. ","They need to improve the NAV system's voice command control functions... it's too complicated. The power rear door is difficult to open from the driver seat, due to all the operation restrictions and conditions.       "
