4.5,Perfect New England Car,vtcj ,04/24/2008,,,4,4,5,5,,5,4,5,4,"So far, this car is terrific. We had tons of snow in Vermont this winter, and I was able to drive anywhere with the standard all-weather tires. While the drive doesn't quite have the feel of a European car, the 5 speed is fun enough and the price tag for an AWD vehicle is just right. Love the hatch for bike/skis/dog etc., and the premium package with the VDC, leather stuff and 6 disc changer is totally worth the money. MPG is better than expected. I do mostly highway driving, and after 10,000 miles I'm starting to average around 29 MPG.","AWD, 6 disc changer, iPod jack, leather steering and shifter.",Tail lights are ugly. Overall shape is somewhat egg-like. Rear hatch sometimes takes just the right amount of force to close.
4.625,Performance w/ Comfort,dgribble ,04/17/2008,,,5,4,4,5,,5,5,4,5,"Previously owned an 05 STI.  This 08 is worlds above the old STI.  It's more comfortable and waay more quiet.  The power delivery is more linear, which makes it seem like it's not faster than previous version but speedometer says otherwise :-)  The suspension offers no shock to the kidneys over bumps while retaining the ability to take corners at much higher speeds than the old versions.   I love that the car looks more aggressive but does not grab the attention like the old versions with the big wing.  Sleeper look.","The wide body look, fender flares look awesome.  Hatchback utility. Smooth suspension.  Interior materials are Major upgrades over previous STIs.  20 MPG avg. is pretty good for a 300HP, AWD car.  Sound of boxer engine and exhaust seems more aggressive and sweeter sounding than my old 05 STI.",Get rid of those ugly clear taillights!  Bring those Recaro seats!  The SI Drive is pointless.  I mode doesn't save me any more gas than S# mode.
4.5,Almost completely satisfied,Curiousfish ,04/16/2008,,,5,4,4,5,,4,5,4,5,"Had the car since January. Having this car made my winter commute just a bit safer and easier. Now that the weather is warmer and the motor is more broken-in, I am getting better MPG. My mix is 60-70% highway and I'm getting roughly 24-25MPG. I'm not exactly the most calm of drivers either, I don't straight cruise too often. I haven't had any problems w/ this car except for the paint which is rather thin. ",Turbo power + AWD + hatch utility = great all around car.,Subaru needs to make the paint a bit thicker.
4.875,Subaru is my brand now,bermo61 ,04/14/2008,,,5,5,5,5,,5,5,4,5,"I have had lots of cars, Jeeps, GMs, Fords, Chryslers, but I had pretty much settled on Toyota being my brand of choice for their reliability. Unfortunately they are kind of boring. I own a Yaris and although I love the mileage it is kind of dull. I want to have fun driving without spending a mortgage payment on my car... enter Subaru. I have the reliability of a Toyota with cutting edge technology and feature laden products. I love my new WRX. I have almost 5000 miles on it and it is so fun to drive it should be illegal (and frequently is based on my tickets hee hee). ","That engine is awesome... AWD,  VDC, the thing is loaded.",The stereo is awful!
5,Perfect complete package?,Daily Driver ,04/10/2008,,,5,5,5,5,,5,5,5,5,"I was looking for a reliable, economical, fun daily driver - a combination surprisingly hard to find. Enter the Impreza: AWD, fun, safe, good looking, good mpg, sporty, practical, good standard equipment. Was ready to buy the 2.5i after the test drive, but told dealer I needed to give the WRX a chance at least. 15 minutes behind the wheel and I was sold. WRX = 2.5i + fun (read: fast!), great standard equipment, decent mpgs. Add the Premium Package for a list of great amenities that can't be beat for the money.","AWD and turbo! MPG easily worth the fun factor. Very exciting to drive. Exterior design - I love it. Projector headlights, body kit, heated mirrors, wipers, and seats. In-dash CD changer. MP3/aux-in jack. Perfect mix of practicality and joyride.",Power driver's seat. Better stereo - even with added subwoofer leaves much to be desired. Lower 5th gear ratio for expressway. Optional moonroof. Turn signals in mirrors (like Legacy). Really stretching for ideas here.
4.875,My Good Choice,alex Stamper ,04/04/2008,,,4,5,5,5,,5,5,5,5,"I used to have a 1994 ford escort that my parents bought me, and now I bought the Outback Sport and I love it. I've gone just over 500 miles on it and the dash computer is telling me in city driving i'm getting 21.3 average. Every other day it's been climbing, I've only taken it on the highway three times. I was going to go with the Mazda 3 until i saw this car and I went with this one. And I'm very happy with my choice.","The hill assist function since I'm new to manual. Nice smooth ride, and very good looking car. Roomy. ","Bigger arm rest, and a place built for change (coins)."
4.375,"Nice looks, good performance",Cyclone411 ,04/04/2008,,,4,5,5,5,,5,3,3,5,"This car handles better than my last car (1999 Passat). It holds the road well and has good power across the RPM range. I would like more cargo space, but knew I was making a compromise for reasons of cost. Car looks sharp in the Outback trim and is well equipped. I wish the driver's seat had adjustable lumbar support and the ability to angle the headrest back. Could also benefit from a telescoping wheel. Overall happy with my purchase 1000 miles into ownership.","Styling, road handling (grips like crazy in corners), very good low-end power for a relatively small engine, AWD for the snow, available manual transmission, price is good for the features.","Lumbar support for driver seat, fore/aft adjustment for roof rack rails, leather seat availability, telescoping steering wheel, full-size spare, remote functions in key head instead of fob, six speed manual, larger center arm rest, auto up on both front windows."
4.375,"Great Base 4i, fast fun interior lacking",p2adan ,04/02/2008,,,4,5,4,4,,5,4,4,5,"Just bought a Base w/out premium package a few days ago. Options: iPod, painted guards, mats. I love the front independent and wishbone, sooo smooth. Especially in Seattle where there are lots of hills, cobble stone brick roads and potholes.  5 star crash test rating. Can't wait to get to the mountain passes and take advantage of the AWD. This is simply much more value then any other car in class.  If you can afford Premium w/ VCD do it.","Performance! Quick off the line and revs fast. Built sporty even though it's not the Sport or WRX hatchback design offers a more functional space as opposed to sedan. LED tail lights, get em! Standard airbags for front and back seat side impact. Lot's of standard options, HIDs! AWD!","Base interior needs some improvement, already hear some sort of rattle coming from the cargo cover or seat at 110 miles. Carbon fiber hood. Dash and roof kinda cheapy but very functional. I am definitely gonna stick a Garmon behind the steering wheel in front of the gas guage."
5,I love my Subie,Dawn ,03/31/2008,,,5,5,5,5,,5,5,5,5,"Recently purchased 2008 Subaru Impreza wagon w/ premium pkg. after trading in 2001 Forester.  Impreza styling, handling and performance are outstanding. I travel at least 100 miles daily and wanted a car that could handle the inclement weather and get decent gas milage, this is the car to get.  Presently averaging 30mpg w/ AC!  Love everything about this car.",,
4.75,Fast and balanced,W.C. ,03/30/2008,,,5,5,5,5,,5,5,3,5,"Bought the car a month ago and love every minute driving the WRX.  My 2nd Subaru (2005 OBS) and WRX higher quality materials, cluster, seats.  Much faster too. Extraordinarily spacious with 5 door, able to fit a whole patio furniture set no problem.  Living in NYC, wanted AWD and looked at Audis but the 5 door WRX balances driving fun with practicality of everyday living for a little less money.  I have grey metallic and its beautiful, thought the OBS was bland w/o the scoop.  Look forward to each moment behind the wheel. ","Engine, interior instrument cluster, iPod jack, 17in rims, driving!","Visor (cheap), gas mileage is poor but I drive in the city all the time (20 MPG)."
5,Great AWD Hatch,Extremistno9 ,03/30/2008,,,5,5,5,5,,5,5,5,5,"So far the car has been great.  Drove it in a bad snow storm (10-14"") and it handled great.  I had to push really hard in order for the stability control to kick in.  When did, the car straighened out beautifuily.  The Outback sport has a slightly raised suspension over the stnd impreza allow it to be taken light offroading plus that allows the snow to not build up as much when driving.  The radio is ok, but comes alive when using the aux for a MP3 player.  Cargo space is great, seats are comfortable and heated.  Dash and conrols are layed out very nice.  Gas mileage is decent for a new AWD car.  Avg 24 w/mainly city driving.  Love the MPG gauge too!  Makes you more aware of how you dirve.","The silver two tone is nice looking along with the 17"" rims.  AWD (handling), heat seats, side mirros and wipers, all weather floor mats, overall feel of the car!  The use of regular gas rather than premium which is what a lot of cars seem to be doing these days.","More horse power on non-turbo.  Adequate 2.5L but more would be nice.  Lighen the car up even more to up gas mileage.  Other than that, the car is great and would highly recommend.  This is our 3rd Subaru, still have the 2nd one and the 1st was traded in running stong at 13yrs old!"
5,Solid and Quick,Dan ,03/27/2008,,,5,5,5,5,,5,5,5,5,"Have my Outback manual for 1000 miles now and it is a pleasure to drive. The car is solid as a rock and the ride is very controlled but not too stiff even with the 17"" wheels. The interior is laid out well and is also very comfortable to drive. Could use a bigger armest and lumbar control. The passenger seat could be a bit higher. Other than that it is very quick and gets good gas mileage, so far average 25 mpg in mixed relaxed driving. On highway it will get close to 30 mpg.  It's not even broken in yet. I had a 2002 Impreza Outback and they don't even compare. This new one is that much better.",Smooth stick shift and clutch. Nice hill assist function. Great gas mileage for AWD car. Comfortable driver seat. Rear seat is also nice size. Overall quiet and solid car.,Larger armrest. Passenger seat up-down adjustment. Could use a 6th gear as it revs a bit high (but not too audible). The car has enough power and it would help gas mileage even more.
4.25,I'm Imprezed,Joe R ,03/25/2008,,,4,4,5,4,,4,4,4,5,"All I needed was practical transportation. Something to get me from point a to point b safely and economcally. I tried the Scion xB, Mazda 3, Rabbit S 4 dr, and the Saturn Astra. I don't think you could go wrong with any of them. But, when you factored in what you can buy them for they were dealing on the Subaru plus you get AWD which was a huge selling point.  The VW is supposed to be the gold standard at this price point, but the Subie was IMHO less plasticky. I needed the versatility of a hatchback, hence the 5 door. I must admit though the xB looked huge on the inside. But I got more car for the money. ","AWD, handling, styling, nice dash layout/materials. Not everyone is driving one. ","Heated seats, moonroof. A little higher quality seat material. Lower price on some accessories; like remote start, or ipod interface. The bulk of the cost is installation I'm sure. But Subaru provides installation instructions for all their accessories."
4.25,OBS,Joe ,03/24/2008,,,4,4,5,5,,4,4,4,4,"Purchased this OBS 4A a week ago and now have almost 600 miles on it. Nice little car with a roomier interior than one would think. My first Subaru (I've owned 62 vehicles including all the German and most Japanese). I'm averaging 25 mpg in mixed driving and expect it to go up another 10 to 15%. The OBS has good content. It does lean a bit as others have mentioned but not to a point of concern.  My only complaint is of some dash plastic vibrations, lack of a sorely needed 5 speed auto, and lack of moonroof. I was aware of the latter two shortcomings going into this and purchased it anyway. I expect my OBS to serve my purposes for a couple of years and I am really quite pleased with the vehicle","Symetrical AWD, great content for a $21k vehicle, decent enought mpg, I like the new look (5 door only), roomy interior.",This is 2008 Subaru. Where's the 5 or 6 speed auto?  Tighten up the handling so it is flatter through the twisties.  Offer a 'moon'.  A bit more sound deadening.
4.875,Awesome Performance Car!!,David ,03/09/2008,,,5,5,5,5,,5,5,4,5,It is an exciting ride and handles like a race car. The suspension is Subaru's new double wishbone rear suspension. Great improvement over previous years. Great acceleration and top speed. The WRX is such an great value for the money you pay!!!,Performance and handling.,None
4.625,Dialed In,Scott ,02/28/2008,,,5,5,5,5,,5,4,3,5,"As my third Impreza and second STI, this is definitely my favorite Subaru. The ride is smoother than the 05 model and generally feels more refined. The interior has plenty of little features I'd be wishing for in the previous iterations. ","As a GPS virgin, the nav system is by far my favorite toy at the moment. The novelty of it will eventually wear off and when it does I doubt the plus of GPS will offset the lack of a multi-disc in dash CD player. ","With the complete removal of the ashtray, I find myself without a place to dump spare change that I like to have on hand for parking and car washes. Height adjustable passenger seasts would be nice plus as passengers often complain of feeling low in that seat. "
5,Great car!,Scooby-Rex ,02/28/2008,,,5,5,5,5,,5,5,5,5,"Purchased this car 2 weeks ago and almost reached 1000 miles. Gas mileage has been a little better than expected--my combined driving right now gets me 25.2 mpg (I don't baby the car but I am not too aggressive either). Interior is very nice--audio and climate controls are well designed, very decent quality, and more spacious than previous generation. Even without the sports grille, I think the exterior is decent. I did not buy the car for the looks anyways.","AWD, turbo, iPod integration",Stiffer suspension.
4.875,Good Cruiser,New Subie ,02/22/2008,,,5,5,5,5,,5,5,4,5,"Only have 500 miles so far, but it's been all good.  Mixed city/highway on first tank yielded over 25 mpg, and on a 90 mile highway trip today, I got 33 mpg!!  Plenty of power, great ride, and the new exterior design of the '08 is sharp.  ","MPG calculator, sharp design, great ride and handling, Subaru reliability, unique car.","Better MPG, maybe diesel motor that's available in Europe, or even a hybrid."
4.25,Love the Car... Hate the Mileage,linmike ,02/22/2008,,,5,5,4,4,,5,5,1,5,Purchased this car in January 2008.  Have put about 200 miles on the car so far. Handles great in all weather.  Mileage has not advance to more than 11.1 mpg; very disappointing.,"Interior, very comfortable.  dash, easily access everything. ","Mileage, mileage, mileage.  This is a small car; should be getting much better mileage."
4.5,Get a radar detector,Mick ,02/19/2008,,,4,4,4,5,,5,5,4,5,"Fun to drive, plenty of torque, manual trans a little clunky, needs to be easier to shift, headliner seems to be made of cardboard, plastics on dash are not top notch. Instrument cluster is good, reminds me of Audi. Test drove Civic Si, Subaru is quieter, better ride and don't have to shift as often, also get more torque at lower rpm, seats are more comfy and easier to clean, more back seat room. I picked WRX even though it cost several thousand more for its driving character and I like the looks of the sedan.","Instrument cluster, seats.","Improve plastics on dash, headliner, lighted visor, better stereo, power seats,sunglass holder."
4,Excellent car,Rob ,02/15/2008,,,5,4,4,4,,4,4,3,4,"I recently purchased this car and have been very happy with it.  The performance is excellent: the tight steering, acceleration, and the way the car sticks to the road.  This is my third Subaru as I can't seem to part with the AWD.  Definitely go with the premium package, it's worth it and adds pizzazz to the car.","Large engine for a small car (170HP), AWD, exterior trim with alloy wheels, neat display and layout in the interior.","Well, the car seats are low. In fact, the whole car is low to the ground, including the engine which may explain why the car hugs the road so well."
5,Fantastic,Mike ,01/31/2008,,,5,5,5,5,,5,5,5,5,"2nd Subaru. I traded in a 2007 Impreza. Got tired of the styling and ride. New 5 door just great. Get over 27 mpg mixed hwy and city. Car not broken in yet. Smooth, quiet ride. Zigs zags in and out of traffic. Buy it! You will love it!","Mirror that tints, New interior styling, smooth ride and great pick up. Seats fold flat in the back.",For some reason the hatch back doesnt pop open with the trunk release on the key fob. I will take into the dealer to get fixed.
4.5,great car,new buyer ,01/26/2008,,,4,4,4,5,,5,5,4,5,I just purchased the Impreza. The 170 HP and AWD make the car perform exceptionally. The seats are of a 70s type found in cars in the 80s the velor which i prefer stitched cloth. I have test driven many cars this was my choice., The powerful 173 standard HP . The ability of the car to exceed others in ride quality and safety. Over all low interior noise., Seats should be better constructed. What is with the card board interior roof? 
4.625,It rocks!,New to subaru ,01/09/2008,,,5,5,5,5,,4,5,4,4,"Had been looking at the WRX.  But cost of gas using this as a commute car , made me look at the regular Impreza.  I was under the idea that the Outback sport had drum rear brakes.  That is wrong.  My salesman pointed this out to me on a just delivered silver Outback sport.  I look the looks of it.  It drives so solid. If you haven't driven a Subaru before take a test drive, it is the oddest feeling and it is great.  Try this car and you will buy one.  The winter package is only available on the outback sport and the WRx.  Interior is great and the car handles very well.  No regrets buying one. ",heated seats wiper defrosters Room 4-wheel drive the way it drives,optional sport suspension for non-wrx a more economical WRX 
3.875,2008 Subaru Impreza 2.5i,joker75 ,01/07/2008,,,4,4,4,4,,4,4,4,3,"I just purchased this car yesterday. I have already put 100 miles on it, and have been very impressed. The VDC has kept me going straight even on very snowy and icy roads. I originally wanted a 5 speed manual, but the throttle response was terrible. with the car in gear it took about a full second to even feel the engine try to accelerate after pressing the gas pedal. However, the throttle response on my auto is immediate.","AWD w/VDC, can't beat it in the snow. Cool gadgets like iPod controls in radio. I like the looks, but wish I had a WRX with the hood scoop instead.",No major complaints yet. I only wish I did not have to baby the engine through the break-in period. Faster is usually funner.
4.875,Nearly Perfect,chris ,01/07/2008,,,5,5,5,5,,5,4,5,5,"Have had the car since the end of Nov. and I am loving it.  Outback package is the best of the bunch, larger wheels, two tone, great features for a great price. Great in the snow, after 3000 miles I am averaging 24.6 mpg in mixed driving.  The look grows on me more and more.  Roof rack is noisy, but easy to take off. Not a big fan of the stereo, the sound never seems to fill the cabin or your ears. I think I will upgrade or get the amp.  Heated seats and mirrors are great.  Overall I am very happy.","Heated seats, mirrors and wipers. Gas mileage (former suv owner), mpg gauge, I am a whole new driver. Roomy cabin and storage. You can plug in your iPod, zune, etc.","Stereo, stereo, stereo 100w for the premium package, c'mon!  Seat position and comfort, but it is breaking in"
4.375,2008 Outback Sport,Jeff ,01/03/2008,,,4,5,5,5,,4,4,4,4,"The 2008 OBS, as with the Impreza/WRX family, is substantially changed from 2007. Most of the major issues on the earlier models (interior quality, handling, braking, climate control, tires, etc.) have been addressed, mostly successfully. The 2008, IMO, is far closer to the ideal of a WRX w/o the turbo than past attempts. The OBS's ability to travel through rain/sleet/snow, etc. is superb. Still, its appeal will likely be limited to those who value 4wd and a sporty image over size, utility, and gas mileage.","Full-time 4wd. Safety packege is world class. Braking w/ ABS, and force distribution. Standard feature list. Very nice stock tire/wheel package. Very modest price for what you get.","Gas mileage is mediocre at best.  The passenger seat is very low relitve to the dask board. Check before buying! Performance-wise, it's not a sports car. Gearing is needlessly/stupidly low w/ 5mt. The stock speakers are poor and are shallow-mount, limiting replacements options."
4.5,"Beats Matrix,Fit, Versa and Vibe",Aamir ,12/28/2007,,,4,4,5,5,,5,4,4,5,"This car beats the Matrix,Fit and Versa when it comes to stability, power and performance. Try all the above in Wisconsin weather and you would know what I am talking about. Try the Impreza AWD and you would know why the trucks rush past you without caring much about the snow. It is the AWD, baby! The only thing I care about is the mileage. It is low but the car can give you more than 20 mpg driven in city conditions. It is as powerful as my Camry and does groan as others do when you hit the gas. The pickup is instant. The steering does not vibrate when on highway. Compared to all the above wagons this one is the best, safest and the fastest.","AWD, IPOD interface, Bluetooth Interface Sat Radio",A little more leg room for the driver. Mileage >25mpg
4.25,New to Subaru and Happy,nt22 ,12/21/2007,,,4,4,5,5,,4,4,3,5,"So far I have really enjoyed my new Impreza (3000k miles/two months).  I opted for the simplified and economical 2.5i auto 5-door in dark grey with a center armrest ext.  I've already added on the aux jack, rear seat net, and rear bumper cover.  It's definitely a joy to drive around.  It makes you hate city traffic, bored with open highway, and eager for some empty country roads.  It would be nice if it were a bit quieter, but then it would be a Saab.  I originally wanted a Saab 9-2 a few years ago, but it was discontinued and this car substitues perfectly, with the added bonus of AWD.  I'm getting 25 mpg on mixed travel.  Measuring highway trips gets me 28-32 mpg.  Had absolutely no problems.","AWD, MP3 disc capability and aux jack, hatch and 100% fold down rear seats, MPG/temp indicator, auto headlight shut-off, Sportshift, All safety features (lower insurance cost), small storage pockets under cargo floor, and ability to easily add tons of handy accesories after purchase. ","5 speed auto, better MPG, upgraded interior, improved stereo sound quality and controls layout, better rear sight lines, a little less road noise."
4.375,Great Car Great Price,oZeven600rr ,12/19/2007,,,4,4,5,5,,4,4,4,5,"Lots to love about this car. For the low price, you get AWD, tight suspension, pretty good MPG, fun, and room. The base stereo (4 speakers) is actually OK and doesn't distort at high volume. I will be adding the Subaru subwoofer soon. The ride is great and the car feels like it has claws that attack the road. 5 spd is fun since you have more control. Trunk loses some space as it raises toward the back because of the new double wishbone suspension. Interior is good for the price. Plastic used on the door and dash, but for $16k I don't mind. I like the looks of the 2007 better, but oh well. The 08 is more ""grown up"" looking. ","MPG readout. It really helps to conserve gas when wanted. I am getting 32 mpg hwy and 26 mpg city when driving conservatively. I love it with AWD! If I decide to have some fun on snowy roads, mileage drops to about 23. Still good for AWD.","I can't seem to get the driver's seat with the pump height adjustment to fit me comfortably. Too high and I feel like it is pushing me out of the seat, too low and it is like I'm ghetto cruising. "
4.875,Great Impressions,SkyHigh ,12/15/2007,,,5,5,5,5,,5,5,4,5,"For the money the car can't be beat! Even with the lower fuel enconomy, Honda and Toyota don't compare. Upgrading to the Premium package is worth the extra $. I've only put 400 miles since buying it and have yet to run above 4000 rpm (break-in period) but the engine is itching to perform! The standard AWD is perfect for Colorado weather. Seats are much more comfortable in '08 than earlier models! Great car and very happy so far!",AWD and VDC for piece of mind. H4 engine is the same as many piston engine aircraft use. Seats!,"Keys are way to big! What happened to normal sized keys? I would like heated seats too. Chrome, or chrome plating on the grill, window trim and trunk should be replaced with body color or black molding!"
4.875,Impreza1,mike310 ,12/10/2007,,,5,5,5,5,,5,5,4,5,"We got the 2008 hatchback and have 1700 miles on it.  Handling and comfort are excellent, it's really fun to drive.  Performance getting better every day as the engine gets broken in.  Used it in some deep snow, traction is great, it climbs steep snow covered roads with ease.  So far the mileage is the only gripe.  Getting about 20 around town and 26 - 27 on the highway.  Hope it gets better when it fully broken in and the weather warms up. Excellent car, we had 2 Legacys before but the new Impreza is roomier than the old model.  I'd buy another.","All wheel drive, traction, handling, comfortable seats, full air bag package standard.",Mud guards on base model.  Better mileage.
