5,Love my X3!,ECS ,02/02/2016,5,5,5,,,5,5,5,5,,,"I am the second owner of my X3...it is a local car purchased at the BMW dealership and had been serviced there.  It now has 95,000 miles on it and I plan to keep for a long time.  I have learned that it runs much smoother on 93 octane Shell gasoline.  The only issue I have is the tire pressure light is on and numerous people have tried to make it go away with no success...BMW dealership does not recommend spending the money it would cost to clear it.  My husband is 6'2"" and he does have difficulty getting in the car but finds it roomy enough once he is in!",,
2,Never Again,Mackenzie ,12/09/2015,2,3,5,,,1,4,2,3,,,"I just got my 2008 BMW X3 a few months ago back in April. I bought it off a used lot and as I drove away, the engine light came on. I've taken it in multiple times and I've had everything from my radio just suddenly not wanting to work to my car cutting off in the middle of a busy intersection. This car has almost gotten me in many accidents with its poor driving performance. I actually had it in the shop for a week during Thanksgiving and as soon as I got it back it broke down and left me stranded the day after. I got it back to the repair place and it magically had 10+ new issues. We have spent well over 3k in the past few weeks on this vehicle. I would absolutely never suggest this car to anyone especially as their first car unless you want to constantly have your car in the shop and 0 money in  your wallet. I will never purchase a BMW ever again. They say to get rid of a BMW once it hits 85,000 miles... I should have listened.Oh, and not to mention its HORRIBLE gas mileage. I fill up every week and it costs around 50 bucks every time. It's ridiculous.",,
5,Still One of The Funniest Cars I've Owned,rootforthecubs ,11/13/2015,4,5,5,,,5,5,5,5,,,"Purchased my pre-owned 2008 BMW E83/X3 coming off of a lease with 32,000 miles on the clock.  Lucky enough to find a rare 6 speed manual, which sold me from the get go and unfortunately the dealership knew as in their words ""we have 2 other people with cash in hand willing to buy the car sight unseen"", and I believed them, but still got a fair deal.  So far I haven't any electronic or sun roof issues which I understand come with the territory.  Obviously can't speak to the automatic shifting complaints that are out there but I can say the 6 speed manual shifts like butter.  In summary, the 2008 X3 is roomy enough for the family and fun enough for Dad to drive.  The interior is appealing to the eye and logically laid out.  My only complaint is that they stopped offering the 6 speed option after 2010 or I would have bought new.Update: one year since this review and I haven't had a single issue with this car, still lovin it, can't wait to tackle the coming Winter!",,
4,Great SAV /Sports car,Joe Iuzzolino ,10/09/2015,5,4,5,,,5,5,5,4,,,"I'll tell ya, I've had a bunch of SUV Japanese vehicles and none compare to the X3. Love the power and handling. I have not had it in snow yet but looking forward to taking to the mountains this winter, it's a tight suspension and I like it. Bluetooth works but not as easy to set up as other vehicles. Really like the interior but most of all the power and steering are aesome, I have the xenon light pkg  wow! I love the adaptive lights!",,
1,"BMW, never again",Ken Hardy ,08/13/2015,2,3,3,,,1,3,4,4,,,"I have owned 5 BMW's over the last 30 years, 2 were good cars 3 were not, the current 2008 X3 is the worst of the lot. body water leaks, engine oil leaks, sensor failures, water pump failure, ignition coil failures, transmission failure, you name it and I have had to have it fixed all before the car reached 91000 miles. I purched the car from BMW as a certified used car and had trouble with it from the beginning. The Dealer was of little help they just kept telling me the transmission was fine UNTIL the extended warrenty ran out, then it was "" It failed and you need to replace it "" at a cost of 8 grand. BMW is not the Ultimate Driving Machine, they are the Ultimate Maintenance Machine",,
3,let down,jeff ,07/28/2015,2,2,3,,,3,4,3,3,,,"I knew what we were getting into with the car when purchased back in 2012, with 58k miles on it. But I was assured that BMWs last forever.  Wasn't a full month and the car was in the shop. Spent hundreds on the vanos, which I later learned is German for ""don't let your local non certified BMW mechanic work on your cat or you will spend hundreds of dollars repairs the vanos"".   Gas guzzling vehicle, but just never captured any value from the car. Just a big let down from day one.  Oh and a bright orange light in the car was annoying as was the fact I could never pair the Bluetooth despite 3 ""know how to do it"" guys trying.",,
4.625,Would Recommend 2008 BMW X3,micbk90 ,05/25/2015,,,4,5,5,5,,4,5,4,5,"I bought this SUV a year ago and I'm extremely pleased.  Needs just regular maintenance as far as oil changes, etc.  No problems whatsoever.  Drives great and I feel very safe in this vehicle, especially in snow.  Very sturdy and I live in Pittsburgh so we get a fair amount of bad weather.

I've had 3 Audi's and a Volvo; this is my first BMW.  I really do love the X3.  I can't drive a big SUV.  I'm 5'0"" and this is the perfect size.  Not too small, but not too big.

Note:  I have the 3.0xi automatic, not the 6-speed manual but it did not provide that option.",Love love love the heated steering wheel.  Also love the bluetooth and the programmable garage door opener.  The X3 has great features and amenities.  The leather heated seats are great and super comfortable.  ,Gas mileage is decent but could be improved.
2.375,Never again,ohicks ,10/08/2014,,,3,3,1,1,,3,3,2,3,"First and last BMW.   Quality is not what you would expect from a high end vehicle.  Problems started almost immediately, the warranty covered the repairs not the in convince of the wasted time.  After warranty ran out.. 55k miles...replaced window regulator on passenger window, at 60k miles, replaced all 6 sparks plugs. at 65 k, replaced valve cover gasket. at 67K, replaced water pump.  Now at 68k, all 4 engine mount bolts have sheared..vibration broke the water pump.  Never again.. Disappointed in BMW's responses.",,
3,Sheared Motor Mount Bolts,wrh47 ,04/16/2013,2,3,3,,,2,3,4,3,,,"2008 BMW X3 with 59,000 miles sheared all 4 motor mount bolts in normal street driving.BMW said Âtough luckÂ.A quick internet search indicated this was not an isolated incident, many other relatively low mileage BMW's have had sheared motor mount bolts.I believe this problem to be a serious safety issue and filed a complaint with the National Highway Traffic Safety Administration.I encourage others that have had similar problems to file NHTSA complaints at the following website:safercar.govClick the ÂREPORT A VEHICLE OR CHILD SEAT DEFECTÂ Tab and submit your complaint.If there are enough complaints, BMW will, hopefully, be forced to acknowledge this problem.",,
3.125,I'm very much disappointed,nstephanie ,09/24/2012,,,4,4,3,2,,3,3,2,4,"I've just finished the 4 year warranty with my car as of September 1st 2012. The car was at the dealer several times, the gas odometerdoesn't show the actual gas in the tank even the tank is full until several days later. It doeslet me pump gas into it and keep stop getting gas even the tank is not half yet. The water pump was not working just 2 year for a brand new X3. The dealer had to replace a new pump because the engine shut off while I was driving several times due to no coolant water in the engine. Now the warranty is over just 22 days, the car is just 28k and the coolant water pump having the problem again.I'm very disappointed and regret that I bought this expensive car.","bluetooth feature, heated seats, stable brakes",BMW should make the car more reliable for all features since there are too many bad reviews. The car is expensive but it is not worth to spend that much. I would rather buy a Lexus. Please make a better coolant system and water pump also for the sensor for the gas tank.
3.375,BRAKES FAILED,capricornlady ,03/14/2012,,,4,4,4,1,,4,4,2,4,"My X3 brakes failed causing a major accident.The accident resulted in approximately $75,000 worth of damage.BMW denied any brake issues.When I picked the vehicle up from BMW body shop I had to return it.All of the brake indicator lights on the dashboard lit up. I loved how my vehicle handled, but there were frequent trips to the repair shop, including previous brake jobs.It was disturbing and disappointing that BMW denied a major issue that could have resulted in casualties.BMW blamed the car mats for the accident (sounds familiar).Yet they returned the vehicle with mats in same position.Car was in service 2 wks before accident.A co-worker friend had similiar experience.","Sturdy handling, Nice design, Headlamp washers,
full folding backseat, access to trunk from back seat, heated steering wheel, all wheel drive, ability to drive as automatic or manual.","Increase back seat leg room.

MOST IMPORTANT...improve brake system.
Be honest!
Brakes are serious, inspectors should never lie about faulty brakes even to save reputation!"
3.375,2008 X3: Problem Prone,shnoby ,10/10/2010,,,2,4,1,4,,4,5,2,5,"I've owned BMWs for the last 10 years; I love the way they handle. Fortunately, my 2008 X3 is a lease.  At 5K a chronic, very loud engine tapping began (akin to the vehicle in the movie 'Chitty, Chitty, Bang, Bang.') I had it serviced at least 6 times. By 21K, the tapping reduced to a soft finger strumming, it still taps, but I deal with it.  The engine strains on small & big hills & fails to shift. The car has, on *multiple* occasions, locked me inside.  Neither the unlocking mechanism nor the windows opened. I drove to the dealer, called them on my cell, had them force the window down & climbed out.  The interior handles, cup holders, arm rests, etc. are peeling& have been replaced once.",Runs on flat tires & can be driven manually.,See above review.
2.375,Bucking bronco,Atlgax3 ,10/04/2010,,,4,4,1,1,,1,4,3,1,"Unexpected acceleration when going over bumps or after turning uphill can throw you into car in front of you, complete hesitation on entrance ramp, strange gear changes. Totally unacceptable and un-ultimate driving experience. Turned the 2007 model in as a lemon because it was so dangerous. 2008 is only slightly better than 2007. No help from software patches at dealer service dept. Will ",lease almost over,totally different transmission needed
2.125,Part 2 of N52 engine really has problems,1978bmx ,04/28/2010,,,3,3,1,1,,2,3,3,1,"My review somehow incorrectly stated the miles on my X3. The engine valve issue started at 6K, Not 60K as it states. And the car only has 11K,Not 110K as the reviews states, and yes it has been in the shop 5 times in a year and a half. The followup to my last review: After being in the shop for the 5th time BMW thinks the valve slam/tapping is normal! you should hear this especially during a cold start...it sounds like crap, no kidding it slams and thumps like crazy, and this was AFTER the cylinder head replacement! the sound comes and goes still! BMW WILL NOT DO MUCH FOR YOU AFTER THESE ATTEMPTS TO FIX A DEFECTIVE ENGINE ACCEPT TELL YOU THAT THE SOUND IS NORMAL!! BE WARNED FUTURE BMW BUYERS",None.  ,Work on quality issues.
3.25,N52 engine really has problems,1978bmx ,04/04/2010,,,4,3,1,2,,4,4,4,4,"I purchased my x3 new, did my research and the x3 came in to be up there with the 3 series in quality.  At around 60k the valves started to tap like crazy, (metal on metal sounds- if yours is doing this it is not normal! It needs to be repaired- don't let the dealer service people tell you it's air bubbles in the oil. It will lead to premature engine failure this should be covered under warranty) the tapping sound was especially loud with cold starts. The engine cylinder head was replaced, but the sound is more of a thumping slamming sound now, it will be in the shop this week again! Even the BMW techs I've talked to, feel the quality of BMW is really slipping. ","None anymore, I've really lost my passion for BMW","If you're shopping for a BMW, I would advise you to consider Infiniti, Lexus (Toyota still builds a great product-regardless of what you hear in the news!)My BMW dealer service guys have been great about taking care of me,  but after only 110K this will be its 5th time in the shop! it's getting old"
2.25,First and Last BMW,Gary ,03/15/2010,,,2,4,1,1,,2,3,3,2,"Well German engineering aside this SUV has been the worst new car I have ever owned in 30 years of driving.  It lives at the dealer.  So far still cannot fix the hesitation issue which is severe in normal ""D""; moon roof significant issues: needed new exhaust at 40K miles: blower motor issues; navigation system is major piece of junk: now satellite radio is defective and no parts to fix it; X drive is lousy in the snow not really a true AWD system; etc.  Horrible vehicle trying to get out of the lease early.  When get loaner car usually a 3 series love it.  X3 is just a BMW fiasco stay far far away from any of these until they redesign it.  Oh love heating steering wheel.",BMW emblem Heated steering wheel,The entire vehicle from head to toe.  No quality on any level here this SUV just is horrible awful etc
4.75,Second X3 better than the first,Eric ,02/28/2010,,,5,5,5,5,,5,5,3,5,"We leased a 2005 X3 and loved it so much, we leased a new 2008 when the first lease was up. I wanted to post this review because many people post because they have an axe to grind. Both X3's we owed were excellent. The 2008 has been completely perfect, no flaws or repairs in 22,000 miles. The new 3.0si engine that was put into X3 beginning in 2007 flat out rips with 260 HP. Handling is great, yes it is a little stiff but you are rewarded with a SUV with 50:50 weight distribution and very sporty handling. If you want a cushy floaty ride, numb steering, and 30 MPG, look elsewhere. ",Adaptive xenon headlights swivel in the direction you are turning. Rain sensing wipers. Fast shifting 6 speed auto tranny. Heated seats that also warm your lower back. The new 3.0si motor. Drives like a BMW should. I actually like that this SAV is based on the older E46 platform. ,"Gas mileage with the new engine is better than the 2005 engine, but is still not stellar. The Bluetooth hands free phone system is terrible."
4.125,Solid for a challenging climate,Debbie ,01/29/2009,,,4,4,5,5,,4,4,3,4,"For me driving in major snow storms is a given.  This vehicle does everything you need it to do and feels rock solid.  I drove through a monster storm this morning and to a ski resort last week on poor road conditions. I was never concerned.It tracks the road, is very stable and in the worst storm is balanced and steady.   Unlike some larger SUVs I have had, the size and weight distribution on this vehicle provides a feel for the road surface and an ability to get you there.  This vehicle is for someone who wants a smaller suv that can get you around in the worst of conditions.  And of course, its a BMW so it goes without saying that the interior, the reliability and the extras are fantastic","It has a solid drive, does not feel like a truck.",The styling is good but not great.
4.75,Really fun to drive,Mike ,01/22/2009,,,5,5,5,5,,5,5,3,5,"I have owned my 2008 X3 for 1 year. The ride is great, handling is incredible. Brakes are superior. I have the winter package, it works well. Had a problem with the heating coils in the back seat, they stuck. Dealer did a great job fixing the problem. GPS and radio are cheap at best. Gas mileage average. AWD is great. Overall great car so far.","Ride, handling, engine, brakes.","Radio, GPS, better gas mileage, vehicle is a little over priced."
4.75,2008 bmw x3,78bmx  ,11/21/2008,,,5,5,5,4,,5,5,4,5,"Driving Hondas for years (owned three and put over 200k miles on each of them). I recently purchased a new BMW X3 in September. Been a BMW motorcyclist for over 25 years. I thought I would try one of their four wheeled models. I have been a bit skeptical about the quality of BMW cars, ""they drive great, but more electrical demons than you can imagine"" and so on is what I would hear. The X3 drives great, it's a solid handler, great tracking, good road feel. But guess what: at 1243 miles my cd player-radio just decided to quite working, off to the shop it goes. It's a minor issue, but a radio should work on a brand new $43k car!! ","No question about the handling of these cars. Great road feel, great performance.","Improve your electrical engineering! BMW builds a great car, but the Japanese have you beat on quality issues, I know my radio issue is minor, but who knows what's next?"
4.5,Great Crossover,Deal Finder ,11/17/2008,,,4,4,4,5,,4,5,5,5,"This is my 2nd BMW in 2 years and I love this X3. It is fully loaded (I got a dealer demo so got a great deal) and in the 2 weeks that I have driven it I got 22 MPG. I tried Acura, Infiniti, Volvo and Lexus. No doubt you pay a little more upfront, but once you drive it for a few years its all worth it - thanks to 0 maintenance for 4 years and the overall BMW brand value. When you buy a BMW you don't buy a car - you buy an experience.","Engine response and overall handling, navigation, comfort seats, loading space in the trunk, Xenon adaptive lights and last but not the least the turn lights. A bright light comes on in the direction you are trying to turn - makes you more confident about the turn.",Option to buy a upgraded engine - the 335's engine in this will be great.
4,A joy to drive,JOHN ,10/14/2008,,,4,4,4,3,,5,3,4,5,"I have had the X3 for about 6 months and now has about 10,000 miles.  Its a great SUV.  Great handling, good power, controls are easy to use (but a little old fashioned for a 2008).  I like the panoramic sunroof though I rarely use it.  Gas mileage is fairly decent.  Theres not much room in the rear seat for passengers.   ","Great handling for an suv, nice power, pano sunroof,  responsive transmission, stiff suspension","Cup holders are to small to use, aux control is in the back seat, get rid of the cheap unpainted trim"
4.75,Fun and Practical,Kevin P. Kamraczewsk ,10/14/2008,,,5,4,5,5,,5,5,4,5,I have had my X3 for 6 months now and find it to be fun and practical.  It has been extremely reliable. I have the automatic and most options. I am averaging about 22 mpg. It is very useful for hauling around my dogs and for moving things back and forth to my daughter's college which is about a 4 1/2 drive away.  It holds a surprising amount of stuff.  The handling with the Sport Activity package is great. It handles better than my last sedan.  The navigation calculates (and recalculates) very quickly.  The xenon headlights automatically follow curves which is great for the dark streets around my house. The seats and steering wheel heat up very quickly on cold nights.  ,I really enjoy the handling and acceleration.  The steering and brakes are very precise.  The mileage is pretty good too for a 4 wheel drive SUV.  ,"It would be nice to have dual temperature control for the air conditioning,  heated and cooled seats, and a surround sound system.  Push button start would also be a good option."
2.75,"After 11k miles, it's time to walk away",Paul Milton ,09/15/2008,,,3,4,2,1,,4,4,1,3,"I leased this '08 X3 in December of '07. Unfortunately, I regret the decision. The X3 is no doubt an excellent driver for a 4100lb small SUV. By small, I mean the interior is very small and cramped and only after owning this vehicle for some time I now know it has limited utility and horrid resale value. Others such as the Lincoln MKX are cheaper by thousands and more practical in every way. ","Good brakes, steering. Nimble handling. Comfortable front seats. Good winter traction with snow tires. Other than that not much can be said about the X3 that is great or even good. ",Gas consumption is abysmal. I normally see 13-14 MPG on the computer display. The downside to the excellent handling is a stiff ride- you feel every bump and imperfection in the road and on long trips makes your kidney's hurt. Reliability is poor. Edmunds does not provide enough space to list all
1.875,Overpriced Horrid BMW Model,Marc ,08/28/2008,,,2,3,1,1,,1,3,2,2,"This is an update of an original posting.  The BMW X3 has HORRIBLE engine and transmission response.  The dealer can not remedy it as no more software updates are out from BMW but I do not think any more computer programs will solve the potentially dangerous throttle response; you do not go anywhere at times when merging.  The navigation system is awful I had to buy a Magellan unit.  The handling is sub-par, think the crappy cheap Pirelli STR part to blame but not up to BMW standards.  BMW corporate is impossible to deal with they are of no help at all.","BMW emblem, heated steering wheel.","Engine and transmission. Navigation system. Radio, even upgraded one, sounds like junk. Handling and tires are a mess.  This is the WORST new car I have ever owned and BMW should be ashamed of ever producing this model."
2.5,Disappointed,car guy ,08/18/2008,,,3,3,1,3,,3,3,1,3,"This is our second BMW,  we are so disappointed with the quality of construction.  The front bumper, a pathetic piece of plastic just buckled and fell when going over a bump.   Told by a BMW service agent that this is happening so frequently with the x3 that people are not even bothering to fix the bumper, they just drive around with it hanging.  This is unconscionably  poor construction, design and quality.  There are other issues with the quality of materials used in the construction of this car.  This is definitely our last BMW and if it wasn't a lease, I would get rid of it immediately.",,
4.375,2008 BMW X3,don592 ,07/22/2008,,,4,4,5,5,,5,4,3,5,"Ive had the auto 4 months, handling is outstanding.  Acceleration and braking also outstanding.  Interior fit and finish are top quality.  I ordered a 6 speed manual, a big part of the fun factor  the manual transmission is smooth and easy to use, although the position of reverse, to the left and up of first, takes some getting used to. The exterior finish is perfect. Dashboard and radio controls are different than most cars, but after a few weeks, it all makes sense.  While super unleaded fuel is recommended, the auto runs fine on regular.  My previous car was a Honda Pilot which was a nice solid car, but the X3 brings back the excitement of driving and everything still fits.",6 speed manual transmission - it's not the Japanese transmissions of the 80s and 90s.  Xenon headlights worth the money.,Don't waste you money on the HD radio - it has not been perfected yet.  Too much waiting for signal (30 miles outside of NYC).
5,Love it!,cv ,07/17/2008,,,5,5,5,5,,5,5,5,5,"It's my first time to own a BMW.  I have to say:"" WOW!""  For a SUV, this one is easy to handle, easy to park, excellent engine, good acceleration and sensitive brake! The gas mileage is not bad at all! Plus the BMW ultimate service package.  I'm very happy with it!  It's been a week, I have a hard time from getting off the driver's seat. And when I'm out of the car, I couldn't get my eyes off it.",Bluetooth Technology.  Panoramic moonroof. SOS service button.,The cup holders are too small
4.5,Bmw X3 Review,steve ,06/22/2008,,,5,5,5,5,,4,5,3,4,"This is my 3rd bmw. I have owned the 323 sedan, 325 coupe and now the X3. the X3 has the most power of the group but does not handle as good as the coupe. This is expected since it is a truck. I put in all the bells and whistles and only option I would not recommend is upgraded stereo. The Harmon Kardon upgrade in the 325 coupe sounded much better than the X3. I do not know if it is b/c the x3 is a truck and is bigger and more open, but not worth the money. I only have 200 miles on the car, gas mileage of the car is 13 miles. Hopefully that will go up as I put more miles on the car. I would highly recommend this truck, loving the view from up high and drives excellent. ","Leather seats, heated steering wheel and seats, panaromic sunroof, aux input for radio.","Upgraded stereo needs to be improved. BMW should go back to the drawing board and put a real upgraded stereo sound system in this car.  Please add sirius radio as a factory option, not worth $1000 to put in as an aftermarket product!"
4.875,The best vehicle I've ever owned.,Rick ,06/09/2008,,,5,5,5,5,,5,5,4,5,"From the moment I first climbed into the cockpit of the X3 till now, it has been a great driving experience.   I used to think all the BMW talk was hype. Not any more.   Aside from the fact that this is the best handling auto I've ever owned, I am still discovering all the fine features of the X3.   Recently, I opened the sunroof. It opens the entire length of both the front and rear seating areas, wow.   I play my iPod all the time, and I think the sound system is awesome.   The bottom line is the 4 year or 50,000 mile warranty including all service and roadside assistance. Who else has this much faith in their vehicles?","Power everything, leather interior, display, including the GPS, and the stereo.",I have already upgraded the floormats to a berber weave.   And the carpet looks thin to me.
