3.125,Slow Love Affair,Chicabags ,11/06/2009,,,2,4,3,5,,3,2,3,3,"This is my first brand new car and Subaru. My first driving an AWD as well.   At first I didn't like it much.  It took me a year to appreciate it.  In time I experienced how safe it kept in challenging weather, bumping terrain sudden braking. I love how safe it keeps me on the road.  This is important to me since I drive quite a bit on a daily basis, street and highway. However, there are a lot of things I would like changed. Appreciate anti-theft features standard with the model.  ",New exterior design.  Really LOVE the Newport Blue.  The upgraded stereo sound system is great for my taste.  Don't need to blast it to enjoy it.  I love the surrounded system feature.,REPLACE NAVIGATION PROGRAM.  Very inaccurate and unclear mapping directions. Unreliable.  Too difficult to figure out. Side view visibility poor. Front seats too low.  Back window view difficult to gauge closeness of car behind. Need to use side view mirrors for clarity.
2.5,Not worth the money,Carmen ,11/01/2009,,,4,4,1,1,,3,2,1,4,"Way too much money for what you get. I paid $34,000 for my 2008 STI and it started to wear, rattle, and the is so cheaply done that it scratches easily and flakes off.  The car is fast but is very hard to get it to drive smoothly. It jerks with the smallest of gas and throttle inputs. The utility of the hatch is great and its very fast. I averaged about 17 mpg and that should be against the law in a 4 cylinder car. The seats are cheap and offer no support. I have been in $18,000 cars with better sport seats.",1. Speed the car is fast. 2. Utility of a hatch 3. Styling,"Subaru needs to use better paint. The interior ages quickly and the shiny parts scratch and flake.  The seats need to be bolstered and of a higher quality.  Get rid of the rattles it rattles in the front, sides, and back. Use direct injection for better gas mileage."
5,My 5th Subaru--And Not My Last,ccarbone22 ,09/10/2009,,,5,5,5,5,,5,5,5,5,"I bought the Impreza in March 2008.  This is my 5th Subaru, and I'm a big fan.  So far over 15,000 miles, not one single problem.  The 2.5L engine is great, and the car handles quiet well.  Lots of cargo room with the rear seats down, and the optional roof rails and cargo carrier are helpful too.  AWD is great, and over the 15K miles, I've gotten 26 MPG overall-- which I think is really good considering the AWD and larger 4-cyl engine.  The wagon (yes, it's a wagon, not a hatchback!) looks great-the sedan is kinda boring.  Interior design is nice, and the materials are an improvement over past Imprezas.  Looking forward to many years and miles with this car!","The growl of the boxer engine, AWD, exterior design, reliability, and the fun of driving it!  And the fact that it's a Subaru!","Subaru, PLEASE get a clue and start putting better sound systems in your cars.  Every Subaru I've owned has had a terrible sound system.  Otherwise, no major improvements needed."
4.375,Very fun and Reliable!,Huffman.ben ,09/07/2009,,,5,4,4,5,,5,4,3,5,This was my very first brand new car and I'm glad I bought a Subaru. I have had no problems to date. I went through one winter so far and it was easy with the WRX. ,"AWD, Heated Seats,Turbo",Better Stereo.
4.75,Star On ICE!,Carlos ,09/01/2009,,,4,5,5,5,,5,5,4,5,"Greetings! Winter of 2009 my wife and I drove on I-40 somewhere in Oklahoma and the road was coated with snow turned to ICE... it was around midnight and we were the only ones driving on I-40 at about 40-50 mph. All Semi- Truck/cars, etc. stuck along the side of the interstate due to the road condition, but our 2008 2.5i Impreza 5door kept going. The car took control whenever it sensed a ""side-way"" skid. The 2008 2.5i Impreza 5 door handled perfectly well on the snow & ice coated I-40 interstate...  ",All Wheel Drive & Stability Control.,Design a Subaru with a 30-35miles per gallon (combined city/highway).
4.875,My STi,CK ,08/06/2009,,,5,5,5,5,,5,5,4,5,"This is my first Subaru & what I've noticed is that wrx & sti owners have some special bond when they see another. Everyone always waves or smiles. Pretty cool. Those that know what a STi is, are always wanting to race & well sometimes I have to just let her run & they get to see my tail lights. ; ) I've taken it snowboarding several times even in white out conditions & my STi has never let me down. I've taken corners like it was on rails. I don't even sweat it anymore. So... definitely fun to drive & I hope to keep for a very long time because I can't see myself in another car. ","SI-drive, DCCD, boxer engine sound, turbo sound, bbs rims, nav, side fender vents with the STi logo.","I have to think really hard & so I'm nitpicking, but tano cover for my STi's trunk area seems loose & can kinda make a little noise on bumpy roads. Would like standard hid fog lights."
5,Subaru: Always a Great Purchase!,Jason ,07/28/2009,,,5,5,5,5,,5,5,5,5,"This is my 3rd Subaru: 04 WRX (wish I never sold it!), 07 Forester XS, and this car. I'm driving 45,000 miles a year (crazy!) and averaging 30 MPG at usually 70-75 MPH, which is beyond the EPA reading! Cruise control is my friend. Can't beat the AWD in any weather. I HIGHLY recommend any Subaru model to anyone looking for a vehicle. No issues whatsoever with this car. -- If you're car shopping, just take a moment to drive some Subaru's, especially in a downpour or bad weather... I bet you'll be amazed!  For comparison, do the same with other brands. This is when you'll notice more about the true feel of a vehicle versus a bright, dry, sunny day.","Manual transmission (auto was too weak); smooth ride (though it was too ""washy"" until I adjusted to the ride height) after having sports cars; Premium Pkg & lower seats (for the shifting); Body Style; AWD; Because Subaru makes awesome reliable products.",Better paint! I've never had a car's hood chip so easily before. This is my 6th car and even the other Subies didn't chip like this one. Rear hatch rattles. Using tape on the metal ring helps. Sunroof in the Outback version? Better factory roof rails. These are noisy. Diesel?  Please?!?!
2.875,My first Subaru,RT ,07/18/2009,,,2,4,2,5,,2,2,2,4,"All the reviews about paint problems are true. I bought this car 9 months ago and can't believe how fragile the paint is. I've only got 6,000 miles on the car and it looks like there's 4 years of abrasion on the rear qtr panels. Severe chips on the hood and front of the vehicle. Hopefully Subaru officials read these reviews and do something because they're losing customers. This was my first and believe me last Subaru. Unless you want to pay for a total repaint every 3 years stay away from this car. Other Subaru models have the same problem. Oh and do something about the ridiculously low passenger seat and what's with the holes in the front bumper?? Not all states have front license plates!","I like the styling, everything else is average or below.","Put a 5 speed transmission in the car, the 4 speed is totally inadequate. Improve the quality of your paint. Do away with the clown height passenger seat. Stop putting the unsightly holes in the front bumper and do away with the red instrument lighting, it's awful!"
3.75,"Cheap AWD Safety, Small Family Car",Third Subaru ,07/05/2009,,,4,4,4,5,,4,4,2,3,"Biggest complaint: rear drum brakes!  We don't drive too many miles but we do have to deal with snow.  This model is underpowered and boring to drive, but it gets you to your destination safely and reliably in northern winters.  We have averaged 23.5 mpg and have had zero maintenance issues.  The interior is cheap but well put together and functional.  The rear hatch is poorly designed, when you shut it you either push too light and doesn't latch or push too hard and it rubs the bumper.  I am not happy with the amount of rust developing in the suspension, and may take it in to complain about that.  The paint looks great but it chips and scratches very easily.",AWD and reliable build.,"Buyers: Skip the nav and ipod upgrade and get an aftermarket in dash GPS with iPod and sat radio.  But go for a version with disk brakes.  Subaru: use 4 disk brakes, fix the hatch, use better paint, up the power, give us a diesel or hybrid option, and use better rust proofing."
4,2008 Subaru 2.5i ,nospe811 ,06/21/2009,,,4,4,4,5,,4,4,3,4,I leased this car and after 21 months with it I would highly recommend it. It has been completely reliable and has returned decent fuel economy (25 mpg overall). The only major nit I have to pick is with the passenger seat. It is mounted way too low and has no height adjustment. Makes one feel like a four year old trying to see out.,The interior lay out is attractive. This car is very nice looking in Newport blue. I like that the hood stays up with out a prop rod (it uses hydraulic cylinders). The light color interior is very rich looking.,Make the passenger seat height adjustable.
4.125,Overall not too bad of a car,llkdd8 ,06/05/2009,,,5,4,4,5,,4,4,4,3,"Have had car for over a year now with 30k miles.  I like it with no major complaints, just minor ones. Handling is a little soft, but it gives a very nice ride. After driving manual for 18 years, I feel the 4spd Auto Trans is very weak. Should have gone with the 5M, I really miss it. That is my mistake. I have a black two tone and the paint scratches very, very easily, more so than any car I have ever had.  AWD is great, and the VDC is really cool. Next year snow tires will go on, which should really improve the AWD. Even with AWD, 17 inch, wide, low profile tires, aren't the best in the snow.  After 30k miles, averaging about 27mpg in all sorts of driving.","AWD of course.  Nice gas mileage. Very roomy inside (except for hatch with all seats up), with nice head room.  Looks great except from directly behind (not a big fan of the clear rear lights). So far very dependable, no issues at all.  Lots of features for 20k.","Stiffer suspension. Better paint quality. Don't look at it the wrong way you might scratch it. Improved premium sound system. More modern 5spd auto trans. Firmer seats with adjustable lumbar support. Do it yourself mechanics will appreciate this one, better location for the oil filter. Ouch!"
5,Wolf in Sheeps Clothing,Oliverzilla ,05/19/2009,,,5,5,5,5,,5,5,5,5,"I was looking for a car that was a great performing sports car, fun to drive, good daily driver, 4 doors, could be used to get groceries, and did not scream sports car. I found the perfect combination with the my black 2008 WRX STI with silver BBS wheels. This car just rocks. Here are the things that I like best about this car: 1. The ability to tune the car between intelligent for daily driving and sport and serious fun with Sport # -- nothing like it on the market. 2. The ability to change the differential for power to the front and rear wheels - tons of options, tons of power, this car moves! 3. The clean simple design of the interior - very nice but not complicated and overdone.",The breaks... they are wonderful.,"No automatic drivers seat. The stereo is very good but could be better for the money. Floor mats, are a little cheap in the material."
2.375,Go Elsewhere ,Michael ,05/14/2009,,,2,3,2,4,,2,2,2,2,"I've had this car now for a little over a year and I can honestly say that it ranks quite high on the list of worst cars I've ever driven.  Horrible visibility, especially at night, you can't see anything because of the position of the pillars and the size of the mirrors.  Painfully weak and horrendously thirsty engine, you'll be lucky to get 22/23mpg on the highway, driving in cruise control at 65. Quality of materials inside is absolutely appalling, cheap plastics all around!  Clutch pedal has no precision making it difficult to drive smoothly. The Navigation system is overpriced for what you get, and no built-in blue tooth.  The seats though, make me cringe every time I have to drive.",External styling is quite good and the car does look nice. ,"Seat quality, very uncomfortable especially for drives longer than an hour or so.  Engine power, stability, steering precision, steering response. Better quality materials and plastics inside.  Improve build quality so that random ""warning"" lights don't turn on that are just ""loose"" connections."
3.125,Wife's Car ,Kevin  ,05/12/2009,,,4,3,3,3,,3,3,3,3,I know what I have to say sounds a lot like nit picking. However If you are going to lay out 19k on a car you should know a few things. Over all it really is a good little car. However to make it a great car you are going to need to do some work.,24 mpg city/highway. Four wheel drive. Good visibility looking out all windows. Wife loves the car. ,"Needs better: tires, paint, suspension, window sun block, bigger rear view mirrors, sun visor is horrible, a real service manual, bigger controls on stereo, gas cap on left side of car, a real coolant temp gauge.  "
1,Worst Car I've Ever Purchased,emanpa68 ,05/09/2009,,,1,1,1,1,,1,1,1,1,"Words cannot explain how bad my Subaru Impreza has been. The dealership sold me the car with a dirty interior, and damage to paint on the doors. I was told this was to be fixed by a painter, but even he agreed that the paint was too far beyond repair for a minor touch-up.  Needless to say I'm going to have to sue the dealership and have them investigated for fraud if this isn't fixed.  Thanks for Subaru for not standing behind your cars at all. I feel bad for anyone who is going through the same problems with this company since there is a known paint problem with the 2008 Imprezas.","I would say the floor mats, but they are falling apart... so I guess the seats are my favorite.",Use better paint.
4.625,Impressed with Impreza,bakerlexky ,05/06/2009,,,4,5,5,5,,5,4,4,5,"Subaru has won me over!  I build the best selling import in the US and it doesn't have anything on Subaru's!!  This car drives great.  Excellent performance in all driving conditions.  Gets 29 mpg HWY and 20 mpg city,  averages 24.9 in the summer and 23.5 in the winter, great numbers for AWD.  So far I've got 16600 miles with absolutely no problems.  All I've done is changed the oil and rotated the tires.  Quality of the build is A-1. Watch out Toyota!  No wonder Subaru was one of only two manufacturers reporting sales increases for 2008!!!  Buy one you'll love it!",Excellent handling.  Ample stereo with the 10 speaker system.  Really like the new style.  Excellent acceleration!,"Improve the automatic trans! VDC overrides sport shift under hard acceleration.  Not only annoying, but potentially dangerous. Power drivers seat."
4.625,In Summary,jtvb ,05/02/2009,,,5,5,5,5,,4,4,4,5,"I have to say - this is my first Subaru and I'm pretty impressed with it.  It seems well put together and pretty solid.  It's a great commuter that handles well.  With all the negative hype about Subarus and fuel economy, I seem to average 26 mpg in mixed driving and during my daily commutes. Good little car - I can see myself getting another Subaru!  ",Even the base 2.5I comes with plenty of features. To me the car combines some of those qualities I liked best in the dozen or so cars I've owned. The Boxer engine seems pretty smooth for a 4!,A 5 speed automatic and perhaps a better sound system.  
4.75,Best 1st Car,917shadowfax ,04/28/2009,,,5,5,5,5,,4,5,4,5,"Hands down I think this is the best first car a teen could have. I love it. Having been in search of a car and having saved $10k for a car, I wanted to make sure I was getting a quality build, reliable, fun, usable, and most of all SAFE car. Having bought the 5-door the Impreza had more usability, resale value personality, and safety then the Elantra I looked at, and I got it for the same price as an Elantra with the Extended Warrenty and a lower APR. I really love my car. It's beautiful inside and out. Plus it has AWD, something found on only one other car in its class.  ","AWD, build quality, interior space, interior design, ride quality, personality, LED tail lights, usability. ","All hard plastic interior, rear drum brakes, what happened to allow wheels which were standard on the 2007 2.5i? Stereo could be a little better. Standard Aux. Jack."
3.25,Paint Issues,08 wrx dude ,04/28/2009,,,4,1,1,5,,4,3,3,5,"I have recently purchased an 08 wrx 5- door back in September of 08. Since then I have had issues with the paint. With only having 7000 miles my wrx, my old 2006 impreza wagon with 20000 miles still looked brand new compared to my 08 wrx now. I am getting rust on my rear hatch and really bad road abrasion on the fronts of both rear passenger doors and both rear quarter panels. I am very disappointed that this is happening to a $25000 car!!!!!! The dealership has told me that SOA is not going to take action and fix my vehicle because it is normal ""wear and tear"" when it is clearly a warranty issue in the first place. Pretty much I have a great platform with a Hyundai shell. THE PAINT STINKS!!!","Great car to drive, fun and easy once you get the clutch figured out!!! Fast and reliable except for the PAINT!!!!",PAINT PAINT PAINT PAINT PAINT!!!!!! The corrosion and rust warranty is a gimmick because they are not taking care of my issues. Good thing that Subaru has a reliable platform because if it wasn't for that these cars would not sell!!!!!
3.875,A great car that could be better,stijockey ,04/01/2009,,,4,4,3,5,,4,4,3,4,"The STI is a great daily driver: fast, comfortable, good visibility and the hatch makes it practical. Handling is good with some understeer but the AWD grip is amazing.  The interior quality is a little sub-par but it is an Impreza after all. Road noise is a bit on the high side but much quieter than the previous generation.  What's missing are heated mirrors and headlight washers, heated seats and the push button start system.  ","The AWD, hatchback practicality, Turbo","A few more comfort and convenience features, twin scroll turbocharger, Recaro seats.  Oh, the Spec C would be a nice addition the the line up."
4.125,Mostly satisfied,cboy219 ,03/07/2009,,,4,4,3,5,,5,4,3,5,"After 1000 miles, pretty content.  Comfy, good head room, fun2drive! Smooth pickup, good ride.  The 'hum' from the engine is AWESOME.  Good sized trunk.  Car is perfect for a single person - quick and fun, 4 door versatility, adaptable to add luggage racks.  Sporty and stylish enough, but kinda flies under the police radar cuz it isn't TOO flashy.  I did have a cooling hose issue (factory didn't tighten it), and it does 'rattle' a bit which is scary considering I traded in a 1997 Ford Probe that didn't rattle at all, but overall a very great car in my opinion if it holds up over time.  Other Subaru owners near me all are happy with theirs.  I have high expectations for this car.","The functional hood scoop, dashboard ambient lighting, windows are on door frames, unlike the Legacy I looked at.  Great visibility.  Oh yeah, and All-Wheel-Drive with side airbags = safe!","Climate control system requires a training course, but once you figure it out, totally fine.  Sound system flat out STINKS for a $25,000 car.  Would like to be getting more than 22mpg with 95% highway driving, but hopefully that will improve after the break-in period."
4.375,First new car,edan ,03/04/2009,,,5,4,5,5,,3,4,5,4,"It's a sharp looking car. Gets me a lot of complements.  Not a lot of people know what it is which I like. I can't seem to find a comfortable spot to put the seat,  and the clutch is the most unforgiving I've ever used. Fuel economy is pretty good I get about 25 city and 32 highway but I really baby it. There is no use trying to strangle power out of this thing. The interior is super nice, I love the blue accent light next to the shifter to put your phone or whatever. Fit and finish are exellent, interior is beautiful!  Overall though I'm really impressed with the car.","Instruments are easy to read and get along with. Radio easy to program, car is very user friendly. I love the info cluster on the dash. Tells you outside air temp, time, and makes it easy to keep fuel economy up with a mpg gauge.","Five speed manual has given me some problems. Mainly the clutch, its either on or off. You need the perfect touch to get it to take off without surging and bucking on you.  Difficult to get into reverse from time to time.  Car pulls to the right on highway trips. Needs an alignment."
4.75,They're on to something here,legolas11 ,02/07/2009,,,5,5,5,5,,4,5,4,5,"This is a great car. Safe, fun, practical, and great looking both inside and out. I had been saving up for about 4 years to buy my first car (I am 17) and after test driving cars like the Hyundai Elantra, Nissan Versa, and the Suzuki SX4 Sport, I am much happier with an  Impreza parked in my driveway. I live in NY and the winter here, though not the worst in the country, are still pretty bad. The geography doesn't really help with winter driving either. Having all wheel drive vehicle is a necessity and this car fits the bill perfectly. It gives me peace of mind to know that I have the added safety of traction from all wheel drive, no matter what the weather is. ","Usefulness of a hatchback, all wheel drive, beautiful interior design and layout, clean exterior design, all around visibility, the growl from the boxer engine.   ","I would have liked 4-wheel disc brakes, body colored side mirrors and door handles, improved interior materials (there is just way to much hard plastic, not that its cheap) and alloy wheels standard (like previous models). (A lot of this has been covered with the 2009 Impreza.)"
4.875,Great winter car for MI!,Cosworth ,01/31/2009,,,5,5,5,5,,5,5,4,5,"We bought the car to get us through sometimes very slick and snowy Michigan.  And, we love the AWD handling of this car in snow!  Even when the roads are covered with 2-3"" of snow, the car tracks straight and it performs like it's on dry road. ",AWD w/ VDC.  ,Better gas mileage by offering a taller 6th gear.  
4.375,My first and last Subaru,chenn78 ,01/23/2009,,,5,5,2,4,,5,5,4,5,"This is my first Subaru, I bought it because I wanted a fairly inexpensive car with AWD and a manual transmission and I liked the style of the hatch.  The car is a pleasure to drive and gets decent fuel mileage but service and build quality is pretty poor.  The car has a large number squeaks and rattles.  The paint on the car is terrible, the lower parts of the rear doors and the are behind them have been chipped away so badly after 16,000 miles I already have rust forming.  This has to be a design flaw since the front wheels kick everything up on the side of the car and the cheap thin paint chips the second anything touched it. Fuel door release broke has broken twice.",Interior is nicely laid out and comfortable.  Car is great in the snow.  Subaru makes a lot of accessories.  Too bad the build quality is keeping us from trading our 01 Grand Cherokee in for a new Forester.,"Paint needs to be improved, if I was having these issues after 80,000 miles I wouldn't care that much but not after the first couple of hundred miles.  The radio is not that great.  I should not have so many squeaks in a car that is not even a year old."
4.875,2008 Impreza WRX loaded,JMILLER ,01/20/2009,,,5,5,5,5,,5,5,4,5,"Great acceleration, handling, hill climbing and  traction in the Chicago snow. Really like the looks. People are surprised that my car is a Subaru. Average about 27 mpg on the highway and 20mpg in the city. 1st gear is too low and would be nice if there was a 6th gear. Also noticed is hard to keep inside at a consistent temperature  Also nav system should come with bluetooth and not be a $400.00 add-on. For the price, worth every penny.","Turbo, nav system turn by turn and driver's seat (goes up and down) and looks and safety - especially airbags in the rear.",1)1st gear too low 2)Need 6th gear 3)Bluetooth should be included with nav 4)Better system for controlling interior temp 5)Better seat adjustments for passenger
4.25,2008 Subaru Impreza Outback Sport,Stephan ,01/10/2009,,,4,5,5,5,,4,4,3,4,"I bought this car brand-new in September 2008 to replace my 2005 Impreza RS wagon. I love the looks of the new car versus the old - it was long due for a ground-up remodel and they (IMHO) got it right. Upgrading to the outback sport was a no-brainer considering what the package gives you; roof-rack, larger 17"" alloy wheels, a far better stereo, 4 wheel disc brakes, upgraded suspension and the very slick VDC. Oh, and you get to say 'Outback' even though it's also an Impreza. :)  So Subaru calls it a wagon. Why? It doesn't look or smell or taste like a wagon. With the seats up & even with a mild trip to the market, it can't even stuff like a wagon. Call it what it is. A great little 5 door!",Well thought out interior. Nice two-color paint schemes in this model. Keyless entry. Trunk release on the remote as well. Good stereo. Larger alloy rims are visually well designed. Rubberized pad on the bumper for the 5th door. VDC is amazing in the snow. Hood even stays open all by itself. :),"With the best financing incentives tied closely to in-stock vehicles Subaru should make both the subwoofer & the iPod accessory cable standard equipment.  Find a way to get some more engine noise into the cabin - I miss that.  Lastly, a one-touch up and down button for the driver window."
