3,loan only not for keeps,chema ,04/24/2016,3,2,3,,,4,4,3,3,,,"well i decided to test the car at dealer had a very good deal and the fact that i needed to loan to rebuilt my credit. what i like is the car is remote start great for winnterits fast and smooth ride ===== for long trips but seats are not comfortable enough.GAS! in city is poor im guessing 17mpg ? i just drove 125 miles and its already half tank yeah thats cause its a big engine with large trunk so i havent hitthe high way muchmy saab with turbo 200 miles to half a tank in city or high wayanyways i do like a car with lots of interior room trunk is large enough for luggages or groceries some like it for subwoofersradio not the best it has pioneer speakers? cant find that info anywhere...moving on you cant customize almost anything billet grills,headlights,tail lights,instrument cluster,rims.i do recommend the car to anyone",,
4,Love it/Hate it,AT ,04/23/2016,3,3,5,,,3,4,5,4,,,"First I love this car!  Great power, room, and space in the truck!  I purchase my SS brand new and it now has 180k miles.  My biggest complaint  seem to be OEM Parts.  I have replaced the Wheel Bearing three times, Repairman told me there is a problem with GM on these, the original set last for 130k miles the second less than 3k.   The new set is not OEM and came with a three year warranty.  I have had to replace the accelerator senor (twice) and the door actuators (once).  Any more replacement will not be OEM, I've learned my lesson.  Even with these issues I love this car.  Please do not pull along the side and think you can beat me, you may lose your ""pick slip"",  She a BEAST!!!",,
5,Great car love the smooth ride,Richard Cerkleski ,03/31/2016,,,5,,,,,5,5,,,Had this car for 8 yrs not a bit of trouble  only 37000 mi but still runs like new,,
5,LOVE IT!!,Crystal Brown ,02/14/2016,5,,5,,,,5,5,5,,,,,
4,Is what it is,John ,01/31/2016,1,2,3,,,4,5,4,4,,,Low resale value even tho great car,,
1,Stay away from this vehicle,Jason ,10/25/2015,2,,3,,,1,3,3,4,,,"A nice looking vehicle, very comfortable, lots of storage space, rear seats will not fold down all the way making that feature almost useless. Spent over $5,000 in repair work, Including transmission work, before the car had 60 thousand miles on it. I am extremely disappointed with this vehicle having now dumped over $23,000 in a car that I bought used with 17000 miles on it. I shudder to think what is next. Two other GM vehicles in the past had their motors go bad not due to anything I did. Will not be buying another GM vehicle.",,
1,"Run, run, run....away from buying this car.",Debi ,10/23/2015,2,3,3,,,2,3,2,2,,,"Our 2008 Impala has less than 80,000 miles on it, for a seven year old car that is low mileage........right now it's undergoing almost $3,000 of repairs.  Our mechanic said that he's never seen a vehicle with so few miles have such problems.  And of course, one of the problems seems to be another infamous GM defect........an anti-freeze leak.  I Googled it and there are A LOT of complaints about that problem.  Also has severe paint ""crazing"" on the black trim/paint by the windows.  Started very shortly after purchase.  I complained to GM, was told that ""it's not a safety issue"" so basically they were saying ""tough &%*$"".  Won't EVER buy another GM.",,
3,2008 Impala LS,Dederic Crisp ,09/09/2015,3,3,2,,,2,4,3,4,,,I bought this car used abt 3.5 years ago. lock actuators had to be replaced. I know have 200000 miles on it and it's been a pretty reliable vehicle.  I only wish GM would've gotten the kinks out of the motor and transmission.,,
3,Regret buying this car!!!,alsaims123 ,02/19/2015,,,3,3,3,3,,3,3,3,3,"Bought my impala used from carmax. Bought it with 29k on it in 2011 since buying it i have had to replace transmission with 42k then front and rear head gaskets before the 50k manufacturer warranty was up. Since then used the carmax warranty to get the rear window defrost wiring replaced. The warranty's are all up, scared to see what is next. Granted i feel lucky compared to some of the issues people have had to done to their impala. Still have issues with the cd player, driver seat doesn't go up and down like it should. Won't buy another chevy car again. ",XM satellite radio. ,
1.5,Extended Warranty Needed,debrajmsmith ,05/21/2014,,,3,3,1,1,,1,1,1,1,"We have had a lot go wrong with this car (after the warranty went off), and we are still paying car payments to the bank.Besides expected things, like brakes and tires, the following things have gone wrong on this car so far:--1) emissions vent solenoid, 2) rear defogger, 3) front wheel barrings (both), 4) window washer pump, 5) air conditioning air-vent actuator, 6) key-less door lock units (all four) It is hard to feel comfortable driving a car that can have something go wrong so often, as well as hard to find any fun in it. ","It drives nicely and handles well, when nothing is wrong with it.","The car needs to include a 10 year 100,000 mile warranty. --Too much has gone wrong and we still have a while to go with owning it. I don't even want to think of what else is going to go wrong with it."
4.5,Bought with 11k Now close to 100k no issues,michaelvanity ,03/19/2014,,,4,3,5,5,,5,4,5,5,"Only thing ive had to do to this car within the past 90k miles are oil changes every 6 months,I make sure to use the highest octane gas, And I only stick with one gas station, Shell being my choice.I have not had one probem thank God. And I plan on buying a new 2014 Impala, Love the new design. So heres how it add up. Me driving in San Francisco, I live here. Taking frequent trips to sacramento and reno. Lots of city driving. Things ive had done in terms of matienceOil Changes - Every 6 Months Reguardless of what meter saysBest gas you can buy - IE most expensivetires changed twice.Brakes changed once.No Major Issues.Im going to stick with my Chevys.","Smooth Ride, Big Trunk. Security of having a well built American car, I would gate getting into an accident with a rice rocket.

And the Power.
Vroom Vroom. Muscle car to say the least","Well it looks like everything I wanted is in the new 2014 model.

Such a beauty"
2.625,Won't buy another GM vehicle.,md_jake ,01/29/2014,,,3,3,1,4,,3,3,2,2,"Car was my first new one in over 30 years. Bought new against my usual practice of buying used. This car has the worst blind spots of any vehicle I have ever driven, including my pickup truck with a bed cap on it. I have 73k on it now and have already had to replace all four rotors once, had the bottoms of the front doors and right rear fender in the shop for rust work (under warranty) and now my AC compressor is broken ... in the middle of January of all times. Also, my stereo has never worked properly and only plays music through the rear speakers 99% of the time.I think I will trade it in while it has the most trade-in value and try a foreign car or another Ford product.","None really, other than when it was between new-2 years old it was reliable and had no issues.",Do something about the horrible blind spots and make it a quality car again.
2.25,Run don't walk,dennis139 ,01/22/2014,,,3,3,1,1,,3,3,1,3,"We purchased this car with 50K on it. We now have 80K. Trans jumps from starts, both right side door lock stopped working, rear window connector burned, now head gaskets leaking, and trans lines leaking. Total cost of repairs is 4000.00 dollars. Car in only worth about 8K. Paint finish is poor, Would not purchase anotherGM vehicle. ",The ride,Starting building a quality product
3.75,Used buy value,stirfry1 ,01/02/2014,,,3,3,4,5,,3,4,5,3,"Bought the car one year old, now have 60,000 on it with no significant issues.","Larger car with decent gas mileage . A workhorse v6 engine.
Good for tall man","New impala is awesome, but expensive, not a value"
4.75,Great Car. So far so good,chevalltheway ,10/10/2013,,,4,5,5,5,,5,4,5,5,"Purchased used certified from a Chev dealer only 5 months ago with 135,000 km. Was in near perfect condition inside and out. Very fun to drive. Lots of power, no loss of oil or coolant leaks. Recently drove on a long trip and the car performed great! Tons of power through the mountains. Getting about 9.5 liters per 100K. Respectable.I replaced the factory audio system, because it sucked. Performed well but the audio was bad. Replaced with an aftermarket Pioneer deck and the system came to life. Now sounds ok with the factory 6 speaker system. I find better automatic shifting using ""3rd"" instead of ""D"" Not a 4 speed. 3 speed with overdrive.","Looks, power, spacious interior, large trunk. Reliable. Handles great in the city and solid feel on the highway. ",Could use a power seat or manual height adjustment on the passenger seat. 
4,Great value.,stirfry1 ,08/25/2013,,,4,,,4,,4,4,,,"Bought the car with 20,000 on it, and now have 50,000 with no significant repair issues.",,
4.25,Value car,desoto3 ,08/01/2013,,,4,4,4,4,,5,4,5,4,"I bought 2008 impala in 2011 with 59k on the speedometer. Besides a few issues I like the car. In 2013, the car now is at 92k.",Powerful engine in a light frame.,"I replaced the following: 2 rear door latches at $140 each (parts only), front rotors($39.95 each, parts) and ceramic pads($54.00, parts). They warped when I bought the car.
Problem with the traction control and engine limit power lights due to improper tire pressures. The car should instead raise improper tire pressures, but it chooses to raise the other two alerts instead.
The cruise control doesn't work when I bought the car."
3.5,Impala 08,piercebmng ,04/15/2013,,,5,2,1,3,,4,5,3,5,"locks, heater, fresh air, design, when back windows are down forget about it. bearings, tire wear, oil consumption, spudders, probably when the cylinders cut off the oil flows out filling the converter.",paid 4,"locks, heater, fresh air, design, when back windows are down forget about it. bearings, tire wear, oil consumption, spudders, probably when the cylinders cut off the oil flows out filling the converter."
3.25,mixed feelings,ifyousayso ,04/09/2013,,,3,4,3,1,,4,4,4,3,"I bought the car certified used with 28,000 miles2 mos after warped rotors. dealership w/ plenty of ""warranty"" says rotors aren't covered (bumper to bumper??). After market rotors hadn't come out yet so I had them turned. 1500 miles later warped again. I also noticed uneven tire wear. Took it in to have alignment checked dealer told me it was to GM spec. Took it to a local tire shop which informed me GM spec (at that time) was very broad. ie. Properly aligned didn't mean it was optimized for tire life. I had them align and put on a set of tires. 65000 miles later no uneven wear. clear coat started peeling from spoiler 2000 miles after warranty on paint was up. see Fav Features. ","Gets me where I need to go when it starts
2 yrs ago had 1 incident where I turned key & it didn't crank. waited a few mins then it started. 8-9 mos later it happened again. Since it started after a few mins and didn't happen again I thought maybe a fluke. Until recently. I get the same symptoms only might start in 10 mins might be 3 hrs. Dealer says starter is bad. During 1 incident the dic said ""SVC Theft detterent sys"" Dealer: Its the starter. Me going bad for 2 yrs? getting it replaced. But have a feeling they aren't telling me the truth. Will see if it happens again","Tighten up Alignment Specs if they haven't yet so consumer gets more life from tire. Allow owner to override theft detterent system in event of malfunction, as this strands the owner when parts of this system go bad, & it usually happens after warranty is out.
"
4.5,Getting my moneys worth.,brad1992 ,02/03/2013,,,4,4,5,5,,4,5,4,5,"I purchased my 2008 impala LT 3.5 VVT in the cold Michigan winter of 2011 with 47000 Miles. The day after I bought it we had a 12 inch snow fall , thus making it near impossible to drive. However,at the time I was a Corrections Officer so it was imperitive that I make it to work. So I bundled up and braved the cold and, icy roads. This car was excellent on my commute. It never gave me any issues other than the traction control limiting the ammount of power I could supply to the wheels. I am proud to say I now have 80000 miles on this automobile and other than replacing the gas cap, battery and, two tires I have not had to do anything to it. I would def. purchase this car all over again.","The MPG's 33 on the highway lack luster preformance in the city though. Spacious cabin with limited road noise. Peppy engine and, hauls a trailer very nicely.","Tire tread wear and, Brake componets wear out fast. and the rear door acuators wear out easily."
3.75,"So far, so good",lashacotton ,08/21/2012,,,3,4,3,4,,4,4,4,4,"I just purchased my Impala SS with just 33K miles on it. I have driven the car for three days and the gas mileage has been great. This car offers a smooth quiet ride. The only thing that I am kind of disappointed in is the side view mirrors, they are not extended from the car enough and makes it kinda difficult to see what is besides you in either direction. Also because of how the body it shaped, it can also be a little difficult to see what is behind you.",,Side mirrors 
3.5,Chevy don't FAIL me now!!,iluvchevys ,07/25/2012,,,3,3,3,4,,4,4,3,4,"I have owned my 2008 for a little over 2 years and at first I loved it but now I'm starting to have problems.Feels like my transmission is slipping, if I'm at a dead stop when I press on the gas it is kinda hesitant (seems to only do this in the hot weather) When I run my ac it has less power, my back locks don't work. A year ago I had the reduce engine power show up but I let me car sit for the weekend and haven't had the message again (knock on wood)I still have 3 years left on my lease and I'm starting to get worried. My first car I bought was a complete lemon thought I was doing the smart thing going to a ""major dealership"" but the warranty that you buy seems to not cover anything. ",,I love my Impala but if this keeps up I will straight go to FORD!!!
4.125,"Solid, Safe & Reliable",c_ram ,04/15/2012,,,3,3,5,5,,4,4,5,4,"After 3 years, I have followed the recommended maintenance schedule and had a great experience. We bought it for the safety (side airbag curtains standard & crash test results) & reliability and have not been disappointed.In response to the previos post, GM was bailed out by the government in March 2009 well after the 2008 Impala was designed, built and most likely sold. It is not responsible for your experience. Nor are the dealers, which are independently owned and operated.","Safety, drive comfort & reliability.",Road noise & cabin design.
1.875,"Worst Car, Absolute Junk ",rmk711 ,04/08/2012,,,3,4,1,1,,2,2,1,1,"This is absolutely the worst car I have ever owned, or known anybody to have ever owned, worst mistake of my car buying life letting myself be sold into buying this car. Everything on the car breaks! This car company is paid for in part by my tax dollars and at this point I feel like I have not only been ripped off by GM, but also by the American government. GM needs to take responsibility for its poor product designs whether part of the NEW GM or the OLD GM, recall these cars and give me a refund of absurd amount of money I have had to pay for a poor excuse of a way to get to work and pay my tax dollars to support this country.","At least it looks good, at least it moves, I guess!","I have been stuck in a supermarket parking lot unable to move because the shifter was locked up. I have been listening and feeling the car shake like an earthquake going downhill due to constantly warped brakes even after changing out all 4 rotors and pads, I have had my accelerator changed out by the dealership, a defective leaking Fuel Valve replaced, random battery corrosion, one door lock no longer works, premature tire wear, two wheel hubs replaced and the ride on the car is still extremely noisy, I feel/hear every bump in the road, the shifter torque locks every time I park on a hill. Had the car serviced at 3 different Chevy/GM dealerships, same poor attitude each time."
4.625,** Very Reliable ***,chat55904 ,03/03/2012,,,5,4,4,5,,5,5,4,5,"I bought this car used with higher miles 160,000 miles to be exact and i bought it in another state and had it shipped to me i figured i better order a Engine &Transmission just in case so i did and when i got the car it was nice needed nothing! I now have 204,000 miles on this car with the original Engine & Transmission I love to drive and this car is One i can not down talk it does have its flaws but then again what car don't! Gas milage is not the best but for the comfort and drive ability it is worth it plus its flex fuel which is 60 cent less a gallon! ",Xm Radio is a great deal for me i spend $26.00 for 6 months to have it i use it everyday love it! Remote start is a plus & I have to say I live in the cold weather and my car warms up very fast and i have hot heat! I love that! ,It does wear through tires faster then normal in the rear & gm is in a law suit over that right now but to be honest if you rotate them as needed its not that bad at least not for me! My rear defrost does not work but that's all mint other wize!
5,"I was involved in a accident that was not my fault, 25 days after I purchased my vehicle",mlwoolum ,02/06/2012,,,5,5,5,5,,5,5,5,5,"I purchased a 2008 chevy impala, I bought the vehicle on December 20, 2011 and on Jan 14 2012 a guy ran a stop sign and I couldn't stop and I t-boned his truck. My son was in the car. We walked away from the accident, the only thing that happened to me was that the dash hit my knee and it is a little banged up. We were traveling at 55 mph when the other vehicle pulled out in front of us. The other guy didn't walk away he was in critical condition, he was taken to the hospital. For the impact that my car took, and we didn't get hurt. I HIGHLY recommend a impala to anyone. Look at the review's, i have since then purchased another impala, this is probably the only car I will ever purchase. ","My favorite feature was that it has a excellent crash rating, it saved me and my son from being hurt in a accident that someone else caused. For the speed we were going, we probably should have been hurt. But we walked away and he didn't. I would tell anyone I know to buy a impala. Excellent car!!!!",
2.375,junk from day one,tankzulla ,12/28/2011,,,3,3,1,1,,3,4,1,3,bought certified pre owned 2008 with 34k miles. 3 months in the ball join and control arm break replaced for free. november hits and snow falls car is uncontrollable in any snow or wet conditions even at 10 mph. 2 times car has flown across highway turning sideways almost crashed both times. i take it and the tires are worn to the medal on the inside of the tread out of pocket 250 for new ones with no explanation of why only the inside was worn down took it back out in the snow and lost it again. dealership has no solution and gm says its not awd that's why. when i could take my 95 turbo supra out and do better. such a pathetic company makes me sick any one else having this problem?,"heated leather seats, remote start","use better parts and construct a more reliable safe car, its no wonder every one is buying imports "
3.875,Bad rear door locks,mes1944 ,11/24/2011,,,4,4,4,4,,4,4,3,4,Rear door locks quit working at 32000 miles.I believe this to be a safety issue in that the rear seat passengers especially infants and young children may become trapped during an emergency.The driver will not be able to activate the rear door locks.,,Replace or make available new locks
4.375,It's a love/hate relationship!,dustinjoe ,10/07/2011,,,5,5,3,4,,5,4,4,5,"Love my car. I am the 2nd owner. Its fun to drive, reliable, and its a head-turner. I have the LTZ. Its bright red and got all the chrome around it and drives a lot of attention. At 49000 the car started using two quarts of oil around every 2000 miles. The salesman said it was normal. Yeah right. My door locks have began to act up and the a/c system doesn't work right sometimes. I love my car, but i'm afraid its going to start using more oil. No leak can to be found and it doesn't seem to be burning the oil. Thats really my only concern. I absolutely love driving the car. It gets excellent gas mileage and is very comfortable. Will buy again when all the bugs are worked out of it.","Love the remote start, the chrome accents, heated seats, bose stereo system, and the steering wheel audio controls. The car is very comfortable and has lots of features The onstar is awesome. Love the driving directions it provides as I travel alot Its a great everyday car.","The door locks need to be fixed along with the a/c system. That doesnt prevent my from buying again, but the oil problems do. When I read reviews that does not consist of the oil troubles I will definately have another one. I love the car but hate the problems that is has."
2.125,IMPALA THE UNSAFE VEHICLE,randykn ,04/27/2011,,,3,4,1,1,,3,3,1,1,"These cars are JUNK 34,000 miles equal 3 sets of tires, brakes 3 times. Rotors last a month at best. Can not be aligned properly, (recalled for goverment vehicles but not the public. DO NOT BUY A IMPALA you will be disapointed. Dealer suggestion to solve the brake problems is to NOT drive on any hills, quoate ""these cars were not made for driving in the mountians"" for 40 years i have driven GM cars but NO MORE. My 97 Taurus with 320,000 miles does not have the problems that my 2008 Impala has. Thouhjt i would buy my wife a safe car, boy was i wrong.NO MORE GM PRODUCTS FOR ME",Can not think of one,"Fix the brake, alingment and tire problems. A car that eats brake rotors in a month is poor engineering to say the least, recalls to only vehicles only sold to goverment agencies is bull. Are they more important than my families safty? NO Having to buy suspension kit to properly aling vehicle more bull."
2.75,Not What You Pay For,kanani4274 ,04/19/2011,,,3,3,1,3,,3,4,1,4,"I purchased my 2008 Chevy Impala new July 2008. I thought it was a bit pricey coming from a Chevy Pickup, but, needed to get away from high gas prices. This vehicle IS fuel efficient. It is hard to believe that this is a Full Size vehicle. The cab is extremely small for full size. I have two major complaints: #1 The suspension from the factory is junk and they know it. GM will not replace or repair this. I had to spend $1200.00 to fix a manufacturer defect after going through 3 sets of tires in under 40,000 miles. No thanks to GM. #2 The A/C-Heater System is JUNK, once again, GM knows of the problems and they will not repair or replace it. With that, I will NEVER purchase another GM vehicle.",Fuel efficient,"GM needs to learn to support the people that support them. I have owned only GM made vehicles. Every single one of the five vehicles had problems from the factory that GM would not repair or replace. The quality of product they produce is not worth the price they ask (and get). Because of GM's lack of integrity, I will not purchase another GM made vehicle. Sorry to say that, but it's true. So long GM."
4.5,great all-around sedan,mace57 ,01/18/2011,,,4,4,5,5,,5,4,5,4,"I bought my Impala as a work vehicle.It has since become the all-around family work horse.Not bad looking with the spoiler, and sun roof.OK stero system.The car has a great balance of weight and power, and is super in the winter with good snow tires.we get about 24 mpg average.Lots of room and a hugh trunk.I have about 77k miles on it, and have had no repair issues.I think it is a great value, reliable sedan.",reliablity and solid handling.,
2.625,bad deal,Anonymous ,12/08/2010,,,3,3,2,1,,3,3,3,3,"i bought this car brand new and i loved it at first. Then i started to have problems, rear defrost don't shut off, needed a new rack and pinion at 25,000 miles and know at 34,500 miles i need a new ball joint and we had new tires put on the car and they can't do an alignment on the tires because of the way the tires sit on the rims. They have low profile tires and they look nice but they are awful.",heated seats and remote start are great,do something different with the tires.
4.375,"Actually, a decent sedan",Stavros ,11/15/2010,,,4,4,4,4,,5,5,5,4,"own for 3 yrs. & have 116,000 km. I have to say, its not BMW 5 level ride & style, but I gave it good ratings cause, for what it is, it does well. it has plenty of power and reasonably responsive and hwy. power is great for passing anything. fit n finish is a bit cheap and lines not perfectly matched up...interior is not so stylish, but functional...front seats are not bucket enough, so they don't hold you on sharp turns, but very comfortable for everyday and long trips, rear seats, very comfortable (according to my passengers). for big car, actually handles pretty good (LTZ model)as engine got broken in, I get 10.5 L/100 km.AVG. Good Family Mover. Drives & feels solid on hwy. speeds.","Power, stability control works great, huge trunk, rear flip up seat, exposing room to store stuff, solid safe feel on hwy.. low insurance cost on this car, fuel economy for big car and power is decent, computer messages, remote start which turns on defroster & defogger,4 sec. door lock delay, onstar","more bucket shaped seats to hold you, windshield wipers off position to sit lower on glass, more stylish console design, cup holds too deep (med. coffee lid is near top of cup hole, so lid is almost pushed off & harder to grab coffee, front passenger seat to have up/down movement & lumbar support"
