4.875,Ain't Nothin' Like the Real Thing,courthouseguy99 ,05/17/2008,,,5,5,5,5,,5,5,4,5,"Traded in an 06 X5 3.0i and love the upgraded engine BMW put into the X3 in 07. 800 less lbs to lug around, so it really flies. Got Prem, Sport, 19"" wheels, NAV, Cold Wthr, Xenon, Prem Audio, Servotronic. The car rides A-OK with 19"" wheels. It's got a taut, responsive yet compliant ride, just what BMWs are known for. Throttle response is lightning quick, but you quickly learn how to modulate it. Putting the car into SD mode *really* amps up the car's responsiveness. Tried out RDX (nice at first glance, but plasticky inside), EX35 (great engine, but even shorter on utility than X3), even the new X5 (too big, hate iDrive), but this was the one I had to have.","Engine performance, steering precision, handling, sport seats, heated front AND rear seats, Bluetooth that uploads your contacts, panoramic moonroof, design of 19"" wheels.","Better cupholders, more small item storage cubby holes, voice-activated nav system, better location of AUX port (who thought to put it on the REAR side of the front console?!?!), sound quality (Prem Audio doesn't sound very premium at all even after self-adjusting, and I'm not even an audiophile!) "
4.75,Great Buy,bimmerdriver ,05/03/2008,,,5,4,5,5,,5,5,4,5,This has been a great car so far. No mechanical issues. The BMW engine is smooth and delivers the power when you need it. The suspension works really well too. It provides amazing road feel and yet is able to absorb our Chicago pot holes better than any car I've recently driven. The transmission has been good so far. When immediate passing power is needed I switch from D to SD for a quick burst of speed.  ,"Servotronic, Xenons",Wish diesel was available
4.25,Smaller SUV,Jeff ,05/02/2008,,,4,4,5,5,,5,4,3,4,I was looking for better fuel mileage in a well built SUV with many of the features from my previous vehicle.  The X3 has more room than it looks.  It is well finished inside and out. I like the engine but the 6 sp auto trans. seems to hold onto gears too long and down shift easily.  Mileage is only about 21 in a mostly highway commute.  The ride is very firm and it handles well for an SUV.  The X3 reminds me of my wife's old 2003 530 in many of the interior operation components.   ,"Interior/exterior fit and finish, performance from the 3.0 six and handling.","Revise the auto trans., update the switch and functions to the more modern BMWs, improve the fuel mileage. "
4.75,Remember - it's a BMW,TedTEd ,03/28/2008,,,5,5,5,5,,5,4,4,5,"Remember, you're buying this car b/c it handles incredibly. Acceleration is great. I experience no hesitation. This car is fun to drive - lots of fun to drive. I get 21 mpg. However, the electronics are horrible. I got the upgraded stereo and wish I hadn't. Sirius costs $900 to install, only available through BMW and it's the worst antenna - continuously drops the signal. The read out is limited to the point of annoying. The radio only has 6 presets. The GPS (yeah I went for that too) is incredibly useless - difficult to use (the manual is awful) why do they allot so much space to longitude, latitude and altitude? It's ridiculous. Did I say it handles incredibly?","Handling, handling, acceleration, handling.",Electronics
4.875,Good Vehicle,sgarg ,03/28/2008,,,5,5,5,5,,5,5,4,5,"Purchased in march. Nice car. Looks are attractive. Features are excellent except navigation system. Navigation system is really bad, Honda has much much better nav system. Fuel avg is around 17-18.","Auto light, auto viper, Blue tooth, sound system.",Navigation system has to be improved.
4.875,Enjoying New BMW,New X3 Owner ,03/07/2008,,,5,5,5,5,,5,5,4,5,"Purchased in Feb.  Terrific ride - very comfortable.  The oversized sunroof is a real plus.  Ordered Premium Package, rear side airbags, mats, heated front seats, metallic color.  Nice ride:  car performs beautifully.  So far, shows I'm only getting 15.6 miles to gallon, although alot of street driving.  No hesitation as mentioned in another post.  Very powerful and sensitive brakes.  This is a feature added as I read it's designed to perform right away.  Very roomy although rear has hump in middle seat.  The technology over just a few years ago is amazing.  Had another customer in car wash actually strike up conversation about how nice the car is.","Blue tooth with upload of contacts, and callout voice dialing of any number.  Oversized sunroof, Nevada leather seats, mp3 capability in cd system affords about 95 songs per cd.  I pod jack with charger right next to it.  Auto wipers and auto lights.  Sound system with basic stereo. Driving is fun!","Even better mileage, mp3s don't recognize artist nor song title even though recognized in other stereo systems, contacts appear alpha by first name instead of last, rear latch opener on key chain is too close and opens when trying to start car, iphone integration should not be extra."
4.375,What a blast,Scotty ,02/23/2008,,,4,4,4,5,,5,4,4,5,"What an absolute blast this little SUV has been from day one, It still brings a smile to my face every time I get to climb behind the wheel.  It sticks to the road like glue, accelerates bullet like away from lights (or as bullet like as you'll get in an SUV) and it's very comfortable.  We bought Alpine White with sport package and loaded it up with options.  Be prepared for sticker shock - big time !","Exhilarating and fun to drive, like having an oversized go kart.  Great acceleration and awesome stopping power, sticks to the road like glue.   ","Nav system update is a must for BMW. Compared to the competition the BMW set up verges on being useless, we still haven't figured out how to use it properly.  Sticker shock hits hard, like every BMW, turning a base box into an ""ultimate driving machine"" is a very expensive proposition indeed"
2.625,Just Not Worth the Money,Marc ,12/08/2007,,,3,3,3,3,,2,3,2,2,"This is my 2nd X3 in 6 months.  I had so many problems with 2007 that BMW bought out my lease and I ordered another one (would not let me totally out of the lease).  These are overpriced and not up to par with Japanese vehicles.  Problems-- transmission does not mesh with engine, hesitation, brakes grab, OEM tires were AWFUL in snow last few weeks, took them off before slid into something.  Navigation system is archaic.  Radio even upgraded one just does not provide quality sound.  This is definitely not the ultimate driving machine.  I would never recommed an X3 to anyone else.  I do not know how other reviews are favorable.  Guess just taken away with BMW emblems all over the car.",BMW emblems ,Navigation. Engine/transmission that work together. Decent OEM tires that grip the road. Better sound systems. Make an alarm standard.  
4.875,Worth Every Penny,ericbell1 ,11/13/2007,,,5,5,5,5,,5,5,4,5,We've owned the car approximately one month and still brings a smile to our face while driving.  This is our first BMW and we're very pleased with the build quality and the fit/finish.,Absolutely love the handling.  The wife likes the bluetooth and heated steering wheel.,"Automatic transmission problems from '07 still remain in early production '08s. Will take it to the dealer for the supposed fix; however, this does not ruin our experience one bit."
4.875,What a wonderful SAV by BMW,BMW4Life ,11/09/2007,,,5,5,5,5,,5,5,4,5,"Just got our 2008 X3 two weeks ago with all options except servotronic.  It's been wonderful so far.  We have the alpine white with sports performance package which comes with 19"" wheels.  This is a must have if you want the best looking X3 out there, it looks so much better than the rest.  The color coded aero kit makes this car look even better (no more black bumpers/moldings.  It drives like my 540 and it also has the cargo space to haul our weekend gears.  We have two kids and my wife can sit between the two car seats for our two our trip last weekend, and she's 5'8"", it is almost the same size as our 01 X5, but it is much quicker because it's 800 lbs lighter and it is also fuel efficient","Alpine white exterior, 19"" wheels, auto-headlights; panoramic moonroof, bluetooth; quick and smooth transmission.",it could use a better navigation system.
4.875,One great small SAV,BMW4Life ,11/09/2007,,,5,5,5,5,,5,5,4,5,"Got my 08 X3 two weeks ago, have all options except servotronic steering, sports performance package is a must, the 19"" wheels look so much better than the rest.  Alpine white exterior is the best color choice by far.  Automatic headlights is cool.  It drives like my 540, but with enough cargo to haul our weekend gears.  We have two kids and my wife can still sit in the middle between the two car-seats for a two hour drive.  It is almost the same size as my 01 X5, only quicker and more fuel efficient.","Color coded aerodynamic kit, 19"" wheels, smooth but quick acceleration (no hestitation noticed), automatic headlights, bluetooth, panoramic moonroof, good cargo space for a small SAV.",Navigation could be better
