5,Great little car,Clint ,09/17/2016,5,4,4,,,4,5,5,4,,,"I have 78,000 miles and have had very few problems with my Compass. I have only had to replace I believe the tie rods or whatever goes bad in all of them and the back brake pads. The front pads are still good. I bought a lifetime warranty and have only used it for the tie rods. It drives great, has plenty of room(I am 6'2"") and has been very reliable. For a $15000 car it has alot of value.",,
3,HA!!!!!,Yellowberry35 ,03/05/2016,2,2,2,,,3,3,3,3,,,"I rented this vehicle once upon a time and it felt like a great drive  so I bought one thinking I would get the same kind of quality....HA!!!,  what a joke.  If this vehicle costs a lot less I wouldn't be unhappy,  but it wasn't worth the money I spent.  The stabilization in both front axles will go very easy and cost a lot to repair  as well as the throttle body ( this is a common problem in Nearly  all of these models ). I hear the the updated models have been improved ( I'll believe it when I see it). Other than that if you can tolerate the little maintenance  here and there ,  you should be good to go otherwise I'll spend my money elsewhere !",,
3,Great for the first 5 yrs,Erika ,02/06/2016,2,2,5,,,2,4,4,5,,,"My husband and i bought this jeep brand new in 8/2008, we paid it off 2yrs ago and when we paid it off we looked up the value on it which ended up being much less than we thought:(The jeep drove great at first, it has a great handle, turns eaisly. Good looking body style. But after 5 yrs the car started hesitating and as we were at a red light the car almost always wants to shut off. Well fast forward 8 yrs later... 2 major brake repair, jeep sounds awful super loud and now needs major repair. Basicly a great car for a few years.",,
2,DONT BUY THIS P.O. S. .,Brittney ,09/30/2015,3,2,2,,,2,,3,3,,,"THIS IS THE ABSOLUTE WORST VEHICLE I HAVE EVER OWNED. The sun roof leaks drastically when it rains or when I wash the vehicle. So much that the sun roof has stopped working, it leaks down on all electrical units underneath. The whole ceiling is water stained , and when it rains heavily the rain pours out of the ceiling light and the seats are covered ! Not considered a  manufacturer defect, not covered under warranty or extended warranty. Passenger side back seat floor leaks all year long. The floor is continuously wet then frozen in the winter. Go through brakes like crazy , having to change every 3 months. ( I am not heavy on the brakes either) RUSTS LIKE CRAZY EVERYWHERE !  Overheated and blew thermostat, leaking anti freeze liquid, with only $75000.00 , this was covered under warranty. Does not hold its value at all. Thankfully I paid ahead on loan so I can at least break even when getting rid of this P. O. S ! 4 wheel drive stopped working when I first bought vehicle , the wires housing compartment melted and wires where fried. This was figured out after taking to the dealership 4 times . They kept saying the couldn't  find the problem. Do not buy what ever you do ! Blind spots all over .",,
3,Discussed,Johnnie ,09/16/2015,2,3,4,,,2,2,3,5,,,I have had this jeep for 1 week and the shop has had it more than me. I love jeeps but this one is a joke. After 1 week the front axle broke on this jeep. What a rip off. I am unhappy and disappointed with this jeep my van works better than this car.,,
3,Seven year switch,T Wolf ,08/24/2015,3,3,2,,,3,3,3,4,,,"My 2008 Compass was purchased new and now has about 78k miles.  In the winter months it won't take gas....  In the deep freeze I have to slowly drip gas into my tank.  Takes me 20 mins to get enough gas to get me to work.  In the spring/summer is fine.  Now my engine is slamming around.  My husband says I have a broken manifold.  It is paid in full, I hate to sell, but what else can I do?",,
2,Really???,Lillie ,07/31/2015,1,1,2,,,1,4,3,3,,,"I purchased this vehicle used. One owner, good carfax report.... Had it for a year.. Repair cost have exceeded 3800.00!!! Still a little more to go. Needless to say I am disappointed in jeep. I have been a jeep owner for ten years.  My other jeeps were well made tough machines that finally wore out after tons of miles. Repair cost are ridiculous on these compass models in my opinion. I seriously doubt I will ever purchase another jeep after this compass.",,
2.625,lots of repairs on a 7 yr old vehicle,Dorothy Mason ,04/28/2015,,,3,3,1,1,,4,4,2,3,"2008 Jeep Compass 5 sp manual tranny with 88,000 mi. in the past 9 months I have replaced the drivers ball joint, clutch assembly and stabalizer bars (several times) and it now looks like the struts are going. I am disgusted with the vehicle. I have a 97 Saturn with 236,000 miles and a 5 sp. manual tranny same clutch and only routine maintenance on it, that should tell the whole story on the Jeep..........Don't buy one! I am on a fixed income, just recently semi-retired and can't afford to keep fixing it.",The only redeeming quality is I prefer to drive standard shift.,Fix the problems.
5,Perfect Small SUV,jammy2 ,07/10/2014,,4,5,,,5,5,5,5,,,Love this Jeep!! Its everything I wanted in a SUV.I went from an Olds Alero to this jeep and couldn't be happier.My kids have so much more room to stretch out in.,,
3.75,Fun & Reliable,ensoniqman ,04/12/2013,,,3,4,4,4,,4,3,4,4,"We traded in our second Honda Hybrid for this 2008 Jeep Compass (had a 2003 and 2005 Honday Civic hybrid...transmissions and CV joint went out on both of them).I liked the styling of the Compass because it didn't really look like anything but a Jeep.Plus, I'm 5'11"" and fit very comfortably in this Compass...unlike the Civic.Nice & comfy for road trips too; not alot of road noise. Using BF Goodrich tires and makes for a nice ride.Averaging about 32 to 33 mpg on the freeway when doing 60mph and using cruise control. No frills basic interior, typical utilitarian Jeep.","Great for commuting & running about town.
Lots of room for grocerices or a weekend camping/skiing trip.","Rear brake pads will need replacing soon, as the car now has 50k miles. Factory stereo sounds ok, but we installed MB Quart 6x9 speakers...now sounds even better. Blind spots take some getting used to."
4.75,Love this baby Jeep,schneikm ,09/28/2012,,,4,5,5,5,,4,5,5,5,"I bought my Jeep Compass used 2 years ago at 22,000 miles and I'm at about 50,000 now. They didn't give me the option to select the correct model I have, mine is the 2.0L 4-cyl autostick. All I have had to replace so far is brake pads, and I probably need new tires soon.I love this car because I am a tall person (5'10) and it is so spacious I don't feel like I'm compacted into a car. The turn radius is great.The seats are comfortable, even on long 12 hour drives. Perfect for moving because there is so much space when you put the seats down.I dislike the 2.0L engine because the get-up is slow and my gas mileage is about 26mpg highway.","I love this car because I am a tall person (5'10) and it is so spacious I don't feel like I'm compacted into a car. The turn radius is great. Did I mention I have manual locks and windows and I still love it? The seats are comfortable, even on long 12 hour drives. I like the AUX outlet so I can plug in my music. Oh, I also call it my moving machine because I can fit so much in the car when I put the seats down.",
4.375,Surprisingly reliable,dteitzel ,01/13/2011,,,4,4,4,5,,5,4,5,4,"Bought the 2008 Compass after being a long time, repeat Toyota buyer. The price was excellent and I got a 3 year gas card that I am still using, every time I get gas I save some change or more. I don't have the confidence in Jeep, but I have been pleasantly surprised. I have not had problems, other than battery died once after a cold spell. The car has never died or stranded me. I have not done any additional service other than the most basic. I have 48K miles on it. ","Regular power outlet-love it. Wish more vehicles would add this feature. I use it to keep my blue tooth charged at all times. I just love the idea that I could plug anything from the house in the car. I also like the knowing the temperature. My previous more expensive SUV, Highlander didn't have either of these features.",Better quality interior plastic and fabric. Bigger gas tank. Better gas mileage.
3.5,roll-backs,southmax ,08/13/2010,,,3,5,3,1,,4,4,3,5,"I thought i loved the jeep compass, until i came to an incline, the truck goes backward instead of forward.  Has anyone else had this problem with the 08 COMPASS? Other than the roll back, it seems to be a great little car. I reported the problem to Chrysler's headquarter, they had the car picked up about 20 minutes after i called.I am waiting to hear from them.","It is roomy,very cute, and the paint job is great with the sparkles in it.","It has a blind side, could redesign to have a better side view."
3.5,Disappointed,Kelly  ,05/04/2010,,,1,4,3,5,,5,1,4,5,"I bought this car after a Liberty because I was trying to save on gas. Saved there lost elsewhere.  I am 5'10 and this car is NOT for tall people.  The roof is not like other cars and when I pull up to stop lights (on the white line) I have to duck my head to see what color the light is.  I do like how it whips around corners and handles great. However, after having this car for a week, I am in the process of returning it.  I wish the roof was better and didn't have the extra material by the windshield. Jeep struck out with this one for tall people.",The color and sunroof are hands down my favorite.  The handling is also amazing.  I love how the trunk area is made of hard plastic.  Easy clean up.  The many small compartments and the sliding middle is also a plus.,The large space above the windshield needs to be removed.  This car is only for people under 5'6 as my mother in law had a hard time seeing as well.
4.625,I like it!,Mission ,03/06/2010,,,5,5,4,4,,4,5,5,5,Just picked up an '08 last weekend. So far I love it!. Fun to drive very comfortable and good on gas. I actually really enjoy the CVT transmission and when I need a change I go to autostick. You do not need any more power than this in a vehicle.,"Comfortable, looks great. I'm 6'1 and have tons of head and leg room in here.",Center console is too low
4,Zippy,Johnny Rocket ,10/15/2009,,,4,2,4,4,,4,4,5,5,"My wife and I got this Jeep for $12,700... NEW off the lot with 62 miles on it. We have the 2.4L with a five-speed. We heard the CVT was a turd and are very happy with a manual; my wife hates it, but I turn of the traction control and pull the parking brake, roll and smoke the front tires all day long. I don't like the styling its too round, but its my wife's car and she loves it. The transmission had to be replaced after 10,000 miles, it was not do to my abuse, but because of the syncro for 5th gear exploding on the freeway. We get on avg 28mpg with a mix of 50%city 40%highway 10%idling (I idle alot waiting on my wife while she is inside the store shopping and I'm sleeping in the Jeep.)","The 5-speed transmission and 2.4L engine. The way you drive affects your MPG, if my wife always drove I think that this Jeep could start to creep up into the low 30's MPG","There are some refinements that are done in a products life cycle. The only thing is, when dropping the back seats forward it scratches the hand cranks for the back door windows. You must have the door open for the side you are dropping. "
4.625,Ignore the critics.... Compass is A-OK!,CompassMan ,07/24/2009,,,4,5,5,5,,4,5,4,5,"Our 2008 Compass Sport is an extremely nice, well featured vehicle... esp. when considering what we paid out-the- door for it:  $16,400.   The interior catches way TOO much flak from reviewers.  It is roomy and the seats are very comfortable.   Gas mileage is good:  4 people/luggage, A/C on, 75 mph produced nearly 26 mpg on a recent trip.  No A/C and under 65 mph pushed it up over 30 mpg!  It's been reliable, and only had one warranty repair for a couple of suspension bolts in nearly 20k mileage.  As far as performance... all you have to do is put your foot down on the accelerator a bit more firm and get the RPMs up.  That's it.  The 172 HP does the rest.  Highly recommend for $$$","Auto CVT/power windows/locks/tilt/cruise/rear defrost/privacy glass/air conditioning/ABS/traction control/CD player/spoked 17"" rims... all for $16,400 OTD!  Comfortable seating for 4 adults.",2009 interior redo took care of the armrest padding and need for a bit more sound deadening /insulation.
3,compass,Amy ,06/10/2009,,,3,3,3,3,,3,3,3,3,"This is a good SUV.  The only real problems I have encountered are the huge blind spots on the sides between side windows and windshield.  Also, whenever I open the doors after it has snowed, all of the snow plops into the front seats.  Also, the automatic locks drive me crazy.",Roomy,Make the snow not fall directly into drivers seat when the door opens!  Redesign this and the huge columns in the front to get rid of blind spots.
4.875,Great Car - Great Value,rebe ,04/17/2009,,,5,5,5,5,,5,5,4,5,"I Love driving my Red Jeep Compass. I am an over 40 woman and drive to and from work. I like simplicity. Leather seats are not for me especially in Florida. I love the fabric upholstery because it is cool and supportive. Since I am short, I love that I can raise the drivers seat and I am not sitting in a hole. The power is plenty and I can easily pass other cars when needed. Driving this car is fun and easy and there are no blind spots to worry about.","My favorite features are: raising and lowering the driver's seat, the stereo is about the best standard stereo that I have ever had in a car.. it is awesome and you can plug in your mp3 player easily. I like the fact the seats fold down all the way in the back. The fabric upholstery is durable.",I would like to have the air conditioning vents to be adjusted more easily and I would like a door lock button on the passenger's side door.
3.5,Jeep Compass-stalls & cuts out,Shan-payne ,04/04/2009,,,3,4,2,4,,4,4,3,4,"The jeep compass is an overall ok vehicle Its design is sleek & nice but the quality of the mini SUV needs to be worked on especially with the constant stalling, cutting out etc. but i'm still luvin my lil JEEP",Sleek exterior design,Start from scratch by making big adjustments with the exterior
5,luvin-it,mills64 ,02/24/2009,,,5,5,5,5,,5,5,5,5,"Great suv, great mileage, very roomy vehicle my family is very comfortable in this vehicle and a fun vehicle to drive 45 minute back and forth to work","sun roof,seating is high,4 wheel drive and looks great",power seats and when you remove the keys all doors unlock
3.125,Interior is terrible.,Ben ,02/07/2009,,,1,5,1,4,,3,3,5,3,Whilst this vehicle is a very nice vehicle to look at the quality of the interior is terrible.  My wife's car is just over a year old and the plastic skirting on the front chair has snapped off.  The storage panels on both front doors are beginning to break off. Overall very cheaply made interior.  About the only good thing going for this vehicle is the good gas mileage.  If this is how jeeps are being manufactured now then this will be the last one that I purchase.,Gas mileage. Exterior look.,Interior quality.
2.625,Stalls out ,virgin island ,01/25/2009,,,2,3,3,2,,2,3,3,3,"Is a fairly comfortable ride, somewhat fun, but stalls out in the morning hours. Currently have a computer installed on the car to try to find the problem. I'm hoping my family does not get hurt in a car accident, cause by the car stalling out. Might have to sue the dealer and Chrysler.",None,
2.625,Why Why would you buy this?,Center ,12/10/2008,,,1,4,2,4,,3,2,2,3,My father just bought this car.  We both thought that for the price it was a good buy. How disappointed we both were. In fact so disappointed that after exactly 9 days we returned the car.   The interior is horrible. Looks like a cheap fake toy car. Buttons are poorly built. No interesting options (i.e. USB connections etc nothing)  Though the car has only 4 cylinders it consumes way more than the design info states. The fact that for this price it 4 wheel drive is not standard is shocking especially when compared to others like the Grand Vitara (for 2 k more than the compass) or the Tuscon (or less or the same price as the compass),The only thing we really liked about it was its cool and slick appearance. Apart from that this car has nothing to offer. ,"The interior when compared to theirs in the same price range (i.e. the Tuscon or the Grand Vitara -2kmore-) is absolutely shocking. The entire interior is very poor quality plastic. I mean not even your normal plastic, the kind that if you are ever mad and turn a nob hard you will break it off."
4.625,Great vehicle for the price!,Rich Reed ,11/17/2008,,,4,5,5,5,,4,5,4,5," I've had the Compass for 15 mos., and have not gone back to the dealer for anything. I have the 5 spd. manual, as I prefer that with a 4 cylinder. Long trips give me 28-30 mpg's, while my ""rural"" driving returns 27 mpg's. Seldom do city driving. I use the Compass for errands, fishing, and hunting, (with dog). Therefore, the ""cheap"" plastic interior is just fine, and easy to keep clean. No regrets buying the Compass!"," Like the elevated seating position, & easy in, easy out. Good build quality. Nice exterior design. Plenty of space for dog, gear, etc. Mileage is good for this type of vehicle. Love the 110 AC outlet, (use it frequently)."," ALL doors need to unlock when the ignition is turned off! After 15 mos., I still go the rear liftback, only to return to hit the unlock button. Arm rests definitely need some padding."
4.375,My favorite car.,Paula ,11/17/2008,,,4,4,4,5,,4,5,4,5,"I wanted to get a car that was SUV- like, but gets good gas mileage.  This car does that wonderfully.  I get an average of 27 mpg and still have comfortable room for passengers and a fair amount of storage space in the back.  It rides higher up and has plenty of leg room.  I bought a standard transmission, and I love the way it shifts gears.  Very smooth.",Gas Mileage Appearance Room Price,"The interior plastics seem cheap.  The fake ""chrome"" look around the stereo has already scratched some.  Also, the air pressure light and alarm are constantly going off even though the tires are properly inflated."
3.25,Good,Gemms ,11/07/2008,,,2,3,3,3,,3,4,4,4,"I got it in Oct 2008 and I like it seeing how I own 1 other jeep before, it runs very good so far, I can not say that I like the way or how the sales people push it on me, I would change a lot about the way Cary auto park does there thing and have a lot of bad things to say about them but I do like the Jeep compass over all!",Do not have any so can not tell you,make a few things standard
3.625,orange limited,limited ,09/24/2008,,,3,4,3,4,,4,3,4,4,"Overall not bad, quiet ride. like the limited accents Seat belt reminder chimes every 8 seconds. CVT can be noisy at times. Should be undercoated from factory, rust after 1 PA winter","heated seats,roomy, easy to get in and out of","interior has too much plastic, looks cheap, scratches easily. get rid of cvt transmission You have to time pulling out and passing a lot. optional 6 cylinder. Glass release on hatch. 11k oil pan leaking"
4.25,Great Jeep,daclasn ,08/13/2008,,,4,5,4,5,,4,4,4,4,"We have put almost 4K miles on our Compass and love it! This is my 2nd Jeep, previously had a Grand Cherokee.  This jeep is perfect for what we use it for. Seats are comfortable, the ride is good and power is acceptable with the manual tranny.  I have grown to love the looks of the Jeep. The build quality appears to be very good as well.  The reviewers are way off on this vehicle. I would recommend it to anyone!","Stereo, sunroof, engine-drivetrain combo, FWD handling, mileage, driving position, appearance.","Softer armrests and headrests, one more 12v power outlet in the back seat area or rear of vehicle, ""average mpg"" should include the ability to view mpg real time, ""miles to empty"" should keep going when the low fuel light goes on.  Just small stuff, love the Jeep!"
5,Michigan/Wisconsin Road trip,Joe Merriman ,08/06/2008,,,5,5,5,5,,5,5,5,5,We took a 2163 mile road trip and couldn't believe how smooth the ride was in such a small vehicle. The seat are at just the right height for age 65 to get in and out of. The best mileage 29 least 24. The MPG computer was very accurate. I compare each fill up and follow the mileage. We never felt the transmission shift when going up and down hills. I could see the RPM going up but could not feel it shift gears. Amazing. It fits in the garage better and handles the roads with ease. This is my wife's car. Think I will get me one. I have to 2.0 engine. It has fine pickup. ,"Wow hard to say what I like best. smooth Ride, MPG, easy to get in and out of, seats seem to fit to my body, tire pressure display, follows the road well, taking curves well, cost, warranty ",Make more of them. 
4.5,"Not for everyone, I could care less!",JeepDryvr1032 ,08/03/2008,,,4,5,4,5,,4,5,4,5,"I was looking for a bigger car/small SUV when I decided to trade in my 2004 Hyundai Elantra in June of '08. I was intrigued by the new Dodge/Jeep models and thought the Compass had such a unique look that I had to check it out. The first vehicle I test drove was the Dodge Caliber, which was OK but didn't have enough 'oomph' with the 2.0 liter engine. Next was the compass, and I fell in love with how it sits up higher and gives you more command of the road. I picked the Rallye Edition with the 18"" tires and black rims, with the YES essentials interior. This is huge for me as I have kids!! For an SUV, I can't complain about the gas mileage. It has plenty of room, and a decent stereo to boot.","""YES essentials"" seat material, comfortable seats, attractive and UNIQUE styling, road handling, easy 4WD operation, and it's a hatchback!","Interior scratches too easily. After loading/unloading a couple things in the trunk, it's pretty scratched up. Also it's be nice to have some bigger storage compartments for maps and whatnot."
4.75,Pretty decent so far,adriane ,07/08/2008,,,5,5,5,5,,5,5,4,4,"So far this vehicle has been great, I haven't had any complaints against it. I find it to be comfortable to ride/ drive in. I like the way it handles, but I'm not a speed demon anyways. I read the Editor's reviews before purchasing and I don't have any regrets on buying this vehicle. ","I bought this vehicle because it was part of the lifetime powertrain warranty. I like the rear folding seats, the info button on the radio, the easy to use 4WD, pull a lever and it's on. ","The only improvement I could give would be for a little bit better gas mileage, I have 4 wheel drive and I know you get less gas mileage as a trade off. I expected it to be better being a 4 cyl. Maybe a bigger gas tank would be beneficial. "
4.75,Good stuff,dave ,07/04/2008,,,5,5,4,5,,5,5,4,5,"Good car, no problem so far, the only thing is the lights come on when lock or unlock vehicle with the remote control, kills the battery, ","Feels like a big suv , running on 4 cylinders, good pick up with the stickshift, small length between front to back fits in the garage or parking space,","Needs a smaller dashboard, it looks like you can have dinner, on the inside dashboard, "
4.5,RaLLyE,Rallye ,06/28/2008,,,4,5,5,5,,4,5,4,4,I just bought my 08 jeep compass 2.4L Rallye Edition in black with black interior and everyone ragged on me about getting a compass until I told them that I was getting the Rallye package. Now people are asking me where I got it and telling me how much they love it! The Rallye package sold me on it. It's no good without it. ,Black on black on black. rallye package. sunroof. autostick. black wheels.,"More hp, more torque. standard 6-disc changer."
4.5,A great suv,jc155 ,06/13/2008,,,4,5,4,5,,5,4,4,5,"I wanted a SUV, but I didnt want to pay the big bucks to own an SUV. So I bought the compass. Very quiet SUV. Gets good gas mileage nothing spectacular. When it goes to shift, I actually cant hear it. My passengers have tried to listen for it but found it very hard to hear. The back seats are very roomy. I have no problem getting in with the seats all the way back and I'm (6""1' and 320 lb). Overall a great car to have.","yes essential seats, lifetime warranty, running lights, quiet engine.",rallye package for white. 
4.5,COMPASS PROBLEM,DMB69442 ,06/11/2008,,,4,4,4,5,,5,4,5,5,I have driven the car 1000 miles now and only one problem so far. Now and then it makes a whining noise for about a minute then goes away.This happens once a day. Has anyone else had this problem? Good gas mileage and fun to drive.A whole lot better than the 05 Equinox I traded in for it.,"Heated cloth seats, power sun roof, nice ride. CVT to me is good.",Seats should be power seats. rear disc brakes.all cars should have front and rear disc brakes..
3.875,Jeep styling with great mileage,tryan02 ,05/12/2008,,,4,4,4,4,,3,4,4,4,"I have had the compass for a month now and love it. Although I've only run one tank through it (its my second vehicle). I got 26 mpg on the first tank and it ain't broke in yet 300miles on it total. I bought the plain jane nothing on it to brag about. No problems so far. Great vehicle for the money got the $250 cash back made it a $15,000 vehicle talk about bang for the buck.","Gotta love the jeep style jeeps have always been impractical and too expensive for me till now. I mean you get the fender flares the front grill, round headlights and even the interior round gauges say jeep. I feel like I'm driving a futuristic CJ7.",power windows and door locks standard on all models. But then again it wouldn't feel like a jeep with power everything. So how about just a removable top?
