4.625,TrailBlazer Fan,TrailblazerFan ,11/26/2008,,,5,5,5,5,,4,5,4,4,"Drive the rest. The TrailBlazer is comfortable, powerful, roomy, handles fairly well, tows a lot, has all the gadgets. This is my second and I wasn't prepared to spend $5-10 grand more for a car with slightly better handling. These cars are bulletproof and in '06-'08 all the kinks have been worked out of this proven truckster. Rides smooth. Drive one and see for yourself. 100K trans and for around a grand get a 100K bumper-bumper and you are good to go. Buy American, save a family!","Comfort, creature amenities like XM and OnStar. 3LT looks. ","Handling - a few tweaks could make the car handle better, still OK as is. There are a lot of TrailBlazer fans out there, they have sold a bazillion for a reason. Improve it, don't discontinue it GM."
4.75,Impressive,Wvasko ,10/12/2008,,,5,5,5,5,,5,5,3,5,"Saw it, liked it, drove it, bought it. It was a great experience. The ride is smooth, acceleration good for nice sized rig and 6 cylinders. Exceptionally comfortable easy, to load groceries etc. Easy to get into and exit. Some don't like the seat belts, I do as they are lower than most and not across neck. We have been averaging 18.5 mpg. I was very impressed going over the bumps etc.","4wd, dashboard layout, visor extensions, Bose sound system, dual climate control.",Fuel economy and dual pipes.
5,Great SUV,stephanie ,09/25/2008,,,5,5,5,5,,5,5,5,5,I drove Jeeps for years. I am so glad I made the switch to my TrailBlazer. I can only say great things about it! Would recomend it to anyone looking for a midsize suv! We have plenty power to tow our camper and boat. Better gas mileage than expected!,"Value, ride, and handling",None
4.625,SS TB Rocks!,DCC ,09/06/2008,,,5,5,4,5,,5,5,3,5,"After owning 2 Corvettes but needing a truck, this is a great way to go. Gas mileage could be much better if Chevy junked the 4-speed transmission for a five or 6-speed. Other than that, it's a blast to drive. This truck gets a lot of looks and is nicer looking (inside and out) than the SRT Jeep I was looking at.  ",The SS looks great and is a lot of fun to drive. Almost as much fun as my '06 Corvette.,Needs overdrive. 4-speed tranny is so 1990's. Gas mileage could be better if you weren't turning 2500 rpm just cruising down the highway.
4.75,Wow,Kimberly Heck ,08/17/2008,,,5,5,5,5,,5,5,3,5,"I love this vehicle. I have problems with low back pain and seats are a great fit for me. This car drives like a dream with tight ride, a little softer than a Mercedes. I managed to get this car with the 5.3 engine and I am very impressed with the performance and I have no problems merging into busy Dallas traffic. The turning radius is amazing and can easily manage any U-turn or parking lot space. I know the the fuel economy could be better but I can't complain because I knew that when I bought the vehicle. ",The handling and ride. The overall appearance.,"I would love to see a diesel, flex fuel or hybrid option"
5,Still great,darren ,08/06/2008,,,5,5,5,5,,5,5,5,5,"Great power, ride, fuel economy better than expected, all the safety features, the quality is awsome! Better than any Toyota I've ever owned. Will buy my wife an 09",,
4.375,Big Fun With a Price,drwooly ,07/02/2008,,,5,3,5,5,,5,5,2,5,"Now, on 07-01-08, kind of an update, because I've always felt like initial purchase is like lust, but keeping for a while is long-term love. MPG has leveled at 15 town/road, and drops to 11 if towing.Where's the six-speed A/T? Ride has degraded some because of low- profile tires, but still fun. Obviously, GM engineers don't expect anyone w/ this vehicle to tow anything because of the brain-dead design for electrical connections is impossible to use w/o altering /cutting some plastic. Just for fun, entered a car show we were playing music for, and walked away with a Top 25 medal for newer models. Didn't expect that! Still fun, still drinks gas like Foster Brooks, very nice!",Corvette soul in an SUV body,None to make; they're discontinuing ths vehicle. How much would a 6spd.A/T cost to swap?
4.75,Love My Trailblazer,Red1 ,06/20/2008,,,5,5,4,5,,5,5,4,5,"I traded my '05 Equinox for my '08 Trailblazer. It has great pick up and a very comfortable ride.I like the interior styling. The controls are all easy to use. The steering wheel controls were a little confusing at first but I got the hang of it. My 3LT has a lot of nice features, sunroof, Bose Radio w/6 cd changer, blk leather seats with warmers (needed for Chicago winters), recall seating using key remotes. The list goes on. Gas mileage same as Equinox more or less. Right now I am averaging 17.3 in the city (must be the lack of summer traffic).","Comfortable ride and seats, Bose radio, interior controls easy to use.",Gas mileage could always be better but much better than other makes of similar size.
4.875,High-Tech ... But Still Some 'Retro'!,tknrg ,05/20/2008,,,5,5,5,5,,5,5,4,5,"The ""TBSS Experience"" is as close as you're going to come today to getting a true sense of the good old glory days of the historic ""Chevy SS"" muscle cars of the '60s and early '70s!  This vehicle not only recreates the feeling of the ""SS power cruisers"" of the past -  - but it has handling, ride, comfort, and convenience features that go well beyond most vehicles (car, SUV, or truck) on the road today, especially in its price-range.  This is an all- around, truly fine, American-made, limited production vehicle!  Pretty spectacular all-around!","This is as close to a ""perfect package"" as one can find. Top-shelf throughout!","Dual exhausts would have looked better , and, in Florida, the window tinting might have been a little darker."
4.25,2nd TrailBlazer,chevy buyer ,05/11/2008,,,4,4,4,4,,5,5,3,5,"This is my second TrailBlazer to purchase. The first one I had for four years with vitually no mechanical problems. I love the 2008 and the cosmetic changes to the front and rear end and the wheels! Great black leather interior, sun roof and 6 disc cd.  It is really fun to drive and looks good. OnStar is a nice security feature too",,Some wind noise from windows
4.125,Nice SUV, Joe ,05/08/2008,,,5,5,5,5,,3,5,2,3,"We traded in a 2005 Saturn Vue because of our growing family. It is more comfortable, quieter, than the Vue. The Vue was much faster due to the Honda V6 that it had, and it was better on gas. For being rwd, the TrailBlazer did great in the snowy season we had in Detroit Michigan. We never got stuck, or slid off the road. We average 15mpg in the city, and 20mpg on the high way.","The sunroof, stability track, and traction control. It is also very comfortable.","Gas mileage, and wind noise on the high way."
4.875,A Wonderful Blend,tjl ,05/01/2008,,,5,5,5,5,,5,5,4,5,"My 2008 TrailBlazer SS AWD is the first performance truck I have owned. In the past I have had BMWs. Z Cars, etc. as my performance rides and a Blazer as my truck. I read a lot of reviews and on-line postings about the TB SS. I took one for an extended test drive and I was hooked. No car I have ever seen does everything well. The truly great cars are a balance of features and the Trailblazer SS is a great ride. Chevy has not just jammed a Corvette engine in a SUV. They have paid attention to all the details such as handling, comfort, looks, build quality, and did I say performance?  They have tweaked everything. You will forget that you are in an SUV.  The SS is a true joy to drive. ","The SS not only goes fast, but it handles like its Corvette sibling. The stealthy exterior. No flashy anything and no roof rack just pure function.  ",A overdrive 5th gear. More hours in the day to enjoy it!
4.625,Big fun with a price,drwooly ,04/24/2008,,,5,5,5,5,,5,5,2,5,"Course I got this before the current gas problems, but I don't care! With the 6.0L engine, this is a blast to drive. Feels very solid; better than my last; 2004 Silverado Crew Cab. AWD really feels good. Mileage is worse than expected, but not horrible. (The same as my Silverados' 5.3L engine) Road/Street combined around 14-15 mpg. Have found 1.5 mpg difference between 55mph, and 65mph. Build quality vey,very good. No problems, 4,00 mi. into it. Just a good, less expensive Corvette, with a big trunk!","One doesn't stand out, although I love the Bose 6-CD radio. Love my music. (XM rocks!)","Why couldn't aftermarket-tpye mileage enhancements come from the factory? Air intake, tuned, dual exhaust. Only complaint is ride w/ low profile tires. Feel all bumps in the road."
4.625,Fast,Midnight ,03/25/2008,,,5,5,5,5,,5,5,2,5,"The wife wanted a hybrid, but nothing caught my except the TBSS.  It has a mean muscular stance.  We bought one in Red Jewel Tintcoat. Just a beautiful color. It is fast, roomy, and handles real well. I like big trucks. I'm a big guy, and even though the HHR was better on gas, this works the best for us.  My wife drives it to and from the train station and we use it on weekends. If I had to drive this to my work every day, 80 miles roundtrip, I wouldn't buy it because the gas would kill us. This is one awesome vehicle and is a lot fun to drive.","The exhaust note, the Bose sound system, looks, color.","Dual exhaust! Remote start, and aux jack in radio to play MP3 player."
4.875,Great SUV for the money,Ron ,03/11/2008,,,5,5,5,5,,5,5,4,5,"I was a first time buyer of a Toyota product and after two years traded it on a Chevy TrailBlazer, best thing I've ever done. Great ride, plenty of power, good ride even on the long trips, good gas mileage, lots of head and leg room. Just a great fun to drive SUV. Next time I will stick with GM.",,
4.875,Chevy's SS package does it again!,SS Man ,02/16/2008,,,5,5,5,5,,5,5,4,5,"For all you SS lovers out there, Chevy finally answered back!  This SUV has it all... power, suspension, body style and all the options you need cruising at 100mph.  I've had no problems with the windows rolling-up at high speeds (like another review I read) and the new 4 speed transmission allows a lot more than torque than any 5 or 6 speed can handle.  I own a 2002 Camaro SS with a 6-speed manual transmission and could've only prayed for a 4-speed manual!  Less shifting.... more driving!  If you like stlye, comfort, power and most importantly SS packages buy this SUV now before there all gone.  I recommend the the Black Granite Metallic for paint.",V-8 6.0 LS2 with cold air induction,"Auto window up, not just down."
5,A compromise,Drew ,02/07/2008,,,5,5,5,5,,5,5,5,5,"I'm 6'5""tall with long legs and after spending nearly a year trying find a SUV that I could fit my legs into and drive without my knees hitting the driver's door armrest on the left and a place my right leg comfortably without hitting the stupid center console, which most exaggerate these days. The Trailblazer was the smallest SUV I could drive without bumping my legs or knees somewhere and get acceptable gas mileage. Even the new Tahoes have less leg room. Tried the Acadia too, No Dice! Pretty sad when most cars don't fit. I really like the vehicle, got all the bells and whistles I need and it's comfortable, fun to drive and handles well. I traded in a '99 Yukon w/230K miles on it.","I like the OnStar, the driver info center, comfort for a tall driver, Bose sound system, the ride is great. ","Owner's manual says there are three radios, one w/6 CD changer, one that plays MP3 CD's and one that does not. No way to know until after you buy. Chevy does not offer option 2 on the web or at the dealer's. They'll let you buy one for $495 at the dealer's even though it's not in the owner's manual."
4.75,"Nice looking, reliable SUV",Rickster1959 ,01/29/2008,,,5,5,5,5,,5,5,3,5,"Purchased as used 2008 Chevy zone rep. demo. Fairly priced as a demo/used vehicle. Great looking ride!, Interior is very comfortable . Cabin is fairly quiet and well appointed. Lots and lots of features included with the 3LT model. Love the heated leather seats and mirrors. Bose stereo is unbeleiveable! Plenty of power is to be had via the famous Inline 4.2L inline six cylinder engine that I have read so many favorable reviews on. Standard trailering package is a welcome standard feature. So far, this is the nicest vehicle I have owned in over 32 yrs. I drive many miles per weeek, so Chevrolet 5 yr., 100,000 mile warranty is a valuable feature!",,
4.75,Gotta Love GM,GMFanatik ,01/22/2008,,,5,5,5,5,,5,5,3,5,"Coming from an 07 Cobalt SS/SC with some decent performance mods, this SUV is a beast. I am quite impressed with the comfort, performance, daily drivability, and overall fit and finish of my Trailblazer SS. Stopping power, go power, and manueverability are very surprising to say the least. Surprising in a positive way of course. I would not recommend the dealership I dealt with, but I would highly recommend picking one of these up.","I love how clean the body lines are, the hidden power, and the overall ride comfort. It's also nice knowing that not many have any clue of what this vehicle is capable of.","6 speed automatic or manual transmission would have been extremely nice, and beneficial for much better fuel economy."
2.75,Think twice before you purchase this,stick w/honda ,01/20/2008,,,5,5,1,1,,1,5,1,3,"I had my truck for 3 months and steering was shaking violently and brakes were even worse.  Took it into the dealership TWICE, but they could find the problem which is still going on!  I had a Honda for the past 10 years without a single problem.  I regret going with GM.  I don't feel safe in it and very hesitant transporting my children in it.  I hate this truck and how  I fear for my safety in it. Traction light is always coming on and the traction warning light comes on too.  I was told it is ok by the dealership and it would reset itself when I turned off the car.  It does, only to turn right back on 5-10 minutes later.","Comfortable, nice interior",Needs more cup holders and more cubby holes.  Might think about a better breaking and steering system too.
4.375,Good Bang for the Buck,andrecan ,01/20/2008,,,5,5,4,5,,5,5,1,5,"Coming off a 2004 Z06 lease I wanted to keep some ""Vette"" in my life w/2 kids and frequent trips to snow country demand AWD. While no Vette, it does instill confidence leaving tolls or kicking down to pass at any speed. Ride is nice and handling is good for this size vehicle. Seats are comfortable. Window doesn't close properly properly at high speed. I have to slow down, then close to get proper fit wout wind noise. Also transmission wants to slow this car down when you try to coast at about 68 mph. which makes it challenging to keep a steady foot in traffic at that speed. I like my wifes FX45 2x better but after comparing stickers I'm happy.",Of course: 0-60 time. Agressive looking front and side profile OnStar hands free linked with Verizon family plan is awesome.,Gearing: Quality: GM's continuing problem with Key - Steering lock mechanisms. It sticks (it did that on both my Vettes too). Duel Exhaust pipes on the other side! Shave some pounds off somewhere..
4.75,Great Car,Larry Marquez ,11/28/2007,,,5,5,5,5,,5,5,3,5,Most of the people that I know including mechanics love this car. Now I know why. It's a joy to drive. I dislike the new European styling so this is the car for me. GM has a winner in this SUV. Recently found out the the small Hummer uses the same chasis.,Management control center,Better gas mileage but for such a big car it's good.
4.25,TrailBlazer SS: SSweet.,Matt Peters ,11/04/2007,,,4,4,4,4,,5,5,3,5,"Not many changes for 2008, but all together the vehicle is a fun and comfortable muscle-truck. The throttle response at all rpm ranges is strong and allows for a fun drive. The tight sport-tuned suspension leaves one with the feeling of driving a car much lower to the ground. The sound of the Corvette LS-2 engine is evident at idle and even more so in high rpm. The full option electronic interior with heated seats and leather/suede wrapping make for a feeling of luxury most GM SUV's don't allow for. Overall, the SS is very sporty in exterior and interior styling, strong horsepower, and tight suspension with the interior luxury factors making it desirable for even standard SUV fans.",LS-2 engine. Suspension. SS style interior,"I know 2008 is the last year for the TrailBlazer, but why not use the 5 or 6 speed tansmission with the automatics when plenty other SUVs use them.  That leads to my other suggestion: better gas mileage."
4.625,Great Buy,nick ,11/01/2007,,,5,5,5,5,,4,5,3,5,"If you're looking for an SUV look into this Chevy. Yea, the gas mileage is terrible, but it handles great, has great looks, and plenty of cargo space. The styling cues are great, and with the usual large Chevy rebate you can get this truck affordably!  This is a must consider",LS2 V8,Move the stupid seat belts. Black rubber seal in the rear is leaky (not on the interior just on the trunk) Needs the shift points to be reprogramed 
4.375,"Zoom, Zoom and more Zoom",Nice ,10/26/2007,,,5,5,5,4,,5,5,2,4,"If you looking for comfort and performance this is the SUV that you should consider. This has so much power, it's hard to imagine a SUV can give this type of performance. If you looking for a family vehicle that is fuel efficient, this is not your type. If you want something fast with the capabilities of a SUV and comfort, look no further. ","Tires and rims are a great. Really I like all the features XM radio, Bose speaker system, and OnStar are standard with this vehicle.  ","The brakes don't seem as good as they should be when in comparison to the performance. Though, it handles really nice in all types of weather. "
4.5,High Performance SUV,Alan ,10/22/2007,,,4,5,5,5,,5,5,2,5,This is the most fun SUV I've ever driven. The power is super & the handling is more like a sports car. If the bad mileage doesn't bother you this SUV is hands down the best performace SUV out there. Only had a minor problem so far & it was fixed promply. Where else can you get a Corvette engine & handling package in a SUV.,The engine & suspension are among the best including lots of much more expensive SUV's & cars. GM didn't hold back on the SUV.When you push on the pedal lots of jaws drop. People that bought much more expensive SUV's should have driven this first.,I'd like to see a 3 way harness available.
4.375,Nice SUV,Bruce ,10/21/2007,,,4,4,4,4,,5,5,4,5,"This is a fun SUV. Not to be mistaken for a real off road SUV.  The fuel mileage is better than the manufacturer says, I'm getting 16.57 mpg.  I am looking forward to increasing the horsepower.  If you are looking forward to a fun SUV with horsepower this is the SUV for you.",AWD with 390 horsepower.,More head room and horsepower.
1.125,Bad bad purchase,"Hauppauge, NY ",09/25/2007,,,1,1,1,1,,1,2,1,1,"Dont even consider buying this vehicle...  Nothing but problems....  Front linkage constantly loosening. Brake rotors wearing unevenly. IGNITION PROBLEMS...whew!!!! Blower Motor Vibrates very loudly Tires wear unevenly. Smithtown Chevy....horrible dealer. Ripoff Salesmen, and Service manager is a tyrant.... no satisfaction, they only fix what they want too... beware  REAL GAS MILEAGE ONLY 13 MPG...... HIGHWAY MPG=14MPG CITY MPG = 13MPG ",,
