4.875,Head gasket problem?,LD ,11/13/2010,,,4,5,5,5,,5,5,5,5,"Bought one owner 56 K miles one owner, Rides drives great. Power 3500 V6 is well matched to car.MPG great in town 20's highway 29 and up. Runs quietly handles well tire wear good so far.Long trips do well. Over all like very well.Past car 3800 V6 Olds little more power.Should used it not the 3500 V6.Its a proven engine,Now 58K miles head gasket seems to be seeping antifreeze. does this problem have a history ? May need a new head & gasket !And rear elec door activator needs replaced already.$300 WOW $$ Hope have not got a bad car I do like it well.Had hoped it would be last car I needed i'm 72 years old now.Thinking should run over 120 K miles for me . I pray it will.",like on board computer system. On star good feature.Air pressure alert also great.drive and rides nice.,"Cup holders could be better placed. 12 volt acc outlet should be on dash some where not in counsel, Needs rear cup holders. ( I don't smoke but need ash trays to store my goodies.)"
4,Had Enough,KD ,11/11/2010,,,4,4,4,4,,4,4,4,4,"In the beginning, car was great, loved the remote start and leather heated seats.  I have had to have a head gasket replaced, new water pump and two sensors.  My issue now is it is using 1 1/2 qt of oil every 2000 miles and GM says that is ok.  Not ok with me. Time to move on.",Remote start and leather heated seats.,Just feel like I got a bad one.  I wanted to keep this car for a long time.
4.875,Will buy again,Susan ,09/27/2010,,,4,5,5,5,,5,5,5,5,This is my second Impala and prior to that I had a 91 Lumina.  This is the best so far although I liked the look of my 2002 Impala much better and Chevy got cheap with the interior lights and mirrors (must have been a man's idea).  My check engine light is on now and my remote start won't work.  I'm told it's a sensor in the evac system. Trying to find out what that's going to cost me.  I do go through front brakes & rotors annually.  I don't replace with Chevy parts and I never cut the rotors.  ,"Remote start, but not working at the moment.",Bring back the lighted visor mirrors and more interior lighting.
4.5,Awesome Car,JS ,09/22/2010,,,4,4,5,4,,5,5,4,5,This is a great car to drive recently bought this car. It is very fun to drive and I have ad nothing but great times in this car. I took this car from Philadelphia to New York City with some friends( 104 miles) and we started on a full tank of gas and using cruise control we got to New York City with approximately 3/4 of a tank left so its great on gas. There have been no problems at all with this beautiful car. Remote start works well and truck space is awesome. There is a safety precaution when there is severe wet weather it sounds like a a loud muffler but it protects the car from flooding the undercarriage,"MP3 Input, Interior lights, OnStar",Not a Thing 
3.5,No more,No more ,09/22/2010,,,5,5,1,1,,4,4,4,4,"We bought this car because we wanted a sporty family sedan.  The car looks great in the red with the large wheels but that's really the only upside.  We've owned over 30 vehicles over the years and this has to be the worst.  Problems started right away.  Door locks stopped working, the CD player stopped working, the ABS/ traction control has had problems 2 different times.  Of course now that everything is fixed it has a pretty substantial coolant leak.  Maybe we got a lemon, but this car is truly a disappointment.  I think we're done with GM.  Our 06 fusion has been perfect through 80k miles and this car has serious problems with only 40K miles on it.",Looks,Don't know where to start.  GM needs to really work on their quality.  It's no wonder why so many people switch to other brands.
4.625,Love The Car,Marvin ,09/05/2010,,,5,5,5,5,,5,5,2,5,I leased the Impala and we love it. Extremely smooth ride. Prior to this Chevy we owner a 2005 Buick LaCross. One of the worst cars we have ever owned. The Chevy was everything we wanted in a car. We will probably lease the 2011 Impala in a few days.,Everything about the car. Very smooth and tireless drive.,Would like  automatic temperature control rather than manual and memory seats.
4.5,Stylish and Underrated,John G ,09/04/2010,,,4,5,5,4,,4,4,5,5,"I traded a 2008 Prius, that's right, Toyota Prius for this car.  The Prius had 32K miles, this car had 24K miles. The Impala now has 55K.  This car has been a joy to own with a few issues.  I commute a total of 60 miles per day and drive around 550 per week.  I average a very fine 23.5 mpg overall.  The care runs extremely well and is smooth.  I would buy again, but there are a few troubling issues. The car uses a quart of oil every 1800 miles.  The dealership is looking into this to see if they can find the issue.  Cylinder deactivation works very well.  Car handles ok and rides well.  Seats are very comfortable for me, but my wife complains about the passenger seat. The leather is awesome. ","Heated seats Remote Start Bose Bose Bose! Front seat leg and hip room! Nothing compares!  I'm 6'3"" and weigh 245 lbs.  ",Needs Bluetooth Needs auto climate control Needs more stylish gauges Had to replace Wheel bearing at 54K miles.  Should last longer than that! 
4.625,Impala - American Pride At Its Finest.,stevenycer ,06/30/2010,,,4,5,5,5,,5,5,4,4,"I've got 2 years and 36,000 miles in on my Impala LS and have had an overall positive experience with it.  This car is strictly a cruiser with very soft handling and very smooth ride. This car is not for performance enthusiasts wishing for feeling the road as they drive.  I'm particularly fond of the exterior styling in a mocha brown color and the tail lights are a nicer improvement over the previous design.  There have been no mechanical issues with drivetrain, brakes, electric, or any engine issues.  Aside from a few minor flaws,  I would purchase this car again in a heartbeat.  The Impala has proven to be an excellent value for the money, and fuel economy for a V6 is fantastic.","Suspension, smooth comfortable ride, 24 mpg city, 33 mpg hwy.  I don't know what others owners are hearing, but I've NEVER been in a car this quiet on the road, sometimes I forget that the engine is running.  AUX port on radio dash, a thoughtful touch.  One touch power windows.","Cheap Goodyear tires, just replaced with excellent Michellin X-Radials. ABS not standard. No split rear seats or interior access into trunk, a bit irritating, but it is an option.  Replaced peeling applique under warranty (plastic between rear and front windows).  Battery replaced under warranty.  "
4.125,A good full size car,Scotlad ,06/19/2010,,,4,4,4,4,,4,4,5,4,"A few issues when new, mostly inside trim and brakes. GM's Chinese made rotors are junk. Have been replaced twice in 40k miles. Otherwise the car is great. Average 25 mpg in town and 29+ on the highway.  Given what we paid ($22,500) nothing else came close.","Gas mileage, comfort, size",Better quality brakes.
4.625,AC/Heater,Laura ,06/18/2010,,,3,5,5,5,,5,5,5,4,I bought my 2008 impala over a year ago and am pretty happy with it. The only thing that i dislike about the car is that the heater doesn't throw heat continuously when the car is in park. Bad situation if you ever get stranded on the side of the road in the middle of winter. I also noticed that the car has a really bad blind spot in between the area where the windshield and the drivers side door meet. The lighting inside the car is also pretty bad. ,The radio with MP3 input. ,Improve the way the heater functions. 
4.75,Love this car,A Cossick ,06/06/2010,,,4,5,5,5,,5,5,4,5,"I have owned this car for 2 yrs, put 24k on it so far.  Love this car, the power, torque steer.  Averaging 21.7 mpg on 15 mile ea way commute to work and all my other driving, including some passes on the 1/4 mile.  I think this is excellent for a 300 HP full size car.  It corners and stops pretty good, though it has quite a bit of understeer when you push it to the limit - overall not bad for a full size car.  Also needs to side support in the seats like the Grand Prix GXP has - these seats are too bench like.  The drive by wire has some limitations as it will cut the throttle at times when I don't want it to - sharp movements that it thinks the car is out of control.  I plan to own 10 yrs+","300 HP V8, good cornering for full size, XM radio, displacement on demand, lumbar support for lower back, plenty of head room, hook to keep floor mat in place, instant economy meter in dash, tire pressure and oil life monitoring systems","More power (always want more power!), beefier transmission to firm up shift, side support in seats, better storage area in center console, SS emblem on the front"
3.75,Big questions,TEV ,06/01/2010,,,4,5,4,3,,4,4,3,3,I have a question for other Impala owners.  Do you hear a change in engine sound during wet weather?  I also feel a loss of power in heavy rains? Am I nuts or does anyone else experience these problems?,,
4.75,Satisfied Customer,Satisfied Driver ,05/28/2010,,,5,5,5,5,,4,5,4,5,"I Love my Impala LT, this is my second Chevrolet and must say they are very wonderful calls. (NO RECALLS YET).The Impala LT is a great car to drive, very cozy I sometimes don't wanna get out.","Spacious, Trunk Room, All around good car.",Gas could be a little better
3.5,A good car for the price,calcote ,04/28/2010,,,4,4,4,4,,3,4,2,3,"The Chevy Impala is a very nice car. It has many nice features. The fuel economy is pretty bad on this car. It gets only about 21 mpg in rural areas. The style of the interior and exterior is very nice and the car is very roomy. It is a very reliable car that looks very nice. The cars is very quiet, comfortable, and has a very fair price.","Very large trunk, roomy interior, great style, remote start, great handeling, built solid, comfortable, and an inside display that tells many things about the car like battery life, individual tire pressures, and fuel economy.",This car needs better fuel economy.
4,A/C controls,Mikey ,04/18/2010,,,4,4,4,4,,4,4,4,4,"A/C controls do not work properly. When switching from outside air to recirculating air the a/c kicks on. a/c lite stays off. Push a/c button, lie comes on. Push a/c button lite goes off but  a/c stays on. Must turn fan knob switch to off to shut off a/c. Chevy division says that's normal. That happens on NO other car that I know of.",,Re-program a/c computer.
3.5,Chevrolet has cheapened the Impala,Charl ,04/08/2010,,,5,5,3,5,,5,2,1,2,I was very disappointed in the newer Impala as I owned a 2005 and loved the vehicle (my fault for not researching).  Chevrolet has left out many of the old standards of comfort and the gas mileage is very disappointing.  We have owned at least six Chevrolet cars and I'm sorry to say I will think twice about purchasing another.,I like the style of the car and the uncluttered dash.,I used to get 30 mpg and now get 22 mpg.  Chevrolet should be ashamed for not improving the mileage!!!  Make the seats softer - my husband's truck is more comfortable.  I miss the back seat that folded down for trunk access.  I like a car with the bench seat but please return to the older style.
5,Another Chevy,Norma & Jim ,03/21/2010,,,5,5,5,5,,5,5,5,5,"We've owned quite a few Chevy cars over the years and some were better than others. We bought a 2005 Impala in 2006 and it`s been one of the best. Then we bought this 2008 Impala LTZ used. It is stylish, comfortable, quiet and just an all around nice car. It has 40000 mi but still drives and looks like new. ","WOW, where to start! This vehicle has all the bells and whistles. Remote start, leather interior, fuel management, power seats, great stereo, great fuel economy (E85 fuel capable) and all I can say is, if you`re in the market for a good car, new or used, check out the Impala. You`ll love it. ",Make the net in the trunk shorter and not as tight (makes it difficult to put large bags and boxes into trunk). Put the strap handle for closing trunk lid back on.
4.75,NASCAR IMPALA,Nascar Impala ,03/17/2010,,,5,4,4,5,,5,5,5,5,"While the few car magazine reviews of this car give it less than stellar reviews, this car is a great cruiser and can be driven as fast as a car needs to be driven! Passing is a blast.  While some reviews call the suspension tuning ""boat"" like, I'd strongly disagree.  I believe it handles very flat and also takes road bumps well.  Very good mix.  I have yet to cause the front end to push taking corners way to fast.  The seats do limit your cornering as they have no side bolsters.  Since most seat time is cruising, this is an acceptable trade off.  Gas mileage is good also....except if you are using it for the V-8...which is why I bought it!","Excessive engine power...even though it is front wheel drive.  In winter, a rear wheel drive power sedan would not be worth it.",Seats with more side support.  Longer remote start range.
3.375,"Fast speed, faster break downs",Mixed Emotions ,02/03/2010,,,4,2,2,2,,5,4,4,4,"Bought used with 34000 miles, lots of wheel spin, 21mpg mixed 27 highway. can keep up with newer mustang gt's and eat up 5.7 hemi chargers, BUT 4 fuel injectors replaced, bad onstar unit and a paranoia when driving more than 100 miles at a time. every time I've been on a road trip a fuel injector goes bad.  i should have learned my lesson after my 05 cts's water pump and transmission went out at 4 yrs and 33000 miles on the clock. no wonder GM went bankrupt so so so much fun to drive...until it breaks down. dealership would blame a flat tire with a nail in it on ""unknown causes with no sure fix""","acceleration, gas mileage for the power",a corvette derived engine that runs 10x's worse than my 92 lebaron's is a travesty.
4.375,Good basic car = LS,swhite ,01/30/2010,,,4,5,4,5,,4,5,4,4,"I drove my Impala LS for two years as company car before buying.  It hasn't ever needed mechanical repair.  At higher mileages, i do ""hear rattling"" or something.  The tires do wear unevenly which may be the rattling.  Otherwise it's a great car and easy decision to purchase for my personal use after being company car.",good quality for price radio,wheel alignment
4.25,Very satisfied,Mark ,01/22/2010,,,3,4,4,5,,5,4,4,5,"Impala now has 50000 kilo's on and not one issue. Original tires still have 15000 or more to go. Not a chev fan but can't complain. The traction control is great in snow. Took it down to Florida from Canada ran perfect. Lot's of power and handles great for big car, even when loaded with luggage. first North American car I've owned that hasn't had a problem. May even buy it out when lease end in Sept. ","Style, handling, big trunk, adequate power for passing smooth ride","better front seats, the carpet in the back window has been changed to something far better in appearance in newer models I think mine looks terrible.."
4.5,American Pride,Gary ,01/01/2010,,,4,4,5,5,,5,5,4,4,"Bought this 08 SS from a dealer, it was a demo model with 588 miles on it. Got a great deal on it. The car is excellent, fully loaded, extreme amounts of power, smooth, and handles good for a large car. I can easily get 29-30mpg on a smooth flat highway going 70. The car is built well and very solid and surefooted. Great car at a great price. ",303hp! Comfortable ride ,"I'd like a more aggressive sounding exhaust from the factory, even though it does have a nice rumble to it. Impossible to not spin the tires, I need more HP :)"
4.875,impala,Felipe Soler ,12/29/2009,,,5,5,5,5,,5,5,4,5,"Great ride, strong car,smooth ride.Would buy An impala again over any Japanese car. AC is great, leather seats are very comfortable.Body metal seems better than Toyota or Honda does not dent easy. Nice acceleration. Gas is fine when traveling far, i get more than 350 miles with a full tank. ","leather seats, a/c, acceleration, fuel management system.","tires wear abnormally on the outside, suspension needs improvement."
3.875,More good than bad,Don W ,12/19/2009,,,4,4,3,4,,4,4,4,4,"I've owned this vehicle for 20 months and 30000 miles. No tire replacement yet, maybe 6000 miles more on them. I love the performance. I owned a Malibu before this Impala. I just feel the Impala is more stable, especially when needing a fast acceleration, or a quick braking. The extra-loud cabin noises (engine Whine and outside wind) are irritating.","Automatic start, 18 inch wheels, interior and exterior design, trunk space, back seat(flip up for extra room), all-around comfortable driving experience","Wind noise is to loud, engine Whine is irritating, automatic climate control would be smart improvement. "
4.25,08 Impala LT 3.5 Liter,JW ,12/14/2009,,,4,4,4,5,,4,4,5,4,"Factory Goodyears on this car were a joke. I bought the car at 14,000 miles and drove the car to 18,000 miles and had to replace the Goodyears. (Why does Goodyear keep getting OEM Contracts with the big three ?) I have Michelins on now and they are wearing excellently. The car is smooth. The V- 6 could use a little more umph for my taste but not bad. The mileage is excellent. I average 30 to 32 miles per gallon in the Impala. I had 2 Ford Focuses and didn't do much better than that. This car has a huge trunk and feels great on the highway.The remote start that is standard, and the stereo system for stock is very nice. Over all I am pleased and would buy again. Buy used for the best deal !! ",Satellite Radio. Remote Start,A little more horsepower would be nice.
4.875,Reliably Rapid,Dave ,12/10/2009,,,5,4,5,5,,5,5,5,5,"My car was a rental for its first 20k miles.  After 1 year and 17k more miles, all I've done is keep the oil changed.  The cylinder deactivation gives highway economy of 27mpg with the cruise set on 70.  It drops to about 17 in town.  A friend with a Bentley Arnage commented on how nice the interior is!  All that and outstanding acceleration to boot.  The look of despair and surprise on a Honda ""tuner"" face in the rearview when the light turns green is priceless :)  This car is a keeper.",1) V8 power and torque 2) Remote starter 3) XM radio 4) flip and fold rear seats 5) SS specific styling,"1) Illuminate the entire inside of the tail lights.  The red dot in an integrated housing may be fine for foreigners, but it looks awful. 2) More power - I can't beat a hemi Challenger! (and I never tried) 3) How about a retractable hard top?"
4.625,"Tires,tires,tires",concerned ,12/02/2009,,,4,5,5,4,,5,5,4,5,"I purchased my 2008 Impala and it had 26000 miles on it.  It now has 35500 and has the back tires on the inside of the tire wore to the cords.  I have to also replace the front as they are wearing unevenly.  I took it to the garage and this is the 2nd set of tires that it has went through at 36000 miles and was told that this is common with this model.  The road noise is terrible.  When my granddaughter rides in my car with me she saw ""airplane grandma?"" by hearing the noise of the car on the road.  I like the power & the room the car provides however I feel that if there is a problem with the tires that the company should step up and take care of it.  I hope it sticks good in the winter.",Large trunk and heated seats,2 sets of tires by 36000 is definitely outrages.  The company needs to step up and admit something is wrong.  The road noise is very bad as well.  
2.25,"Tires started wearing @ 10,000 miles!",chacha7 ,11/30/2009,,,3,1,1,1,,2,5,4,1,"Tires on these 2008 Chevy Impalas, are wearing prematurely starting @ 10,000 miles. Good Year dealer told me these 2008 are coming from factory slightly unaligned, causing premature wear. They also told me that they had 4 city police cars just in that @ 10,000 miles was in need of new tires all the way around on all four Chevy Impalas! And they won't do anything about replacing mine trying now for over 1 year. Had electrical problems with this sense 24 hours of having my Chevy Impala!",,
3.125,AFTER MY 1ST YEAR,Tom ,11/18/2009,,,3,3,3,3,,3,3,4,3,"Purchased this car a year ago, had 22,000 on it now has 42,000. Back to dealership for minor things, but had to replace 2 tires, I swear they are rubbing something under the vehicle, steel belts came through, shouldn't w only 42,000 on them. Just your BASIC sedan  next vehicle will be the Hyundai sonata  hell of a lot more car for the money ",Like the Exterior look but thats about it,"More rear leg room,  rear cup holders, better looking interior more comfortable, better sound system. Just more options for the l t  model that are standard in other cars"
3.5,Don't Buy,Dargiewicz ,11/13/2009,,,4,4,2,2,,4,4,4,4,"The front tires need replaced after 8000 miles. The drivers door is noisy as wind goes by. Rear door lock sticks. This is my wife's car - she is not happy - My mother has owned Impala's for many years, she bought a 2009 Impala and is ready to go buy a Ford. My family of nine has owned GM's from the mid 70's - I own a 2001 GMC truck and have owned many GM vehicles  (great truck but after Impala I may go to Ford truck)Always wanted a 3500 but may go 350","Good power, roomy, nice car for about six months","Front end weak - Tire wear is not good not even fair - Car quite to drive for first six months after that turn signal noisy - out side noise increases - Gas MPG not at 29.       For $23,000.00 not happy"
4.625,"60,000 Miles later!!!",Anthony ,11/10/2009,,,4,4,4,5,,5,5,5,5," I have never had so much fun with a car. The SS is a blast to drive and its sad the 09 year was the last one. I just turned 60k miles already and had the rotors cut once, and a bad fuel evaporator canister needed to be changed. I still have the original tires on the car!I only wish the import buyers would have driven an SS before purchasing a car. The Imp has a ton of room and a huge trunk too! I have avged @ 20 mpgs between city and highway driving. Buy a used one today and it is the steal of the century since resale isn't to strong. If Chevy would have really promoted the car it would have survived. Find one and have some fun!!!",V8..cant beat a small block! Heated seats and the flip and fold back seat. Plenty of space to hold the family. And again V8!!,Brakes fade pretty fast. Handling and seat bolstered could use improvement. For the money you couldn't beat this car. Was the best value when new now a screaming bargain used!!
1.625,Disappointed in Chevy,Frank ,11/04/2009,,,2,1,1,1,,3,2,2,1,"This car has had to be back to the dealer 7 times for emissions related codes that cause a check-engine light within the first 17 months of ownership.  It happened 4 times in the first year, but I didn't file a lemon law claim in time (it had to be done within the first 12 months) and now Chevy won't buy it back and I have changed to a different dealer for the last couple of repairs.",None.,"QUALITY. Why doesn't Chevy get this and why won't they buy it back from me. I am willing to take a hit on the price, but I would feel guilty selling it to anyone other than Chevy."
5,LTZ-Best car for the dollar,JWT in Indianapolis ,11/01/2009,,,5,5,5,5,,5,5,5,5,"My 2008 LTZ is the best car I have ever owned(2 Cadillacs, 2 Porsches, 3 Toyotas, 1 Ford, 1 Buick, 1 BMW).  It is well equipped, fun to drive, built with quality, and good looking.  It gets about 26-30 mpg on the highway depending on speed driven.  If I keep it at 65mph or less I get close to 30 mpg.  I get 20-22 back and forth to work (to/from downtown Indianapolis).  I really like the look of the 18 inch tires.","Bose and XM radio are a great feature.  I can't do without the seat warmers.  I enjoy the information provided on the display-gas mileage, tire pressure, compass, %oil. change, etc.  The 18 inch tires look great.  The large trunk easily accommodates two sets of golf clubs and a pull cart.",I wish it had back-up sensors.
4.25,The Way to Go,Bob Riehm ,09/08/2009,,,4,4,4,5,,5,4,3,5,"Just turned in my 2007 Impala SS.  It was a fantastic car.  Took on a few cross country long trips and clocked 27mpg on the hwy.  The car always performed perfectly and had real power when I needed it.  My new 2008 from the dealer (demo with 6,000 mi.) is similar to the old one.  Not much change, and the 2010 are virtually the same so..... I went for the deal.  I will continue to buy this venue of car (American all the way) before spending thousands more on a foreign hottie which really can't compare to the American Impala SS.   The price is right and the feel is right, both in the car itself and the American pride.... ""step on it !!!!""",,
4.125,"""Good Car not Great car""",Scott ,08/31/2009,,,4,5,4,4,,4,4,5,3,"I bought my 08 Impala Lt 3.5 V6 used with nearly 26,000 miles on it. It was in pristine shape. It runs good ONLY execpt for my excessive tire alignment problems that the factory warranty wont cover. Yea the bumper to bumper the covers ""almost"" everything. Other than those minor problems and the lagging power of the V6 i think it was a great buy.","Huge trunk, really like the look, radio is fantastic for just the basic stock any very roomy","Alot of outside noise when no music is on, handling is clumsy, should just make the 3.9 v-6 and the SS model."
4.625,"Great economical, powerful family sedan",Richard Hanks ,08/24/2009,,,4,4,5,5,,5,5,5,4,"Bought with 34,000 miles on the clock. Immediately set off on a 5744 mile round trip to east coast from WA State.  Amazed at 32.3 average mpg received with cruise set at 70 mph where possible.  Several tanks at 34+.  Some heavy head winds in SD and MT on return reduced economy. The suspension is too soft for my taste with excessive body roll on cornering at higher speeds, though ride was very comfortable. As others have stated the side mirrors are on the small side for total safety.  Power is more than adequate with the 3.5 liter V-6. Fit and finish both inside and out is very good.  Trunk carried dog crate, cooler and all our bags with room to spare.  I am very satisfied with this car.",Fuel economy Styling Price,Stiffer suspension larger cup holders 
