3.875,16th Honda,Hondaman ,12/30/2009,,,4,5,4,4,,4,4,3,3,"Yes, that's no typo--I've had 16 Hondas (and 1 Acura).  First van though, and I've had it 24 months w/o problems.  It doesn't handle like a Civic--but it doesn't ride like one either.  It's been comfortable, safe and reliable.  Fun? Hey, it's a VAN for crying out loud.  It does make an odd ""clunk"" in the back end when using reverse sometimes or turning hard to the right.  But I've got no real complaints.  It's not like my CRVs for toughness, it's not like my Civics for mpg. It IS like my Accords for comfort.  I still can't get over the stigma of owning a minivan but if you have to have one, the Odyssey is the one to get.",AUX jack for my XM radio (didn't want the L package just to get it).  8th passenger seat.  One touch doors.  ,1 touch up/down passenger window. Moonroof option w/o spending $5k more for the touring package.  Black as a standard color not the higher package models.  Why do we need 3 shades of silver/grey?  Heated CLOTH seats.
4.375,My first 18 months,scottinky ,11/29/2009,,,5,4,4,5,,4,5,4,4,"Took out a lease on this 2008 EX-L after trying the large SUV route.  This is by far the most practical vehicle I have ever owned.  The interior is well laid out, but materials could be better. Engine is responsive and smooth.  Ride, even in the third row is comfortable. My kids love the DVD player.  My wife and I love the ease of entry and exit. Despite my ego issues with driving a van and having had the opportunity to dump out of it early and go back to a cheaper SUV, I just couldn't do it.  Dealer service has been excellent in dealing with the transmission problem and the noise issues. All have been fixed. Hopefully I won't have any more issues to deal with, just gas and tires.","Power sliding doors.  Gauge cluster, back up camera, DVD system, hwy fuel economy, sat radio, sporty driving experience and cargo/people hauling capacity. ","Improve interior materials.  Too much wind and road noise, better sound insulation.  More engine HP and AWD model. Improve door trim design, get rid of the stupid silver trim, it comes loose and rattles. "
4.625,Long Term Review,Rich ,09/17/2009,,,4,5,4,5,,5,5,5,4,"The Odyssey bought new in 08 has 27K. I posted previous reviews. Additional comments to previous posts are the brake feel could be improved.   Mileage improved to 30 mpg on several trips using 91 octane, non ethanol gas, speed 60 -65 mph.  28MPG has been seen many times.  In the suburbs mileage is 21 - 23,  Keep acceleration RPM at 2000 vs jack rabbit starts.  The van has had no repairs except for a minor issue with the glove compartment door becoming misaligned due to a screw.           ","Interior gauge legibility, headlight projection at night, seat comfort, ease of entry/exit, turning circle, outside style, outside visibility, navigation and XM radio, EXL/Nav features, drive-ability, tray/cup-holders between driver/fr passenger. Great long distance hauler for older couple like us. ","Improve quality of interior plastics. Reduce road noise, improve paint quality, update the dash design, & improve radio sound.  The power tail-gate and auto-off lights which became standard on the 09 was a good update.  Wish we had those features.   "
2.375,O8 Odyssey Touring,jojobird ,08/04/2009,,,2,3,2,1,,2,3,5,1,"Vehicle is average with utility in mind.  This could be an excellent basic transportation were it not for tire and drivetrain vibration, road noise and Honda's denial and refusal to fix problems.  This is not a luxury vehicle even though it is priced as one.  Not refined, just good basic transportation.  There are better choices.","space,Nav and bumper sensors.",Better quality leather and more selections on power seats. Better dash materials and sound insulations for quieter interior.
4.25,Satisfied...,Ben ,08/01/2009,,,4,4,4,5,,4,5,4,4,"Since we needed more space, I traded our Acura RDX and it was well worth it. The RDX was fun but it lacked cargo space and ran only on premium gas which was expensive. I chose the Odyssey because it is rated overall the top mini van in its class. Its able to hold a baby seat, infant seat, two strollers, guitar, etc. The seats are very comfortable. Driving feels like you're riding on air. ","Navigation, DVD, VCM, folding back row seats, climate control (front and back rows), window shades for the middle row, power sliding doors, temperature gauge, 6 CD changer, multiple cup holders, ",AWD switch
3.625,first year review,MK ,07/30/2009,,,3,3,4,4,,4,3,5,3,"First let me start of by saying that I am a huge car guy. Overall the odyssey is a nice minivan. It is a nice ride for a longer road trip or hauling people around, probably the best minivan out there right now, not that there is a very large selection available. On the down side it is far from perfect. First of when you get a car that is $40000+ you should expect better interior materials, especially on the dash. It's all hard plastic, kinda like the pre- 2007 GM's. I have owned infinities before in the same price range and the dashes were much more luxurious. Secondly the seats other then the driver  side are not exactly comfortable. The backs stick out to much. The outside mirrors stink","The simplicity of the navigation, storage","When you fold the outside mirror it gets back to its default setting. The A/C system is just not powerful enough takes forever to cool down. Where are the auto lights, come on my 2000 LS Astro has auto lights. Improve the seat comfort and upgrade the interior materials. Sound systems sounds hollow."
4.875,Happy so far,Leon ,06/19/2009,,,5,5,5,5,,5,5,4,5,"We drove it from Augusta, Ga. with 14,000 mi. It was smooth and comfortable but so was my 2000 Dodge Minivan with 154,375 mi. Too many toys on the Touring model. Fun to drive: It's a Minivan, how much fun is it driving a Minivan, it's not a sports car.","Love the back-up camera and Gps. Great ride, easy handling. So far so good will let you know after the winter driving.","Get rid of the PAX Tires- Improve the gas mileage, got 28 mpg. If you got 40 mpg like the Toyota Venza would be great and you sell more vehicles."
2.5,Won't buy another Honda!!!,js114 ,06/11/2009,,,4,4,1,3,,3,2,2,1,"I purchased this brand new and at first I did not want a minivan, but I've found I like the convenience of it.  Now I absolutely can't stand it, the passenger side door rattles.  At first it sounded like a marble.  They took the door apart and wrapped everything, it was gone for a few months, now it's a new rattle and now the other door has started.  It's bad when your 4 year old says, ""mommy my door is rattling again.""  You can't even turn up the radio to drown it out.  It's only a year old and I want to get rid of it.  I wish I never got rid of my 4Runner.  Dealer says he's never heard of this problem.  After reading the reviews, it sounds very common.","DVD, Navigation, backup camera",Rattles...fix the doors.  
4.375,One Year With The Odyssey  EXL-Navi,Rich ,06/02/2009,,,4,5,4,5,,4,5,4,4,"A follow-up review from our first month of ownership.  My wife and I bought the van for long trips.  Using 91 octane at 60-65 mph we average 27-28 MPG.  Mileage in town 21 MPG using a light foot on the accelerator. Combined mileage about 22-23. Very comfortable on long trips.  Navi great, seats great, maneuverability great for van, entry/exit seat height great, noise control OK, front suspension OK, mileage better than SUV, exterior looks great, gauge legibility great, headlight projection great, dash design dated (think JDM), interior plastic too cheap. Upgrade the 2010 interior plastic to match the 2009 Pilot.   ","Navi, seats, room, seat height, gauges.  EXL with Navi has great features. When you add it up, the overall experience is great, even if not scoring at the top of many categories. Much like the old Volvo 240/940, it is the whole package score that moved the vehicle to the top. ","Improved noise suppression, front suspension, and interior plastics.  Hard plastics will scratch with little effort. Needs better sounding radio, auto tailgate lift and standard bluetooth. Sure there are things that could be better but the whole package makes this a great long distance hauler.     "
4.375,Please stop the rattles!!!,Sue ,05/23/2009,,,5,4,3,5,,5,5,3,5,"Have had the vehicle for 15 months with little to no problems.  I did hit a deer on Thanksgiving Eve which did $2200 damage to car.  Had repairs done through the dealership with no problems.  My only real complaint with the car is the rattles!  The passenger side slider sounds like it will rattle right off the hinges.  Both sliders creek when coming to and pulling away from a stop.  Very annoying!  While the second row power down windows seem like a great feature, when the windows are open it sounds like I'm driving with flat tires and the thumping in my ears is annoying.  I don't have the second row windows down.  I'd much prefer the far back windows to vent open.  ","Love the leather interior; cleans up nice.  The kids love the entertainment system, although hubby complains the headphones have too much static.",Get rid of the power windows in the second row and allow the far back windows to vent open outwards.
4.875,Glad I bought a mini van,Texdav ,05/03/2009,,,5,5,5,5,,5,5,4,5,I was really stuck whether to buy a van. But now I am glad I did. After 10 months it has been a good experience. I was also wondering about the cylinder shutdown feature but never notice it; it's so smooth. Mileage on a half city; half hwy was 21MPG when checked. Haven't really found any thing I don't like. Everyone that has driven or rode in it is impressed.,Overall I'd say the fact that it drives like a car. Very quiet and very comfortable. A really nice vehicle on a trip.,I would say a stored full size spare as I hate the mini spares.
3.875,2008 Odyssey EX-L,Doca  ,04/29/2009,,,4,4,4,4,,4,5,2,4,"Got a screaming deal on the Odyssey EX- L 2008 for only $26,388.  I have to admit that I was not that excited when my wife wanted to get a van but now I am a convert.  Roomy, functional, and surprisingly agile, which is the reason why I picked the Odyssey over the Sienna. Nice fit and finish, power delivery is smooth across the range (no kick down , comfortable ride even in the third row!!  My only beef with it is that the gas mileage stinks in city driving.  No other issue so far after over 9000 miles.  Improve the gas mileage rating and it's a true winner.  Very happy with purchase. ","Functionality, fit and finish, smooth engine and ride, value.  ",Better gas mileage needed!!!!
1.625,This will be my last Honda,ajaca5 ,04/27/2009,,,1,2,1,2,,3,2,1,1,"Horrible interior and exterior fit & finish, rattles and hard wind noise. Been in the shop for 3 times (replace misaligned top & bottom glove box, streaks on passenger window, and rattles from both front sash trims), bought for steep discount and good experience w/ my current 2002 Odyssey, poor fuel economy, dangerously soft brakes, so-so road handling, cheap plastic interior, poor front ventilation controls for rear, uncomfortable bucket seats (too short for my thigh) poor paint jobs, and etc. Been driving hondas since 1990 (1990 civic, 2000 accord, 2002 oddysey), this will be my last.","navigation, RES, deep discount, auto tailgate ","Dangerously soft brakes!!! Far better fit & finish and interior plastic materials for MSRP >40000, rattles from everywhere, bumpy ride and vibrations from tires while driving at low speed, regain the reputation of ""being most reliable car"" that I was accustomed to driving. I miss my old Hondas."
4.75,Car,dictory ,03/30/2009,,,5,5,5,4,,5,5,4,5,"We bought this car in 2008 and it is wonderful. It runs great. The navigation system is great and it has zagat 2007 restaurant ratings. When I drove it, it was smooth, not bumpy. The gear shifter is at the dashboard, unlike the Dodge caravan, which is on the steering wheel. The rear-seat entertainment system is good and it features two wireless headphones. It is spacious and the seats are comfortable. Overall, I love the Odyssey!","Navigation, entertainment system, seating capacity, leather seats, speaker quality, and driving smoothness","If there would be Tiptronic Transmission, it would be great!"
3.875,Good Van,Zman ,03/23/2009,,,4,4,4,5,,5,5,1,3,"The van has great interior fit finish and space flexibilty. Little I would do to improve, other than some road noise and very poor MPG. With the variable cylinder management, I has hoping to get near the sticker MPG.  There seems to be some extra vibration in the steering column when the engine is under load. It was bad enough I actually thought a tire was out of balance - easy to get at and change the engine oil.",interior flexibility,manual over ride of sliding doors to save on the battery/solonoids.  better mpg!
3.375,Honest Review / Inferior Vehicle,OddVan ,03/16/2009,,,4,4,3,1,,4,4,3,4,"Vehicle purchased new 08/07.  Have had many issues that started as early as 500 miles including dead battery, headlamp switch short, relays short, clunking noises to front undercarriage, steering column replacement, slider door safety locks freeze preventing sliders to lock while open, rattles to right door trim panels.  The newest of the problems now at 21K to address with dealer is the headliner seam coming apart and the heater controls not functioning properly.  We have NEVER been so unhappy with a vehicle.  Traded our 02 Toy Sienna, what a mistake.  Tried trading this vehicle in, dealers are offering low trade... now I wonder if the reliability factor was utilized in the low trade offers.",Space.,Build a solid vehicle with quality to be proud of.  This vehicle reliability is poor.
4.5,She loves the van,kagey1 ,03/13/2009,,,4,5,4,5,,5,5,4,4,"My wife had gone on record as saying she would never drive a minivan. Three kids later she's driving the Odyssey and loves it.  The interior is extremely versatile and great room for the kids, their friends and all of the accumulated stuff. We've had it on several trips and it's performed great with just over 25 mpg on the highway and around 19-20 around town.  The seats are comfortable and it drives more like a car than most vans and handles surprisingly well. It does have a lot of wind noise, primarily from the front passengers seat, but we just turn the radio up.  The breaks are softer than what I'd prefer but not to the point of feeling like we're in danger. My wife's glad we bought it.","Adaptability of seating, handling of vehicle, ride comfort, storage space especially in floor storage, VCM makes gas mileage livable.","Do something about the road and wind noise, improve the breaks, and since we're wishing it would be nice to have the option of a hybrid, especially for in town driving, "
3.625,Average,JTLS ,03/05/2009,,,2,4,3,5,,5,2,3,5,"Bought after totaling 02 Grand Caravan.  Has awesome power, looks great.  Climate control poor, only can control temp of rear cabin and not fan speed or mode from the front.  Interior is extremely uncomfortable and hard.  Dome lights will not go off automatically (What?). I drive mostly highway @ 80MPH and get about 18MPG.  Caravan was 22MPG.  Kinda confusing about maint schedule.  There is no set time, you have to rely on the comp to tell you when to take it in.  Might be 7500 miles or 3000.  Stereo controls are too far away from driver to be comfortable.  Hopefully the reliability and longevity will compensate for the shortfalls.  Wish I had my Dodge back but playing the cards I'm dealt.   ",Power. Handling. Style.  It likes to run fast.  ,Softer interior. Better armrests. Auto/off dome lights. Better designed climate control.
4.5,Great Minivan,RV ,02/17/2009,,,5,4,5,5,,5,4,4,4,"This is my first Honda experience.   A very reliable well built car.   Has many features but always wondered why they couldn't have a back-up sensor (versus a camera) or a windshield wiper fluid sensor, common features on American made vehicles.   One of the few minivans still in production.    My biggest complaint in the navigation system, which was outdated the minute I drove it off the floor.   The system also tells you that you have arrived at your destination when you are still at least a block away.   You can't get the back up camera without buying the navigation system.   I carry a plug in portable system for navigation.",Audio system.  Reliability.  Handling.,Provide an easy and inexpensive to update navigation system rather than the current outdated system.
3.125,Wish I had leased another Sienna,Todd ,02/08/2009,,,1,3,2,5,,3,5,5,1,"Lease was up on my 05 Sienna, so I leased an 08 Odyssey, due to the better lease rate and better exterior styling. Wow do I miss my Sienna after 4 months. The Honda feels so cheap in every way. Fit and finish is TERRIBLE. Several paint flaws, poor fit of exterior trim, horrible fit of interior trim and interior surfaces which feel cheap and scratch ridiculously easily. Brakes are downright scary, they are so soft. Stereo is the worst I have heard since the AM in my old 66 VW. Rough ride, excessive wind noise and an amazing number of rattles round out the package. Hopefully this thing at least turns out to be reliable.",Exterior styling and comfortable seats... that's about it.,"Improve build quality and fit and finish. For the money the quality should be similar to Toyota, but as it stands now, the quality is not even as good as Kia, which also has good exterior styling and a much lower price. This is the first Honda I ever purchased and also the last."
3.125,Update on earlier review,Phred ,02/07/2009,,,3,4,2,3,,4,3,3,3,"I bought this car 6 months ago and the more I see of it the more I think I made the wrong choice.  Got stuck in a snow bank and of course there are no hooks under the car to attach a chain to pull it out - dig, dig, dig!!!  Two months ago the side sliding door jumped off the track and had to be repaired -- two days in the shop!!  On real cold days, before driving, the tire pressure alert show low tire pressure.  I think Honda needs some better engineering!!",Not many to rave about!,See above and earlier post.
1.875,Steve in Guelph,Steve in Guelph ,02/04/2009,,,1,2,1,3,,3,1,3,1,"This is the worst vehicle I have ever owned.  Passenger window rattles, brakes are poor, seat is hard and uncomfortable, radio sound quality is dismal.  Also the paint is rough  to the touch as though it has dirt embedded in it.  The steering wheel does not return to the on center position without assistance.  I read all the reviews before purchasing and cannot believe that they were mostly positive.  Perhaps the higher models are more comfortable.",Interior space and storage,"Seats, brakes, steering and paint"
4.5,Great van,honda ,01/25/2009,,,4,5,5,5,,4,5,4,4,"Owned for 5K miles and 8 months.  Great van, no real issues.  Drives and handles like a car.  Much nicer to drive than our Dodge Grand Caravan and handles nicer than a Sienna.  Road noise is a little more pronounced than in other vans, but not bad at all.  Had DVD player installed aftermarket for 1/2 the price.  Mileage is as advertised, 20 around town, 24 highway, and we're very light on the pedal","Heated seats are great in the winter, rear view camera, remote sliding doors are very handy with the kids.","Interior lights do not turn off automatically after say 10 minutes like on many other vehicles.  If you leave a light switch on or don't shut a door tightly, you'll have a dead battery.  We've had it happen 3 times now."
4.375,2008 Honda Odyssey EX-L,Roger in PA ,12/17/2008,,,5,4,4,4,,5,5,4,4,"Replaced a 7-year-old Sienna (118K miles). Very happy with the Odyssey so far (6 weeks). Roomy, comfortable, good ergonomics. Passed up DVD and Navi due to out-of-line pricing--given how these have plummeted in price as aftermarket add-ons.",Ergonomics. XM. Handling. Ride. Interior space/flexibility.,Floor mats have old fashioned metal snaps to hold them down... not terribly effective (or difficult to snap).
5,Love this Van!!,08EXL ,12/16/2008,,,5,5,5,5,,5,5,5,5,"I've owned 4 Hondas, including this one (3k so far). This is by far my favorite one! I love the styling, features, road feel, comfort, and just about everything. It's true that sometimes wind noise is a little loud on the highway, but it will not keep you from having a conversation with the other passengers. The Rear Ent. Sys is a definite must-have, whether you have children or not. Also, I have no idea what it must be like to drive this van without a rear-view camera. This van just feels solid, safe, and reliable!","VCM (helps with gas mileage), DVD, rear-view camera, air bags all-around, comfort, convenience, features, styling (except wheels, see below).","Wheels on the previous models were better-looking, in my opinion. Better sound-proofing (some wind noise is noticeable). Brakes can be a little tighter (less travel). Some trim pieces may seem loose, but that's just aesthetics to me."
5,Top MiniVan Hands Down!,Tom Ryan ,11/30/2008,,,5,5,5,5,,5,5,5,5,"I've owned my EX-L for about 5 months now and I must say that it is hands down the most comfortable, quality, smooth vehicle I've ever owned and I've owned at least 12 new vehicles from many manufacturers.  I'm averaging 22.6 MPG on combined city/hwy which isn't bad for the weight.  All things considered I bought an excellent van and did so over a Tahoe, Expedition and other many mini vans.  For the money you can not beat it.","Leather, fit and feel of the steering wheel.  Shifter is actually in a nice position.  Dash lights are nice, heated seats a benny.  Lots of cupholders",Put fog lights on all models.
5,The Best Van You Can Get,KenIL ,11/18/2008,,,5,5,5,5,,5,5,5,5,"I traded my 2000 Odyssey in for a 2008 EX-L and it's great.  I test drove 2 of them to watch for things I found in other reviews (rattles, bad brakes, poor shifting, pulling to right, etc.) and the van is great.  I drove the car over multiple rough RR crossings and it's as solid and quiet as you can get.  The ride is nice & solid and everything looks and works exactly as it should.  They made some nice improvements including better mileage with more horsepower.  Nice work Honda.","Sunroof, XM, backup camera, iPod port, leather interior, triple climate control, interior configurations, deep & spacious trunk, middle seat windows that lower (new to us, 2000 model did not do this), multiple glove compartments, two 12-volt power ports, replacement of the spare in rear of car.","I think $4k for the nav & DVD system is a bit steep, plus no dealers in our area had any.  I figure that with 10% of that I could get a portable nav system and portable DVD player and come out ahead.  Would have been nice if the front cut-out for the fog lamps actually had fog lamps!"
5,Happy owner,alex ,10/31/2008,,,5,5,5,5,,5,5,5,5,"I recently traded an 06 Pilot for the 08 Odyssey EX-L, and I am very happy with my choice. The Pilot is probably one of the best mid-size SUV around, but with a growing family I wanted the versatility of a mini-van. I did a lot of research and I found that the Odyssey was the best bet for reliability. I find it to be very comfortable too, and the exterior styling beats the Sienna any day of the week.",Rear entertainment. Seat comfort.,Honda is the best
4,Laminate the Windows!,familyman ,10/26/2008,,,4,4,4,4,,4,4,4,4,"It's a nice van and gets decent mileage. Ride is a bit harsh and road and wind noise prevalent. Needs better insulation and laminate windows like the Buick Enclave and Chrysler Aspen, really does make a difference!","8 passenger, auto slide doors, power hatch, nav system, xm radio, rear entertainment system and gas mileage.",Laminate the Windows and add some insulation. Also get rid of the rattles and wind noise and add a power second row seat for kids to access 3rd row.
4,Nice but some wind noise and rattles,delmartian ,10/26/2008,,,4,4,4,4,,4,4,4,4,"Compared Enclave, Sienna and Odyssey. Enclave was very nice in ride, handling and quietness. The Honda had a nicer price with the rebate. It's a good people mover and the navigation system is very nice. The rear entrainment system is very nice but not intuitive really need to read the instruction manual. Using 0-20w Mobil One and averaging 18.7 around town with up to 30 mpg on the highway.","Mileage, people moving and cargo capacity.","Get rid of wind noise in front passenger window, suspect it's an exterior molding on B pillar that is loose. Leather seats could be more comfortable Tahoe leather seats were very comfortable. Also air conditioned seats would be nice. Power second row seats for ease of entry. Rid the car of rattles."
4.75,Honest Review,HondaLoyalist ,10/11/2008,,,4,5,5,5,,5,5,4,5,"This is our sixth Honda, and third Honda minivan. The 2008 van is impressive in every way but one. The brakes are - (and I am not stretching the truth here) - the brakes are the worst brakes I've ever had on any vehicle be it car, van, truck, or bicycle! Took it back to the dealer and was told this was normal? Now if it were a faulty cup holder or other trivial item, I would have some tolerance, however I am almost afraid to drive this vehicle. It seems the vehicle quality from the Georgia factory is way below par for the Honda that I know (My 2002 van was built there too and had a huge list of problems).","Power, ride, styling, shift quality are all excellent",Fix the brakes - Fix the brakes - Fix the brakes
