5,2008 Trailblazer,Lynn Douglas ,12/31/2015,5,4,5,,,5,5,5,5,,,"We bought it new, I now have 160,000 miles on it and are heading for Arizona tomorrow.  No problems whatsoever. New bat., new tires, new alt., that's it. I have a 18' camper and traveled around the USA. handled great, could use a little more power, but did nicely in the mountains. I have a 4500 lb. boat and we go to Lake Superior, approximately 350 miles, and it handled the job nicely.",,
4.875,Enjoy every moment of the drive!,thesubwaypushe ,04/14/2013,,,5,5,5,5,,5,5,4,5,"It took me about two seconds into the test drive to turn to my friend in the back seat and yell, ""This is my truck!"" And I didn't care that the salesperson heard me. That's how excited I was as I settled into the bolstered leather seats and hit the accelerator. Then after a mile or so, I realized this was a very special truck. It drives like a sports car and truly tugs at your soul when it hits you with that attractive engine note. Going out to the winding curves of Long Island or the hilly moutains in the country is such a treat. It feels like a true muscle CAR of yesteryear, is extremely comfortable, and looks great as well. Vroooooom!!!Chris Thomasel","Power
Comfort
Handling
Steering
Suspension
Payload area
Looks","Could use a differently designed Navigation screen, this Bose, although an excellent performer, is kind of bland."
4.75,Great Vehicle,kimba727 ,02/13/2011,,,5,5,5,5,,4,5,4,5,Leased 1Lt w/4x4-- 1 yr into owning the vehicle moved cross country--happy with performance and ride. It was a comfortable vehicle and has great turning radius for getting in and out of parking spaces. Even my hubby liked the turning and handling.I was involved in a 3 car crash-rear ended by a earlier model TB and had minimal damage-new rear bumper and lift gate. This vehicle held up.My lease is up and cant buy it--so will turn it in- It will be missed and down the road I will keepchecking to see if I cant pickup the same model. It was great in the snow or any elements. Always felt safe and comfortable. ,"style, reliability, turning radius",
4.75,Good Truck,fratblazer08 ,10/24/2010,,,4,5,5,5,,5,5,4,5,"Got my 08 Trailblazer used and I've been loving it ever since. Has a plenty of power for a pretty large SUV, yet also gets around 19mpg if driven for optimal fuel economy. Drives perfectly smooth and handles really well for an SUV, the only thing is that the sway bars are VERY stiff, so going over a speed bump at an angle is going to shake you pretty bad. Handles well off road, can hold its own just fine even with 2wd. I preferred almost everything about the Trailblazer when I compared to all the other SUVs of its caliber on the market.","Ride quality, power, fuel economy, exterior design","Nothing, wouldn't have bought it if I felt like there was something wrong with it."
4.625,Great Truck,one great truck ,10/12/2010,,,3,5,5,5,,5,5,4,5,It has been a very reliable and powerful vehicle.  It still turns more heads than a crossover.  It is comfortable on long trips and has the power of a V8.  The dashboard and radio could use a little updating.,Inline six engine with 285 horsepower. Comfortable seats and ride.  ,Update the dashboard.
2.125,Do not buy this to tow anything,john davis ,08/27/2010,,,3,3,2,1,,1,3,2,2,I purchased 2008 SUV 2 weeks ago. I read reviews. GM's claims were that this car would tow 5200 lbs and up depending on rear end. My boat and trailer weigh 3600. Now to tow on flat interstate highway it will not tow in fourth at all at speed limit without dropping to 3rd gear and 2nd gear on an incline. We contacted gm. They said there was nothing wrong and to tow in third gear 1300 miles to Florida down and 1300 back even though 2 states are mountain states and it would be in 2nd gear at least 1/2 of the time. This is very hard on whole drive train and would diminish the life of vehicle. Their 4.2 6 cyl. is rated at 291 hp at 6500 rpm but max rpm is 4500 how can you research like that just sick,SUV seems ok but to not tow causes us a great financial burden,GM and dealers should disclose vehicle performance honestly so a person could research in confidence and trust
4.125,Nice car at a good deal,Meyers ,07/15/2010,,,4,4,4,4,,4,5,4,4,"I bought my Trailblazer mostly for towing my toys around.  It does this very well. It doesn't get much mileage as I have 2 beater cars that I drive on a daily basis.  I get anywhere from 15 to 17 MPG in the city and around 21 on open highways.  I have been a Ford guy through and through, but when it came to this purchase, I couldn't pass it up. For the price and features, it beat all Explorers that I looked at.  Don't get me wrong, if I were buying brand new, it would be Ford all day, just on principle, but I was looking at getting the biggest bang for my buck on this purchase.","Towing capacity, passenger and cargo space, nice additional gauges that you don't see on most vehicles at this level",My biggest complaint would have to be the 4 speed transmission.  You can definitely feel the transmission shift through the gears.  My only other complaint would be that the breaks seem to be undersized.  It feels like I'm trying to bring a tank to a stop in traffic.
3.875,Too Much Gas!,Too much gas! ,06/29/2010,,,4,4,4,4,,5,5,1,4,"I love everything about this car EXCEPT the horrible gas mileage. I only get about 13 mpg!  I have taken it in and they say that nothing is wrong and that Trailblazer's are gas hogs.  It costs $65 to fill up my tank and if I am lucky I get 300 miles. We have tried high performance oil, but that didn't seem to help much. I enjoy the smooth ride and the power of the engine but it sucks both the oil and your wallet dry! We bought it with 17 mpg in town advertised BUT I have never gotten anywhere close, so we feel like we were ripped off. I have only put 10,000 miles on it and drive average. It handles well in rain and snow when the 4 x 4 kicks in. ","Power, reliability & comfort. ",Need to improve the gas mileage! Would like an automatic mileage tracking system in it. 
4.625,Love mine!,L. Reeve ,06/23/2010,,,5,4,4,5,,5,5,4,5,Bought my 2008 in 2008.  Have 40K mi. on it now. (3 road trips). Pulls my travel trailer like it's not there and I get over 18 mpg. while pulling it!  I get 19.8 in town.  I have had no issues with it at all except a rattle where the sun roof is. One road trip was long and it was extremely comfortable.  I have three Boxers and they all fit comfortably in the rear. No mechanical problems whatsoever. Sorry they aren't still making them!,"Comfy, leather seats; nice ride","Less road noise. Other than that, no complaints!"
4.75,Sad to see the TrailBlazer leave,This is worth a look ,06/06/2010,,,4,5,5,5,,5,5,4,5,After the 2009 Model year GM has discontinued the TrailBlazer and has replaced with with the new Equinox. I test drove a new Equinox last week and was VERY unhappy with it. The vehicle had no power (even with the V6) and the gas mileage was a far cry from what they had claimed. I have had an 04 Trailblazer which was just traded in on a 2010 Acadia and I still have my 2008 Trailblazer. Just can't part with her. There is just something about the exterior look of the LT and the strong acceleration that really sold me. I plan on keeping it until the doors fall off! 45K and not a single problem yet!,XM Radio and OnStar,A little less plastic on the dash and a nicer radio/climate control setup.
2.5,Very Sad,sosad ,05/13/2010,,,3,3,1,1,,1,5,1,5,"In the first year my 2008 TrailBlazer has had the rack and pinion, steering column, sircoil, stabilitrack, airbags, foam insulators, window regulator, left rear shock, five new brake boosters and 1 master cylinder all replaced after failing. Gm paid to have them replaced under warranty. My car is a lemon I wanted a buy back. They have been terrible and are just allowing me to have these newly replaced items warranted with extension. Gm has made me so so sad.",,
4.25,Trail Blazer LTZ 6 In Line Engine 4WD,Nayef ,05/05/2010,,,2,3,4,5,,5,5,5,5,"We bought our 2nd TB. I am satisfied with the car, but not the dealer :( Navigation System is there but the maps/program is not loaded and when I asked them for it, they told me the workshop has it. The workshop thought I as from Mars or other planets when I asked them to load the Map/Software. The car is excellent but the Dealer service is poor.  BTW, I mean the dealer in the State of Qatar. a small country in the Arabian Gulf.","powerful, dependable and comfortable",Looks and interior design
4.25,Trailblazer Still Stacks Up,JEM77 ,03/03/2010,,,5,4,4,5,,4,4,4,4,"Think about price and reliability and you'll find the Trailblazer LT really holds up. This is my second and it has plenty of power, comfort, and a price point that allows for many extras including a factory sunroof. It goes anywhere and I never have had an issue with it. The 4WD is an option as well, I live in FL so no need. The critics ratings are often harsh because it's been around a while and not cache, but note owner ratings, owners love the car.",Pick up and right size.,Factory tires are weak. Pick up a set of Firestone Destination A/T or L/E's and you'll see huge performance improvements and better look with 255/65 R17's/
4.75,nice ride,steve ,02/18/2010,,,4,5,5,5,,5,5,4,5,love the car great in snow... would buy again,fun to drive handles the road well,more room for cup holders...fuel economy average at best
2.875,Interior and features,Ron Adkins ,02/07/2010,,,3,3,2,3,,4,4,1,3,"Lumbar support knob came off in hand. Very poor indeed.   Cable cover by mirror also fell off.   Styling has a lot to be desired.  Sound system very poor. Locking system locks you out if you leave key in ignition, very frustrating.",none,see helpful hints
4.75,I Dig It,Dave ,01/30/2010,,,5,5,5,5,,5,4,4,5,I get a little over 16 mpg average with fairly aggressive driving. I can't complain for what I get. Suspension was too stiff so I softened a little. Perfect now. VERY fun to drive. Its my work truck. People always asking what the heck it is-- SS's are rare around here.,"The driveline and brakes. The look, inside and out.","Glove box light, air conditioned seats."
4.625,Great Car,Jerbo ,01/24/2010,,,4,5,5,5,,5,5,3,5,"I love driving the vehicle, has great handling and the best audio's in any car I have been in. Will but this type or very model over and over again. The only downside is the gas mileage which is expected with a large SUV.",Looks,Gas
4.625,Trailblazer Blazes,Jenny ,01/05/2010,,,5,4,5,5,,5,5,3,5,"Purchased our TB as a demo w/ 500 miles, great deal, great car!  Drives and handles very well, much better than the Fords my family has owned.  Has great space for our two carseats in the backseat and a smaller or thinner person in the middle when necessary.  Cargo space is perfect, can fit strollers & groceries with room to spare.  Easy to find and operate controls, love the electric seat adj as husband & I are 1 ft diff in height, can easily adj to our needs. Have had no problems whatsoever with routine maintenance.  Gas mileage is as expected for an SUV.  OnStar is a major bonus, especially when you have kids.  Travels well for short & long distances - would definitely purchase again!  ","OnStar, electric adjustable seat, cargo space, backseat space, easy to operate & find controls","Better gas mileage for the future, redesign exterior to compare to the sleek other brands"
5,Well built,Harold W. ,11/05/2009,,,5,5,5,5,,5,5,5,5,Bought this program Trailblazer with 7500 miles on it. Now has 16700 and I don't have one complaint. It is one of the best handling vehicle I have driven. Very comfortable on long trips.I have not had anything to complain about and I would buy another one.,"Comfort, Boise Radio, Heated seats and handling.",none
3,Worse car I could have purchased,Gentletouch ,10/29/2009,,,2,3,3,3,,4,3,3,3,"I purchased my TB new with 21 miles on it. Two months later my computers went out. I blew the horn and the car died.  Took a week for the dealership to figure what was actually wrong with the truck, and took another week and a half to fix it.  I have a funny noisy from the wheels now when I back up. Dealer said it was rocks and it would go away, but it didnt. The stabilitrack light comes on all the time for no reason. When I went to trade the TB in the value on it is next to nothing. I wouldnt recommend this care to anybody.","XM radio, And heater",
4.125,Happy so far...,Derek ,10/22/2009,,,3,4,4,5,,4,5,3,5,"We recently purchased a 2008 Chevy TrailBlazer 1LT... our first American built car after a trio of Nissans.We are very happy with our purchase so far. Excellent ride,expected fuel mileage 15city/21hwy,excellent space for each passenger,a real surprise. We were not set on a TrailBlazer but after our purchase we would not hesitate to purchase a newer more updated version if it was produced. ",On-Star-a much over looked under marketed product which we are very happy to have. Take off speed. Size of vehicle ,"Update the interior to complete with Ford products,6 speed trans"
4.5,'08 Black SS,Mike ,10/10/2009,,,4,5,5,5,,5,5,2,5,"I needed an AWD truck/SUV and opted for the TBSS (rebates, standard features). No regrets, drives great, enough power to scare you and pulls a 20' bassboat like it isn't even attached. No problems or issues in 20k miles. Only problem is no matter how I drive I can't get over 16mpg, 50 or 100 doesn't matter. Low 14 high 16, but with everything onboard and the performance not to be found ANYWHERE else in a SUV, period, I'm nit picking about the gas mileage. Love the vehicle. ","Fun to drive, gobs of power, not many around, lots of creature comforts and rock solid reliability.",Better gauge faces especially the white tach. 5-speed transmission would be nice too.
5,2008 Chevrolet Trailblazer ,superniceman ,09/12/2009,,,5,5,5,5,,5,5,5,5,"Best SUV for the price! Have driven quite a number of new and used SUV's. In my opinion it was well worth the price I paid! Very comfortable to sit in, controls within easy reach, well designed. The front bottom seats are especially long, which relieves leg stress on long trips! Very stable on the road, even at 70. Hardly any sway around corners. Great fuel economy with 6 cylinder engine. Plenty of passing power. All the bells and whistles. Very roomy trunk. Great CD sound system. Easy to reach oil filter. ","Passenger Safety, Very Comfortable, Passing Power, Fuel Economy, Price and Re-Sale Value!",Design flaw with the front seat bottom plastic cover plates. They have clips that hold them in place. Within 2 years both sides have broken clips. Instead of buying replacements and waiting for them to break again...I carefully drilled one hole on each plate and installed 2 chrome screws! Perfect Now
4.125,TB5.3v8,Nick Ricc ,06/21/2009,,,4,4,4,4,,5,4,4,4,"First TB was 02, and didn't like 4.2.  Was traded for 04 Tahoe that was great, but I was offered special incentives to trade on a 08TB 5.3, and have enjoyed it ever since.  MPG average is about 18.2 and seems to improve with middle grade 89.",,6 speed AT
2.125,Worst Vehicle I Ever Owned,David Binder ,04/24/2009,,,3,3,1,1,,2,2,2,3,The stabilitrack light comes on and the dealers can not find a problem. The vehicle once would not move when that light came on.  We finally used Onstar to capture the error code but the dealerships we took it to could not identify the problem.  The windows are slow to go up and are noisy.  ,None!,Ascertain the nature of the stabilitrack problems and repair them!
4.875,I love it,TY L. ,04/22/2009,,,5,5,5,5,,5,5,4,5,"I love it. Drives awesome, looks even better. There's not a lot of them around where i live so its awesome being next to the tuner guys and give em hell. The ride is very smooth. Everything is straight forward. Fuel economy is something everyone seems to have an CON for but what do you expect out of an SUV with a corvette engine in it. Id recommend anyone that needs the room of the SUV but the fun of a sports car to buy it and never look back. ","Well duh, the corvette engine. the interior room. rear air ride. ",None
3.5,wish i could drive it,david mcdermott ,03/23/2009,,,4,4,3,1,,4,5,3,4,"well so far ive had my trailblazer almost a month and ive gotten to drive it for two weeks of it. only 500 miles on it and already in shop 3 times for check engine light comming on. first couple times they thought it may be a gas cap, now its been in shop for several days for same thing however now its because a bad sensor that they had to pull gas tank to get to. hopefully that fixes it, thank god for 36,000 mile warranty, after its over come talk to me if you want a 08 trailblazer for cheap as is. anyway, i like my rental car","sound system, comfort of seats, and powerfull",get rid of check engine light
5,Way better then I expected,Canyons ,03/15/2009,,,5,5,5,5,,5,5,5,5,We were looking at a Yukon or a Tahoe but for the price you just can't beat this. I was a little hesitant at first to buy this but I quickly changed my mind. The drive is super smooth (better then some cars) there is room in the back for my 6'3 husband and enough room for our two  large Labradors in the back. With a new baby on the way we should have plenty of room for everyone :),"LOVE the seating, very comfortable. Rides smooth and the tinted glass is a +",The exhaust on this SUV is a bit large. If Chevy can find a way to hide it a bit more it would improve the over all look.
4.625,The Comfort of a Luxury Vehicle,Sailingsoon ,03/03/2009,,,5,5,5,4,,5,5,3,5,"We purchased this vehicle new for $18K when GM was offering great rebates- what a bargain! In 2003 we purchased a TB for my daughter and were impressed by the ride and ease of parking and handling. The reliability of her TB was OK, but not stellar.  In 90,000 miles she had to have the fan clutch replaced, a passenger side power window replaced at her cost and had some initial warranty problems with door seals and taillights. I read where GM later changed the type of fan clutch and solved that problem. ","Smooth ride, better than most luxury cars.  This is the easiest vehicle to park in tight places we have ever owned.  My wife and daughter love to drive this vehicle.  OnStar is a great safety feature that gives added security on out of town trips and came free for 1yr. Towing package came standard.","Gas mileage is not great, but what was expected (16-17 city, 22 on mostly interstate trips).  However, I have a boat and trailer and like the towing capacity and performance.  Would not want to give this up for a little better mileage.  The base model radio is marginal. Overall, GM canned a winner."
4,No room it the back,Kaye ,02/26/2009,,,2,5,3,5,,5,2,5,5,This has always been a dream vehicle until we bought it. The vehicle is very comfortable except the backseat which is very uncomfortable and no room. There is no extras it is only basic inside.,I love the drive and handling of the vehicle. The room is good except for the backseat.,"More room in backseat, something like the Equinox with the moveable forward and backward back seat and the tilt backs of the seat."
3.875,Not sure I want another Chevrolet,cottonqueen ,02/25/2009,,,5,5,1,1,,5,5,4,5,"After owning a 2002 TrailBlazer, decided to get a new one. Boy was that a mistake. I loved it for the first 2 1/2 months. Then the stabilization light came on, got it fixed then check engine light came on. The nightmare begins, took in 12/27/08 and as of this date 2/24/09 I still have not gotten it fixed. They cannot get a torque converter. They say that is my problem. If they cannot get that part, what is to say they can get any other part that breaks! I am begining to hate Chevy. Paying for something, I cannot drive!",,
4.875,An Excellent Affordable SUV!,Kansas Sunflower ,02/09/2009,,,5,5,5,5,,5,5,4,5,"Since buying this vehicle I have driven it in town, on highways, in mud, in sand, in snow, and some on ice. Much of the driving has been a combination of city and highway, but it has been on one trip of about 2000 miles. The performance has been great and the overall mileage has been better than I expected. Most city driving yields about 15-16mpg and most highway driving has yielded 19-20 mpg. However, during the 2000 mile trip the TrailBlazer (6 cylinder) got 23 mpg at times with an overall average of 21 mpg for the trp.  This is a very comfortable vehicle to drive and to ride as a passenger.  It has not given me any problems so far.","Great ride, plenty of power, good looking vehicle, very dependable",A five or six speed transmission with the same engine might improver overall mileage.
4.875,TrailBlazer SS,Darkhell ,01/31/2009,,,5,5,5,5,,5,5,4,5,"The hands down best SUV I have ever driven. I have never been a fan of buying new cars until the day I drove to the dealership to test drive something fast just for the fun of it. Months went by and I couldn't get that car out of my head. Its the comfort of one of a luxury SUV, hands down best looking SUV on the market and is powered by the 400hp ls2 corvette motor.  Not sure if you want one? No harm in just test driving one.  ","Putting the pedal to the floor has never been so rewarding in a SUV. Being able beat a Mustang in a race, and still have enough space to put anything you want, and even tow a trailer of you need.","Remote start, shocks for the hood, light under the hood and light in the glove box."
4.875,Love my TrailBlazer!,New chevyowner ,01/07/2009,,,5,5,5,5,,5,5,4,5,"After being a 25 year Ford customer and having a dismal experience with my last Explorer, I decided to make the switch to a Chevy. Wow what a difference, I should have done it years ago. The TrailBlazer is as beautiful as the Explorer, with a much smoother ride. I can't feel every little crack in the road like with the Explorer, the transmission is superb with none of the problems I experienced from day one with the horrible Explorer transmission (so far, I haven't had it long). Chevy offers the 100,000 mile powertrain warranty which tells me that they put alot of confidence in their product.","Love the seatbelts, they are lower and don't dig into my neck. Love the adjustable drivers seat, (I didn't know a driver's seat could be so comfortable) the XM radio, and one year free OnStar!","I have noticed the cargo area isn't as roomy as my '04 Explorer's, also the middle console is quite a bit smaller. Minor issues though, considering the problems I had with the Explorer. I will take a little less room any day over cracked pieces, peeling paint, and clunky transmission!"
3.25,Rewarding to drive,cristios ,01/05/2009,,,2,2,3,3,,5,4,2,5,My 08 TrailBlazer SS is a truly enjoyable ride. Porsche people will hate this but the car this reminds me most of is the 97 911C2S I drove for a while. Looking over the stubby hood and praying that there is enough traction to make it around the corner makes for fun- if not especially confidence inspiring- driving. There is however a lot of traction and brakes to go with the power of the LS2.,"Engine, brakes, suspension (both handling and ride). Also great steering for an SUV- right up there with my favorite- the FX45 and better than the Cayenne S I drove for two weeks.","Better transmission and interior quality. A five speed would improve economy and performance- the four speed is archaic. The interior is better than the basic TrailBlazer but is so far off anything from Japan, Korea or Europe that it is no wonder GM is struggling."
4.875,TrailBlazer Redux,richgimmel ,01/04/2009,,,5,5,5,5,,5,5,4,5,"This is my second TrailBlazer. My first was an '06 that I gave up without a single problem after 70,000 miles. GM was discounting the new '08 models so heavily I had to buy one.  This is a very well-built vehicle. Naturally, GM decided to shut down the plant that makes them.","The straight-six, interior comfort. Mileage: 21 hwy, 16 city after 2,500 miles, reliability.",Can't think of any.
4,Much better than it's reviews,Locust ,12/23/2008,,,4,3,5,5,,4,4,3,4,"The TrailBlazer is a plain vanilla SUV, but get in and see what you get for thousands less than those that get the great reviews. It has some great features, phone, directions & emergency.  A very nice ride, Bose speakers, buttery soft leather, 2 zone temp control & deep tinted windows. And a lot of room,  I'm a big guy at 265 & I'm not squished in , the seats are large & firm with plenty of headroom.","I wouldn't call it a feature, but this is a good ride on a road trip, you're up a bit higher with good visablity all around, cruise control & XM radio. The miles fly by.",I'd like some improvements in sound proofing for those road trips. The cabin could & should be quiter.
4.625,Built Like An Anvil,Youngturk ,11/28/2008,,,5,5,5,5,,4,4,4,5,"This is my second Trailblazer. I had my first for three years without one single problem. And although some people might think the styling is a bit dated, it's unpretentious, and as functional and reliable a vehicle as you could ask for.  Comfortable and fun to drive. And the inline six is bulletproof.  This is one solid, well-built vehicle.","The 4.2-litre six. Reasonably economical, has all the power you need, great torque, and incredibly reliable.",Can't think of a single one.
