3.25,"Good, but not great",VekinTexas ,06/04/2009,,,4,4,2,3,,3,4,3,3,"I felt compelled to buy an American car due to the current economic crises. This is my first Ford & I really liked the exterior design. The car drove good & overall the interior  is comfortable & roomy. After 8 months of ownership, I wish I'd bought foreign. While I have had no major issues, I feel American cars are still behind in design & quality. The AC is pathetic. The driver side does not blow. This is a bad thing in Texas. I inquired @ the dealership I have my oil changed @, the service manager told me it was a design flaw & they had tons of complaints, but there was no fixes for the issue. Not what I wanted to hear. The dashboard gauges are hard to see in low lighting conditions.",The exterior design is very appealing. The overall size of this car is good. Not too big & not too small. The interior is a clean design & is functional.,The air conditioner needs major improvement. Rear window on the hatch does not open. Gas mileage.
4.25,Edge to Edge,Steelheadrod ,05/30/2009,,,4,5,5,5,,4,5,2,4,"never saw him Got T- Boned @40+ making a left on to nortbound Smokey Pt Drive, New car, back probs, leaving PT ( Back ) 5 pm Poor vis, low heavy clouds & Lt rain, Waited for BIG open spot in traffic flow both ways, found one large one after some smaller gaps, decided to wait for a car 1/3 of way into left gap turn signal on, check both ways again still looks great, wait to see tire on car turn into my road, as  they turn I gently pull out into center turn lane, 15 Ft away the 4X4's comming hard & BAM! just had time to turn hard away both cars towed no injury to me at all car took it all! 15K & 60 days repair, Looks great! Tow's my boat better than my 06 4X4 Ranger FX-4 off-road nice ride/pep","Comfortable & spacious & Im 6' 225 pds, nice get up n go, well placed controlls & armrests, sweet music system ( 6 CD )+ hidden MP3 jack & Power outlet, love the power back seat drop control in back where u need it, get lot of complements on looks, (metalic-Red )","upgrade the color and texture of top of dash to reduce reflection in sunshine, add more HP for 20 mpg avg, 265 hp or whatever is OK but a 300+ hp would really add to the fun!"
4.125,Solid CUV!!!,Jonny A ,05/22/2009,,,4,5,4,5,,4,4,3,4,"After looking at the Subaru Tribeca, Nissan Murano and Mazda CX-7 we decided on an Edge Limited AWD. It compared very well against the competition in build quality, styling, materials and fit and finish. We belived the exterior styling to be the best of the bunch. The interior shines IMHO with a conservative, well designed layout using durable materials and easy, intuitive controls. The leather seating is nice with contrast stitching! The backseat felt the most comfortable and roomy of the 4. The sync system is outstanding, with nothing comaprable in any other vehicle we looked at; bluetooth+Cell=sweet. Little extras like puddle lamps and power rear liftgate are nice too. And the price!","leather seats; sync system (cell phone,iPod voice&steering wheel controls); homelink; tight turning radius; backup sensors; drivetrain; exterior styling; large center console storage with adjustable compartments + hidden USB & aux jack; power rear seat folding buttons in cargo area.",fuel mileage; larger digital radio display that matches LCD of driver info center in instrument cluster; back-up camera; Better speedo day-time visibility;  
4.25,Satisfied,bob ,04/29/2009,,,4,5,5,5,,3,5,3,4,"I think Ford hit the jack pot with this one. The engine is a little noisey when starting off or increasing speed on the highway,this should be improved.",Exterior styling. Interior is a little plain but neat.,Quiet engine noise when accelerating.
2.5,Buyer Beware,Buyer Beware ,04/23/2009,,,2,2,1,1,,4,4,3,3,"Well where do I start, I bought the 08 edge because of the deep discounts and thought what a great deal. I did not know that the radio would not work, the tire would blow out, and then the transmission would go out all in less than a week. I know that it is under warranty but, how would you feel about a new vehicle with this many problems in a short period of time? I lost faith in Ford.","great power, ok ride,",to many to list
3,PTU defect,lastfordIwillown ,04/04/2009,,,3,4,1,1,,4,4,3,4,Our SEL Ford Edge awd has been fixed 4 times and I smell burning oil again.They replaced seals and whole unit and it still leaks!!! Ford needs to let us Edge owners know how and when they can solve this problem.,,Fix PTU leak
4.875,FABULOUS CAR,CAROLE ,03/21/2009,,,5,5,5,5,,5,5,4,5,"The body style was the first thing that caught my eye before I bought a Ford Edge. The overall shape is very pleasing.The height was also a factor for me because I have trouble getting in and out of vehicles that are too low. . The interior  suits my needs perfectly. I find everything is close at hand and easy to read. The seats are totally comfortable, there's plenty of head and foot room. Storage and cargo space is great too.The music system (6 CD changer, AM/FM radio and MP3 option  are very adequate and easy to use. I have yet to look for an option and find that it's missing.The drive-ability is fabulous. Very smooth and easy to park and maneuver.The AWD was a life saver this winter too!",The overall outside look never fails to impress me. The leather interior is asthetically pleasing as well as luxuriously comfortable. The roomy passenger areas and flexibility of the seat functions is a definite plus. The large outside mirrors are very helpful. It's a total pleasure town and drive!,None
4.625,"Cutting ""Edge""",Coach ,03/04/2009,,,5,5,4,5,,5,5,4,4,"I was apprehensive about buying the Edge.  The first time we drove it, it was noisey and rode real rough (SEL Model) compared to the other vehicles we were shopping.  After we returned a second time and drove a Limited with the 20"" wheels we changed our mind.  Very nice ride and quiet.  Sync audio system is awesome as is the Vista Roof.  Getting 20-21mpg around town.  Not too bad, but better than the estimate given on the sticker.  Origionally had some issues with rattles and creeks but were promptly fixed by the selling dealer.  ",Sync and Roof,Ford should stop running ads on how easy the voice activation system is to use.  It is NOT as fast and easy as the commerical portrays.  
4.875,I Love My Edge!,lbwow ,02/04/2009,,,5,5,5,5,,5,5,4,5,"I've had my Edge for about a month now, but have been eyeing them ever since they first came out in 2007. It was between this or the Honda CRV and once I drove the Edge the contest was over. I love how much space I have in the Edge. The center console is big enough for me to put my purse in when I don't want to drag it into a store. There are cup holders everywhere. Love the way it looks sporty compared to some other CUV/SUVs. I feel very safe in this car. It's definitely bigger than my Civic but not too big to feel like I'm driving a tank. Overall, I love this car.","Back up sensor comes in handy when in the parking garage at work.  I love the dark blue, I've gotten quite a few compliments on the color.  I love the MP3 player outlet even though the sound quality could be better. ",Steering wheel volume controls should be standard on all models.  Wish the rear window on the hatch opened.  For those who can't afford the panoramic vista roof a regular sun/moon roof should be an option without having to add it later.
4.375,My wife liked the exterior design,Marco Basto ,01/13/2009,,,4,5,4,4,,5,5,4,4,"No problems until now, poor air conditioning, good acceleration, poor dashboard gauges, to evaluate reliability I will wait to put more miles on it but we drive 2000 miles to Texas and no problems",Rear parking sensor. Seats comfort. Good acceleration. Exterior design. Beautiul black,
4.875,Ford Edge - An Out of the Park Home Run,Gordon ,01/03/2009,,,5,5,5,5,,5,5,4,5,"This is the first SUV I have ever owned and never understood the attraction until now. I have been a continuous Ford owner since I was a teenager and I own a number of Fords including a 1964 T-Bird, 1995 Lincoln Mark 8, 2002 Lincoln LS V8, 2002 T-Bird and now the Edge AWD LTD. This vehicle is comfortable, quiet, solid and well equipped. The exterior and interior styling is beautiful with the leather interior and it rides like my Lincolns.","The Vista Roof adds so much natural light, the BlueTooth/Sync for hands free phone, Sirus radio and the big 20 inch chrome wheels with the AWD make it great in our deep snow up here.  ",Better gas mileage but I am still on break-in but feel a 6 speed should get better mileage and perhaps in the warmer weather and more highway driving I feel it will improve. Braking is not great but it is a big vehicle so adjusting my driving habits will solve that; we all drive too close anyway.
4.125,Outside mirrors,edgeowner ,01/02/2009,,,5,5,4,4,,4,3,4,4,"I am 5'2"" and have problems seeing over or around the outside mirrors. It seems as though they are too large for the vehicle.  They create a horrible blind spot, which makes me very nervous while driving. I have tried raising the seat, but then it's difficult to reach the pedals and I crack my knee on the steering column when I get in and out of the vehicle.  I ask my boyfriend to drive the car to get his feedback.  He is 5'9"" and agreed he thought they were larger than normal.  He drives a F-150 truck.  Prior to owning the Edge I had an Explorer and never had this problem.","Gas mileage, Vista roof, heated seats",Smaller exterior mirrors. Creates hazardous blind spots while driving.
4.625,A great truck,BlairWitch749 ,12/29/2008,,,4,5,5,5,,4,5,4,5,We wanted a family vehichle that would be versitile and that's what we got. Comfortably has 2 car seats and we got an 8 foot Christmas tree inside. It's very comfy to drive and it did well in the recent snow storm,"Steering wheel audio controls, comfortable seats, good power, sharp exterior appearance, good mpgs for a truck this size. 25 mpg on a drive from NY to Chicago",The vents are very cheap and don't close. Also the dash isn't bright enough hard to see in low lighting. Give the truck real vents that can close and it's a winner
4.875,I'm in love.,Crazy for the Edge! ,12/16/2008,,,5,5,5,5,,5,5,4,5,"After owning several foreign cars and SUV's, about 1.5 years ago I purchased a new Ford Explorer. I hated everything about the thing. I told myself over and over again I would never purchase another American-made vehicle again, I thought it was such a mistake. Then I came upon the Edge. It is unlike any Ford I have ever known.  It is gorgeous inside, love the two tone! It's so fun to drive and handles so well! I feel really safe in it. I love the leather, it's not that cheap plasticy leather, and I love the stitching. Super roomy. I was really shocked at the price - very affordable. After seeing the success with the Edge, I hope Ford re-designs all of their vehicles. Thanks Ford!","Leather, two-toned interior.",Gas mileage (feel for the size it should get better).
4.75,Lookin' Good,Granny ,12/13/2008,,,5,5,5,4,,5,5,4,5,"We joined the ""buy American"" movement and purchased an Edge just after a good working over by the local Toyota dealer. Wow, I am impressed with the ease of maneuverability, the sound system, the sun roofs, and the seat's base-length- finally a seat that extends out far enough and doesn't cut off the circulation in one's legs. The second row seating is also unusually comfortable for this type car. Only had it a week, but so far, it's outstanding.","The comfortable seats, the sound system. I'm sure I'll like the voice command too as soon as I learn how to use it.","It could be improved by slightly better gas mileage, but its the same mpg as the Toyota minivan."
4.875,Glad we choose the Edge,On the edge ,10/08/2008,,,5,5,5,5,,5,5,4,5,"After looking at several models of CUV/SUV, including Pilot, Veracruz, CX9, Toyota Highlander, we decided that the 3rd row was the dealbreaker and went looking for something smaller. I am so glad we did. We decided on the Limited model with the Sync/Sirius/6 cd and the leather interior. I really like the two tone interior and the contrast stitching on the seats. We are just back from an 1800 mile trip and the Edge performed wonderfully. Very comfortable on the long ride and plenty of room. Gas mileage was not great, but driving 80+ MPH will do that. My first new car in 12 years and glad I'm on the Edge!","Power adjusting seats (I'm short, he's tall), SYNC, back seat room",Larger gas tank--19 gallons
4.875,A++,Brooker ,09/29/2008,,,5,5,5,5,,5,5,4,5,"My husband and I test drove many crossover SUV's when we were searching for a new car and when we happened upon the Edge, it was love at first site. It's roomy enough for my husband, who is a large guy, to sit in either the front or back comfortably and the panaramic sunroof is great. But most importantly, it's fun to drive! Keep producing this king of vehicle Ford, you hit a homerun with this one!",,
4.75,Love My Edge,Patricia ,09/22/2008,,,5,5,5,4,,5,5,4,5,I love my Edge. I'm a little nervous. It's in the shop after only four weeks with transmission problems. I'm hoping it's a fluke thing and when it's fixed I will regain my confidence in the car and will still love it. ,"The sync, the GPS, the Sirius radio and the tailgate lift. I love it all. Oh the panoramic roof is awesome. I love all the extras it has!",Better gas mileage? You can't have everything
4.75,"Wow, Ford built a winner",Terry ,09/15/2008,,,5,5,5,5,,4,5,4,5,"I bought my Edge after a very bad experience with a Toyota. I have had my Edge for only three weeks and have over 3,000 miles on it. I drove it from Michigan to Maine on vacation. The Edge handled flawlessly. It was very comfortable and except for a little wind noise at 45-50 mph from the outside mirrors is was like driving a luxury car. The looks, vista roof, audio system and overall driving experience still make me smile. There were no issues of quality at delivery. There are none now. I hope this is an omen of things to come. It looks great,it handles well, is very comfortable. As long as I stay around 70 on the road I get about 24.6 miles to the gallon. Good Job Ford.   ","Vista roof,steering wheel controls, audio system and Sync really are nice. The seats are very comfortable. The interior design is crisp and upscale as is the exterior design. The ride is great.",A foot rest for the drivers left foot. Easier to understand sync manual. A real duel exhaust so the 3.5 sounds like a 265 horpower engine. Plastic wheels?
4.5,I'm in love!,EH78 ,08/28/2008,,,3,5,5,5,,5,5,3,5,"After having our first baby three months ago we decided we needed something bigger. I usually have my husband's help but he will soon be deployed so I needed something big enough to carry everything and anything (including two Ridgebacks). I had looked at several SUVs (Honda, BMW, Toyota, Hyundai etc.) and settled for the Edge. ","SYNC! Although ""Penny"" hears whetever she wants sometimes. Seats are comfortable, fits a large stroller plus leaves enough space for groceries. If you are a dog lover like me, it fits two large dogs comfortably. ","Vents, can't shut them off and can't move them easily. Light on dashboard needs to be brighter. A/C needs more power, specially in hot places like Texas. "
4.875,Better Brakes,PM ,08/27/2008,,,5,5,5,5,,5,5,4,5,"This is only the second Ford I have owned in 35 years. Never cared for their stylings until now. Am enjoying  everything about this car except the braking distance.  I live in a deer prone area and have had four accidents due to them over the years. I really need great brakes! The Edge must improve in this category.  Can't believe for the level of this automobile that Ford didn't have a higher standard when it came to such an important feature. Mileage isn't too bad, but can still be improved upon.","Styling, roomy interior, performance, Sirius radio.","Better braking distance, improved mileage."
4.625,Edge - Best find so far,TASully ,08/26/2008,,,5,5,5,5,,4,5,3,5,"Just got an Edge Limited (no nav) and I am extremelly impressed with the car. Looks great and rides even better. Tons of room in the back seat and very comfortable seats. A/C and brakes seem fine to me, no problem at all so far. Sync is awesome - reception is better than mobile and convenient. Panoramic view is super-cool, kids love it! It's been a long time since I've come home with a car without some buyer's remorse - not this time!",Sync/Cool two-tone leather interior. 20- inch wheels. Tons of room. Pano-view. Fun to drive,"Gas mileage - worth the trade off for performance, I think."
4.875,Great Vehicle!,MacAtac ,08/15/2008,,,5,5,5,5,,5,5,4,5,"Truly designed with the driver in mind. From the amenities and comfort of the interior to the way it handles and performs on both city streets and open highways, this is one impressive vehicle! Acceleration and maneuverability beats Saturn, Chevrolet, Toyota and Honda in comparable class vehicles and at a great price. We purchased the base model SE, but all the extras like MicroSoft Sync, top of the line sound system with a 6 CD changer, radio and cruise control in the steering wheel, roof rack, anti-theft system, etc. this vehicle is in a class of its own. The ride is extremely comfortable; cruising at 70 mph feels like you're going 30 or 35 and bumps are almost unnoticeable.","We really like the MicroSoft Sync, radio and cruise controls in the steering wheel, and comfortable yet responsive feel of the suspension system. The passenger compartment is quiet, even at highway speeds, and conversation can be had at normal speaking volume. Lots of leg and hip room in all seats.","If Ford could figure out a way to improve mpg for the Edge by 25% or more while maintaining performance, that would make a great vehicle outstanding! I hope this vehicle continues to evolve to an even higher level in the years to come. Great vehicle, reasonably priced! "
4.625,The most room for a crossover,courtney ,08/14/2008,,,5,4,4,5,,5,5,4,5,I love my Ford Edge. The room in it is amazing. The most room you'll find for your money. And this is one of the most affordable SUV/CUVs. I have 2 kids and this fits all 4 of us comfortably,"MP3, storage space",#ith the way gas prices are I wished I got better gas mileage
4.875,Happily on Edge,On Edge ,08/12/2008,,,4,5,5,5,,5,5,5,5,"I am very pleased with my Edge. I went from a convertible Sebring to an Edge. Being able to see the road is awesome. I love the Sync and Sirius Satellite. I am going on a road trip and can hardly wait to see how she handles on the highway. Right now she's a city girl. The ride in is so smooth, I don't hardly want to get out when I get to work. She's turning heads all over the place. I love my Edge!","Sync, Sirius satellite, mp3 connection.","Make the back lights on the dash brighter, hard to see numbers at dusk. Vents need to be more short people friendly."
3.875,Poor AC not appropriate for hot climates,charles ,08/07/2008,,,3,5,4,4,,5,2,4,4,"I've owned 7 vehicles and the Edge has the worst AC by far.  Have to keep it on max fan and max ac all the time here in TX and still sweat.  Lots of power, soft suspension and low road noise. Vehicle feels like your driving a boat, a floating vs driving sensation.  ","Love the exterior styling. Lots of room. Seats are comfortable. Upgraded painted 18"" wheels look nice. Low road noise. ","The AC needs stronger fan and more directional vents. Need to be able to shut off vents not being used. Center stack is ugly.  Radio looks and sounds like it is from 1970 w 4 cheap speakers. Brakes are poor, almost unsafe. "
5,"33 MPG Highway, Toyota who?",33 mpg Highway ,07/29/2008,,,5,5,5,5,,5,5,5,5,"I submitted a review a month after the wife and I bought a 2008 Edge, but could not wait to brag about the gas mileage we got on our 2,145 mile vacation from Iowa to North Carolina. When we left it had 2,881 miles on it. At first I did not care for the gas mileage at all, but the dealership kept telling me the mileage would get better and boy did it! I always use the cruise control, and at 74 mph this new Edge averaged 33 mpg and I have 4 people who can verify this. So eat your heart out Toyota owners. Ford has a great American crossover in this new Edge.","Love the power liftgate, reclining seats, Vista roof, AWD, Sirus radio, engine power. Most of all the gas mileage! Reverse backing sensor system.","Make dash lights brighter, at dusk its hard to see the gauges. Other than that Ford has hit a home run with this crossover."
4.875,100% impressed...highly recommend!,Todd in Nanaimo ,07/27/2008,,,5,5,5,5,,5,5,4,5,"Being in real estate, I put a ton of miles on a car in a year, and both me and my clients love the Edge! The few snow days were absolutely no challenge, the SYNC system is amazing.  Leather and other interior features are very luxurious and are extremely comfortable even for a full day in the car. Fuel economy is what I expect for a strong V6. I have never driven a car that turns heads like this! A trip up to the ski hill with two friends and skis and snowboards was a perfect use of all the space and comfort and we passed many vehicles on the way up in the snow. Passing on the highway is a breeze..the power seems even more evident at full highway speed, it can snap your head back at 120kph","SYNC, power lift gate, navigation, sound system, leather seats with bold stitching, very comfortable back seats and of course the full glass roof! Awesome to have open on a sunny day and the wind blocker when it is open reduces highway noise to almost imperceptible. Can't decide on one favorite!","A/C vents/blow pattern, get rid of the chrome around the vents. It glares in the window sometimes. Should have an auto temp setting between the lower options of 16 and 19 degrees celsius. I'd like it to be 18 sometimes! Not much to do on this one..it's nearly perfect."
4.875,Short andloves it!!,slg ,07/25/2008,,,5,5,5,5,,5,5,4,5,"As a 5'1 woman, mine is super comfortable! My seat adjusts every which way possible! My car came with Michelins on it, smooth ride with little road noise, less than my Altima! We traded in a 2005 Nissan Altima that I had put 89,000 miles on in 38 months, trust me! The Edge is a good performing car too, has plenty of power. My gas mileage stinks, but that is my fault! Sync is great, although ""Debbie"" hears what she wants sometimes. Good style and design! I love it! Bought it because my sister has an 07 and loves it too! We knew all baby stuff would fit and we had outgrown my car! Husband's knees no longer hit!","Sync and all the power ports! Having my ipod plugged in center console! Steering wheel controls standard! Seats that feel like they are hugging me! Husband is a firefighter so saftey was major selling point! Also glad 08 has lift handle on tailgate, sister has 07 and hers is hard to open/close!",Needs cargo area cover! Fuel door release from inside car!
4,Could be more,Crashley ,07/19/2008,,,3,5,3,4,,4,5,4,4,"Feeling a bit let down. I see other crossovers (MDX, Acadia, Highlander) on the road and wish I had opted for one of those. The drive is nice and smooth ,and I do enjoy the Sync, nav system and power lift-gate. The airconditioning needs some help. Even on high, I keep reaching to turn it higher, and the airvents will not turn to blow directly in your face. Opening the sun-roof helps, but it is loud at higher speeds. You would think will all the hype over Sync, Ford would have invested in more speakers. 4 speakers standard and upgraded sound has only 6?  Our Corolla has better sound! After 4 fillups, we are averaging 16mpg mostly city driving.","Power liftgate, SYNC and Bluetooth.","Beef up the AC,add more airvents or allow vents to turn more inward. Splurge on a few more speakers and subwoofer. VistaRoof- Allow the front sunshade to be open while keeping rear closed. Allow the tilt/vent to occur without pulling sunshade back (like the MDX). "
2.75,I hate the Ford Edge!,Stacey ,07/09/2008,,,2,4,3,3,,3,2,3,2,"I had a '05 Honda CRV, and regret trading for the Edge. Am now looking to trade back in on another CRV or something else. I have a 45 minute drive to work (one way) and am hurting by the time I get there. The seats are uncomfortable,makes my back hurt & makes my legs go to sleep and hurt. The seat needs to tilt more at the base for the shorter person. This car is  not built for the short person. I can't drive through the ATM without a lot of problems or need to get out. The AC vents are pathetic. At certain angles the sun shines on the chrome strip on the shifter and surround and shines in the eyes. Would rather not have the chrome. Road noise on this one, I believe due to the brand of tires. ","Bluetooth feature, radio okay, height of the SUV, love the copper color.","Have a MP3 jack on the dash, bottom of seat needs to tilt forward for shorter drivers. Side mirrors too high, major blind spots. Put Michelins on all instead of no name brand (makes road noise fairly loud), better air vents, arm rests- seating is too wide and seat up to for me to use the door/console."
