2.5,Premature exhaust manifold crack at 4k.,Jomer ,03/28/2009,,,2,2,1,1,,4,4,3,3,"I purchased my 08 Sequoia last Jan 09, after 3 days the headliner rattled, the headlamp washer cover discolored. After 4k miles the exhaust manifold cracked! Interior very plasticky and hollow!",Toyota emblem,Maintain Toyota reputation of durability
4,08 sequoia,mr08SEQUOIA ,03/23/2009,,,4,3,4,4,,5,4,4,4,"I purchased the 2008 Platinum Sequoia for family and weekend road trips. I test drove the Escalade ESV, Suburban, and Expedition XL. I chose the Sequoia with very little deliberation. The ride is smooth and the options are top rate. I love the interior space, the only two complaints I have are the lack of chrome accents for a model labeled platinum and the navigation and radio system.  The resolution on the nav system is poor and the text limitation on the radio is just ridiculous for a product from Toyota. I know the profit margins had to be huge, because they did not invest a lot of money to impress customers or be competitive with $150 Nav systems from Best Buy.","Power rear door, ride, interior storage and space.","The Platinum Sequoia lists at $61K+, it needs more high end features to distinguish from other Sequoias such as more wood grained interior features, more exterior chrome accents, and chrome wheels."
4.75,Bold & Beautiful,Terery ,03/22/2009,,,4,5,5,5,,5,5,4,5,"Traded in Odyssey (loved it) to get a SUV that would fit our family of 6 and tow our 4,500lb boat.  The Sequoia w\ 5.7L has plenty of power on tap & even more torque.  It accelerates better w\ boat in tow than my 2002 Tundra V8 did w\ no boat.  Ride is good for a SUV, but definitely not minivan smooth.  Ergonomics are pretty good, but cups & controls hard to reach (even w\ my long arms).  Like the high ride height & visibility.  Middle & back rows easily fit 6'+ passengers w\ leg-room to spare.  Avg 16-17mpg, which is good for large SUV in town w\ this much power.","Reliable, powerful, large, and fun to drive.  Feel very safe due to safety features, ride height, good control, & impressive braking.  Lots of storage space throughout.  Climate control & radio is easy to use (like steering wheel controls).","Cup-holders & ac controls could be closer to driver & passengers. Running boards s\b standard vs. optional (ingress/egress difficult for anyone under 5').  Plenty leg room throughout, but more cargo space would help (would have gladly payed $1,000 more for 1-2' extended version)."
3.25,2008 Sequoia Warranty Repair@763 miles?,PIF ,03/17/2009,,,4,4,2,1,,4,4,3,4,"I only had the vehicle for 763 miles before a metal piece dropped on the floor as I adjusted my steering column. Now the steering column moves up and down, and can not lock into place.  The service people wanted me to wait 2-3 weeks for an appointment. Would you drive a car like that? I said no. Toyota Quality?",,My confidence with my steering wheel would be a start ;)
4.625,Very Happy,Melissa ,02/28/2009,,,4,5,5,5,,5,5,3,5,"I traded in a 00 4 Runner and a 02 Mercedes C320 for the Sequoia.  Happiest day was getting rid of the Mercedes and I tearfully left my 4 Runner.  I have a 2 year old and one on the way, 2 big dogs and a 6' + hubby, while I am only 5'3"".  I drive approx 1400 miles a week (yes, really).  I LOVE my truck.  I am so happy with it AND I am really tough to please.  I cheaped out and got the base model and I'm thrilled.  It's even won my Dad over.  I have learned how to dock it in to parking spaces but it turns as good as our Mercedes.  If you are thinking about it, do it, you won't regret it.  I got a license plate that says ""In between gas stations"". ","Comfort, ease of access to back seats, smooth ride, looks ",More cup holders in front.  I'm pregnant and cannot reach the door ones anymore.  What's up with the 2 glove boxes?
4.875,This is the DE FACTO Land Cruiser,George Withers ,02/27/2009,,,5,5,5,5,,5,5,4,5,The ultimate large-size luxury SUV. Period.,"Steering, Engine, Transmission, Leather, Power tailgate, Power 3rd row, JBL sound, etc, etc.",The 500hp TRD supercharger should be a factory option for those who are more spirited.
4.875,If you're going to buy a gas guzzler... ,Mike552 ,02/27/2009,,,5,5,5,5,,5,5,4,5,"You may as well buy this one!!!  Don't let some of the magazine reviews turn you away from buying this gorgeous vehicle. I mean, let's face it, is there a halfway decent car out there that has room for the whole family AND gets good gas mileage. The simple answer is NO.  My 2008 Sequoia is a smooth smooth ride, and mine spends its time on Boston roads, which are some of the worst pothole infested roads in the country.  Some reviews say that the steering is too easy, and coming from a 4runner I can see what they are saying, but if the Sequoia had a Lexus badge they would be complementing its effortless steering instead of trying do equate it to a Chevy Silverado.","I got the SR5 but I got it fully loaded. I love the driver's seat, especially the power ergonomic leg support. The telescopic steering is wonderful, and of course the 3rd row power seats. It's incredible how the rows fold flat to have a pickup truck on-demand. The 381hp 5.7L and 6spd auto are great!","The Bluetooth needs slight improvement: Basically a more powerful DSP mic and a better menu for switching phones between myself and the spouse. The way it s now I have to go through 3 menus to change primary phones. Also, fuel economy could be improved, but let's face it, it weighs 6500 pounds!!!"
4.625,My Sequoia Ride ,Ron ,02/20/2009,,,5,5,5,5,,5,5,2,5,I really like the Sequoia.  It really met all my family's needs.  We didn't buy it for the GREAT gas mileage (HAHA).  This is our family car.  Everything is great except for the poor gas mileage.,"My family and I really like how it is really easy to drive.  Once you get used to the size, it really drives like a car.",Gas mileage unless gas goes down to 50 cents a gallon. 
5,Lovin' the Sequoia,LuvSequoia ,02/17/2009,,,5,5,5,5,,5,5,5,5,"I chose the Sequoia because I did the research and read a lot of comments posted on this very website. I am very pleased with the Limited 4X2. The ride is what I expected, but even better. I love the turning radius, when once was disappointed with the Tundra radius. The Sequoia is very sleek in it's interior design. It is very spacious and love the tri-climate control. Gas mileage is about 16-18 hwy. The body is huge and the front end takes some getting use to when it comes to parking. I am very happy I went with an SUV, as a long time truck person, I am pleased. ",I am impressed the the JBL Synses sound system. It is like having spent a ton of money on a sound system. The seamless shifting is incredible. I love the 6-speed. Very smooth. ,
5,Super Sequoia,Bill  ,02/05/2009,,,5,5,5,5,,5,5,5,5,"Needed large SUV so we drove Expedition, Tahoe, and Sequoia.  Great deals on all.  Features very similar but the quality and execution of the Sequoia is superb.  This vehicle is designed to Lexus standards and it shows.  Engine is strong and trans is great.  Fast, quiet and both my wife and I are fighting to take it.  Just had six in it and they all loved it.  Drives like a smaller vehicle and is easy to park.","Seats, engine/trans, and the way it drives.  2nd and 3rd row seats are incredible.",Toyota should include memory seats as standard on Limited.
4.75,Love my new Sequoia,capnjackflash ,01/26/2009,,,5,5,5,5,,5,5,4,4,"2008 Sequoia Platinum, slate w/ red rock interior, laser cruise and DRL the only options.  I've already filled it with stuff twice and am amazed at how much fits with rearview mirror still usable.  Interior reconfiguration is so simple and easy.  400 lb-ft of torque is always evident and handling is surprisingly good in the sport mode.  In soft mode, 85 on a smooth interstate feels like 70.  The seating position and front visibility are great, but there are blind spots behind the large front pillars.  You get the same huge center console as the Tundra, designed for people using their truck as an office. ","This 5,700 monster has a turn radius like a Honda Civic.  Driver has 4 cupholders in easy reach.  The climate control is accurate and easy to use. Laser cruise control is totally predictable and so convenient.  You must add this option if most of your driving is on the highways.","6'3"" and can't clean the windshield w/o a stool.  A fold out step and handle would be nice.  Laser cruise disengages when driving into the early morning sun.  5.7L V8 uses 0W-20 synth oil making the 5,000 mile oil changes about $110 a pop.  Not enough pass. side mirror adjust for shorter drivers.  "
4.625,Silky Smooth,hisenberg ,01/22/2009,,,4,5,4,5,,5,5,4,5,"We drove our new Sequoia to Sequoia National Park for our first outing with the new vehicle.  During this drive, we experienced driving in city, open freeway, mountain roads and icy roads.  The entire drive was very smooth.  The 6-speed automatic engine was far better than our previous 4-speed domestic luxury SUV.  It handled very well in all conditions.  The interior of the car has more ""plastic"" than I normally like.  Needs a little more wood trim and some plastic mouldings are loose.   Navigation system was excellent.  The ride with the air suspension was very comfortable and the steering wheel was steady over all the bumps.",Navigation system is outstanding along with the integrated bluetooth phone.,Platinum only comes with 2nd row captain's chairs.  I'd prefer to have a full 40/20/40 bench which would be much more versatile.  HID headlights should be standard (not the halogen's that come equipped with the high end Platinum Edition).  
5,Love My Big Luxury Toy,DC ,01/15/2009,,,5,5,5,5,,5,5,5,5,"I have had my Sequoia about two months. I went all out. Got the red- rock leather interior, navigation, DVDs in the headrest, etc. My family and I love this SUV. The ride is so smooth and quiet. The leg room for all seats is wonderful. Love the heated and cooled seats. I think once you play around with the navigation it gets easier to control.",I love everything.,Nothing.
3.375,Disappointed,Not satisfied ,01/15/2009,,,4,2,3,2,,5,5,1,5,"We traded our 2002 Suburban for the Sequoia in Jan., 2008.  With three kids and three dogs, we loved the automatic third row and hatch.  It drives and parks like a dream.  Within 6 months, tho, the a/c smelled like mildew.  After four LENGTHY visits to the dealership who found mildew on the filter, multiple calls to Toyota (we purchased the extended warranty), we are extremely dissatisfied with the ""customer service.""   There is a constant clicking noise under the cage, the hatch does not close all the way, and the dealer could not solve any of the problems. The navigational system cuts off when driving so passengers cannot enter the info.  Our TomTom is more well designed. ","Fun to drive; comfortable seats, good lumbar support, easy to park, great pick-up, lousy gas mileage (worse than Suburban).  Not as luxurious as the Infiniti or Lexus, but more so than the Honda Pilot & Suburban,",Revamp the navigational system so that at least a passenger can operate it.  Offer a softer shade of white or prettier colors.  Research the dealership if you decide to purchase this vehicle and do not purchase the extended warranty.  It limits who can work on the vehicle regardless of what they say.
4,almost perfect,Mencken  ,12/19/2008,,,4,4,5,5,,4,5,2,3,"I have had the vehicle for over six months now, and it is flawlessly executed, and easy to drive smoothly, even if it never hides its size.  But there is a glaring flaw that might get me to return it when the lease is over:  Cargo space.  You buy a big vehicle like this if you have a big family, so the third row is always in use. Cargo space is minuscule behind that row, barely a foot of floor, with the seatback angling back, taking away space as you move up.  If the vehicle were 18 inches longer, all of it in the trunk, it would be perfect for its mission.  ","Tight turning circle, powerful engine, smooth operation of 4WD system, transmission performs very well.",No. 1-10:  Cargo space is pitiful for this segment. 11.  Stereo a little sloppy/boomy 12.  Plastic surfaces hard to the touch.
4.875,Stand-out Performer,cb4life ,12/18/2008,,,5,5,5,5,,5,5,4,5,"We bought the Toyota Sequoia Limited (4WD) to replace a 2006 Land Rover LR3 HSE.  We have not regretted it.  Pros:  Strong engine, quiet/smooth ride, reclining seats throughout vehicle, window shades, leg room for adults in all seats.  Cons:  Navigation system is not user- friendly, radio controls are hard to reach (have to stretch while driving).  Kids love legroom and reclining seats.  Wife loves safety feeling, power rear hatch, and power.  I love flexibility for storage and comfort on road trips.","Heated seats, reclining seats in all rows, turn signals in mirrors, bluetooth connection for phone, backup camera.",Make navigation system more user- friendly and easier to reach.  Try to squeeze out a little bit more gas mileage (3mpg) but it is not necessary.  This is already the best SUV out there!
4.875,The best of the best,Finnegan Family ,12/17/2008,,,5,5,5,5,,5,5,4,5,"We had an 03' loved it. We drive this vehicle everywhere and love it. We bought the sr5 model and added leather, blue tooth, t.v. system. We have a rattle in the back unless one of the kids is sitting back in the second row of seats. So much improvement over the last truck. With 4 kids and a screaming stereo you cannot even tell that they are with you.","Power, looks, maintenance, if you read the owners manual all that needs to be done is oil changes, ease of entry.   ","None we have been a Toyota family since 1990, we will never drive anything else ever."
5,Best overall large SUV. Hands down winner,Costa Rica For Me ,12/12/2008,,,5,5,5,5,,5,5,5,5,"I've been a truck/suv guy all my life.  When it became time to ""put down"" my Chevy Suburban I began diligent research to find it's replacement. Without question this is the best large SUV all around for the money.  Go ahead and shop Chevy, Ford, Caddy, GMC, M.Benz and most importantly DRIVE THEM.  Toyota has them all beat in quality and reliability and performance.  While M.Benz has an edge on interior luxury, it lacks in ALL other categories when compared. Sequoia is unbeatable as a family vehicle, especially if you plan to take long trips or tow a boat or camper.  What it lacks in the ""bling"" factor it more than makes up for in the ""cha-ching"" factor--financially it makes good sense.","Third row seats (big enough for adults) recline and fold flat with the touch of a button.  Extremely roomy interior, easy access to third row, power rear hatch, tons of storage space, comfortable seating, a rear window that actually goes down, back up camera and adjustable shocks for ""sport""/comfort""",Nav system is overly complicated.  Perhaps a flex fuel option.
5,Best Suv Ever ,Sodhi  ,12/11/2008,,,5,5,5,5,,5,5,5,5,By far this is the best SUV on the market not just for the buck but for the features.  So much interior room.  The platinum edition feels like owning a Lexus with out the huge payment.  ,"Lazer Dynamic Cruise control, Nav, Bluetooth, sliding 2nd row seats, power rear seats that recline, and Heated Seat in the 1st and 2nd row",
4.375,"Good Truck, It runs like a car",stopshop01 ,12/08/2008,,,5,4,4,4,,5,5,4,4,"It is the first truck we own. Drive very comfortable and good mileage. We took 2 trips to the same road to test out the mileage. First trip fill up with Sheetz gas and got 17.8 mpg avg. Second trip fill up with Sunoco gas and got 18.4 mpg avg on the computer display. Wonder why so much different? It must be the quality in brand gas and no brand. Over all, it is very good truck and highly recommend to new buyer. ",,
4.625,Excellent Choice,Schnauzer ,12/02/2008,,,4,5,5,5,,5,5,3,5,"With a need to haul people and tow a boat, big SUVs are my family's only option.  I have spent a lot of time in all the competing big SUVs.  With the changes brought to the Sequoia in 2008, I now feel it is the best vehicle in its class. Love the fold flat third row, and the ride and handling are as close to 'sportscar' as you can get in a big vehicle like this. The 'wish list' includes some gps/computer oddities but the engine/ride/handling/utility are unrivaled.  The bluetooth/audio/temp controls on the steering wheel are excellent and totally negate the need to reach for the main controls strewn across the dash. Some gps/phone features are unavailable while driving in the name of safety","All the most important categories are strengths for this SUV:  Utility, ride, handling, towing, engine.  Second to none. The tight turning circle makes this big SUV easy to park. The fold flat third row is a must for anyone who actually plans to put people back there. Excellent driving experience.","All my suggestions are ""gadget"" related. The GPS is much more expensive than an after-market gps but less intuitive to learn and worse yet: does an inferior job of navigating to destinations. Simply wont navigate on some secondary roads. They appear, but are unavailable. Proximity sensors = spotty."
4.875,Towing,elknutz ,11/30/2008,,,5,5,5,5,,5,5,4,5,"We all know how the Sequoia drives under normal conditions, but hook up a travel trailer and enjoy it even more.  Our fully loaded Limited includes the air bag suspension which keeps the vehicle level without having to transfer additional weight to the front end.   After a weekend outing to the Oregon Coast I was very impressed with the power this rig has. The combo with our 29' Tango was no match for climbing or descending the Oregon Coast Range. The transmission shifted with ease while in the tow mode and is simply a workhorse.  The Sequoia handled better than any other truck / trailer combo I have driven  over the last 15 years.      ", ,Improve Toyota's navigation - my Garmin is much more informative.  
4.75,Excellent Car for a Large Family,Derek ,11/22/2008,,,4,5,5,5,,5,5,4,5,"We just purchased our Sequoia two weeks ago and love it. We shopped around and took a look at the Tahoe and Escalade to compare it to. The Escalade was about $25k more and a lot worse on the mpg. Workmanship of the Tahoe had a poor feel and look to it, not to mention poor resale value. We had a 2004 Toyota 4 Runner and loved it, but were running out of space and decided to move up to the big boy. We can actually fit 3 more adults into the Sequoia over the 4 Runner comfortably. We opted for the SR5 4 X 4 with most of the options that come on the Limited edition, but without the additional $$$. We actually paid a little less for the Sequoia then we did for the 4 Runner almost 5 years ago.","The leather seats are plush and rear view camera is great. The second and third row seats have plenty of space for adults. The ride and gear shift with the 5.7 liter engine and six speed transmission is smooth. It's not a boat on the road and the steering, handling, and braking are very responsive. ","Control panel should be angled more toward the driver to help those with a shorter reach, like my wife, get to the radio and other controls. Gas mileage could also be better, but again for an SUV of this size it's really good especially compared to other large SUVs."
4.75,Doesn't Compare to the Competition,mjstariha ,11/21/2008,,,5,5,5,5,,5,5,3,5,"We recently let go of our 04 Suburban. Our concern was the loss of room. We knew from experience, our 04 simply did not have the craftsmanship to rival our new Sequoia's life expectancy. The features are well thought out and intuitive. The conveniences have become necessities so don't skimp on these if you appreciate luxury. We needed all the features plus the room so save the addt'l 10k stick w/ the limited. Very smooth ride, not sure if the 20"" tires make a difference from standard 17"", our  Sequoia is fully loaded with all the accessories except two-driver seat memory and 4WD.  A month in and the Sequoia has a piece of all 7 (includes 2 Great Danes) of our hearts","Power at take off no drag, good steering control not loose like our last vehicle Parking assist, back up camera, and rear entertainment system, heated seats, JBL upgraded sound systems, window shades, automatic side view mirrors with turn signal.","When the rear entertainment system is down from the ceiling, it blocks rear view somewhat. Passenger side 8-12 way seat w/memory would be perfect."
4.875,This Central Texas Family loves our LTD.,CourtneyL ,11/17/2008,,,5,5,5,5,,5,5,4,5,"We've had our Sequoia since July 08, approximately 5 months.   We are a family of 4.  My husband, myself, and our two children both under 4years.  We purchased the limited, black exterior with tan interior.  Our sequoia has everything except for nav and dvd.  Things we love: interior roominess- we can fit two carseats, and a full sized adult in the second and third rows.  This never happened in our old suv.  All three rows recline.  In the second row, each seat moves individually.  So if the middle person wants to recline, they can do so without bothering the other two riders.  My husband now wants to trade his corolla S for a similar riding Tundra!","Window screens, light adjusting mirrors, power liftgate, power folding seats, reclining 3 rows, low tire pressure alert, roominess!, cupholders everywhere, get up and go!","Memory seating should be standard on a $49k vehicle.  Mine does not have this. That is it, I'm otherwise very satisfied! "
4.75,"Big SUV, drives like a sedan",soonersok ,11/15/2008,,,5,5,5,5,,5,5,3,5,"When I first looked at the new Sequoias I thought that they would drive like a monster, however, when I test drove it, it was so smooth and the transmission shifted without me even noticing it.  You could tell that this vehicle was well engineered and geared towards people who want a large SUV but without the ""truck like"" feel to it.  The Sequoia is driven primarily by my wife but I always find excuses to drive it on the weekends and we do all of our trips in it.  Its a great vehicle and I strongly recommend it.","My favorite feature is the 5.7L engine, it's very powerful but sophisticated, along with the 6-speed auto transmission.","The front end styling looks a little bit like a cousin of the Dodge Ram, I would rather Toyota stay somewhat ""vanilla"" than go extreme to a look a like.  Besides that, great SUV.  "
4.75,Excellent SUV,Tommy ,11/06/2008,,,5,4,5,5,,5,5,4,5,"I use the Sequoia for business and family travel.  The family travel is primarily to horse shows.  We pull a two horse trailer with two horses and the Sequoia does a great job of pulling 5,000 pounds.  It also has plenty of room for our tack and provisions for the trip.  The ride is extremely comfortable for all passengers.",The Sequoia is the most comfortable and quietest ride of any vehicle I have owned.,Climate controls could be easier to manage and closer to the driver.  I find myself taking my eyes off the road too long to make changes.
4.875,Great family vehicle,Bear1 ,11/04/2008,,,5,5,5,5,,5,5,4,5,"If you need room for a large family, enjoy traveling in silent comfort at barely legal speeds, and do not worry about a high gas bill, this is the vehicle for you. Seems readily apparent that the Lexus engineers had a hand in designing all aspects of this versatile family hauler.","Room, power, power fold-flat 3rd row seats, and more room.",Rear seat DVD entertainment system not up to par with a vehicle of the caliber.
4.75,Nice family SUV,Anthony ,10/27/2008,,,5,5,5,5,,5,5,3,5,This family SUV is very nice. I traded my 03 Sequoia which I like. What I like the most is the safety features this vehicle have and off course the 5.7L engine very responsive and fun to drive. It is also more roomier cargo especially if you have the 3rd row folded.,"Sonar parking, 3rd row seat fully fold down, 5.7L engine, and of course Toyota reliability.",NONE
4.875,08 Sequoia Fit and Finish Excellent,galvang ,10/07/2008,,,5,5,5,5,,5,5,4,5,"I usually do not acquire first year mfg. vehicle unless its from a top tier car mfg's.  Toyota did a fine job, this beast, and I mean beast, drives very smooth and taught with tremendous power, room, and accessories that very much fits my taste. Exterior and interior is well appointed while at this same-time it provides a not too ""girly"" look. ","Bluetooth phone with navigation, towing capability, sonar, rear camera, DVD player, smooth and taught ride, fast acceleration, Toyota reliability and fit and finish. ","Gas mileage, diesel engine or hybrid. Standardize voice recognition language for the the DVD navigation. Not as user friendly as with Honda's navigation system. "
4.875,Great SUV,John ,09/30/2008,,,5,5,5,5,,5,4,5,5,"I bought my Sequoia just over a month ago due to finding out that I will be having another child. I absolutely love driving it, to bad it is primarily my wife's vehicle. I recently had to make a trip to NC from NY and decided to take the Sequoia to see how it did on a long drive. The MPG was great for it size, it averaged 19-20 on the highway. The ride was extremely smooth and I did not have to crank up the radio to hear it over the road noise. I only gave a 8 for comfort due to the fact that my wife, who is 5'2"", has a hard time reaching the pedals and being relaxed at the same time. There is also an annoying little squeaking noise coming from the back seat somewhere. ","Power third row seat, leather package, sliding second row seats, hands free system, towing power, steering agility, comfortable seating space enough for 6 adults and child seat","movable pedals or lower drivers seat, move radio and climate controls closer to driver"
