3.5,Chevy work truck,Ken ,04/13/2010,,,4,2,4,4,,4,5,2,3,"The Rebate back in 2008 was the main selling point.  I have been very satisfied with the performance and reliability of the Chevy. The only setback so far was that the battery died on me after about a year of service. I would not recommend the Ext cab with small rear doors, when parking in a lot, next to other cars, the doors extend to far out and you cannot open them, and if they don't open all the way to 180 degrees they will close by themselves, usually pinching your legs if your leaning in the back. I have the 6 cylinder and wish the MPG were better. The rear suspension holds the bed very high & makes it difficult to reach in. If rear seat could be removed it would be a nice feature","Nice radio/sound system, Onstar and Satellite radio is great. Very comfortable to drive, nice firm ride. Bed liner is nice",Change the Rear door configuation rear window opening- make standard add a pull out step to access the bed put a cover on the center console
4.75,Truck,Strick ,03/28/2010,,,5,5,4,5,,5,5,5,4,Great truck all around. Def gas mileage upgrade to my 05 Hemi. Looks interior and exterior are awesome. Lots of great features. Remote start. All kinds of bells and whistles. Only one problem a little thing called a driveline clunk. Such a new problem on a new truck dealership didn't know what to do initially. But now its fixed. Other than that couldn't ask for more. The back doors are sick due to the 180 opening. back windows roll down. Chevrolet def made some up grades. ,Remote start. Rear window roll down. Storage compartments everywhere. from 8 to 4 cylinders. Cargo management system. extremely smart truck,N/A
5,still owning Chevy`s,Jim & Norma ,03/21/2010,,,5,5,5,5,,5,5,5,5,"This truck is excellent! We've owned about a dozen new and used Chevy pickups in the last 25yrs. They just keep getting better! We like the new hood style. The ride is extremely smooth and comfortable. Visibility out all windows is great. This truck rides more like a car. I would have to say this is probably the best used pickup ""so far"". ","Remote starting, active fuel management,comfortable interior,plenty of power, large rear seat area (plenty of leg room). I could go on and on but I`ll just say if you`re considering a new or used pickup, definitely test drive a silverado. ",I wish they would have stayed with the old style wiper blades. They should also consider tailgate locks standard on all new trucks.
4.625,Nice truck from GM,chen ,03/19/2010,,,5,4,4,5,,5,5,4,5,"before i bought this truck i test drive a new tundra and the tundra is very bumpy, but this Silverado rides smooth and i can't even hear the wind on the window.  i love the leather design and the smooth ride of this truck.  But there is always a problem to very single vehicle out there.  i just have my power door lock and power rear view mirror (passenger side) fixed.  and one time all of my interior lights and speedometer, mile indicator, and all gauges just shut-off by themselves while i was still driving.  But they came back up in the morning when i went to work and no problem ever since.","smooth ride, leather seats, interior design is more better looking than other newer trucks.",fix the electrical problem on the power door locks and mirror.  right now these are the common problem for these GM trucks.
4.75,Best half ton in 2008,Manitouchuck ,03/06/2010,,,5,4,5,5,,5,5,4,5,"Bought this PU new at end of March 2008. I love the truck. 2 problems I have had are the placement of rear exhaust pipe under the chrome rear bumper, it causes spot rusting on the bumper. You have to stay on it or it will eventually rust away. Also, my powertrain control module went out after about 11 months. Truck would not run period. No one I have talked to has heard of this part going out. No problems the last 13 months. This truck is a joy to drive. In the summer I can get 20-22 mpg on the highway on long trips. Around town I get 16-18 on the DIC. Subtract 1 mpg when hand calib. Winter mileage runs about 14-15 in town. Also, damaged black spoiler in frnt hitting snow drift, its 2 low.","Heated seats & windshield washer fluid. Bose stereo, auto folding mirrors. XM for life.","Raise the front end, fix the tailpipe design issue with the rusting."
4.25,Well designed and improved ,jb ,03/04/2010,,,5,5,4,4,,5,5,2,4,"I'm going into my third year of this vehicle and I am mostly impressed.  The build quality is better than many of the foreign trucks for the first time ever, and a huge step up over previous models.  Gas mileage for me has been about 15.5mpg with mostly city driving and a lot of 4wd in the winter.  Other than a fender bender which caused no body damage other than the PLASTIC flashing below the bumper that was easy to remove, I've had no mechanical issues.  The cloth seats are comfortable but collect lint like mad and already are falling apart at the seams.  The ride is great though, and the back seats easily fit my 3 kids on 6 hour fishing trips without a problem","Ride quality is great, and build quality, especially fit and finish is great for a non-import.  I added dual exhaust and a K&M CAI for fun, the interior is still pretty quiet even with the exhaust.  Utility is great for hauling and fishing. and she has handled the crazy snows this year with ease.","Lots.  gas mileage is horrible and it should have more than 4-speed.  Cloth seats are comfy but already showing wear.  MOST IMPORTANT:  this truck has the turning radius of an 18 wheeler.  I've driven bigger trucks that turn better.  I  got parked in, at a lot where most trucks would have no probs"
4.375,poor quality,john ,03/03/2010,,,4,5,2,4,,5,5,5,5,"bought this truck as a demo with 6000 miles rides  nice 4/4 works good put 10000 per  year on truck, seats are falling apart, lint everywhere, back door handles falling off, paint peeling, I picked this truck  over a toyota, because of good deals from GM i had also bought a 2004 silverado that had numerous power steering problems, should have gone with my gut and got the toyota, next truck will be a ford or toyota, ive given GM enough business",,"better quality overall, make it all in USA"
4.75,Love it but slightly sketchy,KoNaGuRl ,02/20/2010,,,5,5,5,5,,4,5,4,5,I bought this truck sight unseen except for pictures sent via email.  I love it but i'm noticing some issues someonelse previously wrote about with the thud noise in the differential.  I've also noticed a delay in acceleration.  No longer have dealerships here on island and i've also been told those are normal??? Anyone experienced these things and if so...normal????,"I love the fact it's a BIG truck.  Love everything except those ""normal"" things i mentioned.  Sound system, onstar, storage all great.",hmmm...can't think of anything.
1.75,Wish I had may Dodge Back,jan coppock ,01/27/2010,,,1,3,1,1,,3,1,2,2,"Purchased this truck new, to get the fuel management system, in December 2007. In Jan. 2009 the check engine light came on. This continued with repeated trips to Dealer. Well, we have had to replace a map sensor, valve spring, 2 oxygen sensors (not under warranty), manifold and gasket,& wiring to cargo lamp. That's not the end. We now have no dome light, there is a chattering noise by the dash board when you let off the gas and go from 55 down to 40-45 (very annoying). We traded a 2 year old Dodge P.U. (fully loaded) for a Chevy (with less on it) and all we got was approx. 3 miles more to the gallon on gas, and a truck with problems and not a comfortable to ride in. NEVER AGAIN!!!!!!",,
4.5,Couple issues,esnewt ,01/26/2010,,,4,5,4,4,,5,5,4,5,I have had this truck for about 3 mos and have noticed a few things I wonder if anyone else has 1. the back bumper is rusting right over the exhaust. This appears to be a design flaw 2. the 4wd control is right in front of a vent and gets HOT when you have the heat going. I hope this is the heater and not the control overheating.,,
4.875,Great Truck,Dexter ,01/17/2010,,,4,5,5,5,,5,5,5,5,"My Silverado performs very well.  After two years of ownership, no problems to note.  Great power with the 5.3.  A six speed trany would have been nice, but four speed is tried and true.  No problems pulling our 6000 lb boat.  Locking rear dif. is the best on the market.  Overall a very nice and capable truck.  ",Best gas mileage of any other full size.  Navigation. Back up sensors.  Flip up back seats.  ,Replace wood grain with polished aluminum.  Larger glove box and more in cab storage.  
2.625,2008 chevy silverado,kstyle ,01/10/2010,,,2,2,3,4,,3,2,2,3,After have this truck for a year and with over 11k on the truck the mpg has not improved. I am at best getting 15 mpg and I am light on the foot. I thought this would be a great truck but I just feel that chevy is too cheap to redesign the transmission and adding more power to the engine.,"I added my own now. ipod stero, line x bed liner, tonnue cover, and dual exhaust.","mpg, interior needs an upgrade and not so cheep paint."
4.375,Cloth Seats Stink but Great Truck ,DWW ,11/22/2009,,,4,4,4,5,,5,4,5,4,"Have had this pickup over a year now and has been flawless! The fuel mileage is great with the 5.3 and the engine goes like scat. Have gotten over 20mpg several times on trips. Do wish the AFM would stay in the V-4 mode longer,it kicks out way too easy.The cloth seats are another matter. Everything sticks to them like flypaper. If I had known this I would have gotten leather.",The dash is very well designed and easy to use. The fit and finish is great. Big improvement over my 04.,Chevy please change the cloth seat material. Have to clean them weekly for lint removal.
4.875,everything i expected!,dtown ,11/22/2009,,,5,5,5,5,,5,5,4,5,"After owning this truck for a year and a half now, I am even more impressed. If you could close your eyes while driving you would not even know you were in a truck. It is so comfortable to drive, even for long distance trips. I have back problems and have had no problems when driving this truck. A little extra lumbar support would be Nice. What they have helps but it could be better. I love the interior except I would have liked more cup holders like everyone else. The stock tires tend to spin on wet roads and I plan on buying better tires when I can afford to. Had a couple if interior noises. Onstar is awesome. 18-21 mpg. I find onstar monthly reports to be helpful. Over all I am very happy.",Onstar is awesome. If I knew I was gonna keep the onstar I would have gotten power Windows and locks!,Find a way to have the v-6 get better mpg than the v-8. Still cant figure out how they can be the same.
4.25,Fixed What I Didn't Like,ktn ,11/16/2009,,,4,4,5,5,,4,4,4,4,"Bought an '08 Silverado 4x4 with the 4.8 V8 in January '09 when Chevy couldn't give a truck away. Got a great price. Overall love the truck, except the front clearance for a 4x4. Cracked the license plate frame the first week crossing a frozen creek. Ended up adding a 4 inch Rancho lift and it handles even better with a better ride and turning radius. The approach and departure angles along with articulation is infinitely better. Highly recommended if you are actually going to take it off road. I got 21-22 MPG on the highway before the lift and adding 33 inch mud tires. Now about 18, still great for what it is. Stock tires were useless offroad. Other complaint: stock skid plates are plastic.","Interior well laid out. MPG+power combo, reliable, comfortable, does what I ask it to do. Drives really really well, now have 23,000 miles on it and it has been bulletproof reliable. Well put together, tows very well. Good daily driver/hauler and now a very good offroad vehicle. Love XM and heater.","Plastic skid plates?? Terrible stock approach angles for a 4x4, terrible. Stock Goodyear tires were worthless offroad. Cannot tell if the locker (G80) is ever actually doing anything. "
4.875,update on a great truck,jpr ,10/14/2009,,,5,5,5,5,,5,5,4,5,"I posted here previously, and now have 2 years on the truck.  Only problem was a rattle in exhaust that happened in cold weather.  GM replaced the converter and back tailpipe, the best warranty experience I have had.  Leer canopy did not increase mileage, but still getting around 20 mpg highway, 18 town.  General Ameritrac tires are poor at best.  Drove truck on Alcan highway with full load, and it performed great.  Love the steering and suspension even on a full load with 55mph tundra waves.  Need posi-traction on slick surfaces such as snow, rain or loose gravel.  Get it on the 2WD.  Overall, this is the best truck I have owned.  A great value.  ","performance as a truck.  Looks great with canopy, hood deflector/window shades, and Bully bars.  20"" or 22"" wheels make it look ""Cool"".  I can't afford cool.  Driving comfort (I am 6'1"" 250 lbs) and find the truck very comfortable.  LUV the automatic lights....very safe feature in Alaska. ","Improve the gas mileage on the 6 cyl. Get seat covers, as the stock tend to ball up lint.  Easier access to air filter.  Locking gas cap.  Bigger sun visors on drivers side.   "
4.625,Still running great and smooth,billboo80 ,09/05/2009,,,5,5,5,4,,4,5,4,5,"I was a little worried about the tires that came with it, but they held up surprisingly well a year later. Leather seating and comfort allows us to take lengthy trips exceeding 6 -9 hours without aches/pains.Initial flapping noise at 60 mph was found to be front windshield plastic trim. We got it replaced. Oh yeah, there is this little thing called GM driveline lash, where there is slop in the differential, between the ring and pinion gears, so you hear a clunk when starting forward after a stop. GM says its normal...I'll keep checking.","Cab allows full view over the hood. 5.3L engine has good power and acceleration. Towed a 5000 lb trailer and felt no engine strain in the slightest.  Low road noise, so I could carry on a nice conversation. Dual zone AC is NICE!!",Redesign the spline and pinion gear assembly to take care of that clunking effect.
4.875,nice truck,dereko ,08/29/2009,,,5,5,5,5,,5,5,4,5,"nice quiet ride. very smooth. we take the truck for family outings, while the suv sit in the garage. i've learned to drive easy to maximize mileage using afm, but would like it to stay in 4cyl at higher speeds/rpm. average is 17.1 on computer. had one problem with pass lock not locking/unlocking. it was fixed under warranty.","active fuel management. packages with 20"" wheels, steering wheel controls,dual ac.","more gears. better afm system, or a manual mode for 4 or 8 cyl"
4.625,"So Fun, Big, Handy, And give it time",MRAUDIOVISUAL ,08/21/2009,,,5,5,5,5,,5,5,3,4,"Truck is great, for those of you worried about MPG, i got to 13000 and finally started to see much Much better gas mileage. Very happy with the dealer, great looking truck, came with chrome bumper, fender,chrome rims, and its very sporty for a pick up, i love the 8 foot bed, as i can lay a full size queen mattress down in the bed flat. Haven t done any towing but have driven from Orlando to Nashville, and only stopped once, Didn't have any issues doing 65-75mph, just dont go above 75mph as the over drive starts to really hurt mpg. I get on average 400 miles a tank on 30 gallons, not to great or bad for a V6, i love my truck im 6'6 and i can fit in it just fine , GM is still a great company. ","Nice big Side view mirrors standard , not power but i dont change them much, Big steering wheel, turns pretty tight, less than 35'turning radius, Very sturdy, Get the Cargo Management system thrown in on the bed, very handy for tieing down to load bearing points. high off the ground rides very high","Driver info system with the LT1 package, i had to buy mine after the fact to keep up on my fuel economy. Everything else is great"
3,Gas mileage less than when new,Calvin Bowlin ,08/11/2009,,,4,3,3,2,,2,4,2,4,"Had a water leak in the cab due to improper vent installation from factory,  lots of wiring issues from water damage, fuel mgt. system robs power and does improve mpg, truck averaged 18-21 mpg for the first 6-8 months.  now averages 15.3 hwy with cruse set at 65mph, 13-14 overall.  Previously had a 2004 with 5.3 engine that got 19mpg on hwy at 80,000 miles, 2004 was much stronger hauling hay and a boat, 2008 5.3 runs at 211-212 degrees.  Seems too hot for just going down the road empty.  I am not convinced GM has improved the truck over previous body style. rear bumper is nothing more than stamped sheet metal, very cheap,","color, quiet, leather seats comfortable","use better quality tires, needs rear bumper that can be used, not just look good, fuel management system does not work and robs power, fix that, "
4.25,After 1 year and 25000 miles,Mole man ,07/31/2009,,,4,5,5,5,,4,5,2,4,"After my first year in the new Silverado I can say I am very pleased. As this is a business truck and I spend a lot of time in it. the ride is fantastic. The 4x4 can't be beat. Great interior although it is lacking in cup holders and storage space. Only one problem so far and that is the stereo. Once the Serious radio was turned off I noticed the radio volume fluctuates horribly as the radio struggles to pick up the digital radio transmission. This is not due to the auto volume adjust option. Just poor radio design. It is so bad that if I don't have a CD to listen to, the radio is turned off. Wished it had a non-satellite radio. Back to dealership 3x on this issue.",Comfortable interior.,Better radio. 5 or 6 speed tranny. Better fuel economy.
4.75,Beats Dodge hands down.,Mike ,07/13/2009,,,5,5,4,5,,5,5,4,5,The only negative comment i have about my 2008 silverado is that the front end of the truck has very little ground clearance for a 4 wheel drive vehicle. I bought a new dodge ram in 1999 and the chevrolet is far superior in quality.,Power and fuel mileage.,Improve the ground clearance.
4.625,Happy with my truck!,Bowtie ,07/08/2009,,,4,5,5,5,,5,5,4,4,"I was a little disappointed in the fact that I have serious lack of options on this model, but after comparing other crew cab trucks for the same price I realize I have more.  The Dodge Ram would have been my other choice, but I have some full sized kids to tote along with other work related items. Performance is decent the engine responds well in a pinch.  The ride is smooth, only second to the Ford F-150 (and I've test driven all the competition).   I've put 2500 miles on it in 2 weeks...and I have filled it up no less than 10 times...so the gas mileage stinks, but hey...it's a truck! ",I soooo need the interior space and the price was great!  I use every inch of this truck.,"Wish it had better gas mileage and more compartment space.  Also, I haven't yet gotten used to parking this big behemoth due to a the view over the front right corner.  I'll get it together soon though. "
4.625,GM -Finally- got it right - For Now,Old Red ,06/28/2009,,,4,5,5,5,,5,5,3,5,"I purchased two new GM vehicles in 2008, a Cadillac STS AWD and a Silverado 1500 LTZ 4WD. The quality of workmanship was the best I've every seen in my 62 years. 0 defects, good fitment, quality throughout. As good over better than any foreign car or truck I've every been exposed to. Thinks I, ""They've finally got it right"".  ","Great quality of manufacture, smooth ride, very comfortably. 6.0 VMax engine has great power for pulling some pretty good loads up Casper Mountain switchbacks. After 1 3/4 years of fairly hard use, I have found NO defects, NONE. Including Japanese it is the best quality 1/2 ton pickup I have drive","It has a 4 speed auto. A 6 speed would match up a lot better to the 6.0 367hp engine power band. Sadly I won't be buying another GM product, because I just can't image a government/labor union owned manufacturer ever being able to turn out vehicles with any kind of quality."
2.75,Must have been built on a holiday,cac4 ,04/20/2009,,,3,3,2,2,,2,4,3,3,"I purchased this truck used with 17 k on it. In the 5 month I have had it it has been to the dlr 5 times and monday is #6.  Trans leak,main seal,body molds,mpg,u-joints.  It now only has 26k.  I also am only getting 15 mpg.  I love gm and must have just got a lemon.  ","Looks great, comfort",Overall quality for the trucks.
4.875,Now THIS is what I call a REAL truck!,Ericonline ,03/30/2009,,,5,5,5,5,,5,5,4,5,"Absolutely love it!  Got a great 2 year lease and within a few days I regretted that I had not bought it!  VERY fun to drive - power, handling, comfortable, etc.  A little bumpy in the back seat for the wife and kids but otherwise an awesome truck.  ",Fun to drive -- I'm not kidding.,"How can anyone suggest improvements to a vehicle they love?  I mean, could there be some, sure, but there are too many good features to worry about improvements."
3.5,bad mpg,MCRIDER ,03/01/2009,,,4,3,4,4,,4,4,2,3,"Anyone else with a 08 chev silv. 1500 v6/4.3l reg cab 4x4 8 ft bed, have terrible gas mileage? I only have 3400 mi. On truck. Normal driving between city/hwy I get 10-11 mpg. Definitely not good!","comfortable, standard features like am/fm/cd, warning cluster are good","You might as well just keep 8 cyl in all full size trucks. Gas mileage is of little or no difference from the 6 cyl, but power is!"
5,So much better than my previous Z-71,CHRISB ,02/22/2009,,,5,5,5,5,,5,5,5,5,"My lease was up on my 06 Z-71 LT3 truck in October 08, so I decided to buy the new 08 for about $2500 more than it would have cost to buy the 06 off of the lease. Wow! What a huge difference a redesign can make. Same basic powertrain, but 5.3 now with flex fuel, same 4L60, but I am almost sure that GM has stopped using that junk rear end supplier that plagued the previous body truck. They claim the new truck is 146% stronger in the frame, and I would say that much and more. I like the Active Fuel Management, but it doesn't seem to work above 70, or on an incline of any sort whatsoever.  Overall A+ ","More intuitive audio controls on wheel, better HVAC (dual) system. New body 3.73 gears just feel stronger and don't have the lock/unlock issues of previous generation.","A litte more flexibility for 4 cyl. threshholds. Factory spray in, and God willing: Instructions of how to deactivate that seat belt chime!"
4.875,"08 Work Truck, Love It",Dennis Adams ,02/16/2009,,,4,5,5,5,,5,5,5,5,"I purchased this truck for its great looks and big bed. I have had many Chevy trucks in the past but this is the best by far. Drives like a big car and rides like one. Pulls a car trailer with a car on it like nothing is behind it, and it is the 4.3 v6. Love the rack steering. Wish it had a grab handle on the drivers side so I wouldn't have to grab the steering wheel to enter the cab. Don't care much for the black cloth on the seats. Shows my cat's hair.",Drives like a Caddy. Rides like one too. Sharp styling. Big and deep 8 ft bed.,Add a grab handle on drivers side. Change cloth color on seats to gray.
4.25,"$13500 Extended Cab, Best deal ever!",taohk ,01/24/2009,,,5,5,4,4,,4,4,4,4,"I purchased the truck on Jan 5th, 09. Last day of the Red tag price. It has the heavy duty chrome grille with chrome mesh, chrome mirror caps, wheels, door and tailgate handles, carpet with all weather floor mat, cargo management system, window and bug deflector, plus deep tinted glasses and a color matched OEM hard Tonneau cover which made by fiberglass. All the chrome makes the truck looks really sharp. The manager accepted my $15000 offer, then I used $1500 GM cash to bring the price down to $13500. The MSRP was over $26000 included Tonneau cover. The truck is nice, but it would nicer if it has a V8. My co-workers didn't believe the price until they see the receipt. Overall, I am satisfied","Sound system with MP3 is nice. Second row leg room is big compare with other brand. Tonneau cover's design also match with hood. I highly suggest to get a OEM tonneau cover. $8000 rebate plus reg tag price, and $1500 GM card cash reward made a sweet deal. Ride is comfortable and quality is good. ",MPG. I only gets about 17MPG. 
4.875,Good Buy,Ryan ,01/13/2009,,,5,5,5,5,,5,5,4,5,"Wanted a dependable work or play truck and got exactly what I was looking for. Purchased a 2008 (4.3 / Auto) with LS package (chrome bumpers and wheels), locking rear, keyless, carpet, cruise and A/C for around $13,500 (Original sticker $20,850).  I couldn't find a used truck with those features for that kind of price. Getting mileage as promised (17-18 combined) Everything in the engine compartment is easy to access. Very pleased with the truck.  ","Overall design very reminiscent of other Chevys I have owned (1973, 1993, 1997) But greatly improved. Hard to believe this is the bottom of the line truck.",Maybe factory spray in or even the new composite bed like the Tacomas.
5,Perfect!,Tina ,01/01/2009,,,5,5,5,5,,5,5,5,5,This truck is perfect! I love eveything about it! Fast and great on gas! I get 21 MPG average most of the time. I have the 5.3 with 315 horsepower. I have gotten up to 24 MPG on a tank of gas a couple of times.,It's fast and smooth.,None. It's great.
