5,Astonishing ,Michael  ,05/27/2007,,,5,5,5,5,,5,5,5,5,"This truck is unbelievable. I loved it ever since I saw it, and once I got in the cab it was just amazing. This truck is the nicest truck I have ever seen. And the engine well lets just say its more than enough power. I cant believe the remarkable acceleration that this has. I have only had this truck for a couple months but I think it speaks for itself. I own a 32 boat that weighs about 11,200 pounds and when i am pulling it out of the water I only have to tap the accelerator, and dont worry about your wheels spinning on the platform, with the new traction assist you will never get that. I have the King Ranch Edition, its fully loaded. I love the truck. ",The navigation was very helpful when we went to visit our friends up in Colorado. My kids loved the rear seat DVD system and the lady and I up front didnt hear a thing thanks to the headphones. The Reverse Vehicle Aid Sensors are a help when I am hooking up my boat. The tailgate step is great. ,Maybe a backup camera. Thats all. You did a excellent job Ford. 
4.875,Best Ford Diesel Yet,Scooter ,05/24/2007,,,5,5,5,5,,5,5,4,5,"I have to tell you after having a 6.0 Power Stroke and what problems came with it, I never thought Ford would get it right.  But after checking Chevrolet and Dodge, I elected to take another chance on Ford. This is the best truck that Ford has ever built. It tows my boat like no other and handles like a dream. Loaded on empty it is one comfortable ride. The power and delivery of the power is unbelievable. I would suggest that everyone who is looking for a new truck, to look and drive one of these new Fords.","The quietness of the diesel, the power and torgue delivery, the smooth ride and the appearance.","Ford should go with at least a 100,000 mile warranty like Chevrolet does."
5,Love my Ford!,suprdutyguy ,05/19/2007,,,5,5,5,5,,5,5,5,5,"Traded in my 2004 PSD Crew short bed for this 2008. Amazing truck. Diesel is new model, very powerful and extremely quiet. Great fuel mileage, and tows my Jayco fifth wheel like it's not really there. The cab is so nice! Quiet, comfortable...all the amenities, too! ",Diesel! ,Can't think of any improvements!
4.875,2008 King Ranch 250,E. Garcia ,05/14/2007,,,5,5,5,5,,5,5,4,5,I just bought our new truck 2 weeks ago.  It has a gorgeous updated leather interior! Ride is smooth. I got it with a regular gas engine. Lots of leg room in back.,Favorite feature is the new reddish look of the King Ranch leather interior.,"Maybe a retractable or screwable antenna would be helpful. My truck does not fit in my garage because of the antenna, need to bend it while driving it in."
4.875,08 Ford Super Duty Dream Machine,Kevin Dean ,03/05/2007,,,5,5,5,5,,5,5,4,5,"I never thought Ford could turn around the Super Duty and produce the truck they have with this new model.  Unbelievable appearance, ride and muscle.",Diesel.,
4.875,New Super Duty,Jim ,02/07/2007,,,5,5,5,5,,5,5,4,5,I've only had my 2008 F250 a short time but I'm really impressed. It is a lot of fun to drive. It tows our trailer without any problems. I've had it out into the Texas Hill Country which was a good test. This summer I'll try it in the mountains. I still don't have a feel for MPG and diesel prices are higher. I'm hoping that my first impressions will be lasting ones. So far it's a fantastic truck.,This is the quietest diesel engine that I've ever heard. Very smooth ride and it handles like a dream.,None 
