3.375,Miss My Suburban!,Shelly ,10/11/2008,,,3,4,1,4,,4,3,4,4,While my husband recently came home bearing gifts.  He left with my Suburban and came home with a Odyssey.  I was expecting to notice a huge increase in gas mileage. Only about 18 in the city w/air.  Not at all pleased with the quality of the interior it barely gets touched by something and scratches horribly!  Some pieces are not put together well and they don't match up.  The carpet seems to stain really easy and not the best of quality. Seems to change gears at times a bit rough when slowing down quickly.  STILL cannot figure out the concept or design with the middle seat belt.  TOTALLY useless! The space is so little for a small child but then the seatbelt cuts them across the throat! ,I like to features on the steering wheel and the mirror to see all passengers.  Would be nice to have ALL of the windows tinted.  Seats need more lumbar support.  The versatility with the seating is a plus.  Middle seat is a waste especially b/c of the design of the seat belt which doesn't fit anyone,"Interior molding is cheap and scratches so easily even if a seat belt hits it or my ring.  Beef up the quality of the carpet or at least put a scotch guard on it.  Tint the front two windows. The black parts of the car have already lost the luster-wipers, outside mirrors etc.  Not sure why, poor."
4.625,Breat Van ISO Better Breaks,k9chita ,10/07/2008,,,5,5,5,5,,4,5,4,4,"The Honda Odyssey EX-L is a great buy.  I love the DVD, CD Changer, Wireless Head Phones, Heated Leather Seats, etc.  The only thing i would add to this impressive vehicle in better stopping power.  The breaks are adequate at best.  ",Kids absolutely love the DVD w/ wireless headphones.  Can't wait for the first long trip.  ,BRAKES.  Very poor stopping power.
3.25,1200 miles on it.,ICDAvi ,10/02/2008,,,3,2,2,4,,4,4,4,3,"Very comfortable for both commuting and hauling the family.  Annoyed by all the door safety interlocks, but getting used to them.  Fit and finish is average.  The dash looks like it was slapped together with some of the lines and edges not matching up.  The passenger air bag trim is slightly lifted causing a gap between it and the dash.  So far I am happy with it.  Got 24.3 mpg with 95% highway and 21.5 mpg with 75% highway (AC always on).  Looks like the mpg is getting better as the engine breaks in and the computer better controls the VCM.","GPS, XM and rear DVD. Sliding doors are nice but open a little slow.  Seats are comfy.",Power lift and bluetooth should be standard with the EX-L.
4.875,Overall Good Choice,Kurt ,09/30/2008,,,5,5,5,5,,5,5,4,5,"Purchased 3 days ago.  Love it, however, noticed that the driver's side power door will close, then beep 3 times, then open.  It does not do this all the time.  Noticed a little wind on the driver's side door with the radio off.  With everything, I am pleased with the choice with Honda.  ",Interior design.,None.
3.75,Not sure about this car,Phred ,09/30/2008,,,4,4,4,4,,4,3,3,4,"I have owned the van for about a month and have driven 3K miles on a trip.  On the positive side the van is nice to drive, looks good and has power.  On the negative side the road noise is excessive.  When passing a truck you can hardly hear anyone else in the car.  The noise from bumps in the road is also very loud.  Automatic shifting is rough. The front seats are not very comfortable compared to my 2005 Dodge van.  The radio sound is very good but it has the poorest station range of any car I've owned in the last 20 years.  The little mirror on the sun glasses holder is useless.  It needs a compass.  At this point I'm not too thrilled about this purchase.",Looks and reported overall quality. Nothing else stands out as being a real favorite feature.,Quiet the inside.  Improve the radio. More comfortable front seats.
4.875,Love this van!  Our 2nd one!,dmaxwellh ,09/29/2008,,,5,5,5,5,,5,5,4,5,"The Odyssey is fantastic.  We put 50,000 miles on our '06 without any problems.  We just traded it in on an '08 Touring.  Paid 33186 which is 3700 below invoice.  Very happy with this deal.  The older one was an EX-L with Nav and DVD.  The addition of movable pedals, Bluetooth, memory seats, and power rear liftgate are nice.  The fog lights are a nice addition, too.  This is an excellent vehicle and drives very nicely; the Sienna was just too soft a ride.","Navigation, DVD, movable pedals, power lift gate, memory seats, auto climate control","HID head lights, ipod integration"
4.25,Satisfied customer,Ben from KC ,09/23/2008,,,4,4,4,5,,4,5,4,4,"Because my wife and I are planning to have more kids, I traded my 08 Acura RDX for the 08 Odyssey EX-L DVD/NAV. It was worth it mainly because of the space, comfort, and reliability of the Honda engine. ","DVD, NAV, leather seats, rear folding seats, comfortable driver and passenger seat.",The speakers should upgraded. Rear view mirror should be bigger. 
4.875,Gas Mileage: The Final Word!,Apollo08 ,09/22/2008,,,5,5,5,5,,5,5,4,5,"Im an engineer and have been interested in and working on cars for years. Ive been reading these user reviews and have been amazed at how many people claim low gas mileage. From these reviews it would appear that the Ody is a real gas pig. This however, is not the case. My Ody gets about 17-18 mpg S. Cal city driving (stop lights every 200- 500 yards). If I can get this and your getting 12 then one or more of the following apply: *low tire pressure (<28) *driving habits (ultra-short 1-5 mile trips-engine not reach operating temp) *load / number of passengers (6+ passengers) *can't properly calc mpg  (many dont do it right)  bottom line: engine variation is negligible. It's the operator","Backup camera, Interior, VCM engine, Sliding doors, sunroof","Seriously needs computer, a hybrid would also be nice"
4.625,'Tis good,Daniel Guidos ,09/22/2008,,,4,5,5,5,,4,5,4,5,"The interior lacks in luxury but it makes it up with practicality. The stereo is limited (LX) only one CD but it sounds great. The displays are clear. The sitting height is nice. At my frame of 6'3"" it's comfortable. My teenage son thought it handled a lot like a car. ","Seats are nice, splitting and folding third row is great. Nice engine. Comfortable.","I know that if wanted more luxury, I should have to pay a little more"
4.25,overall good trade,rob ,09/18/2008,,,4,4,4,4,,5,5,3,5,"traded 2005 sienna xle due to uncomfortable seats.  Once Honda offered $5400 went for it.  Comfortable seats, good power, easy controls. I like the dvd controls and insert in front with young kids. got 27 mpg on 500 mile hwy trip at 68 mph with air on.  Though around town stop and go 16.5 mpg. wish that was better.  with 3500 miles noticed wind noise in around pass front window above 65 mph. dealer seen before change out blk plastic trim piece, poor design.  One blemish in paint from factory but living with it. Scary to hear issues with rattles, brakes, tranny etc. guess when you sell 125k vans some might have issues. Miss my easy to clean 17 wheels and power lift gate. Though Touring over price","comfortable seats, power, highway mpg, easy controls, back up camera, quiet inside, cold air conditioner, price paid","center console storage needed, ex wheels hard to clean, better city mpg, door trim easy to scratch, should have had rear window screens like Toyota, make power lift gate separate option, move sliding door track out of side panel and put near window like Toyota"
3.875,Second One,KrisB ,09/10/2008,,,4,4,3,4,,4,4,4,4,"Overall, a great van.  I had a 2005 Touring, which performed excellently in a roll over - not a scratch or bruise on me.  That was reason enough to get a second.  This time we opted for the EX-L w/ R&N.  There are a few things I miss, like the memory seats (I'm 6'1"", my wife 5'2""), auto headlights, rear sensors and the rear power door, some of which should be standard.  We compared the new Chrysler van (a relative has comparable one), and they are by far more feature intensive at the same price, but they just didn't have the same level of comfort and the gas mileage isn't as good.  Would like to see some of the options at a lesser cost, like Bluetooth.  $800 - a joke!","Nav, DVD system, comfort, handling, engine, ease of use (driving, parking, etc), seats","Have had two problems in first 1000 miles. Slider door broke and wouldn't open and check engine light. We're at 3000 miles now and no other issues.  If you look at the bumper the wrong way, it scratches. With strollers and other kid stuff, it needs to be more durable. It is a bumper, after all."
4.75,Like it so far (10k miles),geppetto2008 ,09/03/2008,,,5,5,4,5,,5,5,4,5,"Smooth driving experience with good pick-up when I need it.  I had a v-8 Ford Explorer beforehand, and the Honda has as much acceleration at the Explorer.  The brakes are fantastic, highly responsive, excellent stopping distance.  We settled for the EX model because for the features in the EX-L, we couldn't justify the price.  I don't understand the other comments re: road noise--our van is by far one of the quietest vehicles I've ever driven.  Gas mileage isn't too bad--we consistently get 24 highway--but city suffers a bit at 17 mpg on average.  We added our own DVD player and screen for a fraction of what it would have cost at the dealership---a little hassle, but saved us nearly $1500!","Lots of small, very practical features:  Love the 8-person removable bench, daytime running lights, AUX input jack, map reading lamp by the driver for nighttime driving.","A little rattling around the windows--tolerable, but could use some improvement."
5,Outstanding,Dave&Ruth ,09/01/2008,,,5,5,5,5,,5,5,5,5,This is my first Honda that I've purchased.  My wife and I are very happy campers to say the least.  We've already made 2 road trips.  One to the beach and one up to the country.  No problems.  Needless to say...it's look like we're going to stick with the Honda Odyssey.  Handles like a car.  ,Like the back up camera in the rear view mirror.  The leather interior.  Very good A/C.  The room.  Good visibility.,Make the new van smell last longer!
4.5,2008 EXL Odyssey ,Rich ,08/31/2008,,,5,5,4,5,,4,5,4,4,"The Odyssey achieved 26.8 mpg on 1500 mile trip with AC set at 72 degrees, speed 65 mph, cruise on, tire pressure 35 psi, some hills, some stop and go, 91 octane gas.  25.0 mpg commuting to work, mostly interstate with some stop and go. I drive in eco mode as much as possible.  Michlelin LX4 energy-saving tires sing badly on some types of concrete highway but otherwise acceptably quiet. Comfortable long distant hauler which gracefully replace our 96 Lexus 400 due to Odyssey tradeoffs in size, seating height, features (nav).",The Nav system is very useful traveling and easy to use. XM radio great during long trips.  ,Improve front suspension to eliminate small front rattles while going over rough pavement.
1.25,Cheap - Junk -  Bad Buy,Kelly Fredericks Wag ,08/29/2008,,,1,2,1,1,,1,2,1,1,"This is my first Japanese brand vehicle and I am very disappointed. I had a 2006 Town & Country that I really loved. No issues ever in 30,000 miles. Then I get talked into this Honda Odyssey. Well 19 trips to the dealer in 10 months for repairs to the brakes, transmission, seat heaters, oil leaks, electrical system and door motors makes me not recommend this, or any other Japanese nameplate.",I love the tow truck driver and shuttle person at the Honda dealer.  we have become good friends with all of the contacts we make with each other.  My favorite person is the service write up guy.  He sees me more than my husband.,Look at a Chrysler van and learn how to make customers happy by making a quality van like my old town and Country.  I will tell everyone I know to stay away from Honda's
5,Exceeds Expectations,Traveler7 ,08/28/2008,,,5,5,5,5,,5,5,5,5,"We bought a 2008 EX-L just over 4 months ago and my wife (and I) couldn't be more pleased. We compared this vs. the Toyota Sienna, and while my wife liked the ""softer/smoother"" freeway ride of the Sienna, the Odyssey handled better than the Sienna when making any turns over 15 MPH. Around-town fuel economy averages about 19 MPG).  The big test came last week when our family of 4 took a trip from So. Cal to the Bay Area. The Odyssey was *extremely* comfortable over the entire trip. The kicker was that I calculated that the van got **27.9 MPG** on the freeway.  Avg speed: 75 MPH; cruise control on when possible; A/C on about 80% of the time. The variable-cylinder technology really works well! ","Handling, fuel economy, styling (IMO, it looks better than any of the other minivans.) The back-up camera is invaluable now that we have it, and I trust a live video view while backing up more than an audio-based (beeping/""sonar"") system.",Rear A/C controls need to be improved. The dealer service dept had to instruct us how to control the rear A/C fan appropriately. 
3,"5,000 Mile Update - Not Good!",fiend_bear ,08/27/2008,,,3,4,1,3,,4,3,2,4,"OK - I have to agree with another reviewer that said many folks will take back their great ratings after putting some miles on the Ody.  This is a follow up to an earlier review.  The 2008 Ody drives and handles well, but that's where it all stops.  Our problems to date include: steering spline knock, faulty wheel alignment, engine ping/knock, oil leak, rattling front windows, and Air Conditioning that currently works only on the passenger side.  None of these issues were of course apparent when the car was purchased, but it did not take very long for them to surface.  We are bringing the Ody in for service tomorrow, so we'll see how things go.  But for now, it's two big thumbs down!","Strong engine (though it pings/knocks when lugged), very good handling for a minivan.",Initial build quality.  When we will see a HYBRID?
3.875,Honda Odyssey vs. Seinna MiniVan,eyedoc ,08/25/2008,,,4,5,3,4,,4,4,3,4,"My wife and I looked at these two vehicles when deciding to purchase a mini van.  Others in the market did not have the build, drive, and quality of these two manufacturers.  Comparing the odyssey touring edition without pax tires (do not recommend pax tires) vs. the sienna limited edition here are the pros and cons of each:  Odyssey: Pros: Front load dvd player, good storage, middle seat in second row, better layout of buttons for opening side doors, power rear lift button (not a strap that needs to be pulled)  Cons: Seats are not very comfortable, brakes not as responsive and strong, fuel economy  ","Sienna: Pros: Strong/responsive brakes, comfortable seats, navigation screen appears sharper, stronger engine with more pickup, dynamic laser cruise control  Cons: awkward location of switches, back load dvd player, no middle seat in second row (a must with little children, fuel economy",Both vans had a impressive ride with the Honda edging out the sienna for responsiveness.  Cabin noise similar. Hard to find a sienna van with the features you want (frustrating shopping experience).  Honda makes it easy.  I could provide more details but the site limits input.  Hopefully this helps!
3.25,"Creaking, Squeaking, & Rattling",kp ,08/21/2008,,,4,4,2,3,,4,4,2,3,"The first 3 months, this van was in the dealership off and on for 7 weeks.  The rattling noises in the windows and doors were so loud that my 5 year old son thought it was hailing outside on a sunny day.  Overall, space is awesome. Dvd & Nav function w/o any issues. Rear view camera is strange & deceiving. Almost out of car seats and will definitely switch out to a less noisy SUV.","cargo room, walk through to rear area from front seat, remote sliding door and trunk opening.","rear view camera, rattling, noises"
2.5,Disappointed,Gail ,08/18/2008,,,3,4,1,1,,1,5,4,1,"We just leased a 2008 Odyssey last week of May.  Barely three months old, on our way for a vacation the car broke down.  It was brought into a Honda dealer and they found that there was a leak on the transmission and the clutch was burned.  Good thing we were able to stop at the nearest area.  So scared of what happened as we were with our five year old son.  Now, even if we take it back and they changed the whole transmission, i will never feel safe again especially for our son.",Spacious and comfortable seats.  AC is great.  ,To keep the Honda quality that we used to know.  It's gone now.
4.75,Excellent BUT. . . ,melissa ,08/13/2008,,,5,5,5,5,,5,5,3,5,"I just bought the 2008 Odyssey EX-L today.  Great car, consistently reliable (i've owned several other Hondas over the years)   However, could use automatic lights and automatic locks.  The outdoor temperature shouldn't be on the dash with mileage it should be on rear view mirror like Chevy.  Too new to tell how the gas mileage is. . . hopefully at least 21-22mpg. We'll See.",automatic sliding doors for the kids.,"Already stated above. . . automatic lights and automatic door locks would be nice, I've owned several Chevy's and they have these features. They are easy to get used to."
4.875,Satisfied,Jim ,08/08/2008,,,5,5,5,5,,5,5,4,5,"Not sure how you can get under 17 mpg in the city. I guess those posting 12- 13 must really live in a city, with stop and go, heavy traffic and never drive over 5-10 mph. We average 18.5 mpg city (suburban driving) and 25-26 highway (only measured highway mileage once). 1900 miles on the odometer. Sold our 4wd Sienna got 12mpg. This is basically the same interior size getting 80% better city mpg.","MPG, Safety 5 star all around, Sienna has 4 star for passenger front.",make backup sensors standard
4.5,I only buy the safest!,The Driver ,08/05/2008,,,5,5,5,5,,4,4,4,4,"Unfortunately we have had many issues with our brakes. They seem to need time to build pressure. When we leave our house, stopping at the stop sign takes a lot of work. Now I dont mean it is impossible to stop, just uncomfortable. I have taken it into the dealership many times and they seem to do something that makes the brakes feel great at the time, but in a few weeks they go back to feeling the same. Im still dealing with this issue after about 5 months now and Im in the process of getting a lawyer to get it taken back on lemon law. Dont get me wrong thought; Im very comfortable when driving and it looks stylish. In my opinion it gets great gas mileage for a minivan. Check it out! ",I love all of its standard safety features and its impeccable crash test ratings! I love the electric sliding doors and the stylish look of the interior and exterior. Im also okay with the gas mileage.,I wish that fog lights were standard rather than having to get them installed. I would like brake lights that show up brighter in the day. I would also like a plug for my ipod. 
4.75,"1 month and 1,000 miles later",SPDFAN ,08/02/2008,,,5,5,5,5,,5,5,4,4,"It has been a month and 1,000 miles since we got our Odyssey. I am very impressed with the van and I am very happy with the buy. The van drives very smooth and plenty of power and good agility. It is also very roomy and comfortable. We have 2 car seats and the interior room is great for our family. The sound system and the DVD player works great. The Navi and DVD are easy to use. I first thought there might be too many features to learn. But it only took me a short time to be very comfortable with all of the controls and features. The gas mileage is good for a vehicle this size, thanks to the cylinder deactivation. I get 18 to 23 combined both freeway and city. ","The Navi and DVD work great and are very easy to use. The sound system is decent, but sounds very good when you play DVD movies. The tri-zone climate control works good. The third row seat that folds flat into the floor creates good cargo room. (moved a desk and a book shelf in the back) ","The back up camera could be more clear with parking guide. The power sliding doors are slow but safe. NEED HID head lights. One more gear (6) would improve MPG even more. Ventilated front seats like Infiniti and Lexus (it is a $40,000 MSRP van) Live traffic update like the Acura MDX. "
4.625,Soft Brakes,tcunningham2 ,07/29/2008,,,5,5,5,3,,5,5,4,5,"Have a case open with Honda on these brakes.  This issue has been known for over a year and a half and dealers have no fix, Honda says they are working on it.  These brakes are firm when new but after a couple of thousand miles become soft.  Note the several accidents involved with the brakes in Edmunds forum.",Everything except the lousy brakes.,Fix the brakes.
5,No better minivan around,daninoah ,07/29/2008,,,5,5,5,5,,5,5,5,5,"If in the market for a minivan, it is hard not to pick the Odyssey.  While styling is never in the forefront in such a practical vehicle, this vehicle looks great.  The engine is silky smooth, and the VCM is seamless.  The DVD system allows all passengers in the 2nd and 3rd row to see and hear great, while the drivers can listen to the radio or just talk.  The navigation system is among the best I have seen.  The fold down third row is convenient.  Access to all seating is easy for all from the youngest to oldest.  Really no downside here.","Engine; sound system, rear entertainment system; VCM; fuel economy; practicality; value; safety.",HID headlights; more sweeping sun/moonroof; adaptive cruise control
4.375,Got 3 kids in carseats?,Greg ,07/21/2008,,,3,4,5,5,,5,5,4,4,"We recently purchased the EX-L model.  We paid $28,200 including the audible back-up sensors (rear bumper) option.  Tax, Tags, Title, processing fee was extra.  We are disappointed after bringing the car home and discovering that there are latch anchors for only 1 car seat in the 3rd row.  What that means is that we need to put our other two kids in the 2nd row seats.  This eliminates your ability to slide one of the 2nd row seats up for easy access to the 3rd row.  It also prevents mom from sitting in the 2nd row next to the newborn.  The Toyota Sienna has latch anchors for 2 car seats in the 3rd row.  ",Backup camera display in rear-view mirror,2 latch anchors on 3rd row seats.  Allow 2nd row left-hand seat to slide toward center like the right-hand seat can
5,Worth It!,Tom Ryan ,07/19/2008,,,5,5,5,5,,5,5,5,5,"I have never owned a Honda but had seen and heard about the Odyssey and decided it was worth a look.  We bought and have fallen in love with the van.  We only have one child but really like the room, convenience, the ride and overall quality.  My wife has been stuck on SUVs and has told me over and over again what a smart buy this van was and how she absolutely loves it.  You will not be disappointed and can be comforted with the fact that as a Honda product your going to get the value (resale/residual) and the performance and life expectancy you expect. Oh and the gas mileage after 3,000 miles is pretty good.  I can cruise at 75 and be on 3 cylinders.  I'm getting about 22.5 - 25 city/hwy.","Automatic sliding door.  Rear camera (standard now on EX-L), Wheels, VCM, Steering wheel comfort.  Leather is top notch.  Cup holders everywhere. I paid what I should have:  Invoice minus the marketing support money, plus the 0.9% financing. About 26,900",Fog lights for every van.  Color coded rock guards standard.
4,TPMS Light will not go off,DeeBee ,07/17/2008,,,5,4,4,3,,4,5,3,4,"We resisted a minivan for a while, but after another baby, took the plunge. The Ody test drove better than Sienna and my older son liked the look, so we traded in our Toyota Avalon. So far, we have returned to the dealer twice (a long drive and missing work) due to the TPMS light coming on. Each time they reset it/initialized it and then an hour later as I drove it home, it popped on again. VERY annoying and the stability control won't work when it's on, so also a safety issue. I do like how it drives and the looks of it, but didn't expect to be annoyed by Honda already.",The roominess. Nice to drive,Include crossbars with the luggage rack. Others do and that's lame to make people pay $300 more to add on later. Make air a bit quieter. 
4.5,Good bad and ugly,param ,07/15/2008,,,5,5,5,5,,4,5,3,4,"Based on several reviews I bought Odyssey without much thoughts. It is a good van for family. But, now I have 900 miles in the car with an awful 10-11 miles/gallon city + fwy. I saw some others also complains about low mileage of odyssey. while my friends 2008 odyssey gives 21 mpg city + fwy in my driving. I took it to the dealer and they asked to leave the car for 3 days for fuel test with out any compensation for replacement car. In general the odyssey makes lot of noise.  ",looks good. spacious interior. hard steering. rough and steady on road.,"uniform mileage in all the vans. If you say 16/23 and avg 20 mpg, all the vans should give that. Storage box between front seats."
5,Love my Minivan,Christe ,07/10/2008,,,5,5,5,5,,5,5,5,5,I love my van.  I tried the Toyota and was not impressed.  Although you can get more for your money.  The quality was not superb as mine. I'd rather get basic model and get the right choice!  However Honda's basic does come with a lot.  Toyota offers some of my basics as options.  The gas mileage is great as well.  I am getting 19/20 mpg.  We all need that with the gas prices.  I'd rather drive a van than any suv too. ,,
